runtime/fineco/code_gen/resnet/conv2_2-49.json
{"i": [["[\"conv2d_2_2\"]", "cuda -keys=cuda,gpu -arch=sm_80 -max_num_threads=1024 -thread_warp_size=32", [-1, 16, 64, 49152, 2147483647, 1024, 8, 32], "", 0, []], [[], [["CHW", 3, "local"], ["SP", 3, 0, 1, [1, 1, 1, 1], 1], ["SP", 3, 5, 64, [8, 4, 2, 1], 1], ["SP", 3, 10, 56, [1, 2, 2, 2], 1], ["SP", 3, 15, 56, [1, 8, 1, 1], 1], ["SP", 3, 20, 64, [2, 16], 1], ["SP", 3, 23, 3, [1, 3], 1], ["SP", 3, 26, 3, [1, 1], 1], ["RE", 3, [0, 5, 10, 15, 1, 6, 11, 16, 2, 7, 12, 17, 20, 23, 26, 21, 24, 27, 3, 8, 13, 18, 22, 25, 28, 4, 9, 14, 19]], ["FSP", 4, 0, 1, 3], ["FSP", 4, 4, 2, 3], ["FSP", 4, 8, 3, 3], ["FSP", 4, 12, 4, 3], ["RE", 4, [0, 4, 8, 12, 1, 5, 9, 13, 2, 6, 10, 14, 3, 7, 11, 15]], ["CA", 3, 4, 11], ["CHR", 2, "shared", [3]], ["CA", 3, 4, 14], ["CHR", 1, "shared", [4]], ["CA", 2, 5, 14], ["CI", 1], ["FU", 6, [0, 1, 2, 3]], ["AN", 6, 0, 5], ["FU", 6, [1, 2, 3, 4]], ["AN", 6, 1, 4], ["FU", 6, [2, 3, 4, 5]], ["AN", 6, 2, 6], ["FU", 4, [0, 1, 2, 3]], ["SP", 4, 0, 192, [1], 1], ["AN", 4, 1, 2], ["FFSP", 4, 0, [4, 3, 2, 1], 1, 1], ["AN", 4, 1, 6], ["FU", 2, [0, 1, 2, 3]], ["SP", 2, 0, 192, [1], 1], ["AN", 2, 1, 2], ["FFSP", 2, 0, [4, 3, 2, 1], 1, 1], ["AN", 2, 1, 6], ["PR", 5, 0, "auto_unroll_max_step$16"]]]], "r": [[0.000133131], 0, 5.29813, 1682031830], "v": "v0.6"}
{"i": [["[\"conv2d_2_2\"]", "cuda -keys=cuda,gpu -arch=sm_80 -max_num_threads=1024 -thread_warp_size=32", [-1, 16, 64, 49152, 2147483647, 1024, 8, 32], "", 0, []], [[], [["CHW", 3, "local"], ["SP", 3, 0, 1, [1, 1, 1, 1], 1], ["SP", 3, 5, 64, [4, 16, 1, 1], 1], ["SP", 3, 10, 56, [1, 2, 4, 1], 1], ["SP", 3, 15, 56, [1, 2, 1, 4], 1], ["SP", 3, 20, 64, [1, 4], 1], ["SP", 3, 23, 3, [3, 1], 1], ["SP", 3, 26, 3, [3, 1], 1], ["RE", 3, [0, 5, 10, 15, 1, 6, 11, 16, 2, 7, 12, 17, 20, 23, 26, 21, 24, 27, 3, 8, 13, 18, 22, 25, 28, 4, 9, 14, 19]], ["FSP", 4, 0, 1, 3], ["FSP", 4, 4, 2, 3], ["FSP", 4, 8, 3, 3], ["FSP", 4, 12, 4, 3], ["RE", 4, [0, 4, 8, 12, 1, 5, 9, 13, 2, 6, 10, 14, 3, 7, 11, 15]], ["CA", 3, 4, 11], ["CHR", 2, "shared", [3]], ["CA", 3, 4, 14], ["CHR", 1, "shared", [4]], ["CA", 2, 5, 14], ["CI", 1], ["FU", 6, [0, 1, 2, 3]], ["AN", 6, 0, 5], ["FU", 6, [1, 2, 3, 4]], ["AN", 6, 1, 4], ["FU", 6, [2, 3, 4, 5]], ["AN", 6, 2, 6], ["FU", 4, [0, 1, 2, 3]], ["SP", 4, 0, 36, [1], 1], ["AN", 4, 1, 2], ["FFSP", 4, 0, [4, 3, 2, 1], 1, 1], ["AN", 4, 1, 6], ["FU", 2, [0, 1, 2, 3]], ["SP", 2, 0, 144, [1], 1], ["AN", 2, 1, 2], ["FFSP", 2, 0, [4, 3, 2, 1], 1, 1], ["AN", 2, 1, 6], ["PR", 5, 0, "auto_unroll_max_step$16"]]]], "r": [[0.000108585], 0, 5.79435, 1682031832], "v": "v0.6"}
{"i": [["[\"conv2d_2_2\"]", "cuda -keys=cuda,gpu -arch=sm_80 -max_num_threads=1024 -thread_warp_size=32", [-1, 16, 64, 49152, 2147483647, 1024, 8, 32], "", 0, []], [[], [["CHW", 3, "local"], ["SP", 3, 0, 1, [1, 1, 1, 1], 1], ["SP", 3, 5, 64, [2, 8, 1, 4], 1], ["SP", 3, 10, 56, [1, 1, 8, 1], 1], ["SP", 3, 15, 56, [1, 4, 1, 2], 1], ["SP", 3, 20, 64, [1, 4], 1], ["SP", 3, 23, 3, [1, 1], 1], ["SP", 3, 26, 3, [1, 1], 1], ["RE", 3, [0, 5, 10, 15, 1, 6, 11, 16, 2, 7, 12, 17, 20, 23, 26, 21, 24, 27, 3, 8, 13, 18, 22, 25, 28, 4, 9, 14, 19]], ["FSP", 4, 0, 1, 3], ["FSP", 4, 4, 2, 3], ["FSP", 4, 8, 3, 3], ["FSP", 4, 12, 4, 3], ["RE", 4, [0, 4, 8, 12, 1, 5, 9, 13, 2, 6, 10, 14, 3, 7, 11, 15]], ["CA", 3, 4, 11], ["CHR", 2, "shared", [3]], ["CA", 3, 4, 14], ["CHR", 1, "shared", [4]], ["CA", 2, 5, 14], ["CI", 1], ["FU", 6, [0, 1, 2, 3]], ["AN", 6, 0, 5], ["FU", 6, [1, 2, 3, 4]], ["AN", 6, 1, 4], ["FU", 6, [2, 3, 4, 5]], ["AN", 6, 2, 6], ["FU", 4, [0, 1, 2, 3]], ["SP", 4, 0, 16, [1], 1], ["AN", 4, 1, 2], ["FFSP", 4, 0, [4, 3, 2, 1], 1, 1], ["AN", 4, 1, 6], ["FU", 2, [0, 1, 2, 3]], ["SP", 2, 0, 64, [1], 1], ["AN", 2, 1, 2], ["FFSP", 2, 0, [4, 3, 2, 1], 1, 1], ["AN", 2, 1, 6], ["PR", 5, 0, "auto_unroll_max_step$1024"]]]], "r": [[0.000151626], 0, 7.62177, 1682031833], "v": "v0.6"}
{"i": [["[\"conv2d_2_2\"]", "cuda -keys=cuda,gpu -arch=sm_80 -max_num_threads=1024 -thread_warp_size=32", [-1, 16, 64, 49152, 2147483647, 1024, 8, 32], "", 0, []], [[], [["CHW", 3, "local"], ["SP", 3, 0, 1, [1, 1, 1, 1], 1], ["SP", 3, 5, 64, [1, 8, 8, 1], 1], ["SP", 3, 10, 56, [2, 1, 4, 1], 1], ["SP", 3, 15, 56, [1, 4, 2, 1], 1], ["SP", 3, 20, 64, [2, 1], 1], ["SP", 3, 23, 3, [1, 1], 1], ["SP", 3, 26, 3, [1, 1], 1], ["RE", 3, [0, 5, 10, 15, 1, 6, 11, 16, 2, 7, 12, 17, 20, 23, 26, 21, 24, 27, 3, 8, 13, 18, 22, 25, 28, 4, 9, 14, 19]], ["FSP", 4, 0, 1, 3], ["FSP", 4, 4, 2, 3], ["FSP", 4, 8, 3, 3], ["FSP", 4, 12, 4, 3], ["RE", 4, [0, 4, 8, 12, 1, 5, 9, 13, 2, 6, 10, 14, 3, 7, 11, 15]], ["CA", 3, 4, 11], ["CHR", 2, "shared", [3]], ["CA", 3, 4, 14], ["CHR", 1, "shared", [4]], ["CA", 2, 5, 14], ["CI", 1], ["FU", 6, [0, 1, 2, 3]], ["AN", 6, 0, 5], ["FU", 6, [1, 2, 3, 4]], ["AN", 6, 1, 4], ["FU", 6, [2, 3, 4, 5]], ["AN", 6, 2, 6], ["FU", 4, [0, 1, 2, 3]], ["SP", 4, 0, 16, [1], 1], ["AN", 4, 1, 2], ["FFSP", 4, 0, [4, 3, 2, 1], 1, 1], ["AN", 4, 1, 6], ["FU", 2, [0, 1, 2, 3]], ["SP", 2, 0, 16, [1], 1], ["AN", 2, 1, 2], ["FFSP", 2, 0, [4, 3, 2, 1], 1, 1], ["AN", 2, 1, 6], ["PR", 5, 0, "auto_unroll_max_step$64"]]]], "r": [[0.000165068], 0, 5.02062, 1682031834], "v": "v0.6"}
{"i": [["[\"conv2d_2_2\"]", "cuda -keys=cuda,gpu -arch=sm_80 -max_num_threads=1024 -thread_warp_size=32", [-1, 16, 64, 49152, 2147483647, 1024, 8, 32], "", 0, []], [[], [["CHW", 3, "local"], ["SP", 3, 0, 1, [1, 1, 1, 1], 1], ["SP", 3, 5, 64, [8, 8, 1, 1], 1], ["SP", 3, 10, 56, [1, 4, 1, 2], 1], ["SP", 3, 15, 56, [1, 2, 1, 4], 1], ["SP", 3, 20, 64, [4, 2], 1], ["SP", 3, 23, 3, [1, 3], 1], ["SP", 3, 26, 3, [3, 1], 1], ["RE", 3, [0, 5, 10, 15, 1, 6, 11, 16, 2, 7, 12, 17, 20, 23, 26, 21, 24, 27, 3, 8, 13, 18, 22, 25, 28, 4, 9, 14, 19]], ["FSP", 4, 0, 1, 3], ["FSP", 4, 4, 2, 3], ["FSP", 4, 8, 3, 3], ["FSP", 4, 12, 4, 3], ["RE", 4, [0, 4, 8, 12, 1, 5, 9, 13, 2, 6, 10, 14, 3, 7, 11, 15]], ["CA", 3, 4, 11], ["CHR", 2, "shared", [3]], ["CA", 3, 4, 14], ["CHR", 1, "shared", [4]], ["CA", 2, 5, 14], ["CI", 1], ["FU", 6, [0, 1, 2, 3]], ["AN", 6, 0, 5], ["FU", 6, [1, 2, 3, 4]], ["AN", 6, 1, 4], ["FU", 6, [2, 3, 4, 5]], ["AN", 6, 2, 6], ["FU", 4, [0, 1, 2, 3]], ["SP", 4, 0, 72, [1], 1], ["AN", 4, 1, 2], ["FFSP", 4, 0, [4, 3, 2, 1], 1, 1], ["AN", 4, 1, 6], ["FU", 2, [0, 1, 2, 3]], ["SP", 2, 0, 192, [1], 1], ["AN", 2, 1, 2], ["FFSP", 2, 0, [4, 3, 2, 1], 1, 1], ["AN", 2, 1, 6], ["PR", 5, 0, "auto_unroll_max_step$512"]]]], "r": [[7.32954e-05], 0, 11.7394, 1682031836], "v": "v0.6"}
{"i": [["[\"conv2d_2_2\"]", "cuda -keys=cuda,gpu -arch=sm_80 -max_num_threads=1024 -thread_warp_size=32", [-1, 16, 64, 49152, 2147483647, 1024, 8, 32], "", 0, []], [[], [["CHW", 3, "local"], ["SP", 3, 0, 1, [1, 1, 1, 1], 1], ["SP", 3, 5, 64, [4, 4, 1, 4], 1], ["SP", 3, 10, 56, [1, 8, 1, 1], 1], ["SP", 3, 15, 56, [2, 4, 1, 1], 1], ["SP", 3, 20, 64, [1, 4], 1], ["SP", 3, 23, 3, [1, 1], 1], ["SP", 3, 26, 3, [1, 3], 1], ["RE", 3, [0, 5, 10, 15, 1, 6, 11, 16, 2, 7, 12, 17, 20, 23, 26, 21, 24, 27, 3, 8, 13, 18, 22, 25, 28, 4, 9, 14, 19]], ["FSP", 4, 0, 1, 3], ["FSP", 4, 4, 2, 3], ["FSP", 4, 8, 3, 3], ["FSP", 4, 12, 4, 3], ["RE", 4, [0, 4, 8, 12, 1, 5, 9, 13, 2, 6, 10, 14, 3, 7, 11, 15]], ["CA", 3, 4, 11], ["CHR", 2, "shared", [3]], ["CA", 3, 4, 14], ["CHR", 1, "shared", [4]], ["CA", 2, 5, 14], ["CI", 1], ["FU", 6, [0, 1, 2, 3]], ["AN", 6, 0, 5], ["FU", 6, [1, 2, 3, 4]], ["AN", 6, 1, 4], ["FU", 6, [2, 3, 4, 5]], ["AN", 6, 2, 6], ["FU", 4, [0, 1, 2, 3]], ["SP", 4, 0, 48, [1], 1], ["AN", 4, 1, 2], ["FFSP", 4, 0, [4, 3, 2, 1], 1, 1], ["AN", 4, 1, 6], ["FU", 2, [0, 1, 2, 3]], ["SP", 2, 0, 12, [1], 1], ["AN", 2, 1, 2], ["FFSP", 2, 0, [4, 3, 2, 1], 1, 1], ["AN", 2, 1, 6], ["PR", 5, 0, "auto_unroll_max_step$0"]]]], "r": [[9.29344e-05], 0, 4.56281, 1682031837], "v": "v0.6"}
{"i": [["[\"conv2d_2_2\"]", "cuda -keys=cuda,gpu -arch=sm_80 -max_num_threads=1024 -thread_warp_size=32", [-1, 16, 64, 49152, 2147483647, 1024, 8, 32], "", 0, []], [[], [["CHW", 3, "local"], ["SP", 3, 0, 1, [1, 1, 1, 1], 1], ["SP", 3, 5, 64, [2, 8, 1, 4], 1], ["SP", 3, 10, 56, [2, 2, 1, 2], 1], ["SP", 3, 15, 56, [1, 2, 4, 1], 1], ["SP", 3, 20, 64, [2, 4], 1], ["SP", 3, 23, 3, [3, 1], 1], ["SP", 3, 26, 3, [1, 3], 1], ["RE", 3, [0, 5, 10, 15, 1, 6, 11, 16, 2, 7, 12, 17, 20, 23, 26, 21, 24, 27, 3, 8, 13, 18, 22, 25, 28, 4, 9, 14, 19]], ["FSP", 4, 0, 1, 3], ["FSP", 4, 4, 2, 3], ["FSP", 4, 8, 3, 3], ["FSP", 4, 12, 4, 3], ["RE", 4, [0, 4, 8, 12, 1, 5, 9, 13, 2, 6, 10, 14, 3, 7, 11, 15]], ["CA", 3, 4, 11], ["CHR", 2, "shared", [3]], ["CA", 3, 4, 14], ["CHR", 1, "shared", [4]], ["CA", 2, 5, 14], ["CI", 1], ["FU", 6, [0, 1, 2, 3]], ["AN", 6, 0, 5], ["FU", 6, [1, 2, 3, 4]], ["AN", 6, 1, 4], ["FU", 6, [2, 3, 4, 5]], ["AN", 6, 2, 6], ["FU", 4, [0, 1, 2, 3]], ["SP", 4, 0, 288, [1], 1], ["AN", 4, 1, 2], ["FFSP", 4, 0, [4, 3, 2, 1], 1, 1], ["AN", 4, 1, 6], ["FU", 2, [0, 1, 2, 3]], ["SP", 2, 0, 192, [1], 1], ["AN", 2, 1, 2], ["FFSP", 2, 0, [4, 3, 2, 1], 1, 1], ["AN", 2, 1, 6], ["PR", 5, 0, "auto_unroll_max_step$16"]]]], "r": [[0.000304657], 0, 5.05417, 1682031838], "v": "v0.6"}
{"i": [["[\"conv2d_2_2\"]", "cuda -keys=cuda,gpu -arch=sm_80 -max_num_threads=1024 -thread_warp_size=32", [-1, 16, 64, 49152, 2147483647, 1024, 8, 32], "", 0, []], [[], [["CHW", 3, "local"], ["SP", 3, 0, 1, [1, 1, 1, 1], 1], ["SP", 3, 5, 64, [1, 16, 4, 1], 1], ["SP", 3, 10, 56, [1, 1, 8, 1], 1], ["SP", 3, 15, 56, [1, 4, 1, 2], 1], ["SP", 3, 20, 64, [1, 2], 1], ["SP", 3, 23, 3, [1, 1], 1], ["SP", 3, 26, 3, [1, 3], 1], ["RE", 3, [0, 5, 10, 15, 1, 6, 11, 16, 2, 7, 12, 17, 20, 23, 26, 21, 24, 27, 3, 8, 13, 18, 22, 25, 28, 4, 9, 14, 19]], ["FSP", 4, 0, 1, 3], ["FSP", 4, 4, 2, 3], ["FSP", 4, 8, 3, 3], ["FSP", 4, 12, 4, 3], ["RE", 4, [0, 4, 8, 12, 1, 5, 9, 13, 2, 6, 10, 14, 3, 7, 11, 15]], ["CA", 3, 4, 11], ["CHR", 2, "shared", [3]], ["CA", 3, 4, 14], ["CHR", 1, "shared", [4]], ["CA", 2, 5, 14], ["CI", 1], ["FU", 6, [0, 1, 2, 3]], ["AN", 6, 0, 5], ["FU", 6, [1, 2, 3, 4]], ["AN", 6, 1, 4], ["FU", 6, [2, 3, 4, 5]], ["AN", 6, 2, 6], ["FU", 4, [0, 1, 2, 3]], ["SP", 4, 0, 24, [1], 1], ["AN", 4, 1, 2], ["FFSP", 4, 0, [4, 3, 2, 1], 1, 1], ["AN", 4, 1, 6], ["FU", 2, [0, 1, 2, 3]], ["SP", 2, 0, 64, [1], 1], ["AN", 2, 1, 2], ["FFSP", 2, 0, [4, 3, 2, 1], 1, 1], ["AN", 2, 1, 6], ["PR", 5, 0, "auto_unroll_max_step$0"]]]], "r": [[0.000190561], 0, 4.42371, 1682031840], "v": "v0.6"}
{"i": [["[\"conv2d_2_2\"]", "cuda -keys=cuda,gpu -arch=sm_80 -max_num_threads=1024 -thread_warp_size=32", [-1, 16, 64, 49152, 2147483647, 1024, 8, 32], "", 0, []], [[], [["CHW", 3, "local"], ["SP", 3, 0, 1, [1, 1, 1, 1], 1], ["SP", 3, 5, 64, [2, 32, 1, 1], 1], ["SP", 3, 10, 56, [1, 1, 1, 8], 1], ["SP", 3, 15, 56, [2, 4, 1, 1], 1], ["SP", 3, 20, 64, [1, 8], 1], ["SP", 3, 23, 3, [3, 1], 1], ["SP", 3, 26, 3, [1, 3], 1], ["RE", 3, [0, 5, 10, 15, 1, 6, 11, 16, 2, 7, 12, 17, 20, 23, 26, 21, 24, 27, 3, 8, 13, 18, 22, 25, 28, 4, 9, 14, 19]], ["FSP", 4, 0, 1, 3], ["FSP", 4, 4, 2, 3], ["FSP", 4, 8, 3, 3], ["FSP", 4, 12, 4, 3], ["RE", 4, [0, 4, 8, 12, 1, 5, 9, 13, 2, 6, 10, 14, 3, 7, 11, 15]], ["CA", 3, 4, 11], ["CHR", 2, "shared", [3]], ["CA", 3, 4, 14], ["CHR", 1, "shared", [4]], ["CA", 2, 5, 14], ["CI", 1], ["FU", 6, [0, 1, 2, 3]], ["AN", 6, 0, 5], ["FU", 6, [1, 2, 3, 4]], ["AN", 6, 1, 4], ["FU", 6, [2, 3, 4, 5]], ["AN", 6, 2, 6], ["FU", 4, [0, 1, 2, 3]], ["SP", 4, 0, 72, [1], 1], ["AN", 4, 1, 2], ["FFSP", 4, 0, [4, 3, 2, 1], 1, 1], ["AN", 4, 1, 6], ["FU", 2, [0, 1, 2, 3]], ["SP", 2, 0, 240, [1], 1], ["AN", 2, 1, 2], ["FFSP", 2, 0, [4, 3, 2, 1], 1, 1], ["AN", 2, 1, 6], ["PR", 5, 0, "auto_unroll_max_step$0"]]]], "r": [[9.57781e-05], 0, 4.41234, 1682031841], "v": "v0.6"}
{"i": [["[\"conv2d_2_2\"]", "cuda -keys=cuda,gpu -arch=sm_80 -max_num_threads=1024 -thread_warp_size=32", [-1, 16, 64, 49152, 2147483647, 1024, 8, 32], "", 0, []], [[], [["CHW", 3, "local"], ["SP", 3, 0, 1, [1, 1, 1, 1], 1], ["SP", 3, 5, 64, [1, 16, 1, 4], 1], ["SP", 3, 10, 56, [4, 2, 1, 1], 1], ["SP", 3, 15, 56, [1, 4, 1, 2], 1], ["SP", 3, 20, 64, [1, 8], 1], ["SP", 3, 23, 3, [1, 1], 1], ["SP", 3, 26, 3, [1, 3], 1], ["RE", 3, [0, 5, 10, 15, 1, 6, 11, 16, 2, 7, 12, 17, 20, 23, 26, 21, 24, 27, 3, 8, 13, 18, 22, 25, 28, 4, 9, 14, 19]], ["FSP", 4, 0, 1, 3], ["FSP", 4, 4, 2, 3], ["FSP", 4, 8, 3, 3], ["FSP", 4, 12, 4, 3], ["RE", 4, [0, 4, 8, 12, 1, 5, 9, 13, 2, 6, 10, 14, 3, 7, 11, 15]], ["CA", 3, 4, 11], ["CHR", 2, "shared", [3]], ["CA", 3, 4, 14], ["CHR", 1, "shared", [4]], ["CA", 2, 5, 14], ["CI", 1], ["FU", 6, [0, 1, 2, 3]], ["AN", 6, 0, 5], ["FU", 6, [1, 2, 3, 4]], ["AN", 6, 1, 4], ["FU", 6, [2, 3, 4, 5]], ["AN", 6, 2, 6], ["FU", 4, [0, 1, 2, 3]], ["SP", 4, 0, 96, [1], 1], ["AN", 4, 1, 2], ["FFSP", 4, 0, [4, 3, 2, 1], 1, 1], ["AN", 4, 1, 6], ["FU", 2, [0, 1, 2, 3]], ["SP", 2, 0, 32, [1], 1], ["AN", 2, 1, 2], ["FFSP", 2, 0, [4, 3, 2, 1], 1, 1], ["AN", 2, 1, 6], ["PR", 5, 0, "auto_unroll_max_step$512"]]]], "r": [[6.10675e-05], 0, 7.1281, 1682031843], "v": "v0.6"}
{"i": [["[\"conv2d_2_2\"]", "cuda -keys=cuda,gpu -arch=sm_80 -max_num_threads=1024 -thread_warp_size=32", [-1, 16, 64, 49152, 2147483647, 1024, 8, 32], "", 0, []], [[], [["CHW", 3, "local"], ["SP", 3, 0, 1, [1, 1, 1, 1], 1], ["SP", 3, 5, 64, [1, 16, 4, 1], 1], ["SP", 3, 10, 56, [2, 4, 1, 1], 1], ["SP", 3, 15, 56, [1, 1, 2, 4], 1], ["SP", 3, 20, 64, [16, 4], 1], ["SP", 3, 23, 3, [1, 1], 1], ["SP", 3, 26, 3, [1, 1], 1], ["RE", 3, [0, 5, 10, 15, 1, 6, 11, 16, 2, 7, 12, 17, 20, 23, 26, 21, 24, 27, 3, 8, 13, 18, 22, 25, 28, 4, 9, 14, 19]], ["FSP", 4, 0, 1, 3], ["FSP", 4, 4, 2, 3], ["FSP", 4, 8, 3, 3], ["FSP", 4, 12, 4, 3], ["RE", 4, [0, 4, 8, 12, 1, 5, 9, 13, 2, 6, 10, 14, 3, 7, 11, 15]], ["CA", 3, 4, 11], ["CHR", 2, "shared", [3]], ["CA", 3, 4, 14], ["CHR", 1, "shared", [4]], ["CA", 2, 5, 14], ["CI", 1], ["FU", 6, [0, 1, 2, 3]], ["AN", 6, 0, 5], ["FU", 6, [1, 2, 3, 4]], ["AN", 6, 1, 4], ["FU", 6, [2, 3, 4, 5]], ["AN", 6, 2, 6], ["FU", 4, [0, 1, 2, 3]], ["SP", 4, 0, 256, [1], 1], ["AN", 4, 1, 2], ["FFSP", 4, 0, [4, 3, 2, 1], 1, 1], ["AN", 4, 1, 6], ["FU", 2, [0, 1, 2, 3]], ["SP", 2, 0, 512, [1], 1], ["AN", 2, 1, 2], ["FFSP", 2, 0, [4, 3, 2, 1], 1, 1], ["AN", 2, 1, 6], ["PR", 5, 0, "auto_unroll_max_step$0"]]]], "r": [[0.000103082], 0, 4.51406, 1682031844], "v": "v0.6"}
{"i": [["[\"conv2d_2_2\"]", "cuda -keys=cuda,gpu -arch=sm_80 -max_num_threads=1024 -thread_warp_size=32", [-1, 16, 64, 49152, 2147483647, 1024, 8, 32], "", 0, []], [[], [["CHW", 3, "local"], ["SP", 3, 0, 1, [1, 1, 1, 1], 1], ["SP", 3, 5, 64, [1, 16, 1, 4], 1], ["SP", 3, 10, 56, [2, 4, 1, 1], 1], ["SP", 3, 15, 56, [2, 1, 4, 1], 1], ["SP", 3, 20, 64, [2, 16], 1], ["SP", 3, 23, 3, [1, 3], 1], ["SP", 3, 26, 3, [1, 1], 1], ["RE", 3, [0, 5, 10, 15, 1, 6, 11, 16, 2, 7, 12, 17, 20, 23, 26, 21, 24, 27, 3, 8, 13, 18, 22, 25, 28, 4, 9, 14, 19]], ["FSP", 4, 0, 1, 3], ["FSP", 4, 4, 2, 3], ["FSP", 4, 8, 3, 3], ["FSP", 4, 12, 4, 3], ["RE", 4, [0, 4, 8, 12, 1, 5, 9, 13, 2, 6, 10, 14, 3, 7, 11, 15]], ["CA", 3, 4, 11], ["CHR", 2, "shared", [3]], ["CA", 3, 4, 14], ["CHR", 1, "shared", [4]], ["CA", 2, 5, 14], ["CI", 1], ["FU", 6, [0, 1, 2, 3]], ["AN", 6, 0, 5], ["FU", 6, [1, 2, 3, 4]], ["AN", 6, 1, 4], ["FU", 6, [2, 3, 4, 5]], ["AN", 6, 2, 6], ["FU", 4, [0, 1, 2, 3]], ["SP", 4, 0, 384, [1], 1], ["AN", 4, 1, 2], ["FFSP", 4, 0, [4, 3, 2, 1], 1, 1], ["AN", 4, 1, 6], ["FU", 2, [0, 1, 2, 3]], ["SP", 2, 0, 384, [1], 1], ["AN", 2, 1, 2], ["FFSP", 2, 0, [4, 3, 2, 1], 1, 1], ["AN", 2, 1, 6], ["PR", 5, 0, "auto_unroll_max_step$512"]]]], "r": [[0.000167298], 0, 11.4917, 1682031845], "v": "v0.6"}
{"i": [["[\"conv2d_2_2\"]", "cuda -keys=cuda,gpu -arch=sm_80 -max_num_threads=1024 -thread_warp_size=32", [-1, 16, 64, 49152, 2147483647, 1024, 8, 32], "", 0, []], [[], [["CHW", 3, "local"], ["SP", 3, 0, 1, [1, 1, 1, 1], 1], ["SP", 3, 5, 64, [1, 16, 4, 1], 1], ["SP", 3, 10, 56, [2, 1, 1, 4], 1], ["SP", 3, 15, 56, [2, 2, 1, 2], 1], ["SP", 3, 20, 64, [1, 2], 1], ["SP", 3, 23, 3, [3, 1], 1], ["SP", 3, 26, 3, [3, 1], 1], ["RE", 3, [0, 5, 10, 15, 1, 6, 11, 16, 2, 7, 12, 17, 20, 23, 26, 21, 24, 27, 3, 8, 13, 18, 22, 25, 28, 4, 9, 14, 19]], ["FSP", 4, 0, 1, 3], ["FSP", 4, 4, 2, 3], ["FSP", 4, 8, 3, 3], ["FSP", 4, 12, 4, 3], ["RE", 4, [0, 4, 8, 12, 1, 5, 9, 13, 2, 6, 10, 14, 3, 7, 11, 15]], ["CA", 3, 4, 11], ["CHR", 2, "shared", [3]], ["CA", 3, 4, 14], ["CHR", 1, "shared", [4]], ["CA", 2, 5, 14], ["CI", 1], ["FU", 6, [0, 1, 2, 3]], ["AN", 6, 0, 5], ["FU", 6, [1, 2, 3, 4]], ["AN", 6, 1, 4], ["FU", 6, [2, 3, 4, 5]], ["AN", 6, 2, 6], ["FU", 4, [0, 1, 2, 3]], ["SP", 4, 0, 72, [1], 1], ["AN", 4, 1, 2], ["FFSP", 4, 0, [4, 3, 2, 1], 1, 1], ["AN", 4, 1, 6], ["FU", 2, [0, 1, 2, 3]], ["SP", 2, 0, 48, [1], 1], ["AN", 2, 1, 2], ["FFSP", 2, 0, [4, 3, 2, 1], 1, 1], ["AN", 2, 1, 6], ["PR", 5, 0, "auto_unroll_max_step$1024"]]]], "r": [[0.000153409], 0, 10.1038, 1682031847], "v": "v0.6"}
{"i": [["[\"conv2d_2_2\"]", "cuda -keys=cuda,gpu -arch=sm_80 -max_num_threads=1024 -thread_warp_size=32", [-1, 16, 64, 49152, 2147483647, 1024, 8, 32], "", 0, []], [[], [["CHW", 3, "local"], ["SP", 3, 0, 1, [1, 1, 1, 1], 1], ["SP", 3, 5, 64, [2, 8, 2, 2], 1], ["SP", 3, 10, 56, [1, 1, 1, 8], 1], ["SP", 3, 15, 56, [1, 4, 2, 1], 1], ["SP", 3, 20, 64, [8, 4], 1], ["SP", 3, 23, 3, [1, 1], 1], ["SP", 3, 26, 3, [1, 1], 1], ["RE", 3, [0, 5, 10, 15, 1, 6, 11, 16, 2, 7, 12, 17, 20, 23, 26, 21, 24, 27, 3, 8, 13, 18, 22, 25, 28, 4, 9, 14, 19]], ["FSP", 4, 0, 1, 3], ["FSP", 4, 4, 2, 3], ["FSP", 4, 8, 3, 3], ["FSP", 4, 12, 4, 3], ["RE", 4, [0, 4, 8, 12, 1, 5, 9, 13, 2, 6, 10, 14, 3, 7, 11, 15]], ["CA", 3, 4, 11], ["CHR", 2, "shared", [3]], ["CA", 3, 4, 14], ["CHR", 1, "shared", [4]], ["CA", 2, 5, 14], ["CI", 1], ["FU", 6, [0, 1, 2, 3]], ["AN", 6, 0, 5], ["FU", 6, [1, 2, 3, 4]], ["AN", 6, 1, 4], ["FU", 6, [2, 3, 4, 5]], ["AN", 6, 2, 6], ["FU", 4, [0, 1, 2, 3]], ["SP", 4, 0, 128, [1], 1], ["AN", 4, 1, 2], ["FFSP", 4, 0, [4, 3, 2, 1], 1, 1], ["AN", 4, 1, 6], ["FU", 2, [0, 1, 2, 3]], ["SP", 2, 0, 512, [1], 1], ["AN", 2, 1, 2], ["FFSP", 2, 0, [4, 3, 2, 1], 1, 1], ["AN", 2, 1, 6], ["PR", 5, 0, "auto_unroll_max_step$16"]]]], "r": [[0.000154593], 0, 3.82588, 1682031848], "v": "v0.6"}
{"i": [["[\"conv2d_2_2\"]", "cuda -keys=cuda,gpu -arch=sm_80 -max_num_threads=1024 -thread_warp_size=32", [-1, 16, 64, 49152, 2147483647, 1024, 8, 32], "", 0, []], [[], [["CHW", 3, "local"], ["SP", 3, 0, 1, [1, 1, 1, 1], 1], ["SP", 3, 5, 64, [2, 8, 1, 4], 1], ["SP", 3, 10, 56, [4, 2, 1, 1], 1], ["SP", 3, 15, 56, [1, 4, 2, 1], 1], ["SP", 3, 20, 64, [2, 4], 1], ["SP", 3, 23, 3, [3, 1], 1], ["SP", 3, 26, 3, [1, 3], 1], ["RE", 3, [0, 5, 10, 15, 1, 6, 11, 16, 2, 7, 12, 17, 20, 23, 26, 21, 24, 27, 3, 8, 13, 18, 22, 25, 28, 4, 9, 14, 19]], ["FSP", 4, 0, 1, 3], ["FSP", 4, 4, 2, 3], ["FSP", 4, 8, 3, 3], ["FSP", 4, 12, 4, 3], ["RE", 4, [0, 4, 8, 12, 1, 5, 9, 13, 2, 6, 10, 14, 3, 7, 11, 15]], ["CA", 3, 4, 11], ["CHR", 2, "shared", [3]], ["CA", 3, 4, 14], ["CHR", 1, "shared", [4]], ["CA", 2, 5, 14], ["CI", 1], ["FU", 6, [0, 1, 2, 3]], ["AN", 6, 0, 5], ["FU", 6, [1, 2, 3, 4]], ["AN", 6, 1, 4], ["FU", 6, [2, 3, 4, 5]], ["AN", 6, 2, 6], ["FU", 4, [0, 1, 2, 3]], ["SP", 4, 0, 288, [1], 1], ["AN", 4, 1, 2], ["FFSP", 4, 0, [4, 3, 2, 1], 1, 1], ["AN", 4, 1, 6], ["FU", 2, [0, 1, 2, 3]], ["SP", 2, 0, 96, [1], 1], ["AN", 2, 1, 2], ["FFSP", 2, 0, [4, 3, 2, 1], 1, 1], ["AN", 2, 1, 6], ["PR", 5, 0, "auto_unroll_max_step$0"]]]], "r": [[0.000150741], 0, 3.30255, 1682031849], "v": "v0.6"}
{"i": [["[\"conv2d_2_2\"]", "cuda -keys=cuda,gpu -arch=sm_80 -max_num_threads=1024 -thread_warp_size=32", [-1, 16, 64, 49152, 2147483647, 1024, 8, 32], "", 0, []], [[], [["CHW", 3, "local"], ["SP", 3, 0, 1, [1, 1, 1, 1], 1], ["SP", 3, 5, 64, [1, 4, 2, 8], 1], ["SP", 3, 10, 56, [2, 2, 2, 1], 1], ["SP", 3, 15, 56, [1, 4, 2, 1], 1], ["SP", 3, 20, 64, [1, 32], 1], ["SP", 3, 23, 3, [1, 3], 1], ["SP", 3, 26, 3, [1, 1], 1], ["RE", 3, [0, 5, 10, 15, 1, 6, 11, 16, 2, 7, 12, 17, 20, 23, 26, 21, 24, 27, 3, 8, 13, 18, 22, 25, 28, 4, 9, 14, 19]], ["FSP", 4, 0, 1, 3], ["FSP", 4, 4, 2, 3], ["FSP", 4, 8, 3, 3], ["FSP", 4, 12, 4, 3], ["RE", 4, [0, 4, 8, 12, 1, 5, 9, 13, 2, 6, 10, 14, 3, 7, 11, 15]], ["CA", 3, 4, 11], ["CHR", 2, "shared", [3]], ["CA", 3, 4, 14], ["CHR", 1, "shared", [4]], ["CA", 2, 5, 14], ["CI", 1], ["FU", 6, [0, 1, 2, 3]], ["AN", 6, 0, 5], ["FU", 6, [1, 2, 3, 4]], ["AN", 6, 1, 4], ["FU", 6, [2, 3, 4, 5]], ["AN", 6, 2, 6], ["FU", 4, [0, 1, 2, 3]], ["SP", 4, 0, 1536, [1], 1], ["AN", 4, 1, 2], ["FFSP", 4, 0, [4, 3, 2, 1], 1, 1], ["AN", 4, 1, 6], ["FU", 2, [0, 1, 2, 3]], ["SP", 2, 0, 256, [1], 1], ["AN", 2, 1, 2], ["FFSP", 2, 0, [4, 3, 2, 1], 1, 1], ["AN", 2, 1, 6], ["PR", 5, 0, "auto_unroll_max_step$512"]]]], "r": [[0.000336283], 0, 14.2628, 1682031851], "v": "v0.6"}
{"i": [["[\"conv2d_2_2\"]", "cuda -keys=cuda,gpu -arch=sm_80 -max_num_threads=1024 -thread_warp_size=32", [-1, 16, 64, 49152, 2147483647, 1024, 8, 32], "", 0, []], [[], [["CHW", 3, "local"], ["SP", 3, 0, 1, [1, 1, 1, 1], 1], ["SP", 3, 5, 64, [2, 2, 16, 1], 1], ["SP", 3, 10, 56, [1, 8, 1, 1], 1], ["SP", 3, 15, 56, [2, 2, 1, 2], 1], ["SP", 3, 20, 64, [1, 8], 1], ["SP", 3, 23, 3, [1, 1], 1], ["SP", 3, 26, 3, [1, 3], 1], ["RE", 3, [0, 5, 10, 15, 1, 6, 11, 16, 2, 7, 12, 17, 20, 23, 26, 21, 24, 27, 3, 8, 13, 18, 22, 25, 28, 4, 9, 14, 19]], ["FSP", 4, 0, 1, 3], ["FSP", 4, 4, 2, 3], ["FSP", 4, 8, 3, 3], ["FSP", 4, 12, 4, 3], ["RE", 4, [0, 4, 8, 12, 1, 5, 9, 13, 2, 6, 10, 14, 3, 7, 11, 15]], ["CA", 3, 4, 11], ["CHR", 2, "shared", [3]], ["CA", 3, 4, 14], ["CHR", 1, "shared", [4]], ["CA", 2, 5, 14], ["CI", 1], ["FU", 6, [0, 1, 2, 3]], ["AN", 6, 0, 5], ["FU", 6, [1, 2, 3, 4]], ["AN", 6, 1, 4], ["FU", 6, [2, 3, 4, 5]], ["AN", 6, 2, 6], ["FU", 4, [0, 1, 2, 3]], ["SP", 4, 0, 384, [1], 1], ["AN", 4, 1, 2], ["FFSP", 4, 0, [4, 3, 2, 1], 1, 1], ["AN", 4, 1, 6], ["FU", 2, [0, 1, 2, 3]], ["SP", 2, 0, 32, [1], 1], ["AN", 2, 1, 2], ["FFSP", 2, 0, [4, 3, 2, 1], 1, 1], ["AN", 2, 1, 6], ["PR", 5, 0, "auto_unroll_max_step$64"]]]], "r": [[0.000186559], 0, 7.41666, 1682031852], "v": "v0.6"}
{"i": [["[\"conv2d_2_2\"]", "cuda -keys=cuda,gpu -arch=sm_80 -max_num_threads=1024 -thread_warp_size=32", [-1, 16, 64, 49152, 2147483647, 1024, 8, 32], "", 0, []], [[], [["CHW", 3, "local"], ["SP", 3, 0, 1, [1, 1, 1, 1], 1], ["SP", 3, 5, 64, [2, 16, 2, 1], 1], ["SP", 3, 10, 56, [1, 2, 2, 2], 1], ["SP", 3, 15, 56, [1, 1, 2, 4], 1], ["SP", 3, 20, 64, [4, 1], 1], ["SP", 3, 23, 3, [1, 3], 1], ["SP", 3, 26, 3, [3, 1], 1], ["RE", 3, [0, 5, 10, 15, 1, 6, 11, 16, 2, 7, 12, 17, 20, 23, 26, 21, 24, 27, 3, 8, 13, 18, 22, 25, 28, 4, 9, 14, 19]], ["FSP", 4, 0, 1, 3], ["FSP", 4, 4, 2, 3], ["FSP", 4, 8, 3, 3], ["FSP", 4, 12, 4, 3], ["RE", 4, [0, 4, 8, 12, 1, 5, 9, 13, 2, 6, 10, 14, 3, 7, 11, 15]], ["CA", 3, 4, 11], ["CHR", 2, "shared", [3]], ["CA", 3, 4, 14], ["CHR", 1, "shared", [4]], ["CA", 2, 5, 14], ["CI", 1], ["FU", 6, [0, 1, 2, 3]], ["AN", 6, 0, 5], ["FU", 6, [1, 2, 3, 4]], ["AN", 6, 1, 4], ["FU", 6, [2, 3, 4, 5]], ["AN", 6, 2, 6], ["FU", 4, [0, 1, 2, 3]], ["SP", 4, 0, 72, [1], 1], ["AN", 4, 1, 2], ["FFSP", 4, 0, [4, 3, 2, 1], 1, 1], ["AN", 4, 1, 6], ["FU", 2, [0, 1, 2, 3]], ["SP", 2, 0, 240, [1], 1], ["AN", 2, 1, 2], ["FFSP", 2, 0, [4, 3, 2, 1], 1, 1], ["AN", 2, 1, 6], ["PR", 5, 0, "auto_unroll_max_step$1024"]]]], "r": [[0.000152991], 0, 8.81802, 1682031853], "v": "v0.6"}
{"i": [["[\"conv2d_2_2\"]", "cuda -keys=cuda,gpu -arch=sm_80 -max_num_threads=1024 -thread_warp_size=32", [-1, 16, 64, 49152, 2147483647, 1024, 8, 32], "", 0, []], [[], [["CHW", 3, "local"], ["SP", 3, 0, 1, [1, 1, 1, 1], 1], ["SP", 3, 5, 64, [2, 8, 2, 2], 1], ["SP", 3, 10, 56, [2, 2, 2, 1], 1], ["SP", 3, 15, 56, [1, 2, 2, 2], 1], ["SP", 3, 20, 64, [32, 1], 1], ["SP", 3, 23, 3, [1, 1], 1], ["SP", 3, 26, 3, [1, 1], 1], ["RE", 3, [0, 5, 10, 15, 1, 6, 11, 16, 2, 7, 12, 17, 20, 23, 26, 21, 24, 27, 3, 8, 13, 18, 22, 25, 28, 4, 9, 14, 19]], ["FSP", 4, 0, 1, 3], ["FSP", 4, 4, 2, 3], ["FSP", 4, 8, 3, 3], ["FSP", 4, 12, 4, 3], ["RE", 4, [0, 4, 8, 12, 1, 5, 9, 13, 2, 6, 10, 14, 3, 7, 11, 15]], ["CA", 3, 4, 11], ["CHR", 2, "shared", [3]], ["CA", 3, 4, 14], ["CHR", 1, "shared", [4]], ["CA", 2, 5, 14], ["CI", 1], ["FU", 6, [0, 1, 2, 3]], ["AN", 6, 0, 5], ["FU", 6, [1, 2, 3, 4]], ["AN", 6, 1, 4], ["FU", 6, [2, 3, 4, 5]], ["AN", 6, 2, 6], ["FU", 4, [0, 1, 2, 3]], ["SP", 4, 0, 128, [1], 1], ["AN", 4, 1, 2], ["FFSP", 4, 0, [4, 3, 2, 1], 1, 1], ["AN", 4, 1, 6], ["FU", 2, [0, 1, 2, 3]], ["SP", 2, 0, 256, [1], 1], ["AN", 2, 1, 2], ["FFSP", 2, 0, [4, 3, 2, 1], 1, 1], ["AN", 2, 1, 6], ["PR", 5, 0, "auto_unroll_max_step$0"]]]], "r": [[0.000217815], 0, 3.35004, 1682031855], "v": "v0.6"}
{"i": [["[\"conv2d_2_2\"]", "cuda -keys=cuda,gpu -arch=sm_80 -max_num_threads=1024 -thread_warp_size=32", [-1, 16, 64, 49152, 2147483647, 1024, 8, 32], "", 0, []], [[], [["CHW", 3, "local"], ["SP", 3, 0, 1, [1, 1, 1, 1], 1], ["SP", 3, 5, 64, [2, 32, 1, 1], 1], ["SP", 3, 10, 56, [1, 2, 4, 1], 1], ["SP", 3, 15, 56, [2, 4, 1, 1], 1], ["SP", 3, 20, 64, [8, 2], 1], ["SP", 3, 23, 3, [1, 3], 1], ["SP", 3, 26, 3, [1, 1], 1], ["RE", 3, [0, 5, 10, 15, 1, 6, 11, 16, 2, 7, 12, 17, 20, 23, 26, 21, 24, 27, 3, 8, 13, 18, 22, 25, 28, 4, 9, 14, 19]], ["FSP", 4, 0, 1, 3], ["FSP", 4, 4, 2, 3], ["FSP", 4, 8, 3, 3], ["FSP", 4, 12, 4, 3], ["RE", 4, [0, 4, 8, 12, 1, 5, 9, 13, 2, 6, 10, 14, 3, 7, 11, 15]], ["CA", 3, 4, 11], ["CHR", 2, "shared", [3]], ["CA", 3, 4, 14], ["CHR", 1, "shared", [4]], ["CA", 2, 5, 14], ["CI", 1], ["FU", 6, [0, 1, 2, 3]], ["AN", 6, 0, 5], ["FU", 6, [1, 2, 3, 4]], ["AN", 6, 1, 4], ["FU", 6, [2, 3, 4, 5]], ["AN", 6, 2, 6], ["FU", 4, [0, 1, 2, 3]], ["SP", 4, 0, 48, [1], 1], ["AN", 4, 1, 2], ["FFSP", 4, 0, [4, 3, 2, 1], 1, 1], ["AN", 4, 1, 6], ["FU", 2, [0, 1, 2, 3]], ["SP", 2, 0, 96, [1], 1], ["AN", 2, 1, 2], ["FFSP", 2, 0, [4, 3, 2, 1], 1, 1], ["AN", 2, 1, 6], ["PR", 5, 0, "auto_unroll_max_step$64"]]]], "r": [[5.99814e-05], 0, 3.69339, 1682031856], "v": "v0.6"}
{"i": [["[\"conv2d_2_2\"]", "cuda -keys=cuda,gpu -arch=sm_80 -max_num_threads=1024 -thread_warp_size=32", [-1, 16, 64, 49152, 2147483647, 1024, 8, 32], "", 0, []], [[], [["CHW", 3, "local"], ["SP", 3, 0, 1, [1, 1, 1, 1], 1], ["SP", 3, 5, 64, [2, 32, 1, 1], 1], ["SP", 3, 10, 56, [1, 2, 2, 2], 1], ["SP", 3, 15, 56, [4, 1, 2, 1], 1], ["SP", 3, 20, 64, [8, 2], 1], ["SP", 3, 23, 3, [1, 1], 1], ["SP", 3, 26, 3, [1, 1], 1], ["RE", 3, [0, 5, 10, 15, 1, 6, 11, 16, 2, 7, 12, 17, 20, 23, 26, 21, 24, 27, 3, 8, 13, 18, 22, 25, 28, 4, 9, 14, 19]], ["FSP", 4, 0, 1, 3], ["FSP", 4, 4, 2, 3], ["FSP", 4, 8, 3, 3], ["FSP", 4, 12, 4, 3], ["RE", 4, [0, 4, 8, 12, 1, 5, 9, 13, 2, 6, 10, 14, 3, 7, 11, 15]], ["CA", 3, 4, 11], ["CHR", 2, "shared", [3]], ["CA", 3, 4, 14], ["CHR", 1, "shared", [4]], ["CA", 2, 5, 14], ["CI", 1], ["FU", 6, [0, 1, 2, 3]], ["AN", 6, 0, 5], ["FU", 6, [1, 2, 3, 4]], ["AN", 6, 1, 4], ["FU", 6, [2, 3, 4, 5]], ["AN", 6, 2, 6], ["FU", 4, [0, 1, 2, 3]], ["SP", 4, 0, 16, [1], 1], ["AN", 4, 1, 2], ["FFSP", 4, 0, [4, 3, 2, 1], 1, 1], ["AN", 4, 1, 6], ["FU", 2, [0, 1, 2, 3]], ["SP", 2, 0, 128, [1], 1], ["AN", 2, 1, 2], ["FFSP", 2, 0, [4, 3, 2, 1], 1, 1], ["AN", 2, 1, 6], ["PR", 5, 0, "auto_unroll_max_step$64"]]]], "r": [[0.000102894], 0, 5.91506, 1682031858], "v": "v0.6"}
{"i": [["[\"conv2d_2_2\"]", "cuda -keys=cuda,gpu -arch=sm_80 -max_num_threads=1024 -thread_warp_size=32", [-1, 16, 64, 49152, 2147483647, 1024, 8, 32], "", 0, []], [[], [["CHW", 3, "local"], ["SP", 3, 0, 1, [1, 1, 1, 1], 1], ["SP", 3, 5, 64, [1, 2, 8, 4], 1], ["SP", 3, 10, 56, [1, 2, 4, 1], 1], ["SP", 3, 15, 56, [1, 8, 1, 1], 1], ["SP", 3, 20, 64, [2, 8], 1], ["SP", 3, 23, 3, [3, 1], 1], ["SP", 3, 26, 3, [1, 1], 1], ["RE", 3, [0, 5, 10, 15, 1, 6, 11, 16, 2, 7, 12, 17, 20, 23, 26, 21, 24, 27, 3, 8, 13, 18, 22, 25, 28, 4, 9, 14, 19]], ["FSP", 4, 0, 1, 3], ["FSP", 4, 4, 2, 3], ["FSP", 4, 8, 3, 3], ["FSP", 4, 12, 4, 3], ["RE", 4, [0, 4, 8, 12, 1, 5, 9, 13, 2, 6, 10, 14, 3, 7, 11, 15]], ["CA", 3, 4, 11], ["CHR", 2, "shared", [3]], ["CA", 3, 4, 14], ["CHR", 1, "shared", [4]], ["CA", 2, 5, 14], ["CI", 1], ["FU", 6, [0, 1, 2, 3]], ["AN", 6, 0, 5], ["FU", 6, [1, 2, 3, 4]], ["AN", 6, 1, 4], ["FU", 6, [2, 3, 4, 5]], ["AN", 6, 2, 6], ["FU", 4, [0, 1, 2, 3]], ["SP", 4, 0, 1536, [1], 1], ["AN", 4, 1, 2], ["FFSP", 4, 0, [4, 3, 2, 1], 1, 1], ["AN", 4, 1, 6], ["FU", 2, [0, 1, 2, 3]], ["SP", 2, 0, 96, [1], 1], ["AN", 2, 1, 2], ["FFSP", 2, 0, [4, 3, 2, 1], 1, 1], ["AN", 2, 1, 6], ["PR", 5, 0, "auto_unroll_max_step$16"]]]], "r": [[0.000253686], 0, 3.61056, 1682031859], "v": "v0.6"}
{"i": [["[\"conv2d_2_2\"]", "cuda -keys=cuda,gpu -arch=sm_80 -max_num_threads=1024 -thread_warp_size=32", [-1, 16, 64, 49152, 2147483647, 1024, 8, 32], "", 0, []], [[], [["CHW", 3, "local"], ["SP", 3, 0, 1, [1, 1, 1, 1], 1], ["SP", 3, 5, 64, [1, 32, 1, 2], 1], ["SP", 3, 10, 56, [2, 2, 1, 2], 1], ["SP", 3, 15, 56, [1, 1, 4, 2], 1], ["SP", 3, 20, 64, [1, 1], 1], ["SP", 3, 23, 3, [1, 3], 1], ["SP", 3, 26, 3, [1, 3], 1], ["RE", 3, [0, 5, 10, 15, 1, 6, 11, 16, 2, 7, 12, 17, 20, 23, 26, 21, 24, 27, 3, 8, 13, 18, 22, 25, 28, 4, 9, 14, 19]], ["FSP", 4, 0, 1, 3], ["FSP", 4, 4, 2, 3], ["FSP", 4, 8, 3, 3], ["FSP", 4, 12, 4, 3], ["RE", 4, [0, 4, 8, 12, 1, 5, 9, 13, 2, 6, 10, 14, 3, 7, 11, 15]], ["CA", 3, 4, 11], ["CHR", 2, "shared", [3]], ["CA", 3, 4, 14], ["CHR", 1, "shared", [4]], ["CA", 2, 5, 14], ["CI", 1], ["FU", 6, [0, 1, 2, 3]], ["AN", 6, 0, 5], ["FU", 6, [1, 2, 3, 4]], ["AN", 6, 1, 4], ["FU", 6, [2, 3, 4, 5]], ["AN", 6, 2, 6], ["FU", 4, [0, 1, 2, 3]], ["SP", 4, 0, 18, [1], 1], ["AN", 4, 1, 2], ["FFSP", 4, 0, [4, 3, 2, 1], 1, 1], ["AN", 4, 1, 6], ["FU", 2, [0, 1, 2, 3]], ["SP", 2, 0, 40, [1], 1], ["AN", 2, 1, 2], ["FFSP", 2, 0, [4, 3, 2, 1], 1, 1], ["AN", 2, 1, 6], ["PR", 5, 0, "auto_unroll_max_step$16"]]]], "r": [[0.00010909], 0, 3.28948, 1682031860], "v": "v0.6"}
{"i": [["[\"conv2d_2_2\"]", "cuda -keys=cuda,gpu -arch=sm_80 -max_num_threads=1024 -thread_warp_size=32", [-1, 16, 64, 49152, 2147483647, 1024, 8, 32], "", 0, []], [[], [["CHW", 3, "local"], ["SP", 3, 0, 1, [1, 1, 1, 1], 1], ["SP", 3, 5, 64, [1, 2, 8, 4], 1], ["SP", 3, 10, 56, [1, 4, 1, 2], 1], ["SP", 3, 15, 56, [1, 4, 1, 2], 1], ["SP", 3, 20, 64, [2, 8], 1], ["SP", 3, 23, 3, [1, 1], 1], ["SP", 3, 26, 3, [1, 1], 1], ["RE", 3, [0, 5, 10, 15, 1, 6, 11, 16, 2, 7, 12, 17, 20, 23, 26, 21, 24, 27, 3, 8, 13, 18, 22, 25, 28, 4, 9, 14, 19]], ["FSP", 4, 0, 1, 3], ["FSP", 4, 4, 2, 3], ["FSP", 4, 8, 3, 3], ["FSP", 4, 12, 4, 3], ["RE", 4, [0, 4, 8, 12, 1, 5, 9, 13, 2, 6, 10, 14, 3, 7, 11, 15]], ["CA", 3, 4, 11], ["CHR", 2, "shared", [3]], ["CA", 3, 4, 14], ["CHR", 1, "shared", [4]], ["CA", 2, 5, 14], ["CI", 1], ["FU", 6, [0, 1, 2, 3]], ["AN", 6, 0, 5], ["FU", 6, [1, 2, 3, 4]], ["AN", 6, 1, 4], ["FU", 6, [2, 3, 4, 5]], ["AN", 6, 2, 6], ["FU", 4, [0, 1, 2, 3]], ["SP", 4, 0, 512, [1], 1], ["AN", 4, 1, 2], ["FFSP", 4, 0, [4, 3, 2, 1], 1, 1], ["AN", 4, 1, 6], ["FU", 2, [0, 1, 2, 3]], ["SP", 2, 0, 64, [1], 1], ["AN", 2, 1, 2], ["FFSP", 2, 0, [4, 3, 2, 1], 1, 1], ["AN", 2, 1, 6], ["PR", 5, 0, "auto_unroll_max_step$0"]]]], "r": [[0.000261234], 0, 3.33919, 1682031862], "v": "v0.6"}
{"i": [["[\"conv2d_2_2\"]", "cuda -keys=cuda,gpu -arch=sm_80 -max_num_threads=1024 -thread_warp_size=32", [-1, 16, 64, 49152, 2147483647, 1024, 8, 32], "", 0, []], [[], [["CHW", 3, "local"], ["SP", 3, 0, 1, [1, 1, 1, 1], 1], ["SP", 3, 5, 64, [1, 4, 2, 8], 1], ["SP", 3, 10, 56, [1, 4, 2, 1], 1], ["SP", 3, 15, 56, [1, 4, 1, 2], 1], ["SP", 3, 20, 64, [2, 2], 1], ["SP", 3, 23, 3, [3, 1], 1], ["SP", 3, 26, 3, [1, 3], 1], ["RE", 3, [0, 5, 10, 15, 1, 6, 11, 16, 2, 7, 12, 17, 20, 23, 26, 21, 24, 27, 3, 8, 13, 18, 22, 25, 28, 4, 9, 14, 19]], ["FSP", 4, 0, 1, 3], ["FSP", 4, 4, 2, 3], ["FSP", 4, 8, 3, 3], ["FSP", 4, 12, 4, 3], ["RE", 4, [0, 4, 8, 12, 1, 5, 9, 13, 2, 6, 10, 14, 3, 7, 11, 15]], ["CA", 3, 4, 11], ["CHR", 2, "shared", [3]], ["CA", 3, 4, 14], ["CHR", 1, "shared", [4]], ["CA", 2, 5, 14], ["CI", 1], ["FU", 6, [0, 1, 2, 3]], ["AN", 6, 0, 5], ["FU", 6, [1, 2, 3, 4]], ["AN", 6, 1, 4], ["FU", 6, [2, 3, 4, 5]], ["AN", 6, 2, 6], ["FU", 4, [0, 1, 2, 3]], ["SP", 4, 0, 576, [1], 1], ["AN", 4, 1, 2], ["FFSP", 4, 0, [4, 3, 2, 1], 1, 1], ["AN", 4, 1, 6], ["FU", 2, [0, 1, 2, 3]], ["SP", 2, 0, 64, [1], 1], ["AN", 2, 1, 2], ["FFSP", 2, 0, [4, 3, 2, 1], 1, 1], ["AN", 2, 1, 6], ["PR", 5, 0, "auto_unroll_max_step$1024"]]]], "r": [[7.6263e-05], 0, 9.5289, 1682031863], "v": "v0.6"}
{"i": [["[\"conv2d_2_2\"]", "cuda -keys=cuda,gpu -arch=sm_80 -max_num_threads=1024 -thread_warp_size=32", [-1, 16, 64, 49152, 2147483647, 1024, 8, 32], "", 0, []], [[], [["CHW", 3, "local"], ["SP", 3, 0, 1, [1, 1, 1, 1], 1], ["SP", 3, 5, 64, [1, 8, 4, 2], 1], ["SP", 3, 10, 56, [1, 4, 2, 1], 1], ["SP", 3, 15, 56, [1, 4, 1, 2], 1], ["SP", 3, 20, 64, [16, 1], 1], ["SP", 3, 23, 3, [1, 3], 1], ["SP", 3, 26, 3, [1, 3], 1], ["RE", 3, [0, 5, 10, 15, 1, 6, 11, 16, 2, 7, 12, 17, 20, 23, 26, 21, 24, 27, 3, 8, 13, 18, 22, 25, 28, 4, 9, 14, 19]], ["FSP", 4, 0, 1, 3], ["FSP", 4, 4, 2, 3], ["FSP", 4, 8, 3, 3], ["FSP", 4, 12, 4, 3], ["RE", 4, [0, 4, 8, 12, 1, 5, 9, 13, 2, 6, 10, 14, 3, 7, 11, 15]], ["CA", 3, 4, 11], ["CHR", 2, "shared", [3]], ["CA", 3, 4, 14], ["CHR", 1, "shared", [4]], ["CA", 2, 5, 14], ["CI", 1], ["FU", 6, [0, 1, 2, 3]], ["AN", 6, 0, 5], ["FU", 6, [1, 2, 3, 4]], ["AN", 6, 1, 4], ["FU", 6, [2, 3, 4, 5]], ["AN", 6, 2, 6], ["FU", 4, [0, 1, 2, 3]], ["SP", 4, 0, 1152, [1], 1], ["AN", 4, 1, 2], ["FFSP", 4, 0, [4, 3, 2, 1], 1, 1], ["AN", 4, 1, 6], ["FU", 2, [0, 1, 2, 3]], ["SP", 2, 0, 256, [1], 1], ["AN", 2, 1, 2], ["FFSP", 2, 0, [4, 3, 2, 1], 1, 1], ["AN", 2, 1, 6], ["PR", 5, 0, "auto_unroll_max_step$1024"]]]], "r": [[4.70276e-05], 0, 8.90868, 1682031864], "v": "v0.6"}
{"i": [["[\"conv2d_2_2\"]", "cuda -keys=cuda,gpu -arch=sm_80 -max_num_threads=1024 -thread_warp_size=32", [-1, 16, 64, 49152, 2147483647, 1024, 8, 32], "", 0, []], [[], [["CHW", 3, "local"], ["SP", 3, 0, 1, [1, 1, 1, 1], 1], ["SP", 3, 5, 64, [2, 32, 1, 1], 1], ["SP", 3, 10, 56, [1, 1, 2, 4], 1], ["SP", 3, 15, 56, [1, 4, 1, 2], 1], ["SP", 3, 20, 64, [1, 32], 1], ["SP", 3, 23, 3, [1, 3], 1], ["SP", 3, 26, 3, [1, 1], 1], ["RE", 3, [0, 5, 10, 15, 1, 6, 11, 16, 2, 7, 12, 17, 20, 23, 26, 21, 24, 27, 3, 8, 13, 18, 22, 25, 28, 4, 9, 14, 19]], ["FSP", 4, 0, 1, 3], ["FSP", 4, 4, 2, 3], ["FSP", 4, 8, 3, 3], ["FSP", 4, 12, 4, 3], ["RE", 4, [0, 4, 8, 12, 1, 5, 9, 13, 2, 6, 10, 14, 3, 7, 11, 15]], ["CA", 3, 4, 11], ["CHR", 2, "shared", [3]], ["CA", 3, 4, 14], ["CHR", 1, "shared", [4]], ["CA", 2, 5, 14], ["CI", 1], ["FU", 6, [0, 1, 2, 3]], ["AN", 6, 0, 5], ["FU", 6, [1, 2, 3, 4]], ["AN", 6, 1, 4], ["FU", 6, [2, 3, 4, 5]], ["AN", 6, 2, 6], ["FU", 4, [0, 1, 2, 3]], ["SP", 4, 0, 96, [1], 1], ["AN", 4, 1, 2], ["FFSP", 4, 0, [4, 3, 2, 1], 1, 1], ["AN", 4, 1, 6], ["FU", 2, [0, 1, 2, 3]], ["SP", 2, 0, 640, [1], 1], ["AN", 2, 1, 2], ["FFSP", 2, 0, [4, 3, 2, 1], 1, 1], ["AN", 2, 1, 6], ["PR", 5, 0, "auto_unroll_max_step$16"]]]], "r": [[0.000101462], 0, 3.23431, 1682031866], "v": "v0.6"}
{"i": [["[\"conv2d_2_2\"]", "cuda -keys=cuda,gpu -arch=sm_80 -max_num_threads=1024 -thread_warp_size=32", [-1, 16, 64, 49152, 2147483647, 1024, 8, 32], "", 0, []], [[], [["CHW", 3, "local"], ["SP", 3, 0, 1, [1, 1, 1, 1], 1], ["SP", 3, 5, 64, [2, 16, 2, 1], 1], ["SP", 3, 10, 56, [2, 2, 1, 2], 1], ["SP", 3, 15, 56, [1, 4, 2, 1], 1], ["SP", 3, 20, 64, [4, 4], 1], ["SP", 3, 23, 3, [1, 3], 1], ["SP", 3, 26, 3, [1, 1], 1], ["RE", 3, [0, 5, 10, 15, 1, 6, 11, 16, 2, 7, 12, 17, 20, 23, 26, 21, 24, 27, 3, 8, 13, 18, 22, 25, 28, 4, 9, 14, 19]], ["FSP", 4, 0, 1, 3], ["FSP", 4, 4, 2, 3], ["FSP", 4, 8, 3, 3], ["FSP", 4, 12, 4, 3], ["RE", 4, [0, 4, 8, 12, 1, 5, 9, 13, 2, 6, 10, 14, 3, 7, 11, 15]], ["CA", 3, 4, 11], ["CHR", 2, "shared", [3]], ["CA", 3, 4, 14], ["CHR", 1, "shared", [4]], ["CA", 2, 5, 14], ["CI", 1], ["FU", 6, [0, 1, 2, 3]], ["AN", 6, 0, 5], ["FU", 6, [1, 2, 3, 4]], ["AN", 6, 1, 4], ["FU", 6, [2, 3, 4, 5]], ["AN", 6, 2, 6], ["FU", 4, [0, 1, 2, 3]], ["SP", 4, 0, 96, [1], 1], ["AN", 4, 1, 2], ["FFSP", 4, 0, [4, 3, 2, 1], 1, 1], ["AN", 4, 1, 6], ["FU", 2, [0, 1, 2, 3]], ["SP", 2, 0, 128, [1], 1], ["AN", 2, 1, 2], ["FFSP", 2, 0, [4, 3, 2, 1], 1, 1], ["AN", 2, 1, 6], ["PR", 5, 0, "auto_unroll_max_step$16"]]]], "r": [[6.86596e-05], 0, 6.10593, 1682031891], "v": "v0.6"}
{"i": [["[\"conv2d_2_2\"]", "cuda -keys=cuda,gpu -arch=sm_80 -max_num_threads=1024 -thread_warp_size=32", [-1, 16, 64, 49152, 2147483647, 1024, 8, 32], "", 0, []], [[], [["CHW", 3, "local"], ["SP", 3, 0, 1, [1, 1, 1, 1], 1], ["SP", 3, 5, 64, [2, 16, 1, 2], 1], ["SP", 3, 10, 56, [1, 2, 2, 2], 1], ["SP", 3, 15, 56, [4, 1, 1, 2], 1], ["SP", 3, 20, 64, [1, 8], 1], ["SP", 3, 23, 3, [3, 1], 1], ["SP", 3, 26, 3, [3, 1], 1], ["RE", 3, [0, 5, 10, 15, 1, 6, 11, 16, 2, 7, 12, 17, 20, 23, 26, 21, 24, 27, 3, 8, 13, 18, 22, 25, 28, 4, 9, 14, 19]], ["FSP", 4, 0, 1, 3], ["FSP", 4, 4, 2, 3], ["FSP", 4, 8, 3, 3], ["FSP", 4, 12, 4, 3], ["RE", 4, [0, 4, 8, 12, 1, 5, 9, 13, 2, 6, 10, 14, 3, 7, 11, 15]], ["CA", 3, 4, 11], ["CHR", 2, "shared", [3]], ["CA", 3, 4, 14], ["CHR", 1, "shared", [4]], ["CA", 2, 5, 14], ["CI", 1], ["FU", 6, [0, 1, 2, 3]], ["AN", 6, 0, 5], ["FU", 6, [1, 2, 3, 4]], ["AN", 6, 1, 4], ["FU", 6, [2, 3, 4, 5]], ["AN", 6, 2, 6], ["FU", 4, [0, 1, 2, 3]], ["SP", 4, 0, 144, [1], 1], ["AN", 4, 1, 2], ["FFSP", 4, 0, [4, 3, 2, 1], 1, 1], ["AN", 4, 1, 6], ["FU", 2, [0, 1, 2, 3]], ["SP", 2, 0, 192, [1], 1], ["AN", 2, 1, 2], ["FFSP", 2, 0, [4, 3, 2, 1], 1, 1], ["AN", 2, 1, 6], ["PR", 5, 0, "auto_unroll_max_step$64"]]]], "r": [[0.000255672], 0, 10.2161, 1682031892], "v": "v0.6"}
{"i": [["[\"conv2d_2_2\"]", "cuda -keys=cuda,gpu -arch=sm_80 -max_num_threads=1024 -thread_warp_size=32", [-1, 16, 64, 49152, 2147483647, 1024, 8, 32], "", 0, []], [[], [["CHW", 3, "local"], ["SP", 3, 0, 1, [1, 1, 1, 1], 1], ["SP", 3, 5, 64, [2, 8, 4, 1], 1], ["SP", 3, 10, 56, [1, 4, 2, 1], 1], ["SP", 3, 15, 56, [4, 1, 2, 1], 1], ["SP", 3, 20, 64, [4, 1], 1], ["SP", 3, 23, 3, [1, 3], 1], ["SP", 3, 26, 3, [1, 1], 1], ["RE", 3, [0, 5, 10, 15, 1, 6, 11, 16, 2, 7, 12, 17, 20, 23, 26, 21, 24, 27, 3, 8, 13, 18, 22, 25, 28, 4, 9, 14, 19]], ["FSP", 4, 0, 1, 3], ["FSP", 4, 4, 2, 3], ["FSP", 4, 8, 3, 3], ["FSP", 4, 12, 4, 3], ["RE", 4, [0, 4, 8, 12, 1, 5, 9, 13, 2, 6, 10, 14, 3, 7, 11, 15]], ["CA", 3, 4, 11], ["CHR", 2, "shared", [3]], ["CA", 3, 4, 14], ["CHR", 1, "shared", [4]], ["CA", 2, 5, 14], ["CI", 1], ["FU", 6, [0, 1, 2, 3]], ["AN", 6, 0, 5], ["FU", 6, [1, 2, 3, 4]], ["AN", 6, 1, 4], ["FU", 6, [2, 3, 4, 5]], ["AN", 6, 2, 6], ["FU", 4, [0, 1, 2, 3]], ["SP", 4, 0, 48, [1], 1], ["AN", 4, 1, 2], ["FFSP", 4, 0, [4, 3, 2, 1], 1, 1], ["AN", 4, 1, 6], ["FU", 2, [0, 1, 2, 3]], ["SP", 2, 0, 32, [1], 1], ["AN", 2, 1, 2], ["FFSP", 2, 0, [4, 3, 2, 1], 1, 1], ["AN", 2, 1, 6], ["PR", 5, 0, "auto_unroll_max_step$16"]]]], "r": [[0.000157987], 0, 5.5581, 1682031894], "v": "v0.6"}
{"i": [["[\"conv2d_2_2\"]", "cuda -keys=cuda,gpu -arch=sm_80 -max_num_threads=1024 -thread_warp_size=32", [-1, 16, 64, 49152, 2147483647, 1024, 8, 32], "", 0, []], [[], [["CHW", 3, "local"], ["SP", 3, 0, 1, [1, 1, 1, 1], 1], ["SP", 3, 5, 64, [1, 4, 8, 2], 1], ["SP", 3, 10, 56, [1, 8, 1, 1], 1], ["SP", 3, 15, 56, [2, 4, 1, 1], 1], ["SP", 3, 20, 64, [8, 1], 1], ["SP", 3, 23, 3, [3, 1], 1], ["SP", 3, 26, 3, [1, 1], 1], ["RE", 3, [0, 5, 10, 15, 1, 6, 11, 16, 2, 7, 12, 17, 20, 23, 26, 21, 24, 27, 3, 8, 13, 18, 22, 25, 28, 4, 9, 14, 19]], ["FSP", 4, 0, 1, 3], ["FSP", 4, 4, 2, 3], ["FSP", 4, 8, 3, 3], ["FSP", 4, 12, 4, 3], ["RE", 4, [0, 4, 8, 12, 1, 5, 9, 13, 2, 6, 10, 14, 3, 7, 11, 15]], ["CA", 3, 4, 11], ["CHR", 2, "shared", [3]], ["CA", 3, 4, 14], ["CHR", 1, "shared", [4]], ["CA", 2, 5, 14], ["CI", 1], ["FU", 6, [0, 1, 2, 3]], ["AN", 6, 0, 5], ["FU", 6, [1, 2, 3, 4]], ["AN", 6, 1, 4], ["FU", 6, [2, 3, 4, 5]], ["AN", 6, 2, 6], ["FU", 4, [0, 1, 2, 3]], ["SP", 4, 0, 384, [1], 1], ["AN", 4, 1, 2], ["FFSP", 4, 0, [4, 3, 2, 1], 1, 1], ["AN", 4, 1, 6], ["FU", 2, [0, 1, 2, 3]], ["SP", 2, 0, 24, [1], 1], ["AN", 2, 1, 2], ["FFSP", 2, 0, [4, 3, 2, 1], 1, 1], ["AN", 2, 1, 6], ["PR", 5, 0, "auto_unroll_max_step$64"]]]], "r": [[7.72469e-05], 0, 5.3759, 1682031895], "v": "v0.6"}
{"i": [["[\"conv2d_2_2\"]", "cuda -keys=cuda,gpu -arch=sm_80 -max_num_threads=1024 -thread_warp_size=32", [-1, 16, 64, 49152, 2147483647, 1024, 8, 32], "", 0, []], [[], [["CHW", 3, "local"], ["SP", 3, 0, 1, [1, 1, 1, 1], 1], ["SP", 3, 5, 64, [1, 16, 1, 4], 1], ["SP", 3, 10, 56, [2, 2, 1, 2], 1], ["SP", 3, 15, 56, [1, 1, 4, 2], 1], ["SP", 3, 20, 64, [2, 4], 1], ["SP", 3, 23, 3, [1, 3], 1], ["SP", 3, 26, 3, [1, 1], 1], ["RE", 3, [0, 5, 10, 15, 1, 6, 11, 16, 2, 7, 12, 17, 20, 23, 26, 21, 24, 27, 3, 8, 13, 18, 22, 25, 28, 4, 9, 14, 19]], ["FSP", 4, 0, 1, 3], ["FSP", 4, 4, 2, 3], ["FSP", 4, 8, 3, 3], ["FSP", 4, 12, 4, 3], ["RE", 4, [0, 4, 8, 12, 1, 5, 9, 13, 2, 6, 10, 14, 3, 7, 11, 15]], ["CA", 3, 4, 11], ["CHR", 2, "shared", [3]], ["CA", 3, 4, 14], ["CHR", 1, "shared", [4]], ["CA", 2, 5, 14], ["CI", 1], ["FU", 6, [0, 1, 2, 3]], ["AN", 6, 0, 5], ["FU", 6, [1, 2, 3, 4]], ["AN", 6, 1, 4], ["FU", 6, [2, 3, 4, 5]], ["AN", 6, 2, 6], ["FU", 4, [0, 1, 2, 3]], ["SP", 4, 0, 96, [1], 1], ["AN", 4, 1, 2], ["FFSP", 4, 0, [4, 3, 2, 1], 1, 1], ["AN", 4, 1, 6], ["FU", 2, [0, 1, 2, 3]], ["SP", 2, 0, 256, [1], 1], ["AN", 2, 1, 2], ["FFSP", 2, 0, [4, 3, 2, 1], 1, 1], ["AN", 2, 1, 6], ["PR", 5, 0, "auto_unroll_max_step$0"]]]], "r": [[0.000251058], 0, 4.80356, 1682031897], "v": "v0.6"}
{"i": [["[\"conv2d_2_2\"]", "cuda -keys=cuda,gpu -arch=sm_80 -max_num_threads=1024 -thread_warp_size=32", [-1, 16, 64, 49152, 2147483647, 1024, 8, 32], "", 0, []], [[], [["CHW", 3, "local"], ["SP", 3, 0, 1, [1, 1, 1, 1], 1], ["SP", 3, 5, 64, [2, 8, 2, 2], 1], ["SP", 3, 10, 56, [1, 1, 4, 2], 1], ["SP", 3, 15, 56, [2, 4, 1, 1], 1], ["SP", 3, 20, 64, [2, 1], 1], ["SP", 3, 23, 3, [1, 3], 1], ["SP", 3, 26, 3, [1, 1], 1], ["RE", 3, [0, 5, 10, 15, 1, 6, 11, 16, 2, 7, 12, 17, 20, 23, 26, 21, 24, 27, 3, 8, 13, 18, 22, 25, 28, 4, 9, 14, 19]], ["FSP", 4, 0, 1, 3], ["FSP", 4, 4, 2, 3], ["FSP", 4, 8, 3, 3], ["FSP", 4, 12, 4, 3], ["RE", 4, [0, 4, 8, 12, 1, 5, 9, 13, 2, 6, 10, 14, 3, 7, 11, 15]], ["CA", 3, 4, 11], ["CHR", 2, "shared", [3]], ["CA", 3, 4, 14], ["CHR", 1, "shared", [4]], ["CA", 2, 5, 14], ["CI", 1], ["FU", 6, [0, 1, 2, 3]], ["AN", 6, 0, 5], ["FU", 6, [1, 2, 3, 4]], ["AN", 6, 1, 4], ["FU", 6, [2, 3, 4, 5]], ["AN", 6, 2, 6], ["FU", 4, [0, 1, 2, 3]], ["SP", 4, 0, 24, [1], 1], ["AN", 4, 1, 2], ["FFSP", 4, 0, [4, 3, 2, 1], 1, 1], ["AN", 4, 1, 6], ["FU", 2, [0, 1, 2, 3]], ["SP", 2, 0, 20, [1], 1], ["AN", 2, 1, 2], ["FFSP", 2, 0, [4, 3, 2, 1], 1, 1], ["AN", 2, 1, 6], ["PR", 5, 0, "auto_unroll_max_step$512"]]]], "r": [[0.000166108], 0, 7.62755, 1682031898], "v": "v0.6"}
{"i": [["[\"conv2d_2_2\"]", "cuda -keys=cuda,gpu -arch=sm_80 -max_num_threads=1024 -thread_warp_size=32", [-1, 16, 64, 49152, 2147483647, 1024, 8, 32], "", 0, []], [[], [["CHW", 3, "local"], ["SP", 3, 0, 1, [1, 1, 1, 1], 1], ["SP", 3, 5, 64, [2, 8, 4, 1], 1], ["SP", 3, 10, 56, [4, 1, 1, 2], 1], ["SP", 3, 15, 56, [1, 4, 1, 2], 1], ["SP", 3, 20, 64, [16, 2], 1], ["SP", 3, 23, 3, [1, 1], 1], ["SP", 3, 26, 3, [3, 1], 1], ["RE", 3, [0, 5, 10, 15, 1, 6, 11, 16, 2, 7, 12, 17, 20, 23, 26, 21, 24, 27, 3, 8, 13, 18, 22, 25, 28, 4, 9, 14, 19]], ["FSP", 4, 0, 1, 3], ["FSP", 4, 4, 2, 3], ["FSP", 4, 8, 3, 3], ["FSP", 4, 12, 4, 3], ["RE", 4, [0, 4, 8, 12, 1, 5, 9, 13, 2, 6, 10, 14, 3, 7, 11, 15]], ["CA", 3, 4, 11], ["CHR", 2, "shared", [3]], ["CA", 3, 4, 14], ["CHR", 1, "shared", [4]], ["CA", 2, 5, 14], ["CI", 1], ["FU", 6, [0, 1, 2, 3]], ["AN", 6, 0, 5], ["FU", 6, [1, 2, 3, 4]], ["AN", 6, 1, 4], ["FU", 6, [2, 3, 4, 5]], ["AN", 6, 2, 6], ["FU", 4, [0, 1, 2, 3]], ["SP", 4, 0, 384, [1], 1], ["AN", 4, 1, 2], ["FFSP", 4, 0, [4, 3, 2, 1], 1, 1], ["AN", 4, 1, 6], ["FU", 2, [0, 1, 2, 3]], ["SP", 2, 0, 256, [1], 1], ["AN", 2, 1, 2], ["FFSP", 2, 0, [4, 3, 2, 1], 1, 1], ["AN", 2, 1, 6], ["PR", 5, 0, "auto_unroll_max_step$0"]]]], "r": [[0.000330378], 0, 4.96115, 1682031899], "v": "v0.6"}
{"i": [["[\"conv2d_2_2\"]", "cuda -keys=cuda,gpu -arch=sm_80 -max_num_threads=1024 -thread_warp_size=32", [-1, 16, 64, 49152, 2147483647, 1024, 8, 32], "", 0, []], [[], [["CHW", 3, "local"], ["SP", 3, 0, 1, [1, 1, 1, 1], 1], ["SP", 3, 5, 64, [1, 32, 1, 2], 1], ["SP", 3, 10, 56, [1, 4, 1, 2], 1], ["SP", 3, 15, 56, [2, 1, 2, 2], 1], ["SP", 3, 20, 64, [2, 4], 1], ["SP", 3, 23, 3, [3, 1], 1], ["SP", 3, 26, 3, [1, 3], 1], ["RE", 3, [0, 5, 10, 15, 1, 6, 11, 16, 2, 7, 12, 17, 20, 23, 26, 21, 24, 27, 3, 8, 13, 18, 22, 25, 28, 4, 9, 14, 19]], ["FSP", 4, 0, 1, 3], ["FSP", 4, 4, 2, 3], ["FSP", 4, 8, 3, 3], ["FSP", 4, 12, 4, 3], ["RE", 4, [0, 4, 8, 12, 1, 5, 9, 13, 2, 6, 10, 14, 3, 7, 11, 15]], ["CA", 3, 4, 11], ["CHR", 2, "shared", [3]], ["CA", 3, 4, 14], ["CHR", 1, "shared", [4]], ["CA", 2, 5, 14], ["CI", 1], ["FU", 6, [0, 1, 2, 3]], ["AN", 6, 0, 5], ["FU", 6, [1, 2, 3, 4]], ["AN", 6, 1, 4], ["FU", 6, [2, 3, 4, 5]], ["AN", 6, 2, 6], ["FU", 4, [0, 1, 2, 3]], ["SP", 4, 0, 144, [1], 1], ["AN", 4, 1, 2], ["FFSP", 4, 0, [4, 3, 2, 1], 1, 1], ["AN", 4, 1, 6], ["FU", 2, [0, 1, 2, 3]], ["SP", 2, 0, 192, [1], 1], ["AN", 2, 1, 2], ["FFSP", 2, 0, [4, 3, 2, 1], 1, 1], ["AN", 2, 1, 6], ["PR", 5, 0, "auto_unroll_max_step$16"]]]], "r": [[9.7655e-05], 0, 5.56668, 1682031901], "v": "v0.6"}
{"i": [["[\"conv2d_2_2\"]", "cuda -keys=cuda,gpu -arch=sm_80 -max_num_threads=1024 -thread_warp_size=32", [-1, 16, 64, 49152, 2147483647, 1024, 8, 32], "", 0, []], [[], [["CHW", 3, "local"], ["SP", 3, 0, 1, [1, 1, 1, 1], 1], ["SP", 3, 5, 64, [2, 4, 1, 8], 1], ["SP", 3, 10, 56, [2, 4, 1, 1], 1], ["SP", 3, 15, 56, [2, 2, 2, 1], 1], ["SP", 3, 20, 64, [4, 1], 1], ["SP", 3, 23, 3, [1, 3], 1], ["SP", 3, 26, 3, [1, 3], 1], ["RE", 3, [0, 5, 10, 15, 1, 6, 11, 16, 2, 7, 12, 17, 20, 23, 26, 21, 24, 27, 3, 8, 13, 18, 22, 25, 28, 4, 9, 14, 19]], ["FSP", 4, 0, 1, 3], ["FSP", 4, 4, 2, 3], ["FSP", 4, 8, 3, 3], ["FSP", 4, 12, 4, 3], ["RE", 4, [0, 4, 8, 12, 1, 5, 9, 13, 2, 6, 10, 14, 3, 7, 11, 15]], ["CA", 3, 4, 11], ["CHR", 2, "shared", [3]], ["CA", 3, 4, 14], ["CHR", 1, "shared", [4]], ["CA", 2, 5, 14], ["CI", 1], ["FU", 6, [0, 1, 2, 3]], ["AN", 6, 0, 5], ["FU", 6, [1, 2, 3, 4]], ["AN", 6, 1, 4], ["FU", 6, [2, 3, 4, 5]], ["AN", 6, 2, 6], ["FU", 4, [0, 1, 2, 3]], ["SP", 4, 0, 288, [1], 1], ["AN", 4, 1, 2], ["FFSP", 4, 0, [4, 3, 2, 1], 1, 1], ["AN", 4, 1, 6], ["FU", 2, [0, 1, 2, 3]], ["SP", 2, 0, 48, [1], 1], ["AN", 2, 1, 2], ["FFSP", 2, 0, [4, 3, 2, 1], 1, 1], ["AN", 2, 1, 6], ["PR", 5, 0, "auto_unroll_max_step$16"]]]], "r": [[0.000175637], 0, 6.91565, 1682031902], "v": "v0.6"}
{"i": [["[\"conv2d_2_2\"]", "cuda -keys=cuda,gpu -arch=sm_80 -max_num_threads=1024 -thread_warp_size=32", [-1, 16, 64, 49152, 2147483647, 1024, 8, 32], "", 0, []], [[], [["CHW", 3, "local"], ["SP", 3, 0, 1, [1, 1, 1, 1], 1], ["SP", 3, 5, 64, [1, 16, 4, 1], 1], ["SP", 3, 10, 56, [2, 2, 2, 1], 1], ["SP", 3, 15, 56, [2, 4, 1, 1], 1], ["SP", 3, 20, 64, [4, 1], 1], ["SP", 3, 23, 3, [1, 1], 1], ["SP", 3, 26, 3, [1, 1], 1], ["RE", 3, [0, 5, 10, 15, 1, 6, 11, 16, 2, 7, 12, 17, 20, 23, 26, 21, 24, 27, 3, 8, 13, 18, 22, 25, 28, 4, 9, 14, 19]], ["FSP", 4, 0, 1, 3], ["FSP", 4, 4, 2, 3], ["FSP", 4, 8, 3, 3], ["FSP", 4, 12, 4, 3], ["RE", 4, [0, 4, 8, 12, 1, 5, 9, 13, 2, 6, 10, 14, 3, 7, 11, 15]], ["CA", 3, 4, 11], ["CHR", 2, "shared", [3]], ["CA", 3, 4, 14], ["CHR", 1, "shared", [4]], ["CA", 2, 5, 14], ["CI", 1], ["FU", 6, [0, 1, 2, 3]], ["AN", 6, 0, 5], ["FU", 6, [1, 2, 3, 4]], ["AN", 6, 1, 4], ["FU", 6, [2, 3, 4, 5]], ["AN", 6, 2, 6], ["FU", 4, [0, 1, 2, 3]], ["SP", 4, 0, 16, [1], 1], ["AN", 4, 1, 2], ["FFSP", 4, 0, [4, 3, 2, 1], 1, 1], ["AN", 4, 1, 6], ["FU", 2, [0, 1, 2, 3]], ["SP", 2, 0, 8, [1], 1], ["AN", 2, 1, 2], ["FFSP", 2, 0, [4, 3, 2, 1], 1, 1], ["AN", 2, 1, 6], ["PR", 5, 0, "auto_unroll_max_step$0"]]]], "r": [[6.2972e-05], 0, 4.32096, 1682031904], "v": "v0.6"}
{"i": [["[\"conv2d_2_2\"]", "cuda -keys=cuda,gpu -arch=sm_80 -max_num_threads=1024 -thread_warp_size=32", [-1, 16, 64, 49152, 2147483647, 1024, 8, 32], "", 0, []], [[], [["CHW", 3, "local"], ["SP", 3, 0, 1, [1, 1, 1, 1], 1], ["SP", 3, 5, 64, [2, 8, 2, 2], 1], ["SP", 3, 10, 56, [2, 2, 1, 2], 1], ["SP", 3, 15, 56, [2, 2, 1, 2], 1], ["SP", 3, 20, 64, [2, 4], 1], ["SP", 3, 23, 3, [1, 1], 1], ["SP", 3, 26, 3, [1, 1], 1], ["RE", 3, [0, 5, 10, 15, 1, 6, 11, 16, 2, 7, 12, 17, 20, 23, 26, 21, 24, 27, 3, 8, 13, 18, 22, 25, 28, 4, 9, 14, 19]], ["FSP", 4, 0, 1, 3], ["FSP", 4, 4, 2, 3], ["FSP", 4, 8, 3, 3], ["FSP", 4, 12, 4, 3], ["RE", 4, [0, 4, 8, 12, 1, 5, 9, 13, 2, 6, 10, 14, 3, 7, 11, 15]], ["CA", 3, 4, 11], ["CHR", 2, "shared", [3]], ["CA", 3, 4, 14], ["CHR", 1, "shared", [4]], ["CA", 2, 5, 14], ["CI", 1], ["FU", 6, [0, 1, 2, 3]], ["AN", 6, 0, 5], ["FU", 6, [1, 2, 3, 4]], ["AN", 6, 1, 4], ["FU", 6, [2, 3, 4, 5]], ["AN", 6, 2, 6], ["FU", 4, [0, 1, 2, 3]], ["SP", 4, 0, 32, [1], 1], ["AN", 4, 1, 2], ["FFSP", 4, 0, [4, 3, 2, 1], 1, 1], ["AN", 4, 1, 6], ["FU", 2, [0, 1, 2, 3]], ["SP", 2, 0, 32, [1], 1], ["AN", 2, 1, 2], ["FFSP", 2, 0, [4, 3, 2, 1], 1, 1], ["AN", 2, 1, 6], ["PR", 5, 0, "auto_unroll_max_step$512"]]]], "r": [[0.000153182], 0, 11.8448, 1682031905], "v": "v0.6"}
{"i": [["[\"conv2d_2_2\"]", "cuda -keys=cuda,gpu -arch=sm_80 -max_num_threads=1024 -thread_warp_size=32", [-1, 16, 64, 49152, 2147483647, 1024, 8, 32], "", 0, []], [[], [["CHW", 3, "local"], ["SP", 3, 0, 1, [1, 1, 1, 1], 1], ["SP", 3, 5, 64, [2, 2, 8, 2], 1], ["SP", 3, 10, 56, [1, 8, 1, 1], 1], ["SP", 3, 15, 56, [1, 2, 2, 2], 1], ["SP", 3, 20, 64, [1, 8], 1], ["SP", 3, 23, 3, [3, 1], 1], ["SP", 3, 26, 3, [1, 1], 1], ["RE", 3, [0, 5, 10, 15, 1, 6, 11, 16, 2, 7, 12, 17, 20, 23, 26, 21, 24, 27, 3, 8, 13, 18, 22, 25, 28, 4, 9, 14, 19]], ["FSP", 4, 0, 1, 3], ["FSP", 4, 4, 2, 3], ["FSP", 4, 8, 3, 3], ["FSP", 4, 12, 4, 3], ["RE", 4, [0, 4, 8, 12, 1, 5, 9, 13, 2, 6, 10, 14, 3, 7, 11, 15]], ["CA", 3, 4, 11], ["CHR", 2, "shared", [3]], ["CA", 3, 4, 14], ["CHR", 1, "shared", [4]], ["CA", 2, 5, 14], ["CI", 1], ["FU", 6, [0, 1, 2, 3]], ["AN", 6, 0, 5], ["FU", 6, [1, 2, 3, 4]], ["AN", 6, 1, 4], ["FU", 6, [2, 3, 4, 5]], ["AN", 6, 2, 6], ["FU", 4, [0, 1, 2, 3]], ["SP", 4, 0, 384, [1], 1], ["AN", 4, 1, 2], ["FFSP", 4, 0, [4, 3, 2, 1], 1, 1], ["AN", 4, 1, 6], ["FU", 2, [0, 1, 2, 3]], ["SP", 2, 0, 96, [1], 1], ["AN", 2, 1, 2], ["FFSP", 2, 0, [4, 3, 2, 1], 1, 1], ["AN", 2, 1, 6], ["PR", 5, 0, "auto_unroll_max_step$64"]]]], "r": [[0.000238776], 0, 8.66831, 1682031906], "v": "v0.6"}
{"i": [["[\"conv2d_2_2\"]", "cuda -keys=cuda,gpu -arch=sm_80 -max_num_threads=1024 -thread_warp_size=32", [-1, 16, 64, 49152, 2147483647, 1024, 8, 32], "", 0, []], [[], [["CHW", 3, "local"], ["SP", 3, 0, 1, [1, 1, 1, 1], 1], ["SP", 3, 5, 64, [1, 32, 2, 1], 1], ["SP", 3, 10, 56, [4, 1, 1, 2], 1], ["SP", 3, 15, 56, [2, 2, 1, 2], 1], ["SP", 3, 20, 64, [4, 1], 1], ["SP", 3, 23, 3, [1, 3], 1], ["SP", 3, 26, 3, [1, 1], 1], ["RE", 3, [0, 5, 10, 15, 1, 6, 11, 16, 2, 7, 12, 17, 20, 23, 26, 21, 24, 27, 3, 8, 13, 18, 22, 25, 28, 4, 9, 14, 19]], ["FSP", 4, 0, 1, 3], ["FSP", 4, 4, 2, 3], ["FSP", 4, 8, 3, 3], ["FSP", 4, 12, 4, 3], ["RE", 4, [0, 4, 8, 12, 1, 5, 9, 13, 2, 6, 10, 14, 3, 7, 11, 15]], ["CA", 3, 4, 11], ["CHR", 2, "shared", [3]], ["CA", 3, 4, 14], ["CHR", 1, "shared", [4]], ["CA", 2, 5, 14], ["CI", 1], ["FU", 6, [0, 1, 2, 3]], ["AN", 6, 0, 5], ["FU", 6, [1, 2, 3, 4]], ["AN", 6, 1, 4], ["FU", 6, [2, 3, 4, 5]], ["AN", 6, 2, 6], ["FU", 4, [0, 1, 2, 3]], ["SP", 4, 0, 24, [1], 1], ["AN", 4, 1, 2], ["FFSP", 4, 0, [4, 3, 2, 1], 1, 1], ["AN", 4, 1, 6], ["FU", 2, [0, 1, 2, 3]], ["SP", 2, 0, 32, [1], 1], ["AN", 2, 1, 2], ["FFSP", 2, 0, [4, 3, 2, 1], 1, 1], ["AN", 2, 1, 6], ["PR", 5, 0, "auto_unroll_max_step$64"]]]], "r": [[9.1103e-05], 0, 6.08319, 1682031908], "v": "v0.6"}
{"i": [["[\"conv2d_2_2\"]", "cuda -keys=cuda,gpu -arch=sm_80 -max_num_threads=1024 -thread_warp_size=32", [-1, 16, 64, 49152, 2147483647, 1024, 8, 32], "", 0, []], [[], [["CHW", 3, "local"], ["SP", 3, 0, 1, [1, 1, 1, 1], 1], ["SP", 3, 5, 64, [2, 16, 1, 2], 1], ["SP", 3, 10, 56, [1, 2, 1, 4], 1], ["SP", 3, 15, 56, [2, 2, 2, 1], 1], ["SP", 3, 20, 64, [2, 1], 1], ["SP", 3, 23, 3, [1, 1], 1], ["SP", 3, 26, 3, [1, 1], 1], ["RE", 3, [0, 5, 10, 15, 1, 6, 11, 16, 2, 7, 12, 17, 20, 23, 26, 21, 24, 27, 3, 8, 13, 18, 22, 25, 28, 4, 9, 14, 19]], ["FSP", 4, 0, 1, 3], ["FSP", 4, 4, 2, 3], ["FSP", 4, 8, 3, 3], ["FSP", 4, 12, 4, 3], ["RE", 4, [0, 4, 8, 12, 1, 5, 9, 13, 2, 6, 10, 14, 3, 7, 11, 15]], ["CA", 3, 4, 11], ["CHR", 2, "shared", [3]], ["CA", 3, 4, 14], ["CHR", 1, "shared", [4]], ["CA", 2, 5, 14], ["CI", 1], ["FU", 6, [0, 1, 2, 3]], ["AN", 6, 0, 5], ["FU", 6, [1, 2, 3, 4]], ["AN", 6, 1, 4], ["FU", 6, [2, 3, 4, 5]], ["AN", 6, 2, 6], ["FU", 4, [0, 1, 2, 3]], ["SP", 4, 0, 4, [1], 1], ["AN", 4, 1, 2], ["FFSP", 4, 0, [4, 3, 2, 1], 1, 1], ["AN", 4, 1, 6], ["FU", 2, [0, 1, 2, 3]], ["SP", 2, 0, 16, [1], 1], ["AN", 2, 1, 2], ["FFSP", 2, 0, [4, 3, 2, 1], 1, 1], ["AN", 2, 1, 6], ["PR", 5, 0, "auto_unroll_max_step$1024"]]]], "r": [[9.55948e-05], 0, 7.70035, 1682031909], "v": "v0.6"}
{"i": [["[\"conv2d_2_2\"]", "cuda -keys=cuda,gpu -arch=sm_80 -max_num_threads=1024 -thread_warp_size=32", [-1, 16, 64, 49152, 2147483647, 1024, 8, 32], "", 0, []], [[], [["CHW", 3, "local"], ["SP", 3, 0, 1, [1, 1, 1, 1], 1], ["SP", 3, 5, 64, [1, 64, 1, 1], 1], ["SP", 3, 10, 56, [2, 4, 1, 1], 1], ["SP", 3, 15, 56, [2, 2, 1, 2], 1], ["SP", 3, 20, 64, [4, 2], 1], ["SP", 3, 23, 3, [3, 1], 1], ["SP", 3, 26, 3, [3, 1], 1], ["RE", 3, [0, 5, 10, 15, 1, 6, 11, 16, 2, 7, 12, 17, 20, 23, 26, 21, 24, 27, 3, 8, 13, 18, 22, 25, 28, 4, 9, 14, 19]], ["FSP", 4, 0, 1, 3], ["FSP", 4, 4, 2, 3], ["FSP", 4, 8, 3, 3], ["FSP", 4, 12, 4, 3], ["RE", 4, [0, 4, 8, 12, 1, 5, 9, 13, 2, 6, 10, 14, 3, 7, 11, 15]], ["CA", 3, 4, 11], ["CHR", 2, "shared", [3]], ["CA", 3, 4, 14], ["CHR", 1, "shared", [4]], ["CA", 2, 5, 14], ["CI", 1], ["FU", 6, [0, 1, 2, 3]], ["AN", 6, 0, 5], ["FU", 6, [1, 2, 3, 4]], ["AN", 6, 1, 4], ["FU", 6, [2, 3, 4, 5]], ["AN", 6, 2, 6], ["FU", 4, [0, 1, 2, 3]], ["SP", 4, 0, 72, [1], 1], ["AN", 4, 1, 2], ["FFSP", 4, 0, [4, 3, 2, 1], 1, 1], ["AN", 4, 1, 6], ["FU", 2, [0, 1, 2, 3]], ["SP", 2, 0, 96, [1], 1], ["AN", 2, 1, 2], ["FFSP", 2, 0, [4, 3, 2, 1], 1, 1], ["AN", 2, 1, 6], ["PR", 5, 0, "auto_unroll_max_step$16"]]]], "r": [[8.67068e-05], 0, 4.68275, 1682031911], "v": "v0.6"}
{"i": [["[\"conv2d_2_2\"]", "cuda -keys=cuda,gpu -arch=sm_80 -max_num_threads=1024 -thread_warp_size=32", [-1, 16, 64, 49152, 2147483647, 1024, 8, 32], "", 0, []], [[], [["CHW", 3, "local"], ["SP", 3, 0, 1, [1, 1, 1, 1], 1], ["SP", 3, 5, 64, [1, 16, 2, 2], 1], ["SP", 3, 10, 56, [1, 2, 1, 4], 1], ["SP", 3, 15, 56, [1, 2, 1, 4], 1], ["SP", 3, 20, 64, [2, 8], 1], ["SP", 3, 23, 3, [1, 3], 1], ["SP", 3, 26, 3, [1, 1], 1], ["RE", 3, [0, 5, 10, 15, 1, 6, 11, 16, 2, 7, 12, 17, 20, 23, 26, 21, 24, 27, 3, 8, 13, 18, 22, 25, 28, 4, 9, 14, 19]], ["FSP", 4, 0, 1, 3], ["FSP", 4, 4, 2, 3], ["FSP", 4, 8, 3, 3], ["FSP", 4, 12, 4, 3], ["RE", 4, [0, 4, 8, 12, 1, 5, 9, 13, 2, 6, 10, 14, 3, 7, 11, 15]], ["CA", 3, 4, 11], ["CHR", 2, "shared", [3]], ["CA", 3, 4, 14], ["CHR", 1, "shared", [4]], ["CA", 2, 5, 14], ["CI", 1], ["FU", 6, [0, 1, 2, 3]], ["AN", 6, 0, 5], ["FU", 6, [1, 2, 3, 4]], ["AN", 6, 1, 4], ["FU", 6, [2, 3, 4, 5]], ["AN", 6, 2, 6], ["FU", 4, [0, 1, 2, 3]], ["SP", 4, 0, 192, [1], 1], ["AN", 4, 1, 2], ["FFSP", 4, 0, [4, 3, 2, 1], 1, 1], ["AN", 4, 1, 6], ["FU", 2, [0, 1, 2, 3]], ["SP", 2, 0, 384, [1], 1], ["AN", 2, 1, 2], ["FFSP", 2, 0, [4, 3, 2, 1], 1, 1], ["AN", 2, 1, 6], ["PR", 5, 0, "auto_unroll_max_step$64"]]]], "r": [[0.00011171], 0, 7.55514, 1682031912], "v": "v0.6"}
{"i": [["[\"conv2d_2_2\"]", "cuda -keys=cuda,gpu -arch=sm_80 -max_num_threads=1024 -thread_warp_size=32", [-1, 16, 64, 49152, 2147483647, 1024, 8, 32], "", 0, []], [[], [["CHW", 3, "local"], ["SP", 3, 0, 1, [1, 1, 1, 1], 1], ["SP", 3, 5, 64, [1, 16, 2, 2], 1], ["SP", 3, 10, 56, [1, 8, 1, 1], 1], ["SP", 3, 15, 56, [4, 1, 1, 2], 1], ["SP", 3, 20, 64, [1, 2], 1], ["SP", 3, 23, 3, [1, 3], 1], ["SP", 3, 26, 3, [1, 3], 1], ["RE", 3, [0, 5, 10, 15, 1, 6, 11, 16, 2, 7, 12, 17, 20, 23, 26, 21, 24, 27, 3, 8, 13, 18, 22, 25, 28, 4, 9, 14, 19]], ["FSP", 4, 0, 1, 3], ["FSP", 4, 4, 2, 3], ["FSP", 4, 8, 3, 3], ["FSP", 4, 12, 4, 3], ["RE", 4, [0, 4, 8, 12, 1, 5, 9, 13, 2, 6, 10, 14, 3, 7, 11, 15]], ["CA", 3, 4, 11], ["CHR", 2, "shared", [3]], ["CA", 3, 4, 14], ["CHR", 1, "shared", [4]], ["CA", 2, 5, 14], ["CI", 1], ["FU", 6, [0, 1, 2, 3]], ["AN", 6, 0, 5], ["FU", 6, [1, 2, 3, 4]], ["AN", 6, 1, 4], ["FU", 6, [2, 3, 4, 5]], ["AN", 6, 2, 6], ["FU", 4, [0, 1, 2, 3]], ["SP", 4, 0, 72, [1], 1], ["AN", 4, 1, 2], ["FFSP", 4, 0, [4, 3, 2, 1], 1, 1], ["AN", 4, 1, 6], ["FU", 2, [0, 1, 2, 3]], ["SP", 2, 0, 24, [1], 1], ["AN", 2, 1, 2], ["FFSP", 2, 0, [4, 3, 2, 1], 1, 1], ["AN", 2, 1, 6], ["PR", 5, 0, "auto_unroll_max_step$64"]]]], "r": [[6.28834e-05], 0, 4.099, 1682031913], "v": "v0.6"}
{"i": [["[\"conv2d_2_2\"]", "cuda -keys=cuda,gpu -arch=sm_80 -max_num_threads=1024 -thread_warp_size=32", [-1, 16, 64, 49152, 2147483647, 1024, 8, 32], "", 0, []], [[], [["CHW", 3, "local"], ["SP", 3, 0, 1, [1, 1, 1, 1], 1], ["SP", 3, 5, 64, [1, 32, 1, 2], 1], ["SP", 3, 10, 56, [1, 2, 1, 4], 1], ["SP", 3, 15, 56, [2, 2, 1, 2], 1], ["SP", 3, 20, 64, [4, 16], 1], ["SP", 3, 23, 3, [1, 1], 1], ["SP", 3, 26, 3, [1, 1], 1], ["RE", 3, [0, 5, 10, 15, 1, 6, 11, 16, 2, 7, 12, 17, 20, 23, 26, 21, 24, 27, 3, 8, 13, 18, 22, 25, 28, 4, 9, 14, 19]], ["FSP", 4, 0, 1, 3], ["FSP", 4, 4, 2, 3], ["FSP", 4, 8, 3, 3], ["FSP", 4, 12, 4, 3], ["RE", 4, [0, 4, 8, 12, 1, 5, 9, 13, 2, 6, 10, 14, 3, 7, 11, 15]], ["CA", 3, 4, 11], ["CHR", 2, "shared", [3]], ["CA", 3, 4, 14], ["CHR", 1, "shared", [4]], ["CA", 2, 5, 14], ["CI", 1], ["FU", 6, [0, 1, 2, 3]], ["AN", 6, 0, 5], ["FU", 6, [1, 2, 3, 4]], ["AN", 6, 1, 4], ["FU", 6, [2, 3, 4, 5]], ["AN", 6, 2, 6], ["FU", 4, [0, 1, 2, 3]], ["SP", 4, 0, 128, [1], 1], ["AN", 4, 1, 2], ["FFSP", 4, 0, [4, 3, 2, 1], 1, 1], ["AN", 4, 1, 6], ["FU", 2, [0, 1, 2, 3]], ["SP", 2, 0, 512, [1], 1], ["AN", 2, 1, 2], ["FFSP", 2, 0, [4, 3, 2, 1], 1, 1], ["AN", 2, 1, 6], ["PR", 5, 0, "auto_unroll_max_step$0"]]]], "r": [[9.21112e-05], 0, 4.96792, 1682032118], "v": "v0.6"}
{"i": [["[\"conv2d_2_2\"]", "cuda -keys=cuda,gpu -arch=sm_80 -max_num_threads=1024 -thread_warp_size=32", [-1, 16, 64, 49152, 2147483647, 1024, 8, 32], "", 0, []], [[], [["CHW", 3, "local"], ["SP", 3, 0, 1, [1, 1, 1, 1], 1], ["SP", 3, 5, 64, [2, 16, 2, 1], 1], ["SP", 3, 10, 56, [2, 2, 1, 2], 1], ["SP", 3, 15, 56, [1, 8, 1, 1], 1], ["SP", 3, 20, 64, [1, 4], 1], ["SP", 3, 23, 3, [1, 1], 1], ["SP", 3, 26, 3, [3, 1], 1], ["RE", 3, [0, 5, 10, 15, 1, 6, 11, 16, 2, 7, 12, 17, 20, 23, 26, 21, 24, 27, 3, 8, 13, 18, 22, 25, 28, 4, 9, 14, 19]], ["FSP", 4, 0, 1, 3], ["FSP", 4, 4, 2, 3], ["FSP", 4, 8, 3, 3], ["FSP", 4, 12, 4, 3], ["RE", 4, [0, 4, 8, 12, 1, 5, 9, 13, 2, 6, 10, 14, 3, 7, 11, 15]], ["CA", 3, 4, 11], ["CHR", 2, "shared", [3]], ["CA", 3, 4, 14], ["CHR", 1, "shared", [4]], ["CA", 2, 5, 14], ["CI", 1], ["FU", 6, [0, 1, 2, 3]], ["AN", 6, 0, 5], ["FU", 6, [1, 2, 3, 4]], ["AN", 6, 1, 4], ["FU", 6, [2, 3, 4, 5]], ["AN", 6, 2, 6], ["FU", 4, [0, 1, 2, 3]], ["SP", 4, 0, 24, [1], 1], ["AN", 4, 1, 2], ["FFSP", 4, 0, [4, 3, 2, 1], 1, 1], ["AN", 4, 1, 6], ["FU", 2, [0, 1, 2, 3]], ["SP", 2, 0, 24, [1], 1], ["AN", 2, 1, 2], ["FFSP", 2, 0, [4, 3, 2, 1], 1, 1], ["AN", 2, 1, 6], ["PR", 5, 0, "auto_unroll_max_step$64"]]]], "r": [[7.14956e-05], 0, 5.00631, 1682032119], "v": "v0.6"}
{"i": [["[\"conv2d_2_2\"]", "cuda -keys=cuda,gpu -arch=sm_80 -max_num_threads=1024 -thread_warp_size=32", [-1, 16, 64, 49152, 2147483647, 1024, 8, 32], "", 0, []], [[], [["CHW", 3, "local"], ["SP", 3, 0, 1, [1, 1, 1, 1], 1], ["SP", 3, 5, 64, [1, 16, 1, 4], 1], ["SP", 3, 10, 56, [1, 2, 4, 1], 1], ["SP", 3, 15, 56, [8, 1, 1, 1], 1], ["SP", 3, 20, 64, [2, 4], 1], ["SP", 3, 23, 3, [1, 3], 1], ["SP", 3, 26, 3, [3, 1], 1], ["RE", 3, [0, 5, 10, 15, 1, 6, 11, 16, 2, 7, 12, 17, 20, 23, 26, 21, 24, 27, 3, 8, 13, 18, 22, 25, 28, 4, 9, 14, 19]], ["FSP", 4, 0, 1, 3], ["FSP", 4, 4, 2, 3], ["FSP", 4, 8, 3, 3], ["FSP", 4, 12, 4, 3], ["RE", 4, [0, 4, 8, 12, 1, 5, 9, 13, 2, 6, 10, 14, 3, 7, 11, 15]], ["CA", 3, 4, 11], ["CHR", 2, "shared", [3]], ["CA", 3, 4, 14], ["CHR", 1, "shared", [4]], ["CA", 2, 5, 14], ["CI", 1], ["FU", 6, [0, 1, 2, 3]], ["AN", 6, 0, 5], ["FU", 6, [1, 2, 3, 4]], ["AN", 6, 1, 4], ["FU", 6, [2, 3, 4, 5]], ["AN", 6, 2, 6], ["FU", 4, [0, 1, 2, 3]], ["SP", 4, 0, 288, [1], 1], ["AN", 4, 1, 2], ["FFSP", 4, 0, [4, 3, 2, 1], 1, 1], ["AN", 4, 1, 6], ["FU", 2, [0, 1, 2, 3]], ["SP", 2, 0, 144, [1], 1], ["AN", 2, 1, 2], ["FFSP", 2, 0, [4, 3, 2, 1], 1, 1], ["AN", 2, 1, 6], ["PR", 5, 0, "auto_unroll_max_step$0"]]]], "r": [[0.000391632], 0, 5.22868, 1682032120], "v": "v0.6"}
{"i": [["[\"conv2d_2_2\"]", "cuda -keys=cuda,gpu -arch=sm_80 -max_num_threads=1024 -thread_warp_size=32", [-1, 16, 64, 49152, 2147483647, 1024, 8, 32], "", 0, []], [[], [["CHW", 3, "local"], ["SP", 3, 0, 1, [1, 1, 1, 1], 1], ["SP", 3, 5, 64, [1, 4, 4, 4], 1], ["SP", 3, 10, 56, [2, 2, 2, 1], 1], ["SP", 3, 15, 56, [1, 8, 1, 1], 1], ["SP", 3, 20, 64, [64, 1], 1], ["SP", 3, 23, 3, [1, 1], 1], ["SP", 3, 26, 3, [1, 1], 1], ["RE", 3, [0, 5, 10, 15, 1, 6, 11, 16, 2, 7, 12, 17, 20, 23, 26, 21, 24, 27, 3, 8, 13, 18, 22, 25, 28, 4, 9, 14, 19]], ["FSP", 4, 0, 1, 3], ["FSP", 4, 4, 2, 3], ["FSP", 4, 8, 3, 3], ["FSP", 4, 12, 4, 3], ["RE", 4, [0, 4, 8, 12, 1, 5, 9, 13, 2, 6, 10, 14, 3, 7, 11, 15]], ["CA", 3, 4, 11], ["CHR", 2, "shared", [3]], ["CA", 3, 4, 14], ["CHR", 1, "shared", [4]], ["CA", 2, 5, 14], ["CI", 1], ["FU", 6, [0, 1, 2, 3]], ["AN", 6, 0, 5], ["FU", 6, [1, 2, 3, 4]], ["AN", 6, 1, 4], ["FU", 6, [2, 3, 4, 5]], ["AN", 6, 2, 6], ["FU", 4, [0, 1, 2, 3]], ["SP", 4, 0, 1024, [1], 1], ["AN", 4, 1, 2], ["FFSP", 4, 0, [4, 3, 2, 1], 1, 1], ["AN", 4, 1, 6], ["FU", 2, [0, 1, 2, 3]], ["SP", 2, 0, 128, [1], 1], ["AN", 2, 1, 2], ["FFSP", 2, 0, [4, 3, 2, 1], 1, 1], ["AN", 2, 1, 6], ["PR", 5, 0, "auto_unroll_max_step$512"]]]], "r": [[0.000109198], 0, 11.5394, 1682032122], "v": "v0.6"}
{"i": [["[\"conv2d_2_2\"]", "cuda -keys=cuda,gpu -arch=sm_80 -max_num_threads=1024 -thread_warp_size=32", [-1, 16, 64, 49152, 2147483647, 1024, 8, 32], "", 0, []], [[], [["CHW", 3, "local"], ["SP", 3, 0, 1, [1, 1, 1, 1], 1], ["SP", 3, 5, 64, [1, 8, 8, 1], 1], ["SP", 3, 10, 56, [2, 2, 2, 1], 1], ["SP", 3, 15, 56, [1, 2, 1, 4], 1], ["SP", 3, 20, 64, [4, 8], 1], ["SP", 3, 23, 3, [1, 3], 1], ["SP", 3, 26, 3, [1, 1], 1], ["RE", 3, [0, 5, 10, 15, 1, 6, 11, 16, 2, 7, 12, 17, 20, 23, 26, 21, 24, 27, 3, 8, 13, 18, 22, 25, 28, 4, 9, 14, 19]], ["FSP", 4, 0, 1, 3], ["FSP", 4, 4, 2, 3], ["FSP", 4, 8, 3, 3], ["FSP", 4, 12, 4, 3], ["RE", 4, [0, 4, 8, 12, 1, 5, 9, 13, 2, 6, 10, 14, 3, 7, 11, 15]], ["CA", 3, 4, 11], ["CHR", 2, "shared", [3]], ["CA", 3, 4, 14], ["CHR", 1, "shared", [4]], ["CA", 2, 5, 14], ["CI", 1], ["FU", 6, [0, 1, 2, 3]], ["AN", 6, 0, 5], ["FU", 6, [1, 2, 3, 4]], ["AN", 6, 1, 4], ["FU", 6, [2, 3, 4, 5]], ["AN", 6, 2, 6], ["FU", 4, [0, 1, 2, 3]], ["SP", 4, 0, 768, [1], 1], ["AN", 4, 1, 2], ["FFSP", 4, 0, [4, 3, 2, 1], 1, 1], ["AN", 4, 1, 6], ["FU", 2, [0, 1, 2, 3]], ["SP", 2, 0, 512, [1], 1], ["AN", 2, 1, 2], ["FFSP", 2, 0, [4, 3, 2, 1], 1, 1], ["AN", 2, 1, 6], ["PR", 5, 0, "auto_unroll_max_step$64"]]]], "r": [[0.000414321], 0, 5.30085, 1682032123], "v": "v0.6"}
