runtime/fineco/code_gen/resnet/conv2_4-100.json
{"i": [["[\"conv2d_2_4\"]", "cuda -keys=cuda,gpu -arch=sm_80 -max_num_threads=1024 -thread_warp_size=32", [-1, 16, 64, 49152, 2147483647, 1024, 8, 32], "", 0, []], [[], [["CHW", 3, "local"], ["SP", 3, 0, 1, [1, 1, 1, 1], 1], ["SP", 3, 5, 64, [2, 8, 4, 1], 1], ["SP", 3, 10, 56, [1, 4, 1, 7], 1], ["SP", 3, 15, 56, [1, 1, 1, 7], 1], ["SP", 3, 20, 256, [8, 1], 1], ["SP", 3, 23, 1, [1, 1], 1], ["SP", 3, 26, 1, [1, 1], 1], ["RE", 3, [0, 5, 10, 15, 1, 6, 11, 16, 2, 7, 12, 17, 20, 23, 26, 21, 24, 27, 3, 8, 13, 18, 22, 25, 28, 4, 9, 14, 19]], ["FSP", 4, 0, 1, 3], ["FSP", 4, 4, 2, 3], ["FSP", 4, 8, 3, 3], ["FSP", 4, 12, 4, 3], ["RE", 4, [0, 4, 8, 12, 1, 5, 9, 13, 2, 6, 10, 14, 3, 7, 11, 15]], ["CA", 3, 4, 11], ["CHR", 2, "shared", [3]], ["CA", 3, 4, 14], ["CHR", 1, "shared", [4]], ["CA", 2, 5, 14], ["CI", 1], ["FU", 6, [0, 1, 2, 3]], ["AN", 6, 0, 5], ["FU", 6, [1, 2, 3, 4]], ["AN", 6, 1, 4], ["FU", 6, [2, 3, 4, 5]], ["AN", 6, 2, 6], ["FU", 4, [0, 1, 2, 3]], ["SP", 4, 0, 32, [1], 1], ["AN", 4, 1, 2], ["FFSP", 4, 0, [4, 3, 2, 1], 1, 1], ["AN", 4, 1, 6], ["FU", 2, [0, 1, 2, 3]], ["SP", 2, 0, 392, [8], 1], ["AN", 2, 1, 2], ["FFSP", 2, 0, [4, 3, 2, 1], 1, 1], ["AN", 2, 1, 6], ["PR", 5, 0, "auto_unroll_max_step$1024"]]]], "r": [[0.00154616], 0, 14.386, 1672658596], "v": "v0.6"}
{"i": [["[\"conv2d_2_4\"]", "cuda -keys=cuda,gpu -arch=sm_80 -max_num_threads=1024 -thread_warp_size=32", [-1, 16, 64, 49152, 2147483647, 1024, 8, 32], "", 0, []], [[], [["CHW", 3, "local"], ["SP", 3, 0, 1, [1, 1, 1, 1], 1], ["SP", 3, 5, 64, [2, 4, 1, 4], 1], ["SP", 3, 10, 56, [1, 2, 2, 2], 1], ["SP", 3, 15, 56, [2, 28, 1, 1], 1], ["SP", 3, 20, 256, [2, 2], 1], ["SP", 3, 23, 1, [1, 1], 1], ["SP", 3, 26, 1, [1, 1], 1], ["RE", 3, [0, 5, 10, 15, 1, 6, 11, 16, 2, 7, 12, 17, 20, 23, 26, 21, 24, 27, 3, 8, 13, 18, 22, 25, 28, 4, 9, 14, 19]], ["FSP", 4, 0, 1, 3], ["FSP", 4, 4, 2, 3], ["FSP", 4, 8, 3, 3], ["FSP", 4, 12, 4, 3], ["RE", 4, [0, 4, 8, 12, 1, 5, 9, 13, 2, 6, 10, 14, 3, 7, 11, 15]], ["CA", 3, 4, 11], ["CHR", 2, "shared", [3]], ["CA", 3, 4, 14], ["CHR", 1, "shared", [4]], ["CA", 2, 5, 14], ["CI", 1], ["FU", 6, [0, 1, 2, 3]], ["AN", 6, 0, 5], ["FU", 6, [1, 2, 3, 4]], ["AN", 6, 1, 4], ["FU", 6, [2, 3, 4, 5]], ["AN", 6, 2, 6], ["FU", 4, [0, 1, 2, 3]], ["SP", 4, 0, 16, [1], 1], ["AN", 4, 1, 2], ["FFSP", 4, 0, [4, 3, 2, 1], 1, 1], ["AN", 4, 1, 6], ["FU", 2, [0, 1, 2, 3]], ["SP", 2, 0, 56, [1], 1], ["AN", 2, 1, 2], ["FFSP", 2, 0, [4, 3, 2, 1], 1, 1], ["AN", 2, 1, 6], ["PR", 5, 0, "auto_unroll_max_step$512"]]]], "r": [[8.26789e-05], 0, 8.93949, 1672658597], "v": "v0.6"}
{"i": [["[\"conv2d_2_4\"]", "cuda -keys=cuda,gpu -arch=sm_80 -max_num_threads=1024 -thread_warp_size=32", [-1, 16, 64, 49152, 2147483647, 1024, 8, 32], "", 0, []], [[], [["CHW", 3, "local"], ["SP", 3, 0, 1, [1, 1, 1, 1], 1], ["SP", 3, 5, 64, [1, 32, 1, 2], 1], ["SP", 3, 10, 56, [1, 1, 2, 14], 1], ["SP", 3, 15, 56, [1, 7, 8, 1], 1], ["SP", 3, 20, 256, [1, 4], 1], ["SP", 3, 23, 1, [1, 1], 1], ["SP", 3, 26, 1, [1, 1], 1], ["RE", 3, [0, 5, 10, 15, 1, 6, 11, 16, 2, 7, 12, 17, 20, 23, 26, 21, 24, 27, 3, 8, 13, 18, 22, 25, 28, 4, 9, 14, 19]], ["FSP", 4, 0, 1, 3], ["FSP", 4, 4, 2, 3], ["FSP", 4, 8, 3, 3], ["FSP", 4, 12, 4, 3], ["RE", 4, [0, 4, 8, 12, 1, 5, 9, 13, 2, 6, 10, 14, 3, 7, 11, 15]], ["CA", 3, 4, 11], ["CHR", 2, "shared", [3]], ["CA", 3, 4, 14], ["CHR", 1, "shared", [4]], ["CA", 2, 5, 14], ["CI", 1], ["FU", 6, [0, 1, 2, 3]], ["AN", 6, 0, 5], ["FU", 6, [1, 2, 3, 4]], ["AN", 6, 1, 4], ["FU", 6, [2, 3, 4, 5]], ["AN", 6, 2, 6], ["FU", 4, [0, 1, 2, 3]], ["SP", 4, 0, 8, [1], 1], ["AN", 4, 1, 2], ["FFSP", 4, 0, [4, 3, 2, 1], 1, 1], ["AN", 4, 1, 6], ["FU", 2, [0, 1, 2, 3]], ["SP", 2, 0, 896, [1], 1], ["AN", 2, 1, 2], ["FFSP", 2, 0, [4, 3, 2, 1], 1, 1], ["AN", 2, 1, 6], ["PR", 5, 0, "auto_unroll_max_step$512"]]]], "r": [[0.00124481], 0, 11.0473, 1672658599], "v": "v0.6"}
{"i": [["[\"conv2d_2_4\"]", "cuda -keys=cuda,gpu -arch=sm_80 -max_num_threads=1024 -thread_warp_size=32", [-1, 16, 64, 49152, 2147483647, 1024, 8, 32], "", 0, []], [[], [["CHW", 3, "local"], ["SP", 3, 0, 1, [1, 1, 1, 1], 1], ["SP", 3, 5, 64, [2, 4, 2, 2], 1], ["SP", 3, 10, 56, [2, 1, 1, 1], 1], ["SP", 3, 15, 56, [1, 14, 1, 2], 1], ["SP", 3, 20, 256, [16, 1], 1], ["SP", 3, 23, 1, [1, 1], 1], ["SP", 3, 26, 1, [1, 1], 1], ["RE", 3, [0, 5, 10, 15, 1, 6, 11, 16, 2, 7, 12, 17, 20, 23, 26, 21, 24, 27, 3, 8, 13, 18, 22, 25, 28, 4, 9, 14, 19]], ["FSP", 4, 0, 1, 3], ["FSP", 4, 4, 2, 3], ["FSP", 4, 8, 3, 3], ["FSP", 4, 12, 4, 3], ["RE", 4, [0, 4, 8, 12, 1, 5, 9, 13, 2, 6, 10, 14, 3, 7, 11, 15]], ["CA", 3, 4, 11], ["CHR", 2, "shared", [3]], ["CA", 3, 4, 14], ["CHR", 1, "shared", [4]], ["CA", 2, 5, 14], ["CI", 1], ["FU", 6, [0, 1, 2, 3]], ["AN", 6, 0, 5], ["FU", 6, [1, 2, 3, 4]], ["AN", 6, 1, 4], ["FU", 6, [2, 3, 4, 5]], ["AN", 6, 2, 6], ["FU", 4, [0, 1, 2, 3]], ["SP", 4, 0, 16, [1], 1], ["AN", 4, 1, 2], ["FFSP", 4, 0, [4, 3, 2, 1], 1, 1], ["AN", 4, 1, 6], ["FU", 2, [0, 1, 2, 3]], ["SP", 2, 0, 64, [32], 1], ["AN", 2, 1, 2], ["FFSP", 2, 0, [4, 3, 2, 1], 1, 1], ["AN", 2, 1, 6], ["PR", 5, 0, "auto_unroll_max_step$512"]]]], "r": [[3.4747e-05], 0, 11.3439, 1672658600], "v": "v0.6"}
{"i": [["[\"conv2d_2_4\"]", "cuda -keys=cuda,gpu -arch=sm_80 -max_num_threads=1024 -thread_warp_size=32", [-1, 16, 64, 49152, 2147483647, 1024, 8, 32], "", 0, []], [[], [["CHW", 3, "local"], ["SP", 3, 0, 1, [1, 1, 1, 1], 1], ["SP", 3, 5, 64, [1, 8, 8, 1], 1], ["SP", 3, 10, 56, [1, 7, 1, 2], 1], ["SP", 3, 15, 56, [1, 1, 1, 7], 1], ["SP", 3, 20, 256, [1, 64], 1], ["SP", 3, 23, 1, [1, 1], 1], ["SP", 3, 26, 1, [1, 1], 1], ["RE", 3, [0, 5, 10, 15, 1, 6, 11, 16, 2, 7, 12, 17, 20, 23, 26, 21, 24, 27, 3, 8, 13, 18, 22, 25, 28, 4, 9, 14, 19]], ["FSP", 4, 0, 1, 3], ["FSP", 4, 4, 2, 3], ["FSP", 4, 8, 3, 3], ["FSP", 4, 12, 4, 3], ["RE", 4, [0, 4, 8, 12, 1, 5, 9, 13, 2, 6, 10, 14, 3, 7, 11, 15]], ["CA", 3, 4, 11], ["CHR", 2, "shared", [3]], ["CA", 3, 4, 14], ["CHR", 1, "shared", [4]], ["CA", 2, 5, 14], ["CI", 1], ["FU", 6, [0, 1, 2, 3]], ["AN", 6, 0, 5], ["FU", 6, [1, 2, 3, 4]], ["AN", 6, 1, 4], ["FU", 6, [2, 3, 4, 5]], ["AN", 6, 2, 6], ["FU", 4, [0, 1, 2, 3]], ["SP", 4, 0, 1024, [1], 1], ["AN", 4, 1, 2], ["FFSP", 4, 0, [4, 3, 2, 1], 1, 1], ["AN", 4, 1, 6], ["FU", 2, [0, 1, 2, 3]], ["SP", 2, 0, 448, [1], 1], ["AN", 2, 1, 2], ["FFSP", 2, 0, [4, 3, 2, 1], 1, 1], ["AN", 2, 1, 6], ["PR", 5, 0, "auto_unroll_max_step$512"]]]], "r": [[0.000120787], 0, 14.0977, 1672658601], "v": "v0.6"}
{"i": [["[\"conv2d_2_4\"]", "cuda -keys=cuda,gpu -arch=sm_80 -max_num_threads=1024 -thread_warp_size=32", [-1, 16, 64, 49152, 2147483647, 1024, 8, 32], "", 0, []], [[], [["CHW", 3, "local"], ["SP", 3, 0, 1, [1, 1, 1, 1], 1], ["SP", 3, 5, 64, [1, 4, 2, 1], 1], ["SP", 3, 10, 56, [7, 2, 1, 2], 1], ["SP", 3, 15, 56, [1, 4, 2, 1], 1], ["SP", 3, 20, 256, [4, 2], 1], ["SP", 3, 23, 1, [1, 1], 1], ["SP", 3, 26, 1, [1, 1], 1], ["RE", 3, [0, 5, 10, 15, 1, 6, 11, 16, 2, 7, 12, 17, 20, 23, 26, 21, 24, 27, 3, 8, 13, 18, 22, 25, 28, 4, 9, 14, 19]], ["FSP", 4, 0, 1, 3], ["FSP", 4, 4, 2, 3], ["FSP", 4, 8, 3, 3], ["FSP", 4, 12, 4, 3], ["RE", 4, [0, 4, 8, 12, 1, 5, 9, 13, 2, 6, 10, 14, 3, 7, 11, 15]], ["CA", 3, 4, 11], ["CHR", 2, "shared", [3]], ["CA", 3, 4, 14], ["CHR", 1, "shared", [4]], ["CA", 2, 5, 14], ["CI", 1], ["FU", 6, [0, 1, 2, 3]], ["AN", 6, 0, 5], ["FU", 6, [1, 2, 3, 4]], ["AN", 6, 1, 4], ["FU", 6, [2, 3, 4, 5]], ["AN", 6, 2, 6], ["FU", 4, [0, 1, 2, 3]], ["SP", 4, 0, 16, [4], 1], ["AN", 4, 1, 2], ["FFSP", 4, 0, [4, 3, 2, 1], 1, 1], ["AN", 4, 1, 6], ["FU", 2, [0, 1, 2, 3]], ["SP", 2, 0, 32, [2], 1], ["AN", 2, 1, 2], ["FFSP", 2, 0, [4, 3, 2, 1], 1, 1], ["AN", 2, 1, 6], ["PR", 5, 0, "auto_unroll_max_step$16"]]]], "r": [[9.87162e-05], 0, 7.15929, 1672658603], "v": "v0.6"}
{"i": [["[\"conv2d_2_4\"]", "cuda -keys=cuda,gpu -arch=sm_80 -max_num_threads=1024 -thread_warp_size=32", [-1, 16, 64, 49152, 2147483647, 1024, 8, 32], "", 0, []], [[], [["CHW", 3, "local"], ["SP", 3, 0, 1, [1, 1, 1, 1], 1], ["SP", 3, 5, 64, [2, 8, 1, 2], 1], ["SP", 3, 10, 56, [1, 2, 2, 1], 1], ["SP", 3, 15, 56, [2, 4, 7, 1], 1], ["SP", 3, 20, 256, [2, 2], 1], ["SP", 3, 23, 1, [1, 1], 1], ["SP", 3, 26, 1, [1, 1], 1], ["RE", 3, [0, 5, 10, 15, 1, 6, 11, 16, 2, 7, 12, 17, 20, 23, 26, 21, 24, 27, 3, 8, 13, 18, 22, 25, 28, 4, 9, 14, 19]], ["FSP", 4, 0, 1, 3], ["FSP", 4, 4, 2, 3], ["FSP", 4, 8, 3, 3], ["FSP", 4, 12, 4, 3], ["RE", 4, [0, 4, 8, 12, 1, 5, 9, 13, 2, 6, 10, 14, 3, 7, 11, 15]], ["CA", 3, 4, 11], ["CHR", 2, "shared", [3]], ["CA", 3, 4, 14], ["CHR", 1, "shared", [4]], ["CA", 2, 5, 14], ["CI", 1], ["FU", 6, [0, 1, 2, 3]], ["AN", 6, 0, 5], ["FU", 6, [1, 2, 3, 4]], ["AN", 6, 1, 4], ["FU", 6, [2, 3, 4, 5]], ["AN", 6, 2, 6], ["FU", 4, [0, 1, 2, 3]], ["SP", 4, 0, 16, [4], 1], ["AN", 4, 1, 2], ["FFSP", 4, 0, [4, 3, 2, 1], 1, 1], ["AN", 4, 1, 6], ["FU", 2, [0, 1, 2, 3]], ["SP", 2, 0, 56, [1], 1], ["AN", 2, 1, 2], ["FFSP", 2, 0, [4, 3, 2, 1], 1, 1], ["AN", 2, 1, 6], ["PR", 5, 0, "auto_unroll_max_step$16"]]]], "r": [[8.00226e-05], 0, 7.49371, 1672658604], "v": "v0.6"}
{"i": [["[\"conv2d_2_4\"]", "cuda -keys=cuda,gpu -arch=sm_80 -max_num_threads=1024 -thread_warp_size=32", [-1, 16, 64, 49152, 2147483647, 1024, 8, 32], "", 0, []], [[], [["CHW", 3, "local"], ["SP", 3, 0, 1, [1, 1, 1, 1], 1], ["SP", 3, 5, 64, [1, 8, 1, 4], 1], ["SP", 3, 10, 56, [1, 2, 7, 2], 1], ["SP", 3, 15, 56, [1, 2, 1, 2], 1], ["SP", 3, 20, 256, [1, 32], 1], ["SP", 3, 23, 1, [1, 1], 1], ["SP", 3, 26, 1, [1, 1], 1], ["RE", 3, [0, 5, 10, 15, 1, 6, 11, 16, 2, 7, 12, 17, 20, 23, 26, 21, 24, 27, 3, 8, 13, 18, 22, 25, 28, 4, 9, 14, 19]], ["FSP", 4, 0, 1, 3], ["FSP", 4, 4, 2, 3], ["FSP", 4, 8, 3, 3], ["FSP", 4, 12, 4, 3], ["RE", 4, [0, 4, 8, 12, 1, 5, 9, 13, 2, 6, 10, 14, 3, 7, 11, 15]], ["CA", 3, 4, 11], ["CHR", 2, "shared", [3]], ["CA", 3, 4, 14], ["CHR", 1, "shared", [4]], ["CA", 2, 5, 14], ["CI", 1], ["FU", 6, [0, 1, 2, 3]], ["AN", 6, 0, 5], ["FU", 6, [1, 2, 3, 4]], ["AN", 6, 1, 4], ["FU", 6, [2, 3, 4, 5]], ["AN", 6, 2, 6], ["FU", 4, [0, 1, 2, 3]], ["SP", 4, 0, 64, [1], 1], ["AN", 4, 1, 2], ["FFSP", 4, 0, [4, 3, 2, 1], 1, 1], ["AN", 4, 1, 6], ["FU", 2, [0, 1, 2, 3]], ["SP", 2, 0, 448, [1], 1], ["AN", 2, 1, 2], ["FFSP", 2, 0, [4, 3, 2, 1], 1, 1], ["AN", 2, 1, 6], ["PR", 5, 0, "auto_unroll_max_step$16"]]]], "r": [[0.000106116], 0, 7.50994, 1672658605], "v": "v0.6"}
{"i": [["[\"conv2d_2_4\"]", "cuda -keys=cuda,gpu -arch=sm_80 -max_num_threads=1024 -thread_warp_size=32", [-1, 16, 64, 49152, 2147483647, 1024, 8, 32], "", 0, []], [[], [["CHW", 3, "local"], ["SP", 3, 0, 1, [1, 1, 1, 1], 1], ["SP", 3, 5, 64, [2, 2, 1, 1], 1], ["SP", 3, 10, 56, [2, 14, 1, 1], 1], ["SP", 3, 15, 56, [1, 7, 2, 2], 1], ["SP", 3, 20, 256, [1, 4], 1], ["SP", 3, 23, 1, [1, 1], 1], ["SP", 3, 26, 1, [1, 1], 1], ["RE", 3, [0, 5, 10, 15, 1, 6, 11, 16, 2, 7, 12, 17, 20, 23, 26, 21, 24, 27, 3, 8, 13, 18, 22, 25, 28, 4, 9, 14, 19]], ["FSP", 4, 0, 1, 3], ["FSP", 4, 4, 2, 3], ["FSP", 4, 8, 3, 3], ["FSP", 4, 12, 4, 3], ["RE", 4, [0, 4, 8, 12, 1, 5, 9, 13, 2, 6, 10, 14, 3, 7, 11, 15]], ["CA", 3, 4, 11], ["CHR", 2, "shared", [3]], ["CA", 3, 4, 14], ["CHR", 1, "shared", [4]], ["CA", 2, 5, 14], ["CI", 1], ["FU", 6, [0, 1, 2, 3]], ["AN", 6, 0, 5], ["FU", 6, [1, 2, 3, 4]], ["AN", 6, 1, 4], ["FU", 6, [2, 3, 4, 5]], ["AN", 6, 2, 6], ["FU", 4, [0, 1, 2, 3]], ["SP", 4, 0, 4, [1], 1], ["AN", 4, 1, 2], ["FFSP", 4, 0, [4, 3, 2, 1], 1, 1], ["AN", 4, 1, 6], ["FU", 2, [0, 1, 2, 3]], ["SP", 2, 0, 32, [1], 1], ["AN", 2, 1, 2], ["FFSP", 2, 0, [4, 3, 2, 1], 1, 1], ["AN", 2, 1, 6], ["PR", 5, 0, "auto_unroll_max_step$0"]]]], "r": [[4.80683e-05], 0, 6.22275, 1672658607], "v": "v0.6"}
{"i": [["[\"conv2d_2_4\"]", "cuda -keys=cuda,gpu -arch=sm_80 -max_num_threads=1024 -thread_warp_size=32", [-1, 16, 64, 49152, 2147483647, 1024, 8, 32], "", 0, []], [[], [["CHW", 3, "local"], ["SP", 3, 0, 1, [1, 1, 1, 1], 1], ["SP", 3, 5, 64, [1, 4, 2, 8], 1], ["SP", 3, 10, 56, [2, 28, 1, 1], 1], ["SP", 3, 15, 56, [4, 7, 1, 1], 1], ["SP", 3, 20, 256, [1, 1], 1], ["SP", 3, 23, 1, [1, 1], 1], ["SP", 3, 26, 1, [1, 1], 1], ["RE", 3, [0, 5, 10, 15, 1, 6, 11, 16, 2, 7, 12, 17, 20, 23, 26, 21, 24, 27, 3, 8, 13, 18, 22, 25, 28, 4, 9, 14, 19]], ["FSP", 4, 0, 1, 3], ["FSP", 4, 4, 2, 3], ["FSP", 4, 8, 3, 3], ["FSP", 4, 12, 4, 3], ["RE", 4, [0, 4, 8, 12, 1, 5, 9, 13, 2, 6, 10, 14, 3, 7, 11, 15]], ["CA", 3, 4, 11], ["CHR", 2, "shared", [3]], ["CA", 3, 4, 14], ["CHR", 1, "shared", [4]], ["CA", 2, 5, 14], ["CI", 1], ["FU", 6, [0, 1, 2, 3]], ["AN", 6, 0, 5], ["FU", 6, [1, 2, 3, 4]], ["AN", 6, 1, 4], ["FU", 6, [2, 3, 4, 5]], ["AN", 6, 2, 6], ["FU", 4, [0, 1, 2, 3]], ["SP", 4, 0, 16, [1], 1], ["AN", 4, 1, 2], ["FFSP", 4, 0, [4, 3, 2, 1], 1, 1], ["AN", 4, 1, 6], ["FU", 2, [0, 1, 2, 3]], ["SP", 2, 0, 1, [1], 1], ["AN", 2, 1, 2], ["FFSP", 2, 0, [4, 3, 2, 1], 1, 1], ["AN", 2, 1, 6], ["PR", 5, 0, "auto_unroll_max_step$512"]]]], "r": [[0.00316806], 0, 6.84856, 1672658608], "v": "v0.6"}
{"i": [["[\"conv2d_2_4\"]", "cuda -keys=cuda,gpu -arch=sm_80 -max_num_threads=1024 -thread_warp_size=32", [-1, 16, 64, 49152, 2147483647, 1024, 8, 32], "", 0, []], [[], [["CHW", 3, "local"], ["SP", 3, 0, 1, [1, 1, 1, 1], 1], ["SP", 3, 5, 64, [1, 4, 1, 8], 1], ["SP", 3, 10, 56, [1, 4, 2, 1], 1], ["SP", 3, 15, 56, [4, 14, 1, 1], 1], ["SP", 3, 20, 256, [2, 1], 1], ["SP", 3, 23, 1, [1, 1], 1], ["SP", 3, 26, 1, [1, 1], 1], ["RE", 3, [0, 5, 10, 15, 1, 6, 11, 16, 2, 7, 12, 17, 20, 23, 26, 21, 24, 27, 3, 8, 13, 18, 22, 25, 28, 4, 9, 14, 19]], ["FSP", 4, 0, 1, 3], ["FSP", 4, 4, 2, 3], ["FSP", 4, 8, 3, 3], ["FSP", 4, 12, 4, 3], ["RE", 4, [0, 4, 8, 12, 1, 5, 9, 13, 2, 6, 10, 14, 3, 7, 11, 15]], ["CA", 3, 4, 11], ["CHR", 2, "shared", [3]], ["CA", 3, 4, 14], ["CHR", 1, "shared", [4]], ["CA", 2, 5, 14], ["CI", 1], ["FU", 6, [0, 1, 2, 3]], ["AN", 6, 0, 5], ["FU", 6, [1, 2, 3, 4]], ["AN", 6, 1, 4], ["FU", 6, [2, 3, 4, 5]], ["AN", 6, 2, 6], ["FU", 4, [0, 1, 2, 3]], ["SP", 4, 0, 16, [1], 1], ["AN", 4, 1, 2], ["FFSP", 4, 0, [4, 3, 2, 1], 1, 1], ["AN", 4, 1, 6], ["FU", 2, [0, 1, 2, 3]], ["SP", 2, 0, 4, [1], 1], ["AN", 2, 1, 2], ["FFSP", 2, 0, [4, 3, 2, 1], 1, 1], ["AN", 2, 1, 6], ["PR", 5, 0, "auto_unroll_max_step$16"]]]], "r": [[9.83051e-05], 0, 5.91832, 1672658609], "v": "v0.6"}
{"i": [["[\"conv2d_2_4\"]", "cuda -keys=cuda,gpu -arch=sm_80 -max_num_threads=1024 -thread_warp_size=32", [-1, 16, 64, 49152, 2147483647, 1024, 8, 32], "", 0, []], [[], [["CHW", 3, "local"], ["SP", 3, 0, 1, [1, 1, 1, 1], 1], ["SP", 3, 5, 64, [1, 8, 4, 2], 1], ["SP", 3, 10, 56, [7, 1, 1, 8], 1], ["SP", 3, 15, 56, [1, 4, 1, 7], 1], ["SP", 3, 20, 256, [4, 1], 1], ["SP", 3, 23, 1, [1, 1], 1], ["SP", 3, 26, 1, [1, 1], 1], ["RE", 3, [0, 5, 10, 15, 1, 6, 11, 16, 2, 7, 12, 17, 20, 23, 26, 21, 24, 27, 3, 8, 13, 18, 22, 25, 28, 4, 9, 14, 19]], ["FSP", 4, 0, 1, 3], ["FSP", 4, 4, 2, 3], ["FSP", 4, 8, 3, 3], ["FSP", 4, 12, 4, 3], ["RE", 4, [0, 4, 8, 12, 1, 5, 9, 13, 2, 6, 10, 14, 3, 7, 11, 15]], ["CA", 3, 4, 11], ["CHR", 2, "shared", [3]], ["CA", 3, 4, 14], ["CHR", 1, "shared", [4]], ["CA", 2, 5, 14], ["CI", 1], ["FU", 6, [0, 1, 2, 3]], ["AN", 6, 0, 5], ["FU", 6, [1, 2, 3, 4]], ["AN", 6, 1, 4], ["FU", 6, [2, 3, 4, 5]], ["AN", 6, 2, 6], ["FU", 4, [0, 1, 2, 3]], ["SP", 4, 0, 64, [1], 1], ["AN", 4, 1, 2], ["FFSP", 4, 0, [4, 3, 2, 1], 1, 1], ["AN", 4, 1, 6], ["FU", 2, [0, 1, 2, 3]], ["SP", 2, 0, 64, [1], 1], ["AN", 2, 1, 2], ["FFSP", 2, 0, [4, 3, 2, 1], 1, 1], ["AN", 2, 1, 6], ["PR", 5, 0, "auto_unroll_max_step$16"]]]], "r": [[0.010318], 0, 9.70699, 1672658610], "v": "v0.6"}
{"i": [["[\"conv2d_2_4\"]", "cuda -keys=cuda,gpu -arch=sm_80 -max_num_threads=1024 -thread_warp_size=32", [-1, 16, 64, 49152, 2147483647, 1024, 8, 32], "", 0, []], [[], [["CHW", 3, "local"], ["SP", 3, 0, 1, [1, 1, 1, 1], 1], ["SP", 3, 5, 64, [1, 16, 4, 1], 1], ["SP", 3, 10, 56, [2, 1, 2, 2], 1], ["SP", 3, 15, 56, [1, 7, 2, 1], 1], ["SP", 3, 20, 256, [2, 4], 1], ["SP", 3, 23, 1, [1, 1], 1], ["SP", 3, 26, 1, [1, 1], 1], ["RE", 3, [0, 5, 10, 15, 1, 6, 11, 16, 2, 7, 12, 17, 20, 23, 26, 21, 24, 27, 3, 8, 13, 18, 22, 25, 28, 4, 9, 14, 19]], ["FSP", 4, 0, 1, 3], ["FSP", 4, 4, 2, 3], ["FSP", 4, 8, 3, 3], ["FSP", 4, 12, 4, 3], ["RE", 4, [0, 4, 8, 12, 1, 5, 9, 13, 2, 6, 10, 14, 3, 7, 11, 15]], ["CA", 3, 4, 11], ["CHR", 2, "shared", [3]], ["CA", 3, 4, 14], ["CHR", 1, "shared", [4]], ["CA", 2, 5, 14], ["CI", 1], ["FU", 6, [0, 1, 2, 3]], ["AN", 6, 0, 5], ["FU", 6, [1, 2, 3, 4]], ["AN", 6, 1, 4], ["FU", 6, [2, 3, 4, 5]], ["AN", 6, 2, 6], ["FU", 4, [0, 1, 2, 3]], ["SP", 4, 0, 32, [1], 1], ["AN", 4, 1, 2], ["FFSP", 4, 0, [4, 3, 2, 1], 1, 1], ["AN", 4, 1, 6], ["FU", 2, [0, 1, 2, 3]], ["SP", 2, 0, 64, [1], 1], ["AN", 2, 1, 2], ["FFSP", 2, 0, [4, 3, 2, 1], 1, 1], ["AN", 2, 1, 6], ["PR", 5, 0, "auto_unroll_max_step$64"]]]], "r": [[5.07038e-05], 0, 7.79062, 1672658611], "v": "v0.6"}
{"i": [["[\"conv2d_2_4\"]", "cuda -keys=cuda,gpu -arch=sm_80 -max_num_threads=1024 -thread_warp_size=32", [-1, 16, 64, 49152, 2147483647, 1024, 8, 32], "", 0, []], [[], [["CHW", 3, "local"], ["SP", 3, 0, 1, [1, 1, 1, 1], 1], ["SP", 3, 5, 64, [2, 32, 1, 1], 1], ["SP", 3, 10, 56, [2, 1, 1, 1], 1], ["SP", 3, 15, 56, [1, 1, 8, 1], 1], ["SP", 3, 20, 256, [1, 4], 1], ["SP", 3, 23, 1, [1, 1], 1], ["SP", 3, 26, 1, [1, 1], 1], ["RE", 3, [0, 5, 10, 15, 1, 6, 11, 16, 2, 7, 12, 17, 20, 23, 26, 21, 24, 27, 3, 8, 13, 18, 22, 25, 28, 4, 9, 14, 19]], ["FSP", 4, 0, 1, 3], ["FSP", 4, 4, 2, 3], ["FSP", 4, 8, 3, 3], ["FSP", 4, 12, 4, 3], ["RE", 4, [0, 4, 8, 12, 1, 5, 9, 13, 2, 6, 10, 14, 3, 7, 11, 15]], ["CA", 3, 4, 11], ["CHR", 2, "shared", [3]], ["CA", 3, 4, 14], ["CHR", 1, "shared", [4]], ["CA", 2, 5, 14], ["CI", 1], ["FU", 6, [0, 1, 2, 3]], ["AN", 6, 0, 5], ["FU", 6, [1, 2, 3, 4]], ["AN", 6, 1, 4], ["FU", 6, [2, 3, 4, 5]], ["AN", 6, 2, 6], ["FU", 4, [0, 1, 2, 3]], ["SP", 4, 0, 4, [1], 1], ["AN", 4, 1, 2], ["FFSP", 4, 0, [4, 3, 2, 1], 1, 1], ["AN", 4, 1, 6], ["FU", 2, [0, 1, 2, 3]], ["SP", 2, 0, 32, [1], 1], ["AN", 2, 1, 2], ["FFSP", 2, 0, [4, 3, 2, 1], 1, 1], ["AN", 2, 1, 6], ["PR", 5, 0, "auto_unroll_max_step$64"]]]], "r": [[3.77545e-05], 0, 5.82444, 1672658613], "v": "v0.6"}
{"i": [["[\"conv2d_2_4\"]", "cuda -keys=cuda,gpu -arch=sm_80 -max_num_threads=1024 -thread_warp_size=32", [-1, 16, 64, 49152, 2147483647, 1024, 8, 32], "", 0, []], [[], [["CHW", 3, "local"], ["SP", 3, 0, 1, [1, 1, 1, 1], 1], ["SP", 3, 5, 64, [2, 4, 1, 1], 1], ["SP", 3, 10, 56, [1, 1, 2, 1], 1], ["SP", 3, 15, 56, [1, 14, 1, 2], 1], ["SP", 3, 20, 256, [16, 1], 1], ["SP", 3, 23, 1, [1, 1], 1], ["SP", 3, 26, 1, [1, 1], 1], ["RE", 3, [0, 5, 10, 15, 1, 6, 11, 16, 2, 7, 12, 17, 20, 23, 26, 21, 24, 27, 3, 8, 13, 18, 22, 25, 28, 4, 9, 14, 19]], ["FSP", 4, 0, 1, 3], ["FSP", 4, 4, 2, 3], ["FSP", 4, 8, 3, 3], ["FSP", 4, 12, 4, 3], ["RE", 4, [0, 4, 8, 12, 1, 5, 9, 13, 2, 6, 10, 14, 3, 7, 11, 15]], ["CA", 3, 4, 11], ["CHR", 2, "shared", [3]], ["CA", 3, 4, 14], ["CHR", 1, "shared", [4]], ["CA", 2, 5, 14], ["CI", 1], ["FU", 6, [0, 1, 2, 3]], ["AN", 6, 0, 5], ["FU", 6, [1, 2, 3, 4]], ["AN", 6, 1, 4], ["FU", 6, [2, 3, 4, 5]], ["AN", 6, 2, 6], ["FU", 4, [0, 1, 2, 3]], ["SP", 4, 0, 16, [1], 1], ["AN", 4, 1, 2], ["FFSP", 4, 0, [4, 3, 2, 1], 1, 1], ["AN", 4, 1, 6], ["FU", 2, [0, 1, 2, 3]], ["SP", 2, 0, 64, [2], 1], ["AN", 2, 1, 2], ["FFSP", 2, 0, [4, 3, 2, 1], 1, 1], ["AN", 2, 1, 6], ["PR", 5, 0, "auto_unroll_max_step$512"]]]], "r": [[2.1304e-05], 0, 6.70019, 1672658614], "v": "v0.6"}
{"i": [["[\"conv2d_2_4\"]", "cuda -keys=cuda,gpu -arch=sm_80 -max_num_threads=1024 -thread_warp_size=32", [-1, 16, 64, 49152, 2147483647, 1024, 8, 32], "", 0, []], [[], [["CHW", 3, "local"], ["SP", 3, 0, 1, [1, 1, 1, 1], 1], ["SP", 3, 5, 64, [1, 16, 2, 2], 1], ["SP", 3, 10, 56, [1, 1, 2, 14], 1], ["SP", 3, 15, 56, [1, 7, 8, 1], 1], ["SP", 3, 20, 256, [1, 4], 1], ["SP", 3, 23, 1, [1, 1], 1], ["SP", 3, 26, 1, [1, 1], 1], ["RE", 3, [0, 5, 10, 15, 1, 6, 11, 16, 2, 7, 12, 17, 20, 23, 26, 21, 24, 27, 3, 8, 13, 18, 22, 25, 28, 4, 9, 14, 19]], ["FSP", 4, 0, 1, 3], ["FSP", 4, 4, 2, 3], ["FSP", 4, 8, 3, 3], ["FSP", 4, 12, 4, 3], ["RE", 4, [0, 4, 8, 12, 1, 5, 9, 13, 2, 6, 10, 14, 3, 7, 11, 15]], ["CA", 3, 4, 11], ["CHR", 2, "shared", [3]], ["CA", 3, 4, 14], ["CHR", 1, "shared", [4]], ["CA", 2, 5, 14], ["CI", 1], ["FU", 6, [0, 1, 2, 3]], ["AN", 6, 0, 5], ["FU", 6, [1, 2, 3, 4]], ["AN", 6, 1, 4], ["FU", 6, [2, 3, 4, 5]], ["AN", 6, 2, 6], ["FU", 4, [0, 1, 2, 3]], ["SP", 4, 0, 8, [1], 1], ["AN", 4, 1, 2], ["FFSP", 4, 0, [4, 3, 2, 1], 1, 1], ["AN", 4, 1, 6], ["FU", 2, [0, 1, 2, 3]], ["SP", 2, 0, 896, [1], 1], ["AN", 2, 1, 2], ["FFSP", 2, 0, [4, 3, 2, 1], 1, 1], ["AN", 2, 1, 6], ["PR", 5, 0, "auto_unroll_max_step$64"]]]], "r": [[0.00155374], 0, 10.9419, 1672658615], "v": "v0.6"}
{"i": [["[\"conv2d_2_4\"]", "cuda -keys=cuda,gpu -arch=sm_80 -max_num_threads=1024 -thread_warp_size=32", [-1, 16, 64, 49152, 2147483647, 1024, 8, 32], "", 0, []], [[], [["CHW", 3, "local"], ["SP", 3, 0, 1, [1, 1, 1, 1], 1], ["SP", 3, 5, 64, [1, 32, 1, 2], 1], ["SP", 3, 10, 56, [1, 8, 7, 1], 1], ["SP", 3, 15, 56, [1, 1, 1, 1], 1], ["SP", 3, 20, 256, [2, 8], 1], ["SP", 3, 23, 1, [1, 1], 1], ["SP", 3, 26, 1, [1, 1], 1], ["RE", 3, [0, 5, 10, 15, 1, 6, 11, 16, 2, 7, 12, 17, 20, 23, 26, 21, 24, 27, 3, 8, 13, 18, 22, 25, 28, 4, 9, 14, 19]], ["FSP", 4, 0, 1, 3], ["FSP", 4, 4, 2, 3], ["FSP", 4, 8, 3, 3], ["FSP", 4, 12, 4, 3], ["RE", 4, [0, 4, 8, 12, 1, 5, 9, 13, 2, 6, 10, 14, 3, 7, 11, 15]], ["CA", 3, 4, 11], ["CHR", 2, "shared", [3]], ["CA", 3, 4, 14], ["CHR", 1, "shared", [4]], ["CA", 2, 5, 14], ["CI", 1], ["FU", 6, [0, 1, 2, 3]], ["AN", 6, 0, 5], ["FU", 6, [1, 2, 3, 4]], ["AN", 6, 1, 4], ["FU", 6, [2, 3, 4, 5]], ["AN", 6, 2, 6], ["FU", 4, [0, 1, 2, 3]], ["SP", 4, 0, 64, [1], 1], ["AN", 4, 1, 2], ["FFSP", 4, 0, [4, 3, 2, 1], 1, 1], ["AN", 4, 1, 6], ["FU", 2, [0, 1, 2, 3]], ["SP", 2, 0, 64, [1], 1], ["AN", 2, 1, 2], ["FFSP", 2, 0, [4, 3, 2, 1], 1, 1], ["AN", 2, 1, 6], ["PR", 5, 0, "auto_unroll_max_step$512"]]]], "r": [[4.01122e-05], 0, 7.09705, 1672658617], "v": "v0.6"}
{"i": [["[\"conv2d_2_4\"]", "cuda -keys=cuda,gpu -arch=sm_80 -max_num_threads=1024 -thread_warp_size=32", [-1, 16, 64, 49152, 2147483647, 1024, 8, 32], "", 0, []], [[], [["CHW", 3, "local"], ["SP", 3, 0, 1, [1, 1, 1, 1], 1], ["SP", 3, 5, 64, [2, 16, 1, 1], 1], ["SP", 3, 10, 56, [1, 1, 7, 8], 1], ["SP", 3, 15, 56, [2, 28, 1, 1], 1], ["SP", 3, 20, 256, [2, 1], 1], ["SP", 3, 23, 1, [1, 1], 1], ["SP", 3, 26, 1, [1, 1], 1], ["RE", 3, [0, 5, 10, 15, 1, 6, 11, 16, 2, 7, 12, 17, 20, 23, 26, 21, 24, 27, 3, 8, 13, 18, 22, 25, 28, 4, 9, 14, 19]], ["FSP", 4, 0, 1, 3], ["FSP", 4, 4, 2, 3], ["FSP", 4, 8, 3, 3], ["FSP", 4, 12, 4, 3], ["RE", 4, [0, 4, 8, 12, 1, 5, 9, 13, 2, 6, 10, 14, 3, 7, 11, 15]], ["CA", 3, 4, 11], ["CHR", 2, "shared", [3]], ["CA", 3, 4, 14], ["CHR", 1, "shared", [4]], ["CA", 2, 5, 14], ["CI", 1], ["FU", 6, [0, 1, 2, 3]], ["AN", 6, 0, 5], ["FU", 6, [1, 2, 3, 4]], ["AN", 6, 1, 4], ["FU", 6, [2, 3, 4, 5]], ["AN", 6, 2, 6], ["FU", 4, [0, 1, 2, 3]], ["SP", 4, 0, 2, [1], 1], ["AN", 4, 1, 2], ["FFSP", 4, 0, [4, 3, 2, 1], 1, 1], ["AN", 4, 1, 6], ["FU", 2, [0, 1, 2, 3]], ["SP", 2, 0, 56, [1], 1], ["AN", 2, 1, 2], ["FFSP", 2, 0, [4, 3, 2, 1], 1, 1], ["AN", 2, 1, 6], ["PR", 5, 0, "auto_unroll_max_step$512"]]]], "r": [[0.00290331], 0, 9.33155, 1672658618], "v": "v0.6"}
{"i": [["[\"conv2d_2_4\"]", "cuda -keys=cuda,gpu -arch=sm_80 -max_num_threads=1024 -thread_warp_size=32", [-1, 16, 64, 49152, 2147483647, 1024, 8, 32], "", 0, []], [[], [["CHW", 3, "local"], ["SP", 3, 0, 1, [1, 1, 1, 1], 1], ["SP", 3, 5, 64, [1, 1, 1, 16], 1], ["SP", 3, 10, 56, [1, 14, 1, 1], 1], ["SP", 3, 15, 56, [7, 1, 1, 4], 1], ["SP", 3, 20, 256, [8, 2], 1], ["SP", 3, 23, 1, [1, 1], 1], ["SP", 3, 26, 1, [1, 1], 1], ["RE", 3, [0, 5, 10, 15, 1, 6, 11, 16, 2, 7, 12, 17, 20, 23, 26, 21, 24, 27, 3, 8, 13, 18, 22, 25, 28, 4, 9, 14, 19]], ["FSP", 4, 0, 1, 3], ["FSP", 4, 4, 2, 3], ["FSP", 4, 8, 3, 3], ["FSP", 4, 12, 4, 3], ["RE", 4, [0, 4, 8, 12, 1, 5, 9, 13, 2, 6, 10, 14, 3, 7, 11, 15]], ["CA", 3, 4, 11], ["CHR", 2, "shared", [3]], ["CA", 3, 4, 14], ["CHR", 1, "shared", [4]], ["CA", 2, 5, 14], ["CI", 1], ["FU", 6, [0, 1, 2, 3]], ["AN", 6, 0, 5], ["FU", 6, [1, 2, 3, 4]], ["AN", 6, 1, 4], ["FU", 6, [2, 3, 4, 5]], ["AN", 6, 2, 6], ["FU", 4, [0, 1, 2, 3]], ["SP", 4, 0, 128, [2], 1], ["AN", 4, 1, 2], ["FFSP", 4, 0, [4, 3, 2, 1], 1, 1], ["AN", 4, 1, 6], ["FU", 2, [0, 1, 2, 3]], ["SP", 2, 0, 64, [1], 1], ["AN", 2, 1, 2], ["FFSP", 2, 0, [4, 3, 2, 1], 1, 1], ["AN", 2, 1, 6], ["PR", 5, 0, "auto_unroll_max_step$64"]]]], "r": [[0.00138709], 0, 7.73664, 1672658620], "v": "v0.6"}
{"i": [["[\"conv2d_2_4\"]", "cuda -keys=cuda,gpu -arch=sm_80 -max_num_threads=1024 -thread_warp_size=32", [-1, 16, 64, 49152, 2147483647, 1024, 8, 32], "", 0, []], [[], [["CHW", 3, "local"], ["SP", 3, 0, 1, [1, 1, 1, 1], 1], ["SP", 3, 5, 64, [4, 2, 1, 4], 1], ["SP", 3, 10, 56, [1, 14, 1, 1], 1], ["SP", 3, 15, 56, [2, 7, 1, 1], 1], ["SP", 3, 20, 256, [4, 1], 1], ["SP", 3, 23, 1, [1, 1], 1], ["SP", 3, 26, 1, [1, 1], 1], ["RE", 3, [0, 5, 10, 15, 1, 6, 11, 16, 2, 7, 12, 17, 20, 23, 26, 21, 24, 27, 3, 8, 13, 18, 22, 25, 28, 4, 9, 14, 19]], ["FSP", 4, 0, 1, 3], ["FSP", 4, 4, 2, 3], ["FSP", 4, 8, 3, 3], ["FSP", 4, 12, 4, 3], ["RE", 4, [0, 4, 8, 12, 1, 5, 9, 13, 2, 6, 10, 14, 3, 7, 11, 15]], ["CA", 3, 4, 11], ["CHR", 2, "shared", [3]], ["CA", 3, 4, 14], ["CHR", 1, "shared", [4]], ["CA", 2, 5, 14], ["CI", 1], ["FU", 6, [0, 1, 2, 3]], ["AN", 6, 0, 5], ["FU", 6, [1, 2, 3, 4]], ["AN", 6, 1, 4], ["FU", 6, [2, 3, 4, 5]], ["AN", 6, 2, 6], ["FU", 4, [0, 1, 2, 3]], ["SP", 4, 0, 16, [1], 1], ["AN", 4, 1, 2], ["FFSP", 4, 0, [4, 3, 2, 1], 1, 1], ["AN", 4, 1, 6], ["FU", 2, [0, 1, 2, 3]], ["SP", 2, 0, 8, [1], 1], ["AN", 2, 1, 2], ["FFSP", 2, 0, [4, 3, 2, 1], 1, 1], ["AN", 2, 1, 6], ["PR", 5, 0, "auto_unroll_max_step$16"]]]], "r": [[5.69728e-05], 0, 5.9166, 1672658621], "v": "v0.6"}
{"i": [["[\"conv2d_2_4\"]", "cuda -keys=cuda,gpu -arch=sm_80 -max_num_threads=1024 -thread_warp_size=32", [-1, 16, 64, 49152, 2147483647, 1024, 8, 32], "", 0, []], [[], [["CHW", 3, "local"], ["SP", 3, 0, 1, [1, 1, 1, 1], 1], ["SP", 3, 5, 64, [1, 4, 16, 1], 1], ["SP", 3, 10, 56, [7, 1, 1, 8], 1], ["SP", 3, 15, 56, [1, 8, 1, 1], 1], ["SP", 3, 20, 256, [8, 1], 1], ["SP", 3, 23, 1, [1, 1], 1], ["SP", 3, 26, 1, [1, 1], 1], ["RE", 3, [0, 5, 10, 15, 1, 6, 11, 16, 2, 7, 12, 17, 20, 23, 26, 21, 24, 27, 3, 8, 13, 18, 22, 25, 28, 4, 9, 14, 19]], ["FSP", 4, 0, 1, 3], ["FSP", 4, 4, 2, 3], ["FSP", 4, 8, 3, 3], ["FSP", 4, 12, 4, 3], ["RE", 4, [0, 4, 8, 12, 1, 5, 9, 13, 2, 6, 10, 14, 3, 7, 11, 15]], ["CA", 3, 4, 11], ["CHR", 2, "shared", [3]], ["CA", 3, 4, 14], ["CHR", 1, "shared", [4]], ["CA", 2, 5, 14], ["CI", 1], ["FU", 6, [0, 1, 2, 3]], ["AN", 6, 0, 5], ["FU", 6, [1, 2, 3, 4]], ["AN", 6, 1, 4], ["FU", 6, [2, 3, 4, 5]], ["AN", 6, 2, 6], ["FU", 4, [0, 1, 2, 3]], ["SP", 4, 0, 64, [1], 1], ["AN", 4, 1, 2], ["FFSP", 4, 0, [4, 3, 2, 1], 1, 1], ["AN", 4, 1, 6], ["FU", 2, [0, 1, 2, 3]], ["SP", 2, 0, 64, [1], 1], ["AN", 2, 1, 2], ["FFSP", 2, 0, [4, 3, 2, 1], 1, 1], ["AN", 2, 1, 6], ["PR", 5, 0, "auto_unroll_max_step$16"]]]], "r": [[0.00176019], 0, 6.50478, 1672658623], "v": "v0.6"}
{"i": [["[\"conv2d_2_4\"]", "cuda -keys=cuda,gpu -arch=sm_80 -max_num_threads=1024 -thread_warp_size=32", [-1, 16, 64, 49152, 2147483647, 1024, 8, 32], "", 0, []], [[], [["CHW", 3, "local"], ["SP", 3, 0, 1, [1, 1, 1, 1], 1], ["SP", 3, 5, 64, [2, 4, 4, 1], 1], ["SP", 3, 10, 56, [1, 1, 8, 1], 1], ["SP", 3, 15, 56, [1, 14, 1, 2], 1], ["SP", 3, 20, 256, [32, 1], 1], ["SP", 3, 23, 1, [1, 1], 1], ["SP", 3, 26, 1, [1, 1], 1], ["RE", 3, [0, 5, 10, 15, 1, 6, 11, 16, 2, 7, 12, 17, 20, 23, 26, 21, 24, 27, 3, 8, 13, 18, 22, 25, 28, 4, 9, 14, 19]], ["FSP", 4, 0, 1, 3], ["FSP", 4, 4, 2, 3], ["FSP", 4, 8, 3, 3], ["FSP", 4, 12, 4, 3], ["RE", 4, [0, 4, 8, 12, 1, 5, 9, 13, 2, 6, 10, 14, 3, 7, 11, 15]], ["CA", 3, 4, 11], ["CHR", 2, "shared", [3]], ["CA", 3, 4, 14], ["CHR", 1, "shared", [4]], ["CA", 2, 5, 14], ["CI", 1], ["FU", 6, [0, 1, 2, 3]], ["AN", 6, 0, 5], ["FU", 6, [1, 2, 3, 4]], ["AN", 6, 1, 4], ["FU", 6, [2, 3, 4, 5]], ["AN", 6, 2, 6], ["FU", 4, [0, 1, 2, 3]], ["SP", 4, 0, 32, [2], 1], ["AN", 4, 1, 2], ["FFSP", 4, 0, [4, 3, 2, 1], 1, 1], ["AN", 4, 1, 6], ["FU", 2, [0, 1, 2, 3]], ["SP", 2, 0, 512, [1], 1], ["AN", 2, 1, 2], ["FFSP", 2, 0, [4, 3, 2, 1], 1, 1], ["AN", 2, 1, 6], ["PR", 5, 0, "auto_unroll_max_step$512"]]]], "r": [[7.76833e-05], 0, 10.1453, 1672658624], "v": "v0.6"}
{"i": [["[\"conv2d_2_4\"]", "cuda -keys=cuda,gpu -arch=sm_80 -max_num_threads=1024 -thread_warp_size=32", [-1, 16, 64, 49152, 2147483647, 1024, 8, 32], "", 0, []], [[], [["CHW", 3, "local"], ["SP", 3, 0, 1, [1, 1, 1, 1], 1], ["SP", 3, 5, 64, [2, 1, 4, 4], 1], ["SP", 3, 10, 56, [1, 4, 1, 1], 1], ["SP", 3, 15, 56, [1, 56, 1, 1], 1], ["SP", 3, 20, 256, [2, 2], 1], ["SP", 3, 23, 1, [1, 1], 1], ["SP", 3, 26, 1, [1, 1], 1], ["RE", 3, [0, 5, 10, 15, 1, 6, 11, 16, 2, 7, 12, 17, 20, 23, 26, 21, 24, 27, 3, 8, 13, 18, 22, 25, 28, 4, 9, 14, 19]], ["FSP", 4, 0, 1, 3], ["FSP", 4, 4, 2, 3], ["FSP", 4, 8, 3, 3], ["FSP", 4, 12, 4, 3], ["RE", 4, [0, 4, 8, 12, 1, 5, 9, 13, 2, 6, 10, 14, 3, 7, 11, 15]], ["CA", 3, 4, 11], ["CHR", 2, "shared", [3]], ["CA", 3, 4, 14], ["CHR", 1, "shared", [4]], ["CA", 2, 5, 14], ["CI", 1], ["FU", 6, [0, 1, 2, 3]], ["AN", 6, 0, 5], ["FU", 6, [1, 2, 3, 4]], ["AN", 6, 1, 4], ["FU", 6, [2, 3, 4, 5]], ["AN", 6, 2, 6], ["FU", 4, [0, 1, 2, 3]], ["SP", 4, 0, 128, [1], 1], ["AN", 4, 1, 2], ["FFSP", 4, 0, [4, 3, 2, 1], 1, 1], ["AN", 4, 1, 6], ["FU", 2, [0, 1, 2, 3]], ["SP", 2, 0, 4, [1], 1], ["AN", 2, 1, 2], ["FFSP", 2, 0, [4, 3, 2, 1], 1, 1], ["AN", 2, 1, 6], ["PR", 5, 0, "auto_unroll_max_step$512"]]]], "r": [[5.60306e-05], 0, 5.83803, 1672658625], "v": "v0.6"}
{"i": [["[\"conv2d_2_4\"]", "cuda -keys=cuda,gpu -arch=sm_80 -max_num_threads=1024 -thread_warp_size=32", [-1, 16, 64, 49152, 2147483647, 1024, 8, 32], "", 0, []], [[], [["CHW", 3, "local"], ["SP", 3, 0, 1, [1, 1, 1, 1], 1], ["SP", 3, 5, 64, [1, 16, 1, 2], 1], ["SP", 3, 10, 56, [1, 2, 2, 1], 1], ["SP", 3, 15, 56, [1, 2, 4, 1], 1], ["SP", 3, 20, 256, [128, 1], 1], ["SP", 3, 23, 1, [1, 1], 1], ["SP", 3, 26, 1, [1, 1], 1], ["RE", 3, [0, 5, 10, 15, 1, 6, 11, 16, 2, 7, 12, 17, 20, 23, 26, 21, 24, 27, 3, 8, 13, 18, 22, 25, 28, 4, 9, 14, 19]], ["FSP", 4, 0, 1, 3], ["FSP", 4, 4, 2, 3], ["FSP", 4, 8, 3, 3], ["FSP", 4, 12, 4, 3], ["RE", 4, [0, 4, 8, 12, 1, 5, 9, 13, 2, 6, 10, 14, 3, 7, 11, 15]], ["CA", 3, 4, 11], ["CHR", 2, "shared", [3]], ["CA", 3, 4, 14], ["CHR", 1, "shared", [4]], ["CA", 2, 5, 14], ["CI", 1], ["FU", 6, [0, 1, 2, 3]], ["AN", 6, 0, 5], ["FU", 6, [1, 2, 3, 4]], ["AN", 6, 1, 4], ["FU", 6, [2, 3, 4, 5]], ["AN", 6, 2, 6], ["FU", 4, [0, 1, 2, 3]], ["SP", 4, 0, 256, [4], 1], ["AN", 4, 1, 2], ["FFSP", 4, 0, [4, 3, 2, 1], 1, 1], ["AN", 4, 1, 6], ["FU", 2, [0, 1, 2, 3]], ["SP", 2, 0, 1024, [1], 1], ["AN", 2, 1, 2], ["FFSP", 2, 0, [4, 3, 2, 1], 1, 1], ["AN", 2, 1, 6], ["PR", 5, 0, "auto_unroll_max_step$64"]]]], "r": [[2.17098e-05], 0, 7.76924, 1672658626], "v": "v0.6"}
{"i": [["[\"conv2d_2_4\"]", "cuda -keys=cuda,gpu -arch=sm_80 -max_num_threads=1024 -thread_warp_size=32", [-1, 16, 64, 49152, 2147483647, 1024, 8, 32], "", 0, []], [[], [["CHW", 3, "local"], ["SP", 3, 0, 1, [1, 1, 1, 1], 1], ["SP", 3, 5, 64, [2, 1, 4, 8], 1], ["SP", 3, 10, 56, [1, 4, 1, 1], 1], ["SP", 3, 15, 56, [1, 56, 1, 1], 1], ["SP", 3, 20, 256, [2, 2], 1], ["SP", 3, 23, 1, [1, 1], 1], ["SP", 3, 26, 1, [1, 1], 1], ["RE", 3, [0, 5, 10, 15, 1, 6, 11, 16, 2, 7, 12, 17, 20, 23, 26, 21, 24, 27, 3, 8, 13, 18, 22, 25, 28, 4, 9, 14, 19]], ["FSP", 4, 0, 1, 3], ["FSP", 4, 4, 2, 3], ["FSP", 4, 8, 3, 3], ["FSP", 4, 12, 4, 3], ["RE", 4, [0, 4, 8, 12, 1, 5, 9, 13, 2, 6, 10, 14, 3, 7, 11, 15]], ["CA", 3, 4, 11], ["CHR", 2, "shared", [3]], ["CA", 3, 4, 14], ["CHR", 1, "shared", [4]], ["CA", 2, 5, 14], ["CI", 1], ["FU", 6, [0, 1, 2, 3]], ["AN", 6, 0, 5], ["FU", 6, [1, 2, 3, 4]], ["AN", 6, 1, 4], ["FU", 6, [2, 3, 4, 5]], ["AN", 6, 2, 6], ["FU", 4, [0, 1, 2, 3]], ["SP", 4, 0, 128, [2], 1], ["AN", 4, 1, 2], ["FFSP", 4, 0, [4, 3, 2, 1], 1, 1], ["AN", 4, 1, 6], ["FU", 2, [0, 1, 2, 3]], ["SP", 2, 0, 4, [1], 1], ["AN", 2, 1, 2], ["FFSP", 2, 0, [4, 3, 2, 1], 1, 1], ["AN", 2, 1, 6], ["PR", 5, 0, "auto_unroll_max_step$512"]]]], "r": [[8.10849e-05], 0, 6.58617, 1672658628], "v": "v0.6"}
{"i": [["[\"conv2d_2_4\"]", "cuda -keys=cuda,gpu -arch=sm_80 -max_num_threads=1024 -thread_warp_size=32", [-1, 16, 64, 49152, 2147483647, 1024, 8, 32], "", 0, []], [[], [["CHW", 3, "local"], ["SP", 3, 0, 1, [1, 1, 1, 1], 1], ["SP", 3, 5, 64, [1, 2, 2, 8], 1], ["SP", 3, 10, 56, [7, 1, 2, 1], 1], ["SP", 3, 15, 56, [1, 28, 1, 1], 1], ["SP", 3, 20, 256, [8, 1], 1], ["SP", 3, 23, 1, [1, 1], 1], ["SP", 3, 26, 1, [1, 1], 1], ["RE", 3, [0, 5, 10, 15, 1, 6, 11, 16, 2, 7, 12, 17, 20, 23, 26, 21, 24, 27, 3, 8, 13, 18, 22, 25, 28, 4, 9, 14, 19]], ["FSP", 4, 0, 1, 3], ["FSP", 4, 4, 2, 3], ["FSP", 4, 8, 3, 3], ["FSP", 4, 12, 4, 3], ["RE", 4, [0, 4, 8, 12, 1, 5, 9, 13, 2, 6, 10, 14, 3, 7, 11, 15]], ["CA", 3, 4, 11], ["CHR", 2, "shared", [3]], ["CA", 3, 4, 14], ["CHR", 1, "shared", [4]], ["CA", 2, 5, 14], ["CI", 1], ["FU", 6, [0, 1, 2, 3]], ["AN", 6, 0, 5], ["FU", 6, [1, 2, 3, 4]], ["AN", 6, 1, 4], ["FU", 6, [2, 3, 4, 5]], ["AN", 6, 2, 6], ["FU", 4, [0, 1, 2, 3]], ["SP", 4, 0, 64, [32], 1], ["AN", 4, 1, 2], ["FFSP", 4, 0, [4, 3, 2, 1], 1, 1], ["AN", 4, 1, 6], ["FU", 2, [0, 1, 2, 3]], ["SP", 2, 0, 32, [1], 1], ["AN", 2, 1, 2], ["FFSP", 2, 0, [4, 3, 2, 1], 1, 1], ["AN", 2, 1, 6], ["PR", 5, 0, "auto_unroll_max_step$0"]]]], "r": [[0.000147825], 0, 6.52826, 1672658629], "v": "v0.6"}
{"i": [["[\"conv2d_2_4\"]", "cuda -keys=cuda,gpu -arch=sm_80 -max_num_threads=1024 -thread_warp_size=32", [-1, 16, 64, 49152, 2147483647, 1024, 8, 32], "", 0, []], [[], [["CHW", 3, "local"], ["SP", 3, 0, 1, [1, 1, 1, 1], 1], ["SP", 3, 5, 64, [4, 8, 1, 1], 1], ["SP", 3, 10, 56, [1, 1, 7, 4], 1], ["SP", 3, 15, 56, [2, 28, 1, 1], 1], ["SP", 3, 20, 256, [2, 2], 1], ["SP", 3, 23, 1, [1, 1], 1], ["SP", 3, 26, 1, [1, 1], 1], ["RE", 3, [0, 5, 10, 15, 1, 6, 11, 16, 2, 7, 12, 17, 20, 23, 26, 21, 24, 27, 3, 8, 13, 18, 22, 25, 28, 4, 9, 14, 19]], ["FSP", 4, 0, 1, 3], ["FSP", 4, 4, 2, 3], ["FSP", 4, 8, 3, 3], ["FSP", 4, 12, 4, 3], ["RE", 4, [0, 4, 8, 12, 1, 5, 9, 13, 2, 6, 10, 14, 3, 7, 11, 15]], ["CA", 3, 4, 11], ["CHR", 2, "shared", [3]], ["CA", 3, 4, 14], ["CHR", 1, "shared", [4]], ["CA", 2, 5, 14], ["CI", 1], ["FU", 6, [0, 1, 2, 3]], ["AN", 6, 0, 5], ["FU", 6, [1, 2, 3, 4]], ["AN", 6, 1, 4], ["FU", 6, [2, 3, 4, 5]], ["AN", 6, 2, 6], ["FU", 4, [0, 1, 2, 3]], ["SP", 4, 0, 2, [1], 1], ["AN", 4, 1, 2], ["FFSP", 4, 0, [4, 3, 2, 1], 1, 1], ["AN", 4, 1, 6], ["FU", 2, [0, 1, 2, 3]], ["SP", 2, 0, 56, [1], 1], ["AN", 2, 1, 2], ["FFSP", 2, 0, [4, 3, 2, 1], 1, 1], ["AN", 2, 1, 6], ["PR", 5, 0, "auto_unroll_max_step$512"]]]], "r": [[0.000229609], 0, 11.2763, 1672658631], "v": "v0.6"}
{"i": [["[\"conv2d_2_4\"]", "cuda -keys=cuda,gpu -arch=sm_80 -max_num_threads=1024 -thread_warp_size=32", [-1, 16, 64, 49152, 2147483647, 1024, 8, 32], "", 0, []], [[], [["CHW", 3, "local"], ["SP", 3, 0, 1, [1, 1, 1, 1], 1], ["SP", 3, 5, 64, [1, 4, 8, 2], 1], ["SP", 3, 10, 56, [1, 14, 1, 1], 1], ["SP", 3, 15, 56, [1, 1, 1, 7], 1], ["SP", 3, 20, 256, [1, 64], 1], ["SP", 3, 23, 1, [1, 1], 1], ["SP", 3, 26, 1, [1, 1], 1], ["RE", 3, [0, 5, 10, 15, 1, 6, 11, 16, 2, 7, 12, 17, 20, 23, 26, 21, 24, 27, 3, 8, 13, 18, 22, 25, 28, 4, 9, 14, 19]], ["FSP", 4, 0, 1, 3], ["FSP", 4, 4, 2, 3], ["FSP", 4, 8, 3, 3], ["FSP", 4, 12, 4, 3], ["RE", 4, [0, 4, 8, 12, 1, 5, 9, 13, 2, 6, 10, 14, 3, 7, 11, 15]], ["CA", 3, 4, 11], ["CHR", 2, "shared", [3]], ["CA", 3, 4, 14], ["CHR", 1, "shared", [4]], ["CA", 2, 5, 14], ["CI", 1], ["FU", 6, [0, 1, 2, 3]], ["AN", 6, 0, 5], ["FU", 6, [1, 2, 3, 4]], ["AN", 6, 1, 4], ["FU", 6, [2, 3, 4, 5]], ["AN", 6, 2, 6], ["FU", 4, [0, 1, 2, 3]], ["SP", 4, 0, 1024, [1], 1], ["AN", 4, 1, 2], ["FFSP", 4, 0, [4, 3, 2, 1], 1, 1], ["AN", 4, 1, 6], ["FU", 2, [0, 1, 2, 3]], ["SP", 2, 0, 448, [2], 1], ["AN", 2, 1, 2], ["FFSP", 2, 0, [4, 3, 2, 1], 1, 1], ["AN", 2, 1, 6], ["PR", 5, 0, "auto_unroll_max_step$512"]]]], "r": [[0.000144045], 0, 16.1432, 1672658632], "v": "v0.6"}
{"i": [["[\"conv2d_2_4\"]", "cuda -keys=cuda,gpu -arch=sm_80 -max_num_threads=1024 -thread_warp_size=32", [-1, 16, 64, 49152, 2147483647, 1024, 8, 32], "", 0, []], [[], [["CHW", 3, "local"], ["SP", 3, 0, 1, [1, 1, 1, 1], 1], ["SP", 3, 5, 64, [2, 8, 4, 1], 1], ["SP", 3, 10, 56, [1, 2, 1, 7], 1], ["SP", 3, 15, 56, [1, 1, 28, 1], 1], ["SP", 3, 20, 256, [1, 2], 1], ["SP", 3, 23, 1, [1, 1], 1], ["SP", 3, 26, 1, [1, 1], 1], ["RE", 3, [0, 5, 10, 15, 1, 6, 11, 16, 2, 7, 12, 17, 20, 23, 26, 21, 24, 27, 3, 8, 13, 18, 22, 25, 28, 4, 9, 14, 19]], ["FSP", 4, 0, 1, 3], ["FSP", 4, 4, 2, 3], ["FSP", 4, 8, 3, 3], ["FSP", 4, 12, 4, 3], ["RE", 4, [0, 4, 8, 12, 1, 5, 9, 13, 2, 6, 10, 14, 3, 7, 11, 15]], ["CA", 3, 4, 11], ["CHR", 2, "shared", [3]], ["CA", 3, 4, 14], ["CHR", 1, "shared", [4]], ["CA", 2, 5, 14], ["CI", 1], ["FU", 6, [0, 1, 2, 3]], ["AN", 6, 0, 5], ["FU", 6, [1, 2, 3, 4]], ["AN", 6, 1, 4], ["FU", 6, [2, 3, 4, 5]], ["AN", 6, 2, 6], ["FU", 4, [0, 1, 2, 3]], ["SP", 4, 0, 16, [1], 1], ["AN", 4, 1, 2], ["FFSP", 4, 0, [4, 3, 2, 1], 1, 1], ["AN", 4, 1, 6], ["FU", 2, [0, 1, 2, 3]], ["SP", 2, 0, 784, [1], 1], ["AN", 2, 1, 2], ["FFSP", 2, 0, [4, 3, 2, 1], 1, 1], ["AN", 2, 1, 6], ["PR", 5, 0, "auto_unroll_max_step$512"]]]], "r": [[0.00713876], 0, 11.1373, 1672658634], "v": "v0.6"}
{"i": [["[\"conv2d_2_4\"]", "cuda -keys=cuda,gpu -arch=sm_80 -max_num_threads=1024 -thread_warp_size=32", [-1, 16, 64, 49152, 2147483647, 1024, 8, 32], "", 0, []], [[], [["CHW", 3, "local"], ["SP", 3, 0, 1, [1, 1, 1, 1], 1], ["SP", 3, 5, 64, [1, 4, 2, 1], 1], ["SP", 3, 10, 56, [1, 2, 1, 14], 1], ["SP", 3, 15, 56, [1, 4, 2, 1], 1], ["SP", 3, 20, 256, [4, 2], 1], ["SP", 3, 23, 1, [1, 1], 1], ["SP", 3, 26, 1, [1, 1], 1], ["RE", 3, [0, 5, 10, 15, 1, 6, 11, 16, 2, 7, 12, 17, 20, 23, 26, 21, 24, 27, 3, 8, 13, 18, 22, 25, 28, 4, 9, 14, 19]], ["FSP", 4, 0, 1, 3], ["FSP", 4, 4, 2, 3], ["FSP", 4, 8, 3, 3], ["FSP", 4, 12, 4, 3], ["RE", 4, [0, 4, 8, 12, 1, 5, 9, 13, 2, 6, 10, 14, 3, 7, 11, 15]], ["CA", 3, 4, 11], ["CHR", 2, "shared", [3]], ["CA", 3, 4, 14], ["CHR", 1, "shared", [4]], ["CA", 2, 5, 14], ["CI", 1], ["FU", 6, [0, 1, 2, 3]], ["AN", 6, 0, 5], ["FU", 6, [1, 2, 3, 4]], ["AN", 6, 1, 4], ["FU", 6, [2, 3, 4, 5]], ["AN", 6, 2, 6], ["FU", 4, [0, 1, 2, 3]], ["SP", 4, 0, 16, [1], 1], ["AN", 4, 1, 2], ["FFSP", 4, 0, [4, 3, 2, 1], 1, 1], ["AN", 4, 1, 6], ["FU", 2, [0, 1, 2, 3]], ["SP", 2, 0, 32, [1], 1], ["AN", 2, 1, 2], ["FFSP", 2, 0, [4, 3, 2, 1], 1, 1], ["AN", 2, 1, 6], ["PR", 5, 0, "auto_unroll_max_step$16"]]]], "r": [[5.47212e-05], 0, 4.22677, 1672658635], "v": "v0.6"}
{"i": [["[\"conv2d_2_4\"]", "cuda -keys=cuda,gpu -arch=sm_80 -max_num_threads=1024 -thread_warp_size=32", [-1, 16, 64, 49152, 2147483647, 1024, 8, 32], "", 0, []], [[], [["CHW", 3, "local"], ["SP", 3, 0, 1, [1, 1, 1, 1], 1], ["SP", 3, 5, 64, [1, 16, 1, 4], 1], ["SP", 3, 10, 56, [2, 14, 2, 1], 1], ["SP", 3, 15, 56, [1, 1, 14, 4], 1], ["SP", 3, 20, 256, [1, 2], 1], ["SP", 3, 23, 1, [1, 1], 1], ["SP", 3, 26, 1, [1, 1], 1], ["RE", 3, [0, 5, 10, 15, 1, 6, 11, 16, 2, 7, 12, 17, 20, 23, 26, 21, 24, 27, 3, 8, 13, 18, 22, 25, 28, 4, 9, 14, 19]], ["FSP", 4, 0, 1, 3], ["FSP", 4, 4, 2, 3], ["FSP", 4, 8, 3, 3], ["FSP", 4, 12, 4, 3], ["RE", 4, [0, 4, 8, 12, 1, 5, 9, 13, 2, 6, 10, 14, 3, 7, 11, 15]], ["CA", 3, 4, 11], ["CHR", 2, "shared", [3]], ["CA", 3, 4, 14], ["CHR", 1, "shared", [4]], ["CA", 2, 5, 14], ["CI", 1], ["FU", 6, [0, 1, 2, 3]], ["AN", 6, 0, 5], ["FU", 6, [1, 2, 3, 4]], ["AN", 6, 1, 4], ["FU", 6, [2, 3, 4, 5]], ["AN", 6, 2, 6], ["FU", 4, [0, 1, 2, 3]], ["SP", 4, 0, 4, [4], 1], ["AN", 4, 1, 2], ["FFSP", 4, 0, [4, 3, 2, 1], 1, 1], ["AN", 4, 1, 6], ["FU", 2, [0, 1, 2, 3]], ["SP", 2, 0, 224, [32], 1], ["AN", 2, 1, 2], ["FFSP", 2, 0, [4, 3, 2, 1], 1, 1], ["AN", 2, 1, 6], ["PR", 5, 0, "auto_unroll_max_step$0"]]]], "r": [[0.00487182], 0, 4.92436, 1672658636], "v": "v0.6"}
{"i": [["[\"conv2d_2_4\"]", "cuda -keys=cuda,gpu -arch=sm_80 -max_num_threads=1024 -thread_warp_size=32", [-1, 16, 64, 49152, 2147483647, 1024, 8, 32], "", 0, []], [[], [["CHW", 3, "local"], ["SP", 3, 0, 1, [1, 1, 1, 1], 1], ["SP", 3, 5, 64, [1, 4, 2, 1], 1], ["SP", 3, 10, 56, [1, 2, 4, 7], 1], ["SP", 3, 15, 56, [1, 4, 1, 2], 1], ["SP", 3, 20, 256, [4, 4], 1], ["SP", 3, 23, 1, [1, 1], 1], ["SP", 3, 26, 1, [1, 1], 1], ["RE", 3, [0, 5, 10, 15, 1, 6, 11, 16, 2, 7, 12, 17, 20, 23, 26, 21, 24, 27, 3, 8, 13, 18, 22, 25, 28, 4, 9, 14, 19]], ["FSP", 4, 0, 1, 3], ["FSP", 4, 4, 2, 3], ["FSP", 4, 8, 3, 3], ["FSP", 4, 12, 4, 3], ["RE", 4, [0, 4, 8, 12, 1, 5, 9, 13, 2, 6, 10, 14, 3, 7, 11, 15]], ["CA", 3, 4, 11], ["CHR", 2, "shared", [3]], ["CA", 3, 4, 14], ["CHR", 1, "shared", [4]], ["CA", 2, 5, 14], ["CI", 1], ["FU", 6, [0, 1, 2, 3]], ["AN", 6, 0, 5], ["FU", 6, [1, 2, 3, 4]], ["AN", 6, 1, 4], ["FU", 6, [2, 3, 4, 5]], ["AN", 6, 2, 6], ["FU", 4, [0, 1, 2, 3]], ["SP", 4, 0, 32, [1], 1], ["AN", 4, 1, 2], ["FFSP", 4, 0, [4, 3, 2, 1], 1, 1], ["AN", 4, 1, 6], ["FU", 2, [0, 1, 2, 3]], ["SP", 2, 0, 128, [1], 1], ["AN", 2, 1, 2], ["FFSP", 2, 0, [4, 3, 2, 1], 1, 1], ["AN", 2, 1, 6], ["PR", 5, 0, "auto_unroll_max_step$512"]]]], "r": [[0.00010101], 0, 12.1059, 1672658637], "v": "v0.6"}
{"i": [["[\"conv2d_2_4\"]", "cuda -keys=cuda,gpu -arch=sm_80 -max_num_threads=1024 -thread_warp_size=32", [-1, 16, 64, 49152, 2147483647, 1024, 8, 32], "", 0, []], [[], [["CHW", 3, "local"], ["SP", 3, 0, 1, [1, 1, 1, 1], 1], ["SP", 3, 5, 64, [1, 8, 1, 8], 1], ["SP", 3, 10, 56, [1, 4, 2, 1], 1], ["SP", 3, 15, 56, [1, 14, 1, 1], 1], ["SP", 3, 20, 256, [2, 1], 1], ["SP", 3, 23, 1, [1, 1], 1], ["SP", 3, 26, 1, [1, 1], 1], ["RE", 3, [0, 5, 10, 15, 1, 6, 11, 16, 2, 7, 12, 17, 20, 23, 26, 21, 24, 27, 3, 8, 13, 18, 22, 25, 28, 4, 9, 14, 19]], ["FSP", 4, 0, 1, 3], ["FSP", 4, 4, 2, 3], ["FSP", 4, 8, 3, 3], ["FSP", 4, 12, 4, 3], ["RE", 4, [0, 4, 8, 12, 1, 5, 9, 13, 2, 6, 10, 14, 3, 7, 11, 15]], ["CA", 3, 4, 11], ["CHR", 2, "shared", [3]], ["CA", 3, 4, 14], ["CHR", 1, "shared", [4]], ["CA", 2, 5, 14], ["CI", 1], ["FU", 6, [0, 1, 2, 3]], ["AN", 6, 0, 5], ["FU", 6, [1, 2, 3, 4]], ["AN", 6, 1, 4], ["FU", 6, [2, 3, 4, 5]], ["AN", 6, 2, 6], ["FU", 4, [0, 1, 2, 3]], ["SP", 4, 0, 16, [1], 1], ["AN", 4, 1, 2], ["FFSP", 4, 0, [4, 3, 2, 1], 1, 1], ["AN", 4, 1, 6], ["FU", 2, [0, 1, 2, 3]], ["SP", 2, 0, 4, [4], 1], ["AN", 2, 1, 2], ["FFSP", 2, 0, [4, 3, 2, 1], 1, 1], ["AN", 2, 1, 6], ["PR", 5, 0, "auto_unroll_max_step$64"]]]], "r": [[8.23084e-05], 0, 3.7827, 1672658639], "v": "v0.6"}
{"i": [["[\"conv2d_2_4\"]", "cuda -keys=cuda,gpu -arch=sm_80 -max_num_threads=1024 -thread_warp_size=32", [-1, 16, 64, 49152, 2147483647, 1024, 8, 32], "", 0, []], [[], [["CHW", 3, "local"], ["SP", 3, 0, 1, [1, 1, 1, 1], 1], ["SP", 3, 5, 64, [1, 16, 4, 1], 1], ["SP", 3, 10, 56, [1, 2, 2, 2], 1], ["SP", 3, 15, 56, [1, 7, 2, 1], 1], ["SP", 3, 20, 256, [2, 4], 1], ["SP", 3, 23, 1, [1, 1], 1], ["SP", 3, 26, 1, [1, 1], 1], ["RE", 3, [0, 5, 10, 15, 1, 6, 11, 16, 2, 7, 12, 17, 20, 23, 26, 21, 24, 27, 3, 8, 13, 18, 22, 25, 28, 4, 9, 14, 19]], ["FSP", 4, 0, 1, 3], ["FSP", 4, 4, 2, 3], ["FSP", 4, 8, 3, 3], ["FSP", 4, 12, 4, 3], ["RE", 4, [0, 4, 8, 12, 1, 5, 9, 13, 2, 6, 10, 14, 3, 7, 11, 15]], ["CA", 3, 4, 11], ["CHR", 2, "shared", [3]], ["CA", 3, 4, 14], ["CHR", 1, "shared", [4]], ["CA", 2, 5, 14], ["CI", 1], ["FU", 6, [0, 1, 2, 3]], ["AN", 6, 0, 5], ["FU", 6, [1, 2, 3, 4]], ["AN", 6, 1, 4], ["FU", 6, [2, 3, 4, 5]], ["AN", 6, 2, 6], ["FU", 4, [0, 1, 2, 3]], ["SP", 4, 0, 32, [16], 1], ["AN", 4, 1, 2], ["FFSP", 4, 0, [4, 3, 2, 1], 1, 1], ["AN", 4, 1, 6], ["FU", 2, [0, 1, 2, 3]], ["SP", 2, 0, 64, [1], 1], ["AN", 2, 1, 2], ["FFSP", 2, 0, [4, 3, 2, 1], 1, 1], ["AN", 2, 1, 6], ["PR", 5, 0, "auto_unroll_max_step$512"]]]], "r": [[6.88534e-05], 0, 6.27147, 1672658640], "v": "v0.6"}
{"i": [["[\"conv2d_2_4\"]", "cuda -keys=cuda,gpu -arch=sm_80 -max_num_threads=1024 -thread_warp_size=32", [-1, 16, 64, 49152, 2147483647, 1024, 8, 32], "", 0, []], [[], [["CHW", 3, "local"], ["SP", 3, 0, 1, [1, 1, 1, 1], 1], ["SP", 3, 5, 64, [1, 16, 1, 1], 1], ["SP", 3, 10, 56, [2, 1, 1, 4], 1], ["SP", 3, 15, 56, [2, 4, 1, 1], 1], ["SP", 3, 20, 256, [2, 1], 1], ["SP", 3, 23, 1, [1, 1], 1], ["SP", 3, 26, 1, [1, 1], 1], ["RE", 3, [0, 5, 10, 15, 1, 6, 11, 16, 2, 7, 12, 17, 20, 23, 26, 21, 24, 27, 3, 8, 13, 18, 22, 25, 28, 4, 9, 14, 19]], ["FSP", 4, 0, 1, 3], ["FSP", 4, 4, 2, 3], ["FSP", 4, 8, 3, 3], ["FSP", 4, 12, 4, 3], ["RE", 4, [0, 4, 8, 12, 1, 5, 9, 13, 2, 6, 10, 14, 3, 7, 11, 15]], ["CA", 3, 4, 11], ["CHR", 2, "shared", [3]], ["CA", 3, 4, 14], ["CHR", 1, "shared", [4]], ["CA", 2, 5, 14], ["CI", 1], ["FU", 6, [0, 1, 2, 3]], ["AN", 6, 0, 5], ["FU", 6, [1, 2, 3, 4]], ["AN", 6, 1, 4], ["FU", 6, [2, 3, 4, 5]], ["AN", 6, 2, 6], ["FU", 4, [0, 1, 2, 3]], ["SP", 4, 0, 2, [1], 1], ["AN", 4, 1, 2], ["FFSP", 4, 0, [4, 3, 2, 1], 1, 1], ["AN", 4, 1, 6], ["FU", 2, [0, 1, 2, 3]], ["SP", 2, 0, 8, [1], 1], ["AN", 2, 1, 2], ["FFSP", 2, 0, [4, 3, 2, 1], 1, 1], ["AN", 2, 1, 6], ["PR", 5, 0, "auto_unroll_max_step$512"]]]], "r": [[4.74912e-05], 0, 3.35727, 1672658641], "v": "v0.6"}
{"i": [["[\"conv2d_2_4\"]", "cuda -keys=cuda,gpu -arch=sm_80 -max_num_threads=1024 -thread_warp_size=32", [-1, 16, 64, 49152, 2147483647, 1024, 8, 32], "", 0, []], [[], [["CHW", 3, "local"], ["SP", 3, 0, 1, [1, 1, 1, 1], 1], ["SP", 3, 5, 64, [2, 1, 4, 8], 1], ["SP", 3, 10, 56, [1, 4, 1, 1], 1], ["SP", 3, 15, 56, [1, 56, 1, 1], 1], ["SP", 3, 20, 256, [2, 2], 1], ["SP", 3, 23, 1, [1, 1], 1], ["SP", 3, 26, 1, [1, 1], 1], ["RE", 3, [0, 5, 10, 15, 1, 6, 11, 16, 2, 7, 12, 17, 20, 23, 26, 21, 24, 27, 3, 8, 13, 18, 22, 25, 28, 4, 9, 14, 19]], ["FSP", 4, 0, 1, 3], ["FSP", 4, 4, 2, 3], ["FSP", 4, 8, 3, 3], ["FSP", 4, 12, 4, 3], ["RE", 4, [0, 4, 8, 12, 1, 5, 9, 13, 2, 6, 10, 14, 3, 7, 11, 15]], ["CA", 3, 4, 11], ["CHR", 2, "shared", [3]], ["CA", 3, 4, 14], ["CHR", 1, "shared", [4]], ["CA", 2, 5, 14], ["CI", 1], ["FU", 6, [0, 1, 2, 3]], ["AN", 6, 0, 5], ["FU", 6, [1, 2, 3, 4]], ["AN", 6, 1, 4], ["FU", 6, [2, 3, 4, 5]], ["AN", 6, 2, 6], ["FU", 4, [0, 1, 2, 3]], ["SP", 4, 0, 128, [1], 1], ["AN", 4, 1, 2], ["FFSP", 4, 0, [4, 3, 2, 1], 1, 1], ["AN", 4, 1, 6], ["FU", 2, [0, 1, 2, 3]], ["SP", 2, 0, 4, [4], 1], ["AN", 2, 1, 2], ["FFSP", 2, 0, [4, 3, 2, 1], 1, 1], ["AN", 2, 1, 6], ["PR", 5, 0, "auto_unroll_max_step$64"]]]], "r": [[7.88358e-05], 0, 3.73062, 1672658643], "v": "v0.6"}
{"i": [["[\"conv2d_2_4\"]", "cuda -keys=cuda,gpu -arch=sm_80 -max_num_threads=1024 -thread_warp_size=32", [-1, 16, 64, 49152, 2147483647, 1024, 8, 32], "", 0, []], [[], [["CHW", 3, "local"], ["SP", 3, 0, 1, [1, 1, 1, 1], 1], ["SP", 3, 5, 64, [2, 8, 1, 1], 1], ["SP", 3, 10, 56, [1, 8, 1, 7], 1], ["SP", 3, 15, 56, [2, 2, 7, 2], 1], ["SP", 3, 20, 256, [1, 2], 1], ["SP", 3, 23, 1, [1, 1], 1], ["SP", 3, 26, 1, [1, 1], 1], ["RE", 3, [0, 5, 10, 15, 1, 6, 11, 16, 2, 7, 12, 17, 20, 23, 26, 21, 24, 27, 3, 8, 13, 18, 22, 25, 28, 4, 9, 14, 19]], ["FSP", 4, 0, 1, 3], ["FSP", 4, 4, 2, 3], ["FSP", 4, 8, 3, 3], ["FSP", 4, 12, 4, 3], ["RE", 4, [0, 4, 8, 12, 1, 5, 9, 13, 2, 6, 10, 14, 3, 7, 11, 15]], ["CA", 3, 4, 11], ["CHR", 2, "shared", [3]], ["CA", 3, 4, 14], ["CHR", 1, "shared", [4]], ["CA", 2, 5, 14], ["CI", 1], ["FU", 6, [0, 1, 2, 3]], ["AN", 6, 0, 5], ["FU", 6, [1, 2, 3, 4]], ["AN", 6, 1, 4], ["FU", 6, [2, 3, 4, 5]], ["AN", 6, 2, 6], ["FU", 4, [0, 1, 2, 3]], ["SP", 4, 0, 2, [2], 1], ["AN", 4, 1, 2], ["FFSP", 4, 0, [4, 3, 2, 1], 1, 1], ["AN", 4, 1, 6], ["FU", 2, [0, 1, 2, 3]], ["SP", 2, 0, 196, [1], 1], ["AN", 2, 1, 2], ["FFSP", 2, 0, [4, 3, 2, 1], 1, 1], ["AN", 2, 1, 6], ["PR", 5, 0, "auto_unroll_max_step$64"]]]], "r": [[0.00103448], 0, 8.28141, 1672658644], "v": "v0.6"}
{"i": [["[\"conv2d_2_4\"]", "cuda -keys=cuda,gpu -arch=sm_80 -max_num_threads=1024 -thread_warp_size=32", [-1, 16, 64, 49152, 2147483647, 1024, 8, 32], "", 0, []], [[], [["CHW", 3, "local"], ["SP", 3, 0, 1, [1, 1, 1, 1], 1], ["SP", 3, 5, 64, [1, 4, 1, 8], 1], ["SP", 3, 10, 56, [1, 14, 1, 1], 1], ["SP", 3, 15, 56, [7, 1, 1, 4], 1], ["SP", 3, 20, 256, [8, 1], 1], ["SP", 3, 23, 1, [1, 1], 1], ["SP", 3, 26, 1, [1, 1], 1], ["RE", 3, [0, 5, 10, 15, 1, 6, 11, 16, 2, 7, 12, 17, 20, 23, 26, 21, 24, 27, 3, 8, 13, 18, 22, 25, 28, 4, 9, 14, 19]], ["FSP", 4, 0, 1, 3], ["FSP", 4, 4, 2, 3], ["FSP", 4, 8, 3, 3], ["FSP", 4, 12, 4, 3], ["RE", 4, [0, 4, 8, 12, 1, 5, 9, 13, 2, 6, 10, 14, 3, 7, 11, 15]], ["CA", 3, 4, 11], ["CHR", 2, "shared", [3]], ["CA", 3, 4, 14], ["CHR", 1, "shared", [4]], ["CA", 2, 5, 14], ["CI", 1], ["FU", 6, [0, 1, 2, 3]], ["AN", 6, 0, 5], ["FU", 6, [1, 2, 3, 4]], ["AN", 6, 1, 4], ["FU", 6, [2, 3, 4, 5]], ["AN", 6, 2, 6], ["FU", 4, [0, 1, 2, 3]], ["SP", 4, 0, 128, [1], 1], ["AN", 4, 1, 2], ["FFSP", 4, 0, [4, 3, 2, 1], 1, 1], ["AN", 4, 1, 6], ["FU", 2, [0, 1, 2, 3]], ["SP", 2, 0, 64, [1], 1], ["AN", 2, 1, 2], ["FFSP", 2, 0, [4, 3, 2, 1], 1, 1], ["AN", 2, 1, 6], ["PR", 5, 0, "auto_unroll_max_step$1024"]]]], "r": [[0.000195652], 0, 6.9386, 1672658646], "v": "v0.6"}
{"i": [["[\"conv2d_2_4\"]", "cuda -keys=cuda,gpu -arch=sm_80 -max_num_threads=1024 -thread_warp_size=32", [-1, 16, 64, 49152, 2147483647, 1024, 8, 32], "", 0, []], [[], [["CHW", 3, "local"], ["SP", 3, 0, 1, [1, 1, 1, 1], 1], ["SP", 3, 5, 64, [1, 16, 1, 4], 1], ["SP", 3, 10, 56, [2, 2, 1, 7], 1], ["SP", 3, 15, 56, [2, 7, 2, 2], 1], ["SP", 3, 20, 256, [2, 1], 1], ["SP", 3, 23, 1, [1, 1], 1], ["SP", 3, 26, 1, [1, 1], 1], ["RE", 3, [0, 5, 10, 15, 1, 6, 11, 16, 2, 7, 12, 17, 20, 23, 26, 21, 24, 27, 3, 8, 13, 18, 22, 25, 28, 4, 9, 14, 19]], ["FSP", 4, 0, 1, 3], ["FSP", 4, 4, 2, 3], ["FSP", 4, 8, 3, 3], ["FSP", 4, 12, 4, 3], ["RE", 4, [0, 4, 8, 12, 1, 5, 9, 13, 2, 6, 10, 14, 3, 7, 11, 15]], ["CA", 3, 4, 11], ["CHR", 2, "shared", [3]], ["CA", 3, 4, 14], ["CHR", 1, "shared", [4]], ["CA", 2, 5, 14], ["CI", 1], ["FU", 6, [0, 1, 2, 3]], ["AN", 6, 0, 5], ["FU", 6, [1, 2, 3, 4]], ["AN", 6, 1, 4], ["FU", 6, [2, 3, 4, 5]], ["AN", 6, 2, 6], ["FU", 4, [0, 1, 2, 3]], ["SP", 4, 0, 4, [1], 1], ["AN", 4, 1, 2], ["FFSP", 4, 0, [4, 3, 2, 1], 1, 1], ["AN", 4, 1, 6], ["FU", 2, [0, 1, 2, 3]], ["SP", 2, 0, 56, [1], 1], ["AN", 2, 1, 2], ["FFSP", 2, 0, [4, 3, 2, 1], 1, 1], ["AN", 2, 1, 6], ["PR", 5, 0, "auto_unroll_max_step$64"]]]], "r": [[0.00308415], 0, 10.6604, 1672658647], "v": "v0.6"}
{"i": [["[\"conv2d_2_4\"]", "cuda -keys=cuda,gpu -arch=sm_80 -max_num_threads=1024 -thread_warp_size=32", [-1, 16, 64, 49152, 2147483647, 1024, 8, 32], "", 0, []], [[], [["CHW", 3, "local"], ["SP", 3, 0, 1, [1, 1, 1, 1], 1], ["SP", 3, 5, 64, [4, 4, 2, 1], 1], ["SP", 3, 10, 56, [2, 1, 2, 1], 1], ["SP", 3, 15, 56, [1, 14, 1, 1], 1], ["SP", 3, 20, 256, [16, 8], 1], ["SP", 3, 23, 1, [1, 1], 1], ["SP", 3, 26, 1, [1, 1], 1], ["RE", 3, [0, 5, 10, 15, 1, 6, 11, 16, 2, 7, 12, 17, 20, 23, 26, 21, 24, 27, 3, 8, 13, 18, 22, 25, 28, 4, 9, 14, 19]], ["FSP", 4, 0, 1, 3], ["FSP", 4, 4, 2, 3], ["FSP", 4, 8, 3, 3], ["FSP", 4, 12, 4, 3], ["RE", 4, [0, 4, 8, 12, 1, 5, 9, 13, 2, 6, 10, 14, 3, 7, 11, 15]], ["CA", 3, 4, 11], ["CHR", 2, "shared", [3]], ["CA", 3, 4, 14], ["CHR", 1, "shared", [4]], ["CA", 2, 5, 14], ["CI", 1], ["FU", 6, [0, 1, 2, 3]], ["AN", 6, 0, 5], ["FU", 6, [1, 2, 3, 4]], ["AN", 6, 1, 4], ["FU", 6, [2, 3, 4, 5]], ["AN", 6, 2, 6], ["FU", 4, [0, 1, 2, 3]], ["SP", 4, 0, 256, [1], 1], ["AN", 4, 1, 2], ["FFSP", 4, 0, [4, 3, 2, 1], 1, 1], ["AN", 4, 1, 6], ["FU", 2, [0, 1, 2, 3]], ["SP", 2, 0, 256, [1], 1], ["AN", 2, 1, 2], ["FFSP", 2, 0, [4, 3, 2, 1], 1, 1], ["AN", 2, 1, 6], ["PR", 5, 0, "auto_unroll_max_step$512"]]]], "r": [[2.42769e-05], 0, 9.81629, 1672658648], "v": "v0.6"}
{"i": [["[\"conv2d_2_4\"]", "cuda -keys=cuda,gpu -arch=sm_80 -max_num_threads=1024 -thread_warp_size=32", [-1, 16, 64, 49152, 2147483647, 1024, 8, 32], "", 0, []], [[], [["CHW", 3, "local"], ["SP", 3, 0, 1, [1, 1, 1, 1], 1], ["SP", 3, 5, 64, [1, 1, 64, 1], 1], ["SP", 3, 10, 56, [1, 1, 1, 1], 1], ["SP", 3, 15, 56, [7, 8, 1, 1], 1], ["SP", 3, 20, 256, [2, 2], 1], ["SP", 3, 23, 1, [1, 1], 1], ["SP", 3, 26, 1, [1, 1], 1], ["RE", 3, [0, 5, 10, 15, 1, 6, 11, 16, 2, 7, 12, 17, 20, 23, 26, 21, 24, 27, 3, 8, 13, 18, 22, 25, 28, 4, 9, 14, 19]], ["FSP", 4, 0, 1, 3], ["FSP", 4, 4, 2, 3], ["FSP", 4, 8, 3, 3], ["FSP", 4, 12, 4, 3], ["RE", 4, [0, 4, 8, 12, 1, 5, 9, 13, 2, 6, 10, 14, 3, 7, 11, 15]], ["CA", 3, 4, 11], ["CHR", 2, "shared", [3]], ["CA", 3, 4, 14], ["CHR", 1, "shared", [4]], ["CA", 2, 5, 14], ["CI", 1], ["FU", 6, [0, 1, 2, 3]], ["AN", 6, 0, 5], ["FU", 6, [1, 2, 3, 4]], ["AN", 6, 1, 4], ["FU", 6, [2, 3, 4, 5]], ["AN", 6, 2, 6], ["FU", 4, [0, 1, 2, 3]], ["SP", 4, 0, 256, [1], 1], ["AN", 4, 1, 2], ["FFSP", 4, 0, [4, 3, 2, 1], 1, 1], ["AN", 4, 1, 6], ["FU", 2, [0, 1, 2, 3]], ["SP", 2, 0, 8, [1], 1], ["AN", 2, 1, 2], ["FFSP", 2, 0, [4, 3, 2, 1], 1, 1], ["AN", 2, 1, 6], ["PR", 5, 0, "auto_unroll_max_step$16"]]]], "r": [[0.000454492], 0, 4.16686, 1672658650], "v": "v0.6"}
{"i": [["[\"conv2d_2_4\"]", "cuda -keys=cuda,gpu -arch=sm_80 -max_num_threads=1024 -thread_warp_size=32", [-1, 16, 64, 49152, 2147483647, 1024, 8, 32], "", 0, []], [[], [["CHW", 3, "local"], ["SP", 3, 0, 1, [1, 1, 1, 1], 1], ["SP", 3, 5, 64, [1, 8, 4, 2], 1], ["SP", 3, 10, 56, [1, 7, 1, 1], 1], ["SP", 3, 15, 56, [1, 1, 1, 7], 1], ["SP", 3, 20, 256, [1, 64], 1], ["SP", 3, 23, 1, [1, 1], 1], ["SP", 3, 26, 1, [1, 1], 1], ["RE", 3, [0, 5, 10, 15, 1, 6, 11, 16, 2, 7, 12, 17, 20, 23, 26, 21, 24, 27, 3, 8, 13, 18, 22, 25, 28, 4, 9, 14, 19]], ["FSP", 4, 0, 1, 3], ["FSP", 4, 4, 2, 3], ["FSP", 4, 8, 3, 3], ["FSP", 4, 12, 4, 3], ["RE", 4, [0, 4, 8, 12, 1, 5, 9, 13, 2, 6, 10, 14, 3, 7, 11, 15]], ["CA", 3, 4, 11], ["CHR", 2, "shared", [3]], ["CA", 3, 4, 14], ["CHR", 1, "shared", [4]], ["CA", 2, 5, 14], ["CI", 1], ["FU", 6, [0, 1, 2, 3]], ["AN", 6, 0, 5], ["FU", 6, [1, 2, 3, 4]], ["AN", 6, 1, 4], ["FU", 6, [2, 3, 4, 5]], ["AN", 6, 2, 6], ["FU", 4, [0, 1, 2, 3]], ["SP", 4, 0, 1024, [1], 1], ["AN", 4, 1, 2], ["FFSP", 4, 0, [4, 3, 2, 1], 1, 1], ["AN", 4, 1, 6], ["FU", 2, [0, 1, 2, 3]], ["SP", 2, 0, 448, [1], 1], ["AN", 2, 1, 2], ["FFSP", 2, 0, [4, 3, 2, 1], 1, 1], ["AN", 2, 1, 6], ["PR", 5, 0, "auto_unroll_max_step$0"]]]], "r": [[8.28356e-05], 0, 3.46087, 1672658651], "v": "v0.6"}
{"i": [["[\"conv2d_2_4\"]", "cuda -keys=cuda,gpu -arch=sm_80 -max_num_threads=1024 -thread_warp_size=32", [-1, 16, 64, 49152, 2147483647, 1024, 8, 32], "", 0, []], [[], [["CHW", 3, "local"], ["SP", 3, 0, 1, [1, 1, 1, 1], 1], ["SP", 3, 5, 64, [1, 16, 1, 2], 1], ["SP", 3, 10, 56, [4, 1, 1, 1], 1], ["SP", 3, 15, 56, [1, 2, 4, 1], 1], ["SP", 3, 20, 256, [64, 2], 1], ["SP", 3, 23, 1, [1, 1], 1], ["SP", 3, 26, 1, [1, 1], 1], ["RE", 3, [0, 5, 10, 15, 1, 6, 11, 16, 2, 7, 12, 17, 20, 23, 26, 21, 24, 27, 3, 8, 13, 18, 22, 25, 28, 4, 9, 14, 19]], ["FSP", 4, 0, 1, 3], ["FSP", 4, 4, 2, 3], ["FSP", 4, 8, 3, 3], ["FSP", 4, 12, 4, 3], ["RE", 4, [0, 4, 8, 12, 1, 5, 9, 13, 2, 6, 10, 14, 3, 7, 11, 15]], ["CA", 3, 4, 11], ["CHR", 2, "shared", [3]], ["CA", 3, 4, 14], ["CHR", 1, "shared", [4]], ["CA", 2, 5, 14], ["CI", 1], ["FU", 6, [0, 1, 2, 3]], ["AN", 6, 0, 5], ["FU", 6, [1, 2, 3, 4]], ["AN", 6, 1, 4], ["FU", 6, [2, 3, 4, 5]], ["AN", 6, 2, 6], ["FU", 4, [0, 1, 2, 3]], ["SP", 4, 0, 256, [1], 1], ["AN", 4, 1, 2], ["FFSP", 4, 0, [4, 3, 2, 1], 1, 1], ["AN", 4, 1, 6], ["FU", 2, [0, 1, 2, 3]], ["SP", 2, 0, 1024, [1], 1], ["AN", 2, 1, 2], ["FFSP", 2, 0, [4, 3, 2, 1], 1, 1], ["AN", 2, 1, 6], ["PR", 5, 0, "auto_unroll_max_step$64"]]]], "r": [[3.32895e-05], 0, 4.36592, 1672658653], "v": "v0.6"}
{"i": [["[\"conv2d_2_4\"]", "cuda -keys=cuda,gpu -arch=sm_80 -max_num_threads=1024 -thread_warp_size=32", [-1, 16, 64, 49152, 2147483647, 1024, 8, 32], "", 0, []], [[], [["CHW", 3, "local"], ["SP", 3, 0, 1, [1, 1, 1, 1], 1], ["SP", 3, 5, 64, [1, 16, 2, 2], 1], ["SP", 3, 10, 56, [1, 2, 4, 1], 1], ["SP", 3, 15, 56, [1, 1, 1, 1], 1], ["SP", 3, 20, 256, [2, 8], 1], ["SP", 3, 23, 1, [1, 1], 1], ["SP", 3, 26, 1, [1, 1], 1], ["RE", 3, [0, 5, 10, 15, 1, 6, 11, 16, 2, 7, 12, 17, 20, 23, 26, 21, 24, 27, 3, 8, 13, 18, 22, 25, 28, 4, 9, 14, 19]], ["FSP", 4, 0, 1, 3], ["FSP", 4, 4, 2, 3], ["FSP", 4, 8, 3, 3], ["FSP", 4, 12, 4, 3], ["RE", 4, [0, 4, 8, 12, 1, 5, 9, 13, 2, 6, 10, 14, 3, 7, 11, 15]], ["CA", 3, 4, 11], ["CHR", 2, "shared", [3]], ["CA", 3, 4, 14], ["CHR", 1, "shared", [4]], ["CA", 2, 5, 14], ["CI", 1], ["FU", 6, [0, 1, 2, 3]], ["AN", 6, 0, 5], ["FU", 6, [1, 2, 3, 4]], ["AN", 6, 1, 4], ["FU", 6, [2, 3, 4, 5]], ["AN", 6, 2, 6], ["FU", 4, [0, 1, 2, 3]], ["SP", 4, 0, 64, [1], 1], ["AN", 4, 1, 2], ["FFSP", 4, 0, [4, 3, 2, 1], 1, 1], ["AN", 4, 1, 6], ["FU", 2, [0, 1, 2, 3]], ["SP", 2, 0, 64, [1], 1], ["AN", 2, 1, 2], ["FFSP", 2, 0, [4, 3, 2, 1], 1, 1], ["AN", 2, 1, 6], ["PR", 5, 0, "auto_unroll_max_step$0"]]]], "r": [[3.4743e-05], 0, 3.3478, 1672658654], "v": "v0.6"}
{"i": [["[\"conv2d_2_4\"]", "cuda -keys=cuda,gpu -arch=sm_80 -max_num_threads=1024 -thread_warp_size=32", [-1, 16, 64, 49152, 2147483647, 1024, 8, 32], "", 0, []], [[], [["CHW", 3, "local"], ["SP", 3, 0, 1, [1, 1, 1, 1], 1], ["SP", 3, 5, 64, [2, 4, 4, 1], 1], ["SP", 3, 10, 56, [1, 2, 1, 4], 1], ["SP", 3, 15, 56, [1, 7, 8, 1], 1], ["SP", 3, 20, 256, [16, 1], 1], ["SP", 3, 23, 1, [1, 1], 1], ["SP", 3, 26, 1, [1, 1], 1], ["RE", 3, [0, 5, 10, 15, 1, 6, 11, 16, 2, 7, 12, 17, 20, 23, 26, 21, 24, 27, 3, 8, 13, 18, 22, 25, 28, 4, 9, 14, 19]], ["FSP", 4, 0, 1, 3], ["FSP", 4, 4, 2, 3], ["FSP", 4, 8, 3, 3], ["FSP", 4, 12, 4, 3], ["RE", 4, [0, 4, 8, 12, 1, 5, 9, 13, 2, 6, 10, 14, 3, 7, 11, 15]], ["CA", 3, 4, 11], ["CHR", 2, "shared", [3]], ["CA", 3, 4, 14], ["CHR", 1, "shared", [4]], ["CA", 2, 5, 14], ["CI", 1], ["FU", 6, [0, 1, 2, 3]], ["AN", 6, 0, 5], ["FU", 6, [1, 2, 3, 4]], ["AN", 6, 1, 4], ["FU", 6, [2, 3, 4, 5]], ["AN", 6, 2, 6], ["FU", 4, [0, 1, 2, 3]], ["SP", 4, 0, 64, [1], 1], ["AN", 4, 1, 2], ["FFSP", 4, 0, [4, 3, 2, 1], 1, 1], ["AN", 4, 1, 6], ["FU", 2, [0, 1, 2, 3]], ["SP", 2, 0, 512, [1], 1], ["AN", 2, 1, 2], ["FFSP", 2, 0, [4, 3, 2, 1], 1, 1], ["AN", 2, 1, 6], ["PR", 5, 0, "auto_unroll_max_step$0"]]]], "r": [[0.000292667], 0, 4.05178, 1672658655], "v": "v0.6"}
{"i": [["[\"conv2d_2_4\"]", "cuda -keys=cuda,gpu -arch=sm_80 -max_num_threads=1024 -thread_warp_size=32", [-1, 16, 64, 49152, 2147483647, 1024, 8, 32], "", 0, []], [[], [["CHW", 3, "local"], ["SP", 3, 0, 1, [1, 1, 1, 1], 1], ["SP", 3, 5, 64, [2, 1, 2, 1], 1], ["SP", 3, 10, 56, [2, 28, 1, 1], 1], ["SP", 3, 15, 56, [1, 28, 1, 1], 1], ["SP", 3, 20, 256, [4, 1], 1], ["SP", 3, 23, 1, [1, 1], 1], ["SP", 3, 26, 1, [1, 1], 1], ["RE", 3, [0, 5, 10, 15, 1, 6, 11, 16, 2, 7, 12, 17, 20, 23, 26, 21, 24, 27, 3, 8, 13, 18, 22, 25, 28, 4, 9, 14, 19]], ["FSP", 4, 0, 1, 3], ["FSP", 4, 4, 2, 3], ["FSP", 4, 8, 3, 3], ["FSP", 4, 12, 4, 3], ["RE", 4, [0, 4, 8, 12, 1, 5, 9, 13, 2, 6, 10, 14, 3, 7, 11, 15]], ["CA", 3, 4, 11], ["CHR", 2, "shared", [3]], ["CA", 3, 4, 14], ["CHR", 1, "shared", [4]], ["CA", 2, 5, 14], ["CI", 1], ["FU", 6, [0, 1, 2, 3]], ["AN", 6, 0, 5], ["FU", 6, [1, 2, 3, 4]], ["AN", 6, 1, 4], ["FU", 6, [2, 3, 4, 5]], ["AN", 6, 2, 6], ["FU", 4, [0, 1, 2, 3]], ["SP", 4, 0, 16, [2], 1], ["AN", 4, 1, 2], ["FFSP", 4, 0, [4, 3, 2, 1], 1, 1], ["AN", 4, 1, 6], ["FU", 2, [0, 1, 2, 3]], ["SP", 2, 0, 4, [4], 1], ["AN", 2, 1, 2], ["FFSP", 2, 0, [4, 3, 2, 1], 1, 1], ["AN", 2, 1, 6], ["PR", 5, 0, "auto_unroll_max_step$0"]]]], "r": [[8.55546e-05], 0, 3.26159, 1672658657], "v": "v0.6"}
{"i": [["[\"conv2d_2_4\"]", "cuda -keys=cuda,gpu -arch=sm_80 -max_num_threads=1024 -thread_warp_size=32", [-1, 16, 64, 49152, 2147483647, 1024, 8, 32], "", 0, []], [[], [["CHW", 3, "local"], ["SP", 3, 0, 1, [1, 1, 1, 1], 1], ["SP", 3, 5, 64, [1, 1, 8, 1], 1], ["SP", 3, 10, 56, [1, 8, 1, 7], 1], ["SP", 3, 15, 56, [1, 1, 1, 14], 1], ["SP", 3, 20, 256, [1, 4], 1], ["SP", 3, 23, 1, [1, 1], 1], ["SP", 3, 26, 1, [1, 1], 1], ["RE", 3, [0, 5, 10, 15, 1, 6, 11, 16, 2, 7, 12, 17, 20, 23, 26, 21, 24, 27, 3, 8, 13, 18, 22, 25, 28, 4, 9, 14, 19]], ["FSP", 4, 0, 1, 3], ["FSP", 4, 4, 2, 3], ["FSP", 4, 8, 3, 3], ["FSP", 4, 12, 4, 3], ["RE", 4, [0, 4, 8, 12, 1, 5, 9, 13, 2, 6, 10, 14, 3, 7, 11, 15]], ["CA", 3, 4, 11], ["CHR", 2, "shared", [3]], ["CA", 3, 4, 14], ["CHR", 1, "shared", [4]], ["CA", 2, 5, 14], ["CI", 1], ["FU", 6, [0, 1, 2, 3]], ["AN", 6, 0, 5], ["FU", 6, [1, 2, 3, 4]], ["AN", 6, 1, 4], ["FU", 6, [2, 3, 4, 5]], ["AN", 6, 2, 6], ["FU", 4, [0, 1, 2, 3]], ["SP", 4, 0, 16, [1], 1], ["AN", 4, 1, 2], ["FFSP", 4, 0, [4, 3, 2, 1], 1, 1], ["AN", 4, 1, 6], ["FU", 2, [0, 1, 2, 3]], ["SP", 2, 0, 784, [1], 1], ["AN", 2, 1, 2], ["FFSP", 2, 0, [4, 3, 2, 1], 1, 1], ["AN", 2, 1, 6], ["PR", 5, 0, "auto_unroll_max_step$64"]]]], "r": [[0.00176968], 0, 5.10628, 1672658658], "v": "v0.6"}
{"i": [["[\"conv2d_2_4\"]", "cuda -keys=cuda,gpu -arch=sm_80 -max_num_threads=1024 -thread_warp_size=32", [-1, 16, 64, 49152, 2147483647, 1024, 8, 32], "", 0, []], [[], [["CHW", 3, "local"], ["SP", 3, 0, 1, [1, 1, 1, 1], 1], ["SP", 3, 5, 64, [1, 2, 4, 8], 1], ["SP", 3, 10, 56, [7, 2, 1, 1], 1], ["SP", 3, 15, 56, [1, 14, 1, 1], 1], ["SP", 3, 20, 256, [16, 2], 1], ["SP", 3, 23, 1, [1, 1], 1], ["SP", 3, 26, 1, [1, 1], 1], ["RE", 3, [0, 5, 10, 15, 1, 6, 11, 16, 2, 7, 12, 17, 20, 23, 26, 21, 24, 27, 3, 8, 13, 18, 22, 25, 28, 4, 9, 14, 19]], ["FSP", 4, 0, 1, 3], ["FSP", 4, 4, 2, 3], ["FSP", 4, 8, 3, 3], ["FSP", 4, 12, 4, 3], ["RE", 4, [0, 4, 8, 12, 1, 5, 9, 13, 2, 6, 10, 14, 3, 7, 11, 15]], ["CA", 3, 4, 11], ["CHR", 2, "shared", [3]], ["CA", 3, 4, 14], ["CHR", 1, "shared", [4]], ["CA", 2, 5, 14], ["CI", 1], ["FU", 6, [0, 1, 2, 3]], ["AN", 6, 0, 5], ["FU", 6, [1, 2, 3, 4]], ["AN", 6, 1, 4], ["FU", 6, [2, 3, 4, 5]], ["AN", 6, 2, 6], ["FU", 4, [0, 1, 2, 3]], ["SP", 4, 0, 1024, [1], 1], ["AN", 4, 1, 2], ["FFSP", 4, 0, [4, 3, 2, 1], 1, 1], ["AN", 4, 1, 6], ["FU", 2, [0, 1, 2, 3]], ["SP", 2, 0, 32, [32], 1], ["AN", 2, 1, 2], ["FFSP", 2, 0, [4, 3, 2, 1], 1, 1], ["AN", 2, 1, 6], ["PR", 5, 0, "auto_unroll_max_step$1024"]]]], "r": [[0.000189033], 0, 13.5753, 1672658660], "v": "v0.6"}
{"i": [["[\"conv2d_2_4\"]", "cuda -keys=cuda,gpu -arch=sm_80 -max_num_threads=1024 -thread_warp_size=32", [-1, 16, 64, 49152, 2147483647, 1024, 8, 32], "", 0, []], [[], [["CHW", 3, "local"], ["SP", 3, 0, 1, [1, 1, 1, 1], 1], ["SP", 3, 5, 64, [1, 16, 1, 2], 1], ["SP", 3, 10, 56, [2, 2, 1, 1], 1], ["SP", 3, 15, 56, [1, 4, 2, 7], 1], ["SP", 3, 20, 256, [2, 16], 1], ["SP", 3, 23, 1, [1, 1], 1], ["SP", 3, 26, 1, [1, 1], 1], ["RE", 3, [0, 5, 10, 15, 1, 6, 11, 16, 2, 7, 12, 17, 20, 23, 26, 21, 24, 27, 3, 8, 13, 18, 22, 25, 28, 4, 9, 14, 19]], ["FSP", 4, 0, 1, 3], ["FSP", 4, 4, 2, 3], ["FSP", 4, 8, 3, 3], ["FSP", 4, 12, 4, 3], ["RE", 4, [0, 4, 8, 12, 1, 5, 9, 13, 2, 6, 10, 14, 3, 7, 11, 15]], ["CA", 3, 4, 11], ["CHR", 2, "shared", [3]], ["CA", 3, 4, 14], ["CHR", 1, "shared", [4]], ["CA", 2, 5, 14], ["CI", 1], ["FU", 6, [0, 1, 2, 3]], ["AN", 6, 0, 5], ["FU", 6, [1, 2, 3, 4]], ["AN", 6, 1, 4], ["FU", 6, [2, 3, 4, 5]], ["AN", 6, 2, 6], ["FU", 4, [0, 1, 2, 3]], ["SP", 4, 0, 64, [1], 1], ["AN", 4, 1, 2], ["FFSP", 4, 0, [4, 3, 2, 1], 1, 1], ["AN", 4, 1, 6], ["FU", 2, [0, 1, 2, 3]], ["SP", 2, 0, 896, [1], 1], ["AN", 2, 1, 2], ["FFSP", 2, 0, [4, 3, 2, 1], 1, 1], ["AN", 2, 1, 6], ["PR", 5, 0, "auto_unroll_max_step$0"]]]], "r": [[6.22927e-05], 0, 3.45265, 1672658661], "v": "v0.6"}
