runtime/fineco/code_gen/resnet/dense-50.json
{"i": [["[\"dense\"]", "cuda -keys=cuda,gpu -arch=sm_80 -max_num_threads=1024 -thread_warp_size=32", [-1, 16, 64, 49152, 2147483647, 1024, 8, 32], "", 0, []], [[], [["SP", 4, 1, 1000, [32], 1], ["AN", 4, 2, 6], ["FSP", 2, 2, 0, 1], ["AN", 2, 3, 6], ["CA", 2, 4, 1], ["FU", 4, [0, 1]], ["AN", 4, 0, 5], ["PR", 2, 0, "auto_unroll_max_step$512"]]]], "r": [[0.000775899], 0, 4.75967, 1682030312], "v": "v0.6"}
{"i": [["[\"dense\"]", "cuda -keys=cuda,gpu -arch=sm_80 -max_num_threads=1024 -thread_warp_size=32", [-1, 16, 64, 49152, 2147483647, 1024, 8, 32], "", 0, []], [[], [["SP", 4, 1, 1000, [32], 1], ["AN", 4, 2, 6], ["FSP", 2, 2, 0, 1], ["AN", 2, 3, 6], ["CA", 2, 4, 1], ["FU", 4, [0, 1]], ["AN", 4, 0, 5], ["PR", 2, 0, "auto_unroll_max_step$64"]]]], "r": [[0.000783495], 0, 4.77385, 1682030315], "v": "v0.6"}
{"i": [["[\"dense\"]", "cuda -keys=cuda,gpu -arch=sm_80 -max_num_threads=1024 -thread_warp_size=32", [-1, 16, 64, 49152, 2147483647, 1024, 8, 32], "", 0, []], [[], [["SP", 4, 1, 1000, [32], 1], ["AN", 4, 2, 6], ["FSP", 2, 2, 0, 1], ["AN", 2, 3, 6], ["CA", 2, 4, 1], ["FU", 4, [0, 1]], ["AN", 4, 0, 5], ["PR", 2, 0, "auto_unroll_max_step$0"]]]], "r": [[0.000796494], 0, 4.25408, 1682030318], "v": "v0.6"}
{"i": [["[\"dense\"]", "cuda -keys=cuda,gpu -arch=sm_80 -max_num_threads=1024 -thread_warp_size=32", [-1, 16, 64, 49152, 2147483647, 1024, 8, 32], "", 0, []], [[], [["SP", 4, 1, 1000, [32], 1], ["AN", 4, 2, 6], ["FSP", 2, 2, 0, 1], ["AN", 2, 3, 6], ["CA", 2, 4, 1], ["FU", 4, [0, 1]], ["AN", 4, 0, 5], ["PR", 2, 0, "auto_unroll_max_step$16"]]]], "r": [[0.000775699], 0, 4.84113, 1682030321], "v": "v0.6"}
