runtime/fineco/code_gen/mobilenet/depthwise_conv2d_8-98.json
{"i": [["[\"depthwise_conv2d_8\"]", "cuda -keys=cuda,gpu -arch=sm_80 -max_num_threads=1024 -thread_warp_size=32", [-1, 16, 64, 49152, 2147483647, 1024, 8, 32], "", 0, []], [[], [["SP", 3, 0, 1, [1, 1, 1, 1], 1], ["SP", 3, 5, 512, [2, 64, 2, 1], 1], ["SP", 3, 10, 7, [1, 1, 1, 1], 1], ["SP", 3, 15, 7, [1, 1, 1, 1], 1], ["SP", 3, 20, 3, [1, 3], 1], ["SP", 3, 23, 3, [1, 3], 1], ["RE", 3, [0, 5, 10, 15, 1, 6, 11, 16, 2, 7, 12, 17, 20, 23, 21, 24, 3, 8, 13, 18, 22, 25, 4, 9, 14, 19]], ["FSP", 4, 0, 0, 3], ["FSP", 4, 4, 1, 3], ["FSP", 4, 8, 2, 3], ["FSP", 4, 12, 3, 3], ["RE", 4, [0, 4, 8, 12, 1, 5, 9, 13, 2, 6, 10, 14, 3, 7, 11, 15]], ["CA", 3, 4, 11], ["CHR", 2, "shared", [3]], ["CA", 3, 4, 13], ["CHR", 1, "shared", [4]], ["CA", 2, 5, 13], ["CI", 1], ["FU", 6, [0, 1, 2, 3]], ["AN", 6, 0, 5], ["FU", 6, [1, 2, 3, 4]], ["AN", 6, 1, 4], ["FU", 6, [2, 3, 4, 5]], ["AN", 6, 2, 6], ["FU", 4, [0, 1, 2, 3]], ["SP", 4, 0, 18, [1], 1], ["AN", 4, 1, 2], ["FFSP", 4, 0, [3, 2, 1, 0], 1, 1], ["AN", 4, 1, 6], ["FU", 2, [0, 1, 2, 3]], ["SP", 2, 0, 18, [1], 1], ["AN", 2, 1, 2], ["FFSP", 2, 0, [3, 2, 1, 0], 1, 1], ["AN", 2, 1, 6], ["PR", 5, 0, "auto_unroll_max_step$16"]]]], "r": [[1.2922e-05], 0, 2.7468, 1685671590], "v": "v0.6"}
{"i": [["[\"depthwise_conv2d_8\"]", "cuda -keys=cuda,gpu -arch=sm_80 -max_num_threads=1024 -thread_warp_size=32", [-1, 16, 64, 49152, 2147483647, 1024, 8, 32], "", 0, []], [[], [["SP", 3, 0, 1, [1, 1, 1, 1], 1], ["SP", 3, 5, 512, [2, 32, 1, 4], 1], ["SP", 3, 10, 7, [1, 1, 1, 1], 1], ["SP", 3, 15, 7, [1, 1, 1, 1], 1], ["SP", 3, 20, 3, [3, 1], 1], ["SP", 3, 23, 3, [3, 1], 1], ["RE", 3, [0, 5, 10, 15, 1, 6, 11, 16, 2, 7, 12, 17, 20, 23, 21, 24, 3, 8, 13, 18, 22, 25, 4, 9, 14, 19]], ["FSP", 4, 0, 0, 3], ["FSP", 4, 4, 1, 3], ["FSP", 4, 8, 2, 3], ["FSP", 4, 12, 3, 3], ["RE", 4, [0, 4, 8, 12, 1, 5, 9, 13, 2, 6, 10, 14, 3, 7, 11, 15]], ["CA", 3, 4, 11], ["CHR", 2, "shared", [3]], ["CA", 3, 4, 13], ["CHR", 1, "shared", [4]], ["CA", 2, 5, 13], ["CI", 1], ["FU", 6, [0, 1, 2, 3]], ["AN", 6, 0, 5], ["FU", 6, [1, 2, 3, 4]], ["AN", 6, 1, 4], ["FU", 6, [2, 3, 4, 5]], ["AN", 6, 2, 6], ["FU", 4, [0, 1, 2, 3]], ["SP", 4, 0, 36, [1], 1], ["AN", 4, 1, 2], ["FFSP", 4, 0, [3, 2, 1, 0], 1, 1], ["AN", 4, 1, 6], ["FU", 2, [0, 1, 2, 3]], ["SP", 2, 0, 36, [1], 1], ["AN", 2, 1, 2], ["FFSP", 2, 0, [3, 2, 1, 0], 1, 1], ["AN", 2, 1, 6], ["PR", 5, 0, "auto_unroll_max_step$1024"]]]], "r": [[2.30878e-05], 0, 9.72941, 1685671591], "v": "v0.6"}
{"i": [["[\"depthwise_conv2d_8\"]", "cuda -keys=cuda,gpu -arch=sm_80 -max_num_threads=1024 -thread_warp_size=32", [-1, 16, 64, 49152, 2147483647, 1024, 8, 32], "", 0, []], [[], [["SP", 3, 0, 1, [1, 1, 1, 1], 1], ["SP", 3, 5, 512, [4, 32, 2, 1], 1], ["SP", 3, 10, 7, [1, 1, 1, 1], 1], ["SP", 3, 15, 7, [1, 1, 1, 1], 1], ["SP", 3, 20, 3, [1, 1], 1], ["SP", 3, 23, 3, [1, 3], 1], ["RE", 3, [0, 5, 10, 15, 1, 6, 11, 16, 2, 7, 12, 17, 20, 23, 21, 24, 3, 8, 13, 18, 22, 25, 4, 9, 14, 19]], ["FSP", 4, 0, 0, 3], ["FSP", 4, 4, 1, 3], ["FSP", 4, 8, 2, 3], ["FSP", 4, 12, 3, 3], ["RE", 4, [0, 4, 8, 12, 1, 5, 9, 13, 2, 6, 10, 14, 3, 7, 11, 15]], ["CA", 3, 4, 11], ["CHR", 2, "shared", [3]], ["CA", 3, 4, 13], ["CHR", 1, "shared", [4]], ["CA", 2, 5, 13], ["CI", 1], ["FU", 6, [0, 1, 2, 3]], ["AN", 6, 0, 5], ["FU", 6, [1, 2, 3, 4]], ["AN", 6, 1, 4], ["FU", 6, [2, 3, 4, 5]], ["AN", 6, 2, 6], ["FU", 4, [0, 1, 2, 3]], ["SP", 4, 0, 6, [1], 1], ["AN", 4, 1, 2], ["FFSP", 4, 0, [3, 2, 1, 0], 1, 1], ["AN", 4, 1, 6], ["FU", 2, [0, 1, 2, 3]], ["SP", 2, 0, 6, [1], 1], ["AN", 2, 1, 2], ["FFSP", 2, 0, [3, 2, 1, 0], 1, 1], ["AN", 2, 1, 6], ["PR", 5, 0, "auto_unroll_max_step$16"]]]], "r": [[8.93424e-06], 0, 2.57919, 1685671592], "v": "v0.6"}
{"i": [["[\"depthwise_conv2d_8\"]", "cuda -keys=cuda,gpu -arch=sm_80 -max_num_threads=1024 -thread_warp_size=32", [-1, 16, 64, 49152, 2147483647, 1024, 8, 32], "", 0, []], [[], [["SP", 3, 0, 1, [1, 1, 1, 1], 1], ["SP", 3, 5, 512, [1, 256, 1, 1], 1], ["SP", 3, 10, 7, [1, 1, 1, 1], 1], ["SP", 3, 15, 7, [1, 1, 1, 1], 1], ["SP", 3, 20, 3, [3, 1], 1], ["SP", 3, 23, 3, [1, 1], 1], ["RE", 3, [0, 5, 10, 15, 1, 6, 11, 16, 2, 7, 12, 17, 20, 23, 21, 24, 3, 8, 13, 18, 22, 25, 4, 9, 14, 19]], ["FSP", 4, 0, 0, 3], ["FSP", 4, 4, 1, 3], ["FSP", 4, 8, 2, 3], ["FSP", 4, 12, 3, 3], ["RE", 4, [0, 4, 8, 12, 1, 5, 9, 13, 2, 6, 10, 14, 3, 7, 11, 15]], ["CA", 3, 4, 11], ["CHR", 2, "shared", [3]], ["CA", 3, 4, 13], ["CHR", 1, "shared", [4]], ["CA", 2, 5, 13], ["CI", 1], ["FU", 6, [0, 1, 2, 3]], ["AN", 6, 0, 5], ["FU", 6, [1, 2, 3, 4]], ["AN", 6, 1, 4], ["FU", 6, [2, 3, 4, 5]], ["AN", 6, 2, 6], ["FU", 4, [0, 1, 2, 3]], ["SP", 4, 0, 3, [1], 1], ["AN", 4, 1, 2], ["FFSP", 4, 0, [3, 2, 1, 0], 1, 1], ["AN", 4, 1, 6], ["FU", 2, [0, 1, 2, 3]], ["SP", 2, 0, 3, [1], 1], ["AN", 2, 1, 2], ["FFSP", 2, 0, [3, 2, 1, 0], 1, 1], ["AN", 2, 1, 6], ["PR", 5, 0, "auto_unroll_max_step$0"]]]], "r": [[8.8474e-06], 0, 2.30639, 1685671593], "v": "v0.6"}
{"i": [["[\"depthwise_conv2d_8\"]", "cuda -keys=cuda,gpu -arch=sm_80 -max_num_threads=1024 -thread_warp_size=32", [-1, 16, 64, 49152, 2147483647, 1024, 8, 32], "", 0, []], [[], [["SP", 3, 0, 1, [1, 1, 1, 1], 1], ["SP", 3, 5, 512, [4, 64, 1, 1], 1], ["SP", 3, 10, 7, [1, 1, 1, 1], 1], ["SP", 3, 15, 7, [1, 1, 1, 1], 1], ["SP", 3, 20, 3, [3, 1], 1], ["SP", 3, 23, 3, [1, 3], 1], ["RE", 3, [0, 5, 10, 15, 1, 6, 11, 16, 2, 7, 12, 17, 20, 23, 21, 24, 3, 8, 13, 18, 22, 25, 4, 9, 14, 19]], ["FSP", 4, 0, 0, 3], ["FSP", 4, 4, 1, 3], ["FSP", 4, 8, 2, 3], ["FSP", 4, 12, 3, 3], ["RE", 4, [0, 4, 8, 12, 1, 5, 9, 13, 2, 6, 10, 14, 3, 7, 11, 15]], ["CA", 3, 4, 11], ["CHR", 2, "shared", [3]], ["CA", 3, 4, 13], ["CHR", 1, "shared", [4]], ["CA", 2, 5, 13], ["CI", 1], ["FU", 6, [0, 1, 2, 3]], ["AN", 6, 0, 5], ["FU", 6, [1, 2, 3, 4]], ["AN", 6, 1, 4], ["FU", 6, [2, 3, 4, 5]], ["AN", 6, 2, 6], ["FU", 4, [0, 1, 2, 3]], ["SP", 4, 0, 9, [1], 1], ["AN", 4, 1, 2], ["FFSP", 4, 0, [3, 2, 1, 0], 1, 1], ["AN", 4, 1, 6], ["FU", 2, [0, 1, 2, 3]], ["SP", 2, 0, 9, [1], 1], ["AN", 2, 1, 2], ["FFSP", 2, 0, [3, 2, 1, 0], 1, 1], ["AN", 2, 1, 6], ["PR", 5, 0, "auto_unroll_max_step$0"]]]], "r": [[1.31114e-05], 0, 2.47812, 1685671594], "v": "v0.6"}
{"i": [["[\"depthwise_conv2d_8\"]", "cuda -keys=cuda,gpu -arch=sm_80 -max_num_threads=1024 -thread_warp_size=32", [-1, 16, 64, 49152, 2147483647, 1024, 8, 32], "", 0, []], [[], [["SP", 3, 0, 1, [1, 1, 1, 1], 1], ["SP", 3, 5, 512, [2, 32, 1, 4], 1], ["SP", 3, 10, 7, [1, 1, 1, 1], 1], ["SP", 3, 15, 7, [1, 1, 1, 1], 1], ["SP", 3, 20, 3, [3, 1], 1], ["SP", 3, 23, 3, [1, 1], 1], ["RE", 3, [0, 5, 10, 15, 1, 6, 11, 16, 2, 7, 12, 17, 20, 23, 21, 24, 3, 8, 13, 18, 22, 25, 4, 9, 14, 19]], ["FSP", 4, 0, 0, 3], ["FSP", 4, 4, 1, 3], ["FSP", 4, 8, 2, 3], ["FSP", 4, 12, 3, 3], ["RE", 4, [0, 4, 8, 12, 1, 5, 9, 13, 2, 6, 10, 14, 3, 7, 11, 15]], ["CA", 3, 4, 11], ["CHR", 2, "shared", [3]], ["CA", 3, 4, 13], ["CHR", 1, "shared", [4]], ["CA", 2, 5, 13], ["CI", 1], ["FU", 6, [0, 1, 2, 3]], ["AN", 6, 0, 5], ["FU", 6, [1, 2, 3, 4]], ["AN", 6, 1, 4], ["FU", 6, [2, 3, 4, 5]], ["AN", 6, 2, 6], ["FU", 4, [0, 1, 2, 3]], ["SP", 4, 0, 12, [1], 1], ["AN", 4, 1, 2], ["FFSP", 4, 0, [3, 2, 1, 0], 1, 1], ["AN", 4, 1, 6], ["FU", 2, [0, 1, 2, 3]], ["SP", 2, 0, 12, [1], 1], ["AN", 2, 1, 2], ["FFSP", 2, 0, [3, 2, 1, 0], 1, 1], ["AN", 2, 1, 6], ["PR", 5, 0, "auto_unroll_max_step$0"]]]], "r": [[9.40859e-06], 0, 2.55516, 1685671595], "v": "v0.6"}
{"i": [["[\"depthwise_conv2d_8\"]", "cuda -keys=cuda,gpu -arch=sm_80 -max_num_threads=1024 -thread_warp_size=32", [-1, 16, 64, 49152, 2147483647, 1024, 8, 32], "", 0, []], [[], [["SP", 3, 0, 1, [1, 1, 1, 1], 1], ["SP", 3, 5, 512, [4, 64, 1, 1], 1], ["SP", 3, 10, 7, [1, 1, 1, 1], 1], ["SP", 3, 15, 7, [1, 1, 1, 1], 1], ["SP", 3, 20, 3, [1, 1], 1], ["SP", 3, 23, 3, [1, 1], 1], ["RE", 3, [0, 5, 10, 15, 1, 6, 11, 16, 2, 7, 12, 17, 20, 23, 21, 24, 3, 8, 13, 18, 22, 25, 4, 9, 14, 19]], ["FSP", 4, 0, 0, 3], ["FSP", 4, 4, 1, 3], ["FSP", 4, 8, 2, 3], ["FSP", 4, 12, 3, 3], ["RE", 4, [0, 4, 8, 12, 1, 5, 9, 13, 2, 6, 10, 14, 3, 7, 11, 15]], ["CA", 3, 4, 11], ["CHR", 2, "shared", [3]], ["CA", 3, 4, 13], ["CHR", 1, "shared", [4]], ["CA", 2, 5, 13], ["CI", 1], ["FU", 6, [0, 1, 2, 3]], ["AN", 6, 0, 5], ["FU", 6, [1, 2, 3, 4]], ["AN", 6, 1, 4], ["FU", 6, [2, 3, 4, 5]], ["AN", 6, 2, 6], ["FU", 4, [0, 1, 2, 3]], ["SP", 4, 0, 1, [1], 1], ["AN", 4, 1, 2], ["FFSP", 4, 0, [3, 2, 1, 0], 1, 1], ["AN", 4, 1, 6], ["FU", 2, [0, 1, 2, 3]], ["SP", 2, 0, 1, [1], 1], ["AN", 2, 1, 2], ["FFSP", 2, 0, [3, 2, 1, 0], 1, 1], ["AN", 2, 1, 6], ["PR", 5, 0, "auto_unroll_max_step$1024"]]]], "r": [[8.9399e-06], 0, 3.21107, 1685671596], "v": "v0.6"}
{"i": [["[\"depthwise_conv2d_8\"]", "cuda -keys=cuda,gpu -arch=sm_80 -max_num_threads=1024 -thread_warp_size=32", [-1, 16, 64, 49152, 2147483647, 1024, 8, 32], "", 0, []], [[], [["SP", 3, 0, 1, [1, 1, 1, 1], 1], ["SP", 3, 5, 512, [2, 32, 4, 1], 1], ["SP", 3, 10, 7, [1, 1, 1, 1], 1], ["SP", 3, 15, 7, [1, 1, 1, 1], 1], ["SP", 3, 20, 3, [1, 1], 1], ["SP", 3, 23, 3, [3, 1], 1], ["RE", 3, [0, 5, 10, 15, 1, 6, 11, 16, 2, 7, 12, 17, 20, 23, 21, 24, 3, 8, 13, 18, 22, 25, 4, 9, 14, 19]], ["FSP", 4, 0, 0, 3], ["FSP", 4, 4, 1, 3], ["FSP", 4, 8, 2, 3], ["FSP", 4, 12, 3, 3], ["RE", 4, [0, 4, 8, 12, 1, 5, 9, 13, 2, 6, 10, 14, 3, 7, 11, 15]], ["CA", 3, 4, 11], ["CHR", 2, "shared", [3]], ["CA", 3, 4, 13], ["CHR", 1, "shared", [4]], ["CA", 2, 5, 13], ["CI", 1], ["FU", 6, [0, 1, 2, 3]], ["AN", 6, 0, 5], ["FU", 6, [1, 2, 3, 4]], ["AN", 6, 1, 4], ["FU", 6, [2, 3, 4, 5]], ["AN", 6, 2, 6], ["FU", 4, [0, 1, 2, 3]], ["SP", 4, 0, 12, [1], 1], ["AN", 4, 1, 2], ["FFSP", 4, 0, [3, 2, 1, 0], 1, 1], ["AN", 4, 1, 6], ["FU", 2, [0, 1, 2, 3]], ["SP", 2, 0, 12, [1], 1], ["AN", 2, 1, 2], ["FFSP", 2, 0, [3, 2, 1, 0], 1, 1], ["AN", 2, 1, 6], ["PR", 5, 0, "auto_unroll_max_step$512"]]]], "r": [[1.16246e-05], 0, 6.14421, 1685671597], "v": "v0.6"}
{"i": [["[\"depthwise_conv2d_8\"]", "cuda -keys=cuda,gpu -arch=sm_80 -max_num_threads=1024 -thread_warp_size=32", [-1, 16, 64, 49152, 2147483647, 1024, 8, 32], "", 0, []], [[], [["SP", 3, 0, 1, [1, 1, 1, 1], 1], ["SP", 3, 5, 512, [2, 128, 1, 1], 1], ["SP", 3, 10, 7, [1, 1, 1, 1], 1], ["SP", 3, 15, 7, [1, 1, 1, 1], 1], ["SP", 3, 20, 3, [1, 3], 1], ["SP", 3, 23, 3, [1, 1], 1], ["RE", 3, [0, 5, 10, 15, 1, 6, 11, 16, 2, 7, 12, 17, 20, 23, 21, 24, 3, 8, 13, 18, 22, 25, 4, 9, 14, 19]], ["FSP", 4, 0, 0, 3], ["FSP", 4, 4, 1, 3], ["FSP", 4, 8, 2, 3], ["FSP", 4, 12, 3, 3], ["RE", 4, [0, 4, 8, 12, 1, 5, 9, 13, 2, 6, 10, 14, 3, 7, 11, 15]], ["CA", 3, 4, 11], ["CHR", 2, "shared", [3]], ["CA", 3, 4, 13], ["CHR", 1, "shared", [4]], ["CA", 2, 5, 13], ["CI", 1], ["FU", 6, [0, 1, 2, 3]], ["AN", 6, 0, 5], ["FU", 6, [1, 2, 3, 4]], ["AN", 6, 1, 4], ["FU", 6, [2, 3, 4, 5]], ["AN", 6, 2, 6], ["FU", 4, [0, 1, 2, 3]], ["SP", 4, 0, 3, [1], 1], ["AN", 4, 1, 2], ["FFSP", 4, 0, [3, 2, 1, 0], 1, 1], ["AN", 4, 1, 6], ["FU", 2, [0, 1, 2, 3]], ["SP", 2, 0, 3, [1], 1], ["AN", 2, 1, 2], ["FFSP", 2, 0, [3, 2, 1, 0], 1, 1], ["AN", 2, 1, 6], ["PR", 5, 0, "auto_unroll_max_step$1024"]]]], "r": [[9.91647e-06], 0, 3.13735, 1685671598], "v": "v0.6"}
{"i": [["[\"depthwise_conv2d_8\"]", "cuda -keys=cuda,gpu -arch=sm_80 -max_num_threads=1024 -thread_warp_size=32", [-1, 16, 64, 49152, 2147483647, 1024, 8, 32], "", 0, []], [[], [["SP", 3, 0, 1, [1, 1, 1, 1], 1], ["SP", 3, 5, 512, [4, 32, 2, 1], 1], ["SP", 3, 10, 7, [1, 1, 1, 1], 1], ["SP", 3, 15, 7, [1, 1, 1, 1], 1], ["SP", 3, 20, 3, [1, 3], 1], ["SP", 3, 23, 3, [3, 1], 1], ["RE", 3, [0, 5, 10, 15, 1, 6, 11, 16, 2, 7, 12, 17, 20, 23, 21, 24, 3, 8, 13, 18, 22, 25, 4, 9, 14, 19]], ["FSP", 4, 0, 0, 3], ["FSP", 4, 4, 1, 3], ["FSP", 4, 8, 2, 3], ["FSP", 4, 12, 3, 3], ["RE", 4, [0, 4, 8, 12, 1, 5, 9, 13, 2, 6, 10, 14, 3, 7, 11, 15]], ["CA", 3, 4, 11], ["CHR", 2, "shared", [3]], ["CA", 3, 4, 13], ["CHR", 1, "shared", [4]], ["CA", 2, 5, 13], ["CI", 1], ["FU", 6, [0, 1, 2, 3]], ["AN", 6, 0, 5], ["FU", 6, [1, 2, 3, 4]], ["AN", 6, 1, 4], ["FU", 6, [2, 3, 4, 5]], ["AN", 6, 2, 6], ["FU", 4, [0, 1, 2, 3]], ["SP", 4, 0, 18, [1], 1], ["AN", 4, 1, 2], ["FFSP", 4, 0, [3, 2, 1, 0], 1, 1], ["AN", 4, 1, 6], ["FU", 2, [0, 1, 2, 3]], ["SP", 2, 0, 18, [1], 1], ["AN", 2, 1, 2], ["FFSP", 2, 0, [3, 2, 1, 0], 1, 1], ["AN", 2, 1, 6], ["PR", 5, 0, "auto_unroll_max_step$512"]]]], "r": [[2.30854e-05], 0, 9.80081, 1685671600], "v": "v0.6"}
{"i": [["[\"depthwise_conv2d_8\"]", "cuda -keys=cuda,gpu -arch=sm_80 -max_num_threads=1024 -thread_warp_size=32", [-1, 16, 64, 49152, 2147483647, 1024, 8, 32], "", 0, []], [[], [["SP", 3, 0, 1, [1, 1, 1, 1], 1], ["SP", 3, 5, 512, [1, 32, 1, 8], 1], ["SP", 3, 10, 7, [1, 1, 1, 1], 1], ["SP", 3, 15, 7, [1, 1, 1, 1], 1], ["SP", 3, 20, 3, [1, 3], 1], ["SP", 3, 23, 3, [1, 1], 1], ["RE", 3, [0, 5, 10, 15, 1, 6, 11, 16, 2, 7, 12, 17, 20, 23, 21, 24, 3, 8, 13, 18, 22, 25, 4, 9, 14, 19]], ["FSP", 4, 0, 0, 3], ["FSP", 4, 4, 1, 3], ["FSP", 4, 8, 2, 3], ["FSP", 4, 12, 3, 3], ["RE", 4, [0, 4, 8, 12, 1, 5, 9, 13, 2, 6, 10, 14, 3, 7, 11, 15]], ["CA", 3, 4, 11], ["CHR", 2, "shared", [3]], ["CA", 3, 4, 13], ["CHR", 1, "shared", [4]], ["CA", 2, 5, 13], ["CI", 1], ["FU", 6, [0, 1, 2, 3]], ["AN", 6, 0, 5], ["FU", 6, [1, 2, 3, 4]], ["AN", 6, 1, 4], ["FU", 6, [2, 3, 4, 5]], ["AN", 6, 2, 6], ["FU", 4, [0, 1, 2, 3]], ["SP", 4, 0, 24, [1], 1], ["AN", 4, 1, 2], ["FFSP", 4, 0, [3, 2, 1, 0], 1, 1], ["AN", 4, 1, 6], ["FU", 2, [0, 1, 2, 3]], ["SP", 2, 0, 24, [1], 1], ["AN", 2, 1, 2], ["FFSP", 2, 0, [3, 2, 1, 0], 1, 1], ["AN", 2, 1, 6], ["PR", 5, 0, "auto_unroll_max_step$0"]]]], "r": [[9.97452e-06], 0, 2.57021, 1685671601], "v": "v0.6"}
{"i": [["[\"depthwise_conv2d_8\"]", "cuda -keys=cuda,gpu -arch=sm_80 -max_num_threads=1024 -thread_warp_size=32", [-1, 16, 64, 49152, 2147483647, 1024, 8, 32], "", 0, []], [[], [["SP", 3, 0, 1, [1, 1, 1, 1], 1], ["SP", 3, 5, 512, [1, 64, 4, 1], 1], ["SP", 3, 10, 7, [1, 1, 1, 1], 1], ["SP", 3, 15, 7, [1, 1, 1, 1], 1], ["SP", 3, 20, 3, [1, 1], 1], ["SP", 3, 23, 3, [1, 1], 1], ["RE", 3, [0, 5, 10, 15, 1, 6, 11, 16, 2, 7, 12, 17, 20, 23, 21, 24, 3, 8, 13, 18, 22, 25, 4, 9, 14, 19]], ["FSP", 4, 0, 0, 3], ["FSP", 4, 4, 1, 3], ["FSP", 4, 8, 2, 3], ["FSP", 4, 12, 3, 3], ["RE", 4, [0, 4, 8, 12, 1, 5, 9, 13, 2, 6, 10, 14, 3, 7, 11, 15]], ["CA", 3, 4, 11], ["CHR", 2, "shared", [3]], ["CA", 3, 4, 13], ["CHR", 1, "shared", [4]], ["CA", 2, 5, 13], ["CI", 1], ["FU", 6, [0, 1, 2, 3]], ["AN", 6, 0, 5], ["FU", 6, [1, 2, 3, 4]], ["AN", 6, 1, 4], ["FU", 6, [2, 3, 4, 5]], ["AN", 6, 2, 6], ["FU", 4, [0, 1, 2, 3]], ["SP", 4, 0, 4, [1], 1], ["AN", 4, 1, 2], ["FFSP", 4, 0, [3, 2, 1, 0], 1, 1], ["AN", 4, 1, 6], ["FU", 2, [0, 1, 2, 3]], ["SP", 2, 0, 4, [1], 1], ["AN", 2, 1, 2], ["FFSP", 2, 0, [3, 2, 1, 0], 1, 1], ["AN", 2, 1, 6], ["PR", 5, 0, "auto_unroll_max_step$64"]]]], "r": [[8.94888e-06], 0, 2.71326, 1685671602], "v": "v0.6"}
{"i": [["[\"depthwise_conv2d_8\"]", "cuda -keys=cuda,gpu -arch=sm_80 -max_num_threads=1024 -thread_warp_size=32", [-1, 16, 64, 49152, 2147483647, 1024, 8, 32], "", 0, []], [[], [["SP", 3, 0, 1, [1, 1, 1, 1], 1], ["SP", 3, 5, 512, [1, 128, 2, 1], 1], ["SP", 3, 10, 7, [1, 1, 1, 1], 1], ["SP", 3, 15, 7, [1, 1, 1, 1], 1], ["SP", 3, 20, 3, [1, 3], 1], ["SP", 3, 23, 3, [1, 1], 1], ["RE", 3, [0, 5, 10, 15, 1, 6, 11, 16, 2, 7, 12, 17, 20, 23, 21, 24, 3, 8, 13, 18, 22, 25, 4, 9, 14, 19]], ["FSP", 4, 0, 0, 3], ["FSP", 4, 4, 1, 3], ["FSP", 4, 8, 2, 3], ["FSP", 4, 12, 3, 3], ["RE", 4, [0, 4, 8, 12, 1, 5, 9, 13, 2, 6, 10, 14, 3, 7, 11, 15]], ["CA", 3, 4, 11], ["CHR", 2, "shared", [3]], ["CA", 3, 4, 13], ["CHR", 1, "shared", [4]], ["CA", 2, 5, 13], ["CI", 1], ["FU", 6, [0, 1, 2, 3]], ["AN", 6, 0, 5], ["FU", 6, [1, 2, 3, 4]], ["AN", 6, 1, 4], ["FU", 6, [2, 3, 4, 5]], ["AN", 6, 2, 6], ["FU", 4, [0, 1, 2, 3]], ["SP", 4, 0, 6, [1], 1], ["AN", 4, 1, 2], ["FFSP", 4, 0, [3, 2, 1, 0], 1, 1], ["AN", 4, 1, 6], ["FU", 2, [0, 1, 2, 3]], ["SP", 2, 0, 6, [1], 1], ["AN", 2, 1, 2], ["FFSP", 2, 0, [3, 2, 1, 0], 1, 1], ["AN", 2, 1, 6], ["PR", 5, 0, "auto_unroll_max_step$1024"]]]], "r": [[6.39492e-06], 0, 3.51604, 1685671603], "v": "v0.6"}
{"i": [["[\"depthwise_conv2d_8\"]", "cuda -keys=cuda,gpu -arch=sm_80 -max_num_threads=1024 -thread_warp_size=32", [-1, 16, 64, 49152, 2147483647, 1024, 8, 32], "", 0, []], [[], [["SP", 3, 0, 1, [1, 1, 1, 1], 1], ["SP", 3, 5, 512, [1, 64, 2, 2], 1], ["SP", 3, 10, 7, [1, 1, 1, 1], 1], ["SP", 3, 15, 7, [1, 1, 1, 1], 1], ["SP", 3, 20, 3, [3, 1], 1], ["SP", 3, 23, 3, [3, 1], 1], ["RE", 3, [0, 5, 10, 15, 1, 6, 11, 16, 2, 7, 12, 17, 20, 23, 21, 24, 3, 8, 13, 18, 22, 25, 4, 9, 14, 19]], ["FSP", 4, 0, 0, 3], ["FSP", 4, 4, 1, 3], ["FSP", 4, 8, 2, 3], ["FSP", 4, 12, 3, 3], ["RE", 4, [0, 4, 8, 12, 1, 5, 9, 13, 2, 6, 10, 14, 3, 7, 11, 15]], ["CA", 3, 4, 11], ["CHR", 2, "shared", [3]], ["CA", 3, 4, 13], ["CHR", 1, "shared", [4]], ["CA", 2, 5, 13], ["CI", 1], ["FU", 6, [0, 1, 2, 3]], ["AN", 6, 0, 5], ["FU", 6, [1, 2, 3, 4]], ["AN", 6, 1, 4], ["FU", 6, [2, 3, 4, 5]], ["AN", 6, 2, 6], ["FU", 4, [0, 1, 2, 3]], ["SP", 4, 0, 36, [1], 1], ["AN", 4, 1, 2], ["FFSP", 4, 0, [3, 2, 1, 0], 1, 1], ["AN", 4, 1, 6], ["FU", 2, [0, 1, 2, 3]], ["SP", 2, 0, 36, [1], 1], ["AN", 2, 1, 2], ["FFSP", 2, 0, [3, 2, 1, 0], 1, 1], ["AN", 2, 1, 6], ["PR", 5, 0, "auto_unroll_max_step$64"]]]], "r": [[1.34243e-05], 0, 6.08303, 1685671604], "v": "v0.6"}
{"i": [["[\"depthwise_conv2d_8\"]", "cuda -keys=cuda,gpu -arch=sm_80 -max_num_threads=1024 -thread_warp_size=32", [-1, 16, 64, 49152, 2147483647, 1024, 8, 32], "", 0, []], [[], [["SP", 3, 0, 1, [1, 1, 1, 1], 1], ["SP", 3, 5, 512, [1, 64, 4, 1], 1], ["SP", 3, 10, 7, [1, 1, 1, 1], 1], ["SP", 3, 15, 7, [1, 1, 1, 1], 1], ["SP", 3, 20, 3, [3, 1], 1], ["SP", 3, 23, 3, [1, 1], 1], ["RE", 3, [0, 5, 10, 15, 1, 6, 11, 16, 2, 7, 12, 17, 20, 23, 21, 24, 3, 8, 13, 18, 22, 25, 4, 9, 14, 19]], ["FSP", 4, 0, 0, 3], ["FSP", 4, 4, 1, 3], ["FSP", 4, 8, 2, 3], ["FSP", 4, 12, 3, 3], ["RE", 4, [0, 4, 8, 12, 1, 5, 9, 13, 2, 6, 10, 14, 3, 7, 11, 15]], ["CA", 3, 4, 11], ["CHR", 2, "shared", [3]], ["CA", 3, 4, 13], ["CHR", 1, "shared", [4]], ["CA", 2, 5, 13], ["CI", 1], ["FU", 6, [0, 1, 2, 3]], ["AN", 6, 0, 5], ["FU", 6, [1, 2, 3, 4]], ["AN", 6, 1, 4], ["FU", 6, [2, 3, 4, 5]], ["AN", 6, 2, 6], ["FU", 4, [0, 1, 2, 3]], ["SP", 4, 0, 12, [1], 1], ["AN", 4, 1, 2], ["FFSP", 4, 0, [3, 2, 1, 0], 1, 1], ["AN", 4, 1, 6], ["FU", 2, [0, 1, 2, 3]], ["SP", 2, 0, 12, [1], 1], ["AN", 2, 1, 2], ["FFSP", 2, 0, [3, 2, 1, 0], 1, 1], ["AN", 2, 1, 6], ["PR", 5, 0, "auto_unroll_max_step$0"]]]], "r": [[7.81031e-06], 0, 2.36492, 1685671605], "v": "v0.6"}
{"i": [["[\"depthwise_conv2d_8\"]", "cuda -keys=cuda,gpu -arch=sm_80 -max_num_threads=1024 -thread_warp_size=32", [-1, 16, 64, 49152, 2147483647, 1024, 8, 32], "", 0, []], [[], [["SP", 3, 0, 1, [1, 1, 1, 1], 1], ["SP", 3, 5, 512, [1, 32, 2, 4], 1], ["SP", 3, 10, 7, [1, 1, 1, 1], 1], ["SP", 3, 15, 7, [1, 1, 1, 1], 1], ["SP", 3, 20, 3, [3, 1], 1], ["SP", 3, 23, 3, [3, 1], 1], ["RE", 3, [0, 5, 10, 15, 1, 6, 11, 16, 2, 7, 12, 17, 20, 23, 21, 24, 3, 8, 13, 18, 22, 25, 4, 9, 14, 19]], ["FSP", 4, 0, 0, 3], ["FSP", 4, 4, 1, 3], ["FSP", 4, 8, 2, 3], ["FSP", 4, 12, 3, 3], ["RE", 4, [0, 4, 8, 12, 1, 5, 9, 13, 2, 6, 10, 14, 3, 7, 11, 15]], ["CA", 3, 4, 11], ["CHR", 2, "shared", [3]], ["CA", 3, 4, 13], ["CHR", 1, "shared", [4]], ["CA", 2, 5, 13], ["CI", 1], ["FU", 6, [0, 1, 2, 3]], ["AN", 6, 0, 5], ["FU", 6, [1, 2, 3, 4]], ["AN", 6, 1, 4], ["FU", 6, [2, 3, 4, 5]], ["AN", 6, 2, 6], ["FU", 4, [0, 1, 2, 3]], ["SP", 4, 0, 72, [1], 1], ["AN", 4, 1, 2], ["FFSP", 4, 0, [3, 2, 1, 0], 1, 1], ["AN", 4, 1, 6], ["FU", 2, [0, 1, 2, 3]], ["SP", 2, 0, 72, [1], 1], ["AN", 2, 1, 2], ["FFSP", 2, 0, [3, 2, 1, 0], 1, 1], ["AN", 2, 1, 6], ["PR", 5, 0, "auto_unroll_max_step$16"]]]], "r": [[2.38676e-05], 0, 2.6096, 1685671607], "v": "v0.6"}
{"i": [["[\"depthwise_conv2d_8\"]", "cuda -keys=cuda,gpu -arch=sm_80 -max_num_threads=1024 -thread_warp_size=32", [-1, 16, 64, 49152, 2147483647, 1024, 8, 32], "", 0, []], [[], [["SP", 3, 0, 1, [1, 1, 1, 1], 1], ["SP", 3, 5, 512, [2, 64, 1, 2], 1], ["SP", 3, 10, 7, [1, 1, 1, 1], 1], ["SP", 3, 15, 7, [1, 1, 1, 1], 1], ["SP", 3, 20, 3, [1, 1], 1], ["SP", 3, 23, 3, [1, 1], 1], ["RE", 3, [0, 5, 10, 15, 1, 6, 11, 16, 2, 7, 12, 17, 20, 23, 21, 24, 3, 8, 13, 18, 22, 25, 4, 9, 14, 19]], ["FSP", 4, 0, 0, 3], ["FSP", 4, 4, 1, 3], ["FSP", 4, 8, 2, 3], ["FSP", 4, 12, 3, 3], ["RE", 4, [0, 4, 8, 12, 1, 5, 9, 13, 2, 6, 10, 14, 3, 7, 11, 15]], ["CA", 3, 4, 11], ["CHR", 2, "shared", [3]], ["CA", 3, 4, 13], ["CHR", 1, "shared", [4]], ["CA", 2, 5, 13], ["CI", 1], ["FU", 6, [0, 1, 2, 3]], ["AN", 6, 0, 5], ["FU", 6, [1, 2, 3, 4]], ["AN", 6, 1, 4], ["FU", 6, [2, 3, 4, 5]], ["AN", 6, 2, 6], ["FU", 4, [0, 1, 2, 3]], ["SP", 4, 0, 2, [1], 1], ["AN", 4, 1, 2], ["FFSP", 4, 0, [3, 2, 1, 0], 1, 1], ["AN", 4, 1, 6], ["FU", 2, [0, 1, 2, 3]], ["SP", 2, 0, 2, [1], 1], ["AN", 2, 1, 2], ["FFSP", 2, 0, [3, 2, 1, 0], 1, 1], ["AN", 2, 1, 6], ["PR", 5, 0, "auto_unroll_max_step$64"]]]], "r": [[6.50388e-06], 0, 3.08614, 1685671608], "v": "v0.6"}
{"i": [["[\"depthwise_conv2d_8\"]", "cuda -keys=cuda,gpu -arch=sm_80 -max_num_threads=1024 -thread_warp_size=32", [-1, 16, 64, 49152, 2147483647, 1024, 8, 32], "", 0, []], [[], [["SP", 3, 0, 1, [1, 1, 1, 1], 1], ["SP", 3, 5, 512, [8, 32, 1, 1], 1], ["SP", 3, 10, 7, [1, 1, 1, 1], 1], ["SP", 3, 15, 7, [1, 1, 1, 1], 1], ["SP", 3, 20, 3, [1, 1], 1], ["SP", 3, 23, 3, [1, 3], 1], ["RE", 3, [0, 5, 10, 15, 1, 6, 11, 16, 2, 7, 12, 17, 20, 23, 21, 24, 3, 8, 13, 18, 22, 25, 4, 9, 14, 19]], ["FSP", 4, 0, 0, 3], ["FSP", 4, 4, 1, 3], ["FSP", 4, 8, 2, 3], ["FSP", 4, 12, 3, 3], ["RE", 4, [0, 4, 8, 12, 1, 5, 9, 13, 2, 6, 10, 14, 3, 7, 11, 15]], ["CA", 3, 4, 11], ["CHR", 2, "shared", [3]], ["CA", 3, 4, 13], ["CHR", 1, "shared", [4]], ["CA", 2, 5, 13], ["CI", 1], ["FU", 6, [0, 1, 2, 3]], ["AN", 6, 0, 5], ["FU", 6, [1, 2, 3, 4]], ["AN", 6, 1, 4], ["FU", 6, [2, 3, 4, 5]], ["AN", 6, 2, 6], ["FU", 4, [0, 1, 2, 3]], ["SP", 4, 0, 3, [1], 1], ["AN", 4, 1, 2], ["FFSP", 4, 0, [3, 2, 1, 0], 1, 1], ["AN", 4, 1, 6], ["FU", 2, [0, 1, 2, 3]], ["SP", 2, 0, 3, [1], 1], ["AN", 2, 1, 2], ["FFSP", 2, 0, [3, 2, 1, 0], 1, 1], ["AN", 2, 1, 6], ["PR", 5, 0, "auto_unroll_max_step$0"]]]], "r": [[9.33578e-06], 0, 2.56168, 1685671609], "v": "v0.6"}
{"i": [["[\"depthwise_conv2d_8\"]", "cuda -keys=cuda,gpu -arch=sm_80 -max_num_threads=1024 -thread_warp_size=32", [-1, 16, 64, 49152, 2147483647, 1024, 8, 32], "", 0, []], [[], [["SP", 3, 0, 1, [1, 1, 1, 1], 1], ["SP", 3, 5, 512, [1, 128, 1, 2], 1], ["SP", 3, 10, 7, [1, 1, 1, 1], 1], ["SP", 3, 15, 7, [1, 1, 1, 1], 1], ["SP", 3, 20, 3, [3, 1], 1], ["SP", 3, 23, 3, [1, 1], 1], ["RE", 3, [0, 5, 10, 15, 1, 6, 11, 16, 2, 7, 12, 17, 20, 23, 21, 24, 3, 8, 13, 18, 22, 25, 4, 9, 14, 19]], ["FSP", 4, 0, 0, 3], ["FSP", 4, 4, 1, 3], ["FSP", 4, 8, 2, 3], ["FSP", 4, 12, 3, 3], ["RE", 4, [0, 4, 8, 12, 1, 5, 9, 13, 2, 6, 10, 14, 3, 7, 11, 15]], ["CA", 3, 4, 11], ["CHR", 2, "shared", [3]], ["CA", 3, 4, 13], ["CHR", 1, "shared", [4]], ["CA", 2, 5, 13], ["CI", 1], ["FU", 6, [0, 1, 2, 3]], ["AN", 6, 0, 5], ["FU", 6, [1, 2, 3, 4]], ["AN", 6, 1, 4], ["FU", 6, [2, 3, 4, 5]], ["AN", 6, 2, 6], ["FU", 4, [0, 1, 2, 3]], ["SP", 4, 0, 6, [1], 1], ["AN", 4, 1, 2], ["FFSP", 4, 0, [3, 2, 1, 0], 1, 1], ["AN", 4, 1, 6], ["FU", 2, [0, 1, 2, 3]], ["SP", 2, 0, 6, [1], 1], ["AN", 2, 1, 2], ["FFSP", 2, 0, [3, 2, 1, 0], 1, 1], ["AN", 2, 1, 6], ["PR", 5, 0, "auto_unroll_max_step$64"]]]], "r": [[6.42961e-06], 0, 3.45909, 1685671611], "v": "v0.6"}
{"i": [["[\"depthwise_conv2d_8\"]", "cuda -keys=cuda,gpu -arch=sm_80 -max_num_threads=1024 -thread_warp_size=32", [-1, 16, 64, 49152, 2147483647, 1024, 8, 32], "", 0, []], [[], [["SP", 3, 0, 1, [1, 1, 1, 1], 1], ["SP", 3, 5, 512, [2, 32, 4, 1], 1], ["SP", 3, 10, 7, [1, 1, 1, 1], 1], ["SP", 3, 15, 7, [1, 1, 1, 1], 1], ["SP", 3, 20, 3, [1, 1], 1], ["SP", 3, 23, 3, [1, 3], 1], ["RE", 3, [0, 5, 10, 15, 1, 6, 11, 16, 2, 7, 12, 17, 20, 23, 21, 24, 3, 8, 13, 18, 22, 25, 4, 9, 14, 19]], ["FSP", 4, 0, 0, 3], ["FSP", 4, 4, 1, 3], ["FSP", 4, 8, 2, 3], ["FSP", 4, 12, 3, 3], ["RE", 4, [0, 4, 8, 12, 1, 5, 9, 13, 2, 6, 10, 14, 3, 7, 11, 15]], ["CA", 3, 4, 11], ["CHR", 2, "shared", [3]], ["CA", 3, 4, 13], ["CHR", 1, "shared", [4]], ["CA", 2, 5, 13], ["CI", 1], ["FU", 6, [0, 1, 2, 3]], ["AN", 6, 0, 5], ["FU", 6, [1, 2, 3, 4]], ["AN", 6, 1, 4], ["FU", 6, [2, 3, 4, 5]], ["AN", 6, 2, 6], ["FU", 4, [0, 1, 2, 3]], ["SP", 4, 0, 12, [1], 1], ["AN", 4, 1, 2], ["FFSP", 4, 0, [3, 2, 1, 0], 1, 1], ["AN", 4, 1, 6], ["FU", 2, [0, 1, 2, 3]], ["SP", 2, 0, 12, [1], 1], ["AN", 2, 1, 2], ["FFSP", 2, 0, [3, 2, 1, 0], 1, 1], ["AN", 2, 1, 6], ["PR", 5, 0, "auto_unroll_max_step$16"]]]], "r": [[8.47599e-06], 0, 2.52466, 1685671612], "v": "v0.6"}
{"i": [["[\"depthwise_conv2d_8\"]", "cuda -keys=cuda,gpu -arch=sm_80 -max_num_threads=1024 -thread_warp_size=32", [-1, 16, 64, 49152, 2147483647, 1024, 8, 32], "", 0, []], [[], [["SP", 3, 0, 1, [1, 1, 1, 1], 1], ["SP", 3, 5, 512, [1, 128, 2, 1], 1], ["SP", 3, 10, 7, [1, 1, 1, 1], 1], ["SP", 3, 15, 7, [1, 1, 1, 1], 1], ["SP", 3, 20, 3, [1, 1], 1], ["SP", 3, 23, 3, [3, 1], 1], ["RE", 3, [0, 5, 10, 15, 1, 6, 11, 16, 2, 7, 12, 17, 20, 23, 21, 24, 3, 8, 13, 18, 22, 25, 4, 9, 14, 19]], ["FSP", 4, 0, 0, 3], ["FSP", 4, 4, 1, 3], ["FSP", 4, 8, 2, 3], ["FSP", 4, 12, 3, 3], ["RE", 4, [0, 4, 8, 12, 1, 5, 9, 13, 2, 6, 10, 14, 3, 7, 11, 15]], ["CA", 3, 4, 11], ["CHR", 2, "shared", [3]], ["CA", 3, 4, 13], ["CHR", 1, "shared", [4]], ["CA", 2, 5, 13], ["CI", 1], ["FU", 6, [0, 1, 2, 3]], ["AN", 6, 0, 5], ["FU", 6, [1, 2, 3, 4]], ["AN", 6, 1, 4], ["FU", 6, [2, 3, 4, 5]], ["AN", 6, 2, 6], ["FU", 4, [0, 1, 2, 3]], ["SP", 4, 0, 6, [1], 1], ["AN", 4, 1, 2], ["FFSP", 4, 0, [3, 2, 1, 0], 1, 1], ["AN", 4, 1, 6], ["FU", 2, [0, 1, 2, 3]], ["SP", 2, 0, 6, [1], 1], ["AN", 2, 1, 2], ["FFSP", 2, 0, [3, 2, 1, 0], 1, 1], ["AN", 2, 1, 6], ["PR", 5, 0, "auto_unroll_max_step$0"]]]], "r": [[9.93275e-06], 0, 2.45897, 1685671613], "v": "v0.6"}
{"i": [["[\"depthwise_conv2d_8\"]", "cuda -keys=cuda,gpu -arch=sm_80 -max_num_threads=1024 -thread_warp_size=32", [-1, 16, 64, 49152, 2147483647, 1024, 8, 32], "", 0, []], [[], [["SP", 3, 0, 1, [1, 1, 1, 1], 1], ["SP", 3, 5, 512, [2, 32, 2, 2], 1], ["SP", 3, 10, 7, [1, 1, 1, 1], 1], ["SP", 3, 15, 7, [1, 1, 1, 1], 1], ["SP", 3, 20, 3, [1, 1], 1], ["SP", 3, 23, 3, [1, 1], 1], ["RE", 3, [0, 5, 10, 15, 1, 6, 11, 16, 2, 7, 12, 17, 20, 23, 21, 24, 3, 8, 13, 18, 22, 25, 4, 9, 14, 19]], ["FSP", 4, 0, 0, 3], ["FSP", 4, 4, 1, 3], ["FSP", 4, 8, 2, 3], ["FSP", 4, 12, 3, 3], ["RE", 4, [0, 4, 8, 12, 1, 5, 9, 13, 2, 6, 10, 14, 3, 7, 11, 15]], ["CA", 3, 4, 11], ["CHR", 2, "shared", [3]], ["CA", 3, 4, 13], ["CHR", 1, "shared", [4]], ["CA", 2, 5, 13], ["CI", 1], ["FU", 6, [0, 1, 2, 3]], ["AN", 6, 0, 5], ["FU", 6, [1, 2, 3, 4]], ["AN", 6, 1, 4], ["FU", 6, [2, 3, 4, 5]], ["AN", 6, 2, 6], ["FU", 4, [0, 1, 2, 3]], ["SP", 4, 0, 4, [1], 1], ["AN", 4, 1, 2], ["FFSP", 4, 0, [3, 2, 1, 0], 1, 1], ["AN", 4, 1, 6], ["FU", 2, [0, 1, 2, 3]], ["SP", 2, 0, 4, [1], 1], ["AN", 2, 1, 2], ["FFSP", 2, 0, [3, 2, 1, 0], 1, 1], ["AN", 2, 1, 6], ["PR", 5, 0, "auto_unroll_max_step$16"]]]], "r": [[1.01446e-05], 0, 2.79235, 1685671614], "v": "v0.6"}
{"i": [["[\"depthwise_conv2d_8\"]", "cuda -keys=cuda,gpu -arch=sm_80 -max_num_threads=1024 -thread_warp_size=32", [-1, 16, 64, 49152, 2147483647, 1024, 8, 32], "", 0, []], [[], [["SP", 3, 0, 1, [1, 1, 1, 1], 1], ["SP", 3, 5, 512, [1, 64, 4, 1], 1], ["SP", 3, 10, 7, [1, 1, 1, 1], 1], ["SP", 3, 15, 7, [1, 1, 1, 1], 1], ["SP", 3, 20, 3, [1, 3], 1], ["SP", 3, 23, 3, [1, 3], 1], ["RE", 3, [0, 5, 10, 15, 1, 6, 11, 16, 2, 7, 12, 17, 20, 23, 21, 24, 3, 8, 13, 18, 22, 25, 4, 9, 14, 19]], ["FSP", 4, 0, 0, 3], ["FSP", 4, 4, 1, 3], ["FSP", 4, 8, 2, 3], ["FSP", 4, 12, 3, 3], ["RE", 4, [0, 4, 8, 12, 1, 5, 9, 13, 2, 6, 10, 14, 3, 7, 11, 15]], ["CA", 3, 4, 11], ["CHR", 2, "shared", [3]], ["CA", 3, 4, 13], ["CHR", 1, "shared", [4]], ["CA", 2, 5, 13], ["CI", 1], ["FU", 6, [0, 1, 2, 3]], ["AN", 6, 0, 5], ["FU", 6, [1, 2, 3, 4]], ["AN", 6, 1, 4], ["FU", 6, [2, 3, 4, 5]], ["AN", 6, 2, 6], ["FU", 4, [0, 1, 2, 3]], ["SP", 4, 0, 36, [1], 1], ["AN", 4, 1, 2], ["FFSP", 4, 0, [3, 2, 1, 0], 1, 1], ["AN", 4, 1, 6], ["FU", 2, [0, 1, 2, 3]], ["SP", 2, 0, 36, [1], 1], ["AN", 2, 1, 2], ["FFSP", 2, 0, [3, 2, 1, 0], 1, 1], ["AN", 2, 1, 6], ["PR", 5, 0, "auto_unroll_max_step$512"]]]], "r": [[1.34993e-05], 0, 5.76827, 1685671615], "v": "v0.6"}
{"i": [["[\"depthwise_conv2d_8\"]", "cuda -keys=cuda,gpu -arch=sm_80 -max_num_threads=1024 -thread_warp_size=32", [-1, 16, 64, 49152, 2147483647, 1024, 8, 32], "", 0, []], [[], [["SP", 3, 0, 1, [1, 1, 1, 1], 1], ["SP", 3, 5, 512, [4, 32, 1, 2], 1], ["SP", 3, 10, 7, [1, 1, 1, 1], 1], ["SP", 3, 15, 7, [1, 1, 1, 1], 1], ["SP", 3, 20, 3, [1, 3], 1], ["SP", 3, 23, 3, [3, 1], 1], ["RE", 3, [0, 5, 10, 15, 1, 6, 11, 16, 2, 7, 12, 17, 20, 23, 21, 24, 3, 8, 13, 18, 22, 25, 4, 9, 14, 19]], ["FSP", 4, 0, 0, 3], ["FSP", 4, 4, 1, 3], ["FSP", 4, 8, 2, 3], ["FSP", 4, 12, 3, 3], ["RE", 4, [0, 4, 8, 12, 1, 5, 9, 13, 2, 6, 10, 14, 3, 7, 11, 15]], ["CA", 3, 4, 11], ["CHR", 2, "shared", [3]], ["CA", 3, 4, 13], ["CHR", 1, "shared", [4]], ["CA", 2, 5, 13], ["CI", 1], ["FU", 6, [0, 1, 2, 3]], ["AN", 6, 0, 5], ["FU", 6, [1, 2, 3, 4]], ["AN", 6, 1, 4], ["FU", 6, [2, 3, 4, 5]], ["AN", 6, 2, 6], ["FU", 4, [0, 1, 2, 3]], ["SP", 4, 0, 18, [1], 1], ["AN", 4, 1, 2], ["FFSP", 4, 0, [3, 2, 1, 0], 1, 1], ["AN", 4, 1, 6], ["FU", 2, [0, 1, 2, 3]], ["SP", 2, 0, 18, [1], 1], ["AN", 2, 1, 2], ["FFSP", 2, 0, [3, 2, 1, 0], 1, 1], ["AN", 2, 1, 6], ["PR", 5, 0, "auto_unroll_max_step$1024"]]]], "r": [[2.3272e-05], 0, 10.6425, 1685671616], "v": "v0.6"}
{"i": [["[\"depthwise_conv2d_8\"]", "cuda -keys=cuda,gpu -arch=sm_80 -max_num_threads=1024 -thread_warp_size=32", [-1, 16, 64, 49152, 2147483647, 1024, 8, 32], "", 0, []], [[], [["SP", 3, 0, 1, [1, 1, 1, 1], 1], ["SP", 3, 5, 512, [1, 64, 1, 4], 1], ["SP", 3, 10, 7, [1, 1, 1, 1], 1], ["SP", 3, 15, 7, [1, 1, 1, 1], 1], ["SP", 3, 20, 3, [3, 1], 1], ["SP", 3, 23, 3, [1, 3], 1], ["RE", 3, [0, 5, 10, 15, 1, 6, 11, 16, 2, 7, 12, 17, 20, 23, 21, 24, 3, 8, 13, 18, 22, 25, 4, 9, 14, 19]], ["FSP", 4, 0, 0, 3], ["FSP", 4, 4, 1, 3], ["FSP", 4, 8, 2, 3], ["FSP", 4, 12, 3, 3], ["RE", 4, [0, 4, 8, 12, 1, 5, 9, 13, 2, 6, 10, 14, 3, 7, 11, 15]], ["CA", 3, 4, 11], ["CHR", 2, "shared", [3]], ["CA", 3, 4, 13], ["CHR", 1, "shared", [4]], ["CA", 2, 5, 13], ["CI", 1], ["FU", 6, [0, 1, 2, 3]], ["AN", 6, 0, 5], ["FU", 6, [1, 2, 3, 4]], ["AN", 6, 1, 4], ["FU", 6, [2, 3, 4, 5]], ["AN", 6, 2, 6], ["FU", 4, [0, 1, 2, 3]], ["SP", 4, 0, 36, [1], 1], ["AN", 4, 1, 2], ["FFSP", 4, 0, [3, 2, 1, 0], 1, 1], ["AN", 4, 1, 6], ["FU", 2, [0, 1, 2, 3]], ["SP", 2, 0, 36, [1], 1], ["AN", 2, 1, 2], ["FFSP", 2, 0, [3, 2, 1, 0], 1, 1], ["AN", 2, 1, 6], ["PR", 5, 0, "auto_unroll_max_step$0"]]]], "r": [[1.30904e-05], 0, 2.4251, 1685671617], "v": "v0.6"}
{"i": [["[\"depthwise_conv2d_8\"]", "cuda -keys=cuda,gpu -arch=sm_80 -max_num_threads=1024 -thread_warp_size=32", [-1, 16, 64, 49152, 2147483647, 1024, 8, 32], "", 0, []], [[], [["SP", 3, 0, 1, [1, 1, 1, 1], 1], ["SP", 3, 5, 512, [2, 64, 2, 1], 1], ["SP", 3, 10, 7, [1, 1, 1, 1], 1], ["SP", 3, 15, 7, [1, 1, 1, 1], 1], ["SP", 3, 20, 3, [1, 1], 1], ["SP", 3, 23, 3, [1, 1], 1], ["RE", 3, [0, 5, 10, 15, 1, 6, 11, 16, 2, 7, 12, 17, 20, 23, 21, 24, 3, 8, 13, 18, 22, 25, 4, 9, 14, 19]], ["FSP", 4, 0, 0, 3], ["FSP", 4, 4, 1, 3], ["FSP", 4, 8, 2, 3], ["FSP", 4, 12, 3, 3], ["RE", 4, [0, 4, 8, 12, 1, 5, 9, 13, 2, 6, 10, 14, 3, 7, 11, 15]], ["CA", 3, 4, 11], ["CHR", 2, "shared", [3]], ["CA", 3, 4, 13], ["CHR", 1, "shared", [4]], ["CA", 2, 5, 13], ["CI", 1], ["FU", 6, [0, 1, 2, 3]], ["AN", 6, 0, 5], ["FU", 6, [1, 2, 3, 4]], ["AN", 6, 1, 4], ["FU", 6, [2, 3, 4, 5]], ["AN", 6, 2, 6], ["FU", 4, [0, 1, 2, 3]], ["SP", 4, 0, 2, [1], 1], ["AN", 4, 1, 2], ["FFSP", 4, 0, [3, 2, 1, 0], 1, 1], ["AN", 4, 1, 6], ["FU", 2, [0, 1, 2, 3]], ["SP", 2, 0, 2, [1], 1], ["AN", 2, 1, 2], ["FFSP", 2, 0, [3, 2, 1, 0], 1, 1], ["AN", 2, 1, 6], ["PR", 5, 0, "auto_unroll_max_step$512"]]]], "r": [[9.90552e-06], 0, 3.1657, 1685671618], "v": "v0.6"}
{"i": [["[\"depthwise_conv2d_8\"]", "cuda -keys=cuda,gpu -arch=sm_80 -max_num_threads=1024 -thread_warp_size=32", [-1, 16, 64, 49152, 2147483647, 1024, 8, 32], "", 0, []], [[], [["SP", 3, 0, 1, [1, 1, 1, 1], 1], ["SP", 3, 5, 512, [1, 256, 1, 1], 1], ["SP", 3, 10, 7, [1, 1, 1, 1], 1], ["SP", 3, 15, 7, [1, 1, 1, 1], 1], ["SP", 3, 20, 3, [1, 3], 1], ["SP", 3, 23, 3, [3, 1], 1], ["RE", 3, [0, 5, 10, 15, 1, 6, 11, 16, 2, 7, 12, 17, 20, 23, 21, 24, 3, 8, 13, 18, 22, 25, 4, 9, 14, 19]], ["FSP", 4, 0, 0, 3], ["FSP", 4, 4, 1, 3], ["FSP", 4, 8, 2, 3], ["FSP", 4, 12, 3, 3], ["RE", 4, [0, 4, 8, 12, 1, 5, 9, 13, 2, 6, 10, 14, 3, 7, 11, 15]], ["CA", 3, 4, 11], ["CHR", 2, "shared", [3]], ["CA", 3, 4, 13], ["CHR", 1, "shared", [4]], ["CA", 2, 5, 13], ["CI", 1], ["FU", 6, [0, 1, 2, 3]], ["AN", 6, 0, 5], ["FU", 6, [1, 2, 3, 4]], ["AN", 6, 1, 4], ["FU", 6, [2, 3, 4, 5]], ["AN", 6, 2, 6], ["FU", 4, [0, 1, 2, 3]], ["SP", 4, 0, 9, [1], 1], ["AN", 4, 1, 2], ["FFSP", 4, 0, [3, 2, 1, 0], 1, 1], ["AN", 4, 1, 6], ["FU", 2, [0, 1, 2, 3]], ["SP", 2, 0, 9, [1], 1], ["AN", 2, 1, 2], ["FFSP", 2, 0, [3, 2, 1, 0], 1, 1], ["AN", 2, 1, 6], ["PR", 5, 0, "auto_unroll_max_step$16"]]]], "r": [[6.54438e-06], 0, 3.28364, 1685671620], "v": "v0.6"}
{"i": [["[\"depthwise_conv2d_8\"]", "cuda -keys=cuda,gpu -arch=sm_80 -max_num_threads=1024 -thread_warp_size=32", [-1, 16, 64, 49152, 2147483647, 1024, 8, 32], "", 0, []], [[], [["SP", 3, 0, 1, [1, 1, 1, 1], 1], ["SP", 3, 5, 512, [2, 64, 1, 2], 1], ["SP", 3, 10, 7, [1, 1, 1, 1], 1], ["SP", 3, 15, 7, [1, 1, 1, 1], 1], ["SP", 3, 20, 3, [1, 3], 1], ["SP", 3, 23, 3, [1, 3], 1], ["RE", 3, [0, 5, 10, 15, 1, 6, 11, 16, 2, 7, 12, 17, 20, 23, 21, 24, 3, 8, 13, 18, 22, 25, 4, 9, 14, 19]], ["FSP", 4, 0, 0, 3], ["FSP", 4, 4, 1, 3], ["FSP", 4, 8, 2, 3], ["FSP", 4, 12, 3, 3], ["RE", 4, [0, 4, 8, 12, 1, 5, 9, 13, 2, 6, 10, 14, 3, 7, 11, 15]], ["CA", 3, 4, 11], ["CHR", 2, "shared", [3]], ["CA", 3, 4, 13], ["CHR", 1, "shared", [4]], ["CA", 2, 5, 13], ["CI", 1], ["FU", 6, [0, 1, 2, 3]], ["AN", 6, 0, 5], ["FU", 6, [1, 2, 3, 4]], ["AN", 6, 1, 4], ["FU", 6, [2, 3, 4, 5]], ["AN", 6, 2, 6], ["FU", 4, [0, 1, 2, 3]], ["SP", 4, 0, 18, [1], 1], ["AN", 4, 1, 2], ["FFSP", 4, 0, [3, 2, 1, 0], 1, 1], ["AN", 4, 1, 6], ["FU", 2, [0, 1, 2, 3]], ["SP", 2, 0, 18, [1], 1], ["AN", 2, 1, 2], ["FFSP", 2, 0, [3, 2, 1, 0], 1, 1], ["AN", 2, 1, 6], ["PR", 5, 0, "auto_unroll_max_step$16"]]]], "r": [[1.29093e-05], 0, 2.48279, 1685671621], "v": "v0.6"}
{"i": [["[\"depthwise_conv2d_8\"]", "cuda -keys=cuda,gpu -arch=sm_80 -max_num_threads=1024 -thread_warp_size=32", [-1, 16, 64, 49152, 2147483647, 1024, 8, 32], "", 0, []], [[], [["SP", 3, 0, 1, [1, 1, 1, 1], 1], ["SP", 3, 5, 512, [2, 128, 1, 1], 1], ["SP", 3, 10, 7, [1, 1, 1, 1], 1], ["SP", 3, 15, 7, [1, 1, 1, 1], 1], ["SP", 3, 20, 3, [3, 1], 1], ["SP", 3, 23, 3, [1, 3], 1], ["RE", 3, [0, 5, 10, 15, 1, 6, 11, 16, 2, 7, 12, 17, 20, 23, 21, 24, 3, 8, 13, 18, 22, 25, 4, 9, 14, 19]], ["FSP", 4, 0, 0, 3], ["FSP", 4, 4, 1, 3], ["FSP", 4, 8, 2, 3], ["FSP", 4, 12, 3, 3], ["RE", 4, [0, 4, 8, 12, 1, 5, 9, 13, 2, 6, 10, 14, 3, 7, 11, 15]], ["CA", 3, 4, 11], ["CHR", 2, "shared", [3]], ["CA", 3, 4, 13], ["CHR", 1, "shared", [4]], ["CA", 2, 5, 13], ["CI", 1], ["FU", 6, [0, 1, 2, 3]], ["AN", 6, 0, 5], ["FU", 6, [1, 2, 3, 4]], ["AN", 6, 1, 4], ["FU", 6, [2, 3, 4, 5]], ["AN", 6, 2, 6], ["FU", 4, [0, 1, 2, 3]], ["SP", 4, 0, 9, [1], 1], ["AN", 4, 1, 2], ["FFSP", 4, 0, [3, 2, 1, 0], 1, 1], ["AN", 4, 1, 6], ["FU", 2, [0, 1, 2, 3]], ["SP", 2, 0, 9, [1], 1], ["AN", 2, 1, 2], ["FFSP", 2, 0, [3, 2, 1, 0], 1, 1], ["AN", 2, 1, 6], ["PR", 5, 0, "auto_unroll_max_step$0"]]]], "r": [[9.87886e-06], 0, 2.55728, 1685671622], "v": "v0.6"}
{"i": [["[\"depthwise_conv2d_8\"]", "cuda -keys=cuda,gpu -arch=sm_80 -max_num_threads=1024 -thread_warp_size=32", [-1, 16, 64, 49152, 2147483647, 1024, 8, 32], "", 0, []], [[], [["SP", 3, 0, 1, [1, 1, 1, 1], 1], ["SP", 3, 5, 512, [1, 128, 2, 1], 1], ["SP", 3, 10, 7, [1, 1, 1, 1], 1], ["SP", 3, 15, 7, [1, 1, 1, 1], 1], ["SP", 3, 20, 3, [1, 1], 1], ["SP", 3, 23, 3, [1, 3], 1], ["RE", 3, [0, 5, 10, 15, 1, 6, 11, 16, 2, 7, 12, 17, 20, 23, 21, 24, 3, 8, 13, 18, 22, 25, 4, 9, 14, 19]], ["FSP", 4, 0, 0, 3], ["FSP", 4, 4, 1, 3], ["FSP", 4, 8, 2, 3], ["FSP", 4, 12, 3, 3], ["RE", 4, [0, 4, 8, 12, 1, 5, 9, 13, 2, 6, 10, 14, 3, 7, 11, 15]], ["CA", 3, 4, 11], ["CHR", 2, "shared", [3]], ["CA", 3, 4, 13], ["CHR", 1, "shared", [4]], ["CA", 2, 5, 13], ["CI", 1], ["FU", 6, [0, 1, 2, 3]], ["AN", 6, 0, 5], ["FU", 6, [1, 2, 3, 4]], ["AN", 6, 1, 4], ["FU", 6, [2, 3, 4, 5]], ["AN", 6, 2, 6], ["FU", 4, [0, 1, 2, 3]], ["SP", 4, 0, 6, [1], 1], ["AN", 4, 1, 2], ["FFSP", 4, 0, [3, 2, 1, 0], 1, 1], ["AN", 4, 1, 6], ["FU", 2, [0, 1, 2, 3]], ["SP", 2, 0, 6, [1], 1], ["AN", 2, 1, 2], ["FFSP", 2, 0, [3, 2, 1, 0], 1, 1], ["AN", 2, 1, 6], ["PR", 5, 0, "auto_unroll_max_step$64"]]]], "r": [[6.76507e-06], 0, 3.70625, 1685671624], "v": "v0.6"}
{"i": [["[\"depthwise_conv2d_8\"]", "cuda -keys=cuda,gpu -arch=sm_80 -max_num_threads=1024 -thread_warp_size=32", [-1, 16, 64, 49152, 2147483647, 1024, 8, 32], "", 0, []], [[], [["SP", 3, 0, 1, [1, 1, 1, 1], 1], ["SP", 3, 5, 512, [1, 64, 1, 4], 1], ["SP", 3, 10, 7, [1, 1, 1, 1], 1], ["SP", 3, 15, 7, [1, 1, 1, 1], 1], ["SP", 3, 20, 3, [1, 3], 1], ["SP", 3, 23, 3, [1, 1], 1], ["RE", 3, [0, 5, 10, 15, 1, 6, 11, 16, 2, 7, 12, 17, 20, 23, 21, 24, 3, 8, 13, 18, 22, 25, 4, 9, 14, 19]], ["FSP", 4, 0, 0, 3], ["FSP", 4, 4, 1, 3], ["FSP", 4, 8, 2, 3], ["FSP", 4, 12, 3, 3], ["RE", 4, [0, 4, 8, 12, 1, 5, 9, 13, 2, 6, 10, 14, 3, 7, 11, 15]], ["CA", 3, 4, 11], ["CHR", 2, "shared", [3]], ["CA", 3, 4, 13], ["CHR", 1, "shared", [4]], ["CA", 2, 5, 13], ["CI", 1], ["FU", 6, [0, 1, 2, 3]], ["AN", 6, 0, 5], ["FU", 6, [1, 2, 3, 4]], ["AN", 6, 1, 4], ["FU", 6, [2, 3, 4, 5]], ["AN", 6, 2, 6], ["FU", 4, [0, 1, 2, 3]], ["SP", 4, 0, 12, [1], 1], ["AN", 4, 1, 2], ["FFSP", 4, 0, [3, 2, 1, 0], 1, 1], ["AN", 4, 1, 6], ["FU", 2, [0, 1, 2, 3]], ["SP", 2, 0, 12, [1], 1], ["AN", 2, 1, 2], ["FFSP", 2, 0, [3, 2, 1, 0], 1, 1], ["AN", 2, 1, 6], ["PR", 5, 0, "auto_unroll_max_step$0"]]]], "r": [[8.537e-06], 0, 2.50859, 1685671625], "v": "v0.6"}
{"i": [["[\"depthwise_conv2d_8\"]", "cuda -keys=cuda,gpu -arch=sm_80 -max_num_threads=1024 -thread_warp_size=32", [-1, 16, 64, 49152, 2147483647, 1024, 8, 32], "", 0, []], [[], [["SP", 3, 0, 1, [1, 1, 1, 1], 1], ["SP", 3, 5, 512, [2, 64, 1, 2], 1], ["SP", 3, 10, 7, [1, 1, 1, 1], 1], ["SP", 3, 15, 7, [1, 1, 1, 1], 1], ["SP", 3, 20, 3, [3, 1], 1], ["SP", 3, 23, 3, [3, 1], 1], ["RE", 3, [0, 5, 10, 15, 1, 6, 11, 16, 2, 7, 12, 17, 20, 23, 21, 24, 3, 8, 13, 18, 22, 25, 4, 9, 14, 19]], ["FSP", 4, 0, 0, 3], ["FSP", 4, 4, 1, 3], ["FSP", 4, 8, 2, 3], ["FSP", 4, 12, 3, 3], ["RE", 4, [0, 4, 8, 12, 1, 5, 9, 13, 2, 6, 10, 14, 3, 7, 11, 15]], ["CA", 3, 4, 11], ["CHR", 2, "shared", [3]], ["CA", 3, 4, 13], ["CHR", 1, "shared", [4]], ["CA", 2, 5, 13], ["CI", 1], ["FU", 6, [0, 1, 2, 3]], ["AN", 6, 0, 5], ["FU", 6, [1, 2, 3, 4]], ["AN", 6, 1, 4], ["FU", 6, [2, 3, 4, 5]], ["AN", 6, 2, 6], ["FU", 4, [0, 1, 2, 3]], ["SP", 4, 0, 18, [1], 1], ["AN", 4, 1, 2], ["FFSP", 4, 0, [3, 2, 1, 0], 1, 1], ["AN", 4, 1, 6], ["FU", 2, [0, 1, 2, 3]], ["SP", 2, 0, 18, [1], 1], ["AN", 2, 1, 2], ["FFSP", 2, 0, [3, 2, 1, 0], 1, 1], ["AN", 2, 1, 6], ["PR", 5, 0, "auto_unroll_max_step$0"]]]], "r": [[1.30125e-05], 0, 2.57587, 1685671626], "v": "v0.6"}
{"i": [["[\"depthwise_conv2d_8\"]", "cuda -keys=cuda,gpu -arch=sm_80 -max_num_threads=1024 -thread_warp_size=32", [-1, 16, 64, 49152, 2147483647, 1024, 8, 32], "", 0, []], [[], [["SP", 3, 0, 1, [1, 1, 1, 1], 1], ["SP", 3, 5, 512, [1, 128, 1, 2], 1], ["SP", 3, 10, 7, [1, 1, 1, 1], 1], ["SP", 3, 15, 7, [1, 1, 1, 1], 1], ["SP", 3, 20, 3, [1, 1], 1], ["SP", 3, 23, 3, [3, 1], 1], ["RE", 3, [0, 5, 10, 15, 1, 6, 11, 16, 2, 7, 12, 17, 20, 23, 21, 24, 3, 8, 13, 18, 22, 25, 4, 9, 14, 19]], ["FSP", 4, 0, 0, 3], ["FSP", 4, 4, 1, 3], ["FSP", 4, 8, 2, 3], ["FSP", 4, 12, 3, 3], ["RE", 4, [0, 4, 8, 12, 1, 5, 9, 13, 2, 6, 10, 14, 3, 7, 11, 15]], ["CA", 3, 4, 11], ["CHR", 2, "shared", [3]], ["CA", 3, 4, 13], ["CHR", 1, "shared", [4]], ["CA", 2, 5, 13], ["CI", 1], ["FU", 6, [0, 1, 2, 3]], ["AN", 6, 0, 5], ["FU", 6, [1, 2, 3, 4]], ["AN", 6, 1, 4], ["FU", 6, [2, 3, 4, 5]], ["AN", 6, 2, 6], ["FU", 4, [0, 1, 2, 3]], ["SP", 4, 0, 6, [1], 1], ["AN", 4, 1, 2], ["FFSP", 4, 0, [3, 2, 1, 0], 1, 1], ["AN", 4, 1, 6], ["FU", 2, [0, 1, 2, 3]], ["SP", 2, 0, 6, [1], 1], ["AN", 2, 1, 2], ["FFSP", 2, 0, [3, 2, 1, 0], 1, 1], ["AN", 2, 1, 6], ["PR", 5, 0, "auto_unroll_max_step$64"]]]], "r": [[1.01338e-05], 0, 3.53261, 1685671641], "v": "v0.6"}
{"i": [["[\"depthwise_conv2d_8\"]", "cuda -keys=cuda,gpu -arch=sm_80 -max_num_threads=1024 -thread_warp_size=32", [-1, 16, 64, 49152, 2147483647, 1024, 8, 32], "", 0, []], [[], [["SP", 3, 0, 1, [1, 1, 1, 1], 1], ["SP", 3, 5, 512, [1, 256, 1, 1], 1], ["SP", 3, 10, 7, [1, 1, 1, 1], 1], ["SP", 3, 15, 7, [1, 1, 1, 1], 1], ["SP", 3, 20, 3, [3, 1], 1], ["SP", 3, 23, 3, [3, 1], 1], ["RE", 3, [0, 5, 10, 15, 1, 6, 11, 16, 2, 7, 12, 17, 20, 23, 21, 24, 3, 8, 13, 18, 22, 25, 4, 9, 14, 19]], ["FSP", 4, 0, 0, 3], ["FSP", 4, 4, 1, 3], ["FSP", 4, 8, 2, 3], ["FSP", 4, 12, 3, 3], ["RE", 4, [0, 4, 8, 12, 1, 5, 9, 13, 2, 6, 10, 14, 3, 7, 11, 15]], ["CA", 3, 4, 11], ["CHR", 2, "shared", [3]], ["CA", 3, 4, 13], ["CHR", 1, "shared", [4]], ["CA", 2, 5, 13], ["CI", 1], ["FU", 6, [0, 1, 2, 3]], ["AN", 6, 0, 5], ["FU", 6, [1, 2, 3, 4]], ["AN", 6, 1, 4], ["FU", 6, [2, 3, 4, 5]], ["AN", 6, 2, 6], ["FU", 4, [0, 1, 2, 3]], ["SP", 4, 0, 9, [1], 1], ["AN", 4, 1, 2], ["FFSP", 4, 0, [3, 2, 1, 0], 1, 1], ["AN", 4, 1, 6], ["FU", 2, [0, 1, 2, 3]], ["SP", 2, 0, 9, [1], 1], ["AN", 2, 1, 2], ["FFSP", 2, 0, [3, 2, 1, 0], 1, 1], ["AN", 2, 1, 6], ["PR", 5, 0, "auto_unroll_max_step$0"]]]], "r": [[6.63859e-06], 0, 2.7353, 1685671642], "v": "v0.6"}
{"i": [["[\"depthwise_conv2d_8\"]", "cuda -keys=cuda,gpu -arch=sm_80 -max_num_threads=1024 -thread_warp_size=32", [-1, 16, 64, 49152, 2147483647, 1024, 8, 32], "", 0, []], [[], [["SP", 3, 0, 1, [1, 1, 1, 1], 1], ["SP", 3, 5, 512, [1, 128, 2, 1], 1], ["SP", 3, 10, 7, [1, 1, 1, 1], 1], ["SP", 3, 15, 7, [1, 1, 1, 1], 1], ["SP", 3, 20, 3, [1, 3], 1], ["SP", 3, 23, 3, [3, 1], 1], ["RE", 3, [0, 5, 10, 15, 1, 6, 11, 16, 2, 7, 12, 17, 20, 23, 21, 24, 3, 8, 13, 18, 22, 25, 4, 9, 14, 19]], ["FSP", 4, 0, 0, 3], ["FSP", 4, 4, 1, 3], ["FSP", 4, 8, 2, 3], ["FSP", 4, 12, 3, 3], ["RE", 4, [0, 4, 8, 12, 1, 5, 9, 13, 2, 6, 10, 14, 3, 7, 11, 15]], ["CA", 3, 4, 11], ["CHR", 2, "shared", [3]], ["CA", 3, 4, 13], ["CHR", 1, "shared", [4]], ["CA", 2, 5, 13], ["CI", 1], ["FU", 6, [0, 1, 2, 3]], ["AN", 6, 0, 5], ["FU", 6, [1, 2, 3, 4]], ["AN", 6, 1, 4], ["FU", 6, [2, 3, 4, 5]], ["AN", 6, 2, 6], ["FU", 4, [0, 1, 2, 3]], ["SP", 4, 0, 18, [1], 1], ["AN", 4, 1, 2], ["FFSP", 4, 0, [3, 2, 1, 0], 1, 1], ["AN", 4, 1, 6], ["FU", 2, [0, 1, 2, 3]], ["SP", 2, 0, 18, [1], 1], ["AN", 2, 1, 2], ["FFSP", 2, 0, [3, 2, 1, 0], 1, 1], ["AN", 2, 1, 6], ["PR", 5, 0, "auto_unroll_max_step$1024"]]]], "r": [[8.59194e-06], 0, 3.82232, 1685671643], "v": "v0.6"}
{"i": [["[\"depthwise_conv2d_8\"]", "cuda -keys=cuda,gpu -arch=sm_80 -max_num_threads=1024 -thread_warp_size=32", [-1, 16, 64, 49152, 2147483647, 1024, 8, 32], "", 0, []], [[], [["SP", 3, 0, 1, [1, 1, 1, 1], 1], ["SP", 3, 5, 512, [1, 64, 1, 4], 1], ["SP", 3, 10, 7, [1, 1, 1, 1], 1], ["SP", 3, 15, 7, [1, 1, 1, 1], 1], ["SP", 3, 20, 3, [3, 1], 1], ["SP", 3, 23, 3, [3, 1], 1], ["RE", 3, [0, 5, 10, 15, 1, 6, 11, 16, 2, 7, 12, 17, 20, 23, 21, 24, 3, 8, 13, 18, 22, 25, 4, 9, 14, 19]], ["FSP", 4, 0, 0, 3], ["FSP", 4, 4, 1, 3], ["FSP", 4, 8, 2, 3], ["FSP", 4, 12, 3, 3], ["RE", 4, [0, 4, 8, 12, 1, 5, 9, 13, 2, 6, 10, 14, 3, 7, 11, 15]], ["CA", 3, 4, 11], ["CHR", 2, "shared", [3]], ["CA", 3, 4, 13], ["CHR", 1, "shared", [4]], ["CA", 2, 5, 13], ["CI", 1], ["FU", 6, [0, 1, 2, 3]], ["AN", 6, 0, 5], ["FU", 6, [1, 2, 3, 4]], ["AN", 6, 1, 4], ["FU", 6, [2, 3, 4, 5]], ["AN", 6, 2, 6], ["FU", 4, [0, 1, 2, 3]], ["SP", 4, 0, 36, [1], 1], ["AN", 4, 1, 2], ["FFSP", 4, 0, [3, 2, 1, 0], 1, 1], ["AN", 4, 1, 6], ["FU", 2, [0, 1, 2, 3]], ["SP", 2, 0, 36, [1], 1], ["AN", 2, 1, 2], ["FFSP", 2, 0, [3, 2, 1, 0], 1, 1], ["AN", 2, 1, 6], ["PR", 5, 0, "auto_unroll_max_step$64"]]]], "r": [[1.34977e-05], 0, 6.24796, 1685671645], "v": "v0.6"}
{"i": [["[\"depthwise_conv2d_8\"]", "cuda -keys=cuda,gpu -arch=sm_80 -max_num_threads=1024 -thread_warp_size=32", [-1, 16, 64, 49152, 2147483647, 1024, 8, 32], "", 0, []], [[], [["SP", 3, 0, 1, [1, 1, 1, 1], 1], ["SP", 3, 5, 512, [1, 32, 1, 8], 1], ["SP", 3, 10, 7, [1, 1, 1, 1], 1], ["SP", 3, 15, 7, [1, 1, 1, 1], 1], ["SP", 3, 20, 3, [1, 1], 1], ["SP", 3, 23, 3, [1, 3], 1], ["RE", 3, [0, 5, 10, 15, 1, 6, 11, 16, 2, 7, 12, 17, 20, 23, 21, 24, 3, 8, 13, 18, 22, 25, 4, 9, 14, 19]], ["FSP", 4, 0, 0, 3], ["FSP", 4, 4, 1, 3], ["FSP", 4, 8, 2, 3], ["FSP", 4, 12, 3, 3], ["RE", 4, [0, 4, 8, 12, 1, 5, 9, 13, 2, 6, 10, 14, 3, 7, 11, 15]], ["CA", 3, 4, 11], ["CHR", 2, "shared", [3]], ["CA", 3, 4, 13], ["CHR", 1, "shared", [4]], ["CA", 2, 5, 13], ["CI", 1], ["FU", 6, [0, 1, 2, 3]], ["AN", 6, 0, 5], ["FU", 6, [1, 2, 3, 4]], ["AN", 6, 1, 4], ["FU", 6, [2, 3, 4, 5]], ["AN", 6, 2, 6], ["FU", 4, [0, 1, 2, 3]], ["SP", 4, 0, 24, [1], 1], ["AN", 4, 1, 2], ["FFSP", 4, 0, [3, 2, 1, 0], 1, 1], ["AN", 4, 1, 6], ["FU", 2, [0, 1, 2, 3]], ["SP", 2, 0, 24, [1], 1], ["AN", 2, 1, 2], ["FFSP", 2, 0, [3, 2, 1, 0], 1, 1], ["AN", 2, 1, 6], ["PR", 5, 0, "auto_unroll_max_step$0"]]]], "r": [[8.47783e-06], 0, 2.56454, 1685671646], "v": "v0.6"}
{"i": [["[\"depthwise_conv2d_8\"]", "cuda -keys=cuda,gpu -arch=sm_80 -max_num_threads=1024 -thread_warp_size=32", [-1, 16, 64, 49152, 2147483647, 1024, 8, 32], "", 0, []], [[], [["SP", 3, 0, 1, [1, 1, 1, 1], 1], ["SP", 3, 5, 512, [2, 32, 1, 4], 1], ["SP", 3, 10, 7, [1, 1, 1, 1], 1], ["SP", 3, 15, 7, [1, 1, 1, 1], 1], ["SP", 3, 20, 3, [3, 1], 1], ["SP", 3, 23, 3, [1, 1], 1], ["RE", 3, [0, 5, 10, 15, 1, 6, 11, 16, 2, 7, 12, 17, 20, 23, 21, 24, 3, 8, 13, 18, 22, 25, 4, 9, 14, 19]], ["FSP", 4, 0, 0, 3], ["FSP", 4, 4, 1, 3], ["FSP", 4, 8, 2, 3], ["FSP", 4, 12, 3, 3], ["RE", 4, [0, 4, 8, 12, 1, 5, 9, 13, 2, 6, 10, 14, 3, 7, 11, 15]], ["CA", 3, 4, 11], ["CHR", 2, "shared", [3]], ["CA", 3, 4, 13], ["CHR", 1, "shared", [4]], ["CA", 2, 5, 13], ["CI", 1], ["FU", 6, [0, 1, 2, 3]], ["AN", 6, 0, 5], ["FU", 6, [1, 2, 3, 4]], ["AN", 6, 1, 4], ["FU", 6, [2, 3, 4, 5]], ["AN", 6, 2, 6], ["FU", 4, [0, 1, 2, 3]], ["SP", 4, 0, 12, [1], 1], ["AN", 4, 1, 2], ["FFSP", 4, 0, [3, 2, 1, 0], 1, 1], ["AN", 4, 1, 6], ["FU", 2, [0, 1, 2, 3]], ["SP", 2, 0, 12, [1], 1], ["AN", 2, 1, 2], ["FFSP", 2, 0, [3, 2, 1, 0], 1, 1], ["AN", 2, 1, 6], ["PR", 5, 0, "auto_unroll_max_step$64"]]]], "r": [[1.06374e-05], 0, 4.06395, 1685671647], "v": "v0.6"}
{"i": [["[\"depthwise_conv2d_8\"]", "cuda -keys=cuda,gpu -arch=sm_80 -max_num_threads=1024 -thread_warp_size=32", [-1, 16, 64, 49152, 2147483647, 1024, 8, 32], "", 0, []], [[], [["SP", 3, 0, 1, [1, 1, 1, 1], 1], ["SP", 3, 5, 512, [2, 32, 2, 2], 1], ["SP", 3, 10, 7, [1, 1, 1, 1], 1], ["SP", 3, 15, 7, [1, 1, 1, 1], 1], ["SP", 3, 20, 3, [3, 1], 1], ["SP", 3, 23, 3, [1, 1], 1], ["RE", 3, [0, 5, 10, 15, 1, 6, 11, 16, 2, 7, 12, 17, 20, 23, 21, 24, 3, 8, 13, 18, 22, 25, 4, 9, 14, 19]], ["FSP", 4, 0, 0, 3], ["FSP", 4, 4, 1, 3], ["FSP", 4, 8, 2, 3], ["FSP", 4, 12, 3, 3], ["RE", 4, [0, 4, 8, 12, 1, 5, 9, 13, 2, 6, 10, 14, 3, 7, 11, 15]], ["CA", 3, 4, 11], ["CHR", 2, "shared", [3]], ["CA", 3, 4, 13], ["CHR", 1, "shared", [4]], ["CA", 2, 5, 13], ["CI", 1], ["FU", 6, [0, 1, 2, 3]], ["AN", 6, 0, 5], ["FU", 6, [1, 2, 3, 4]], ["AN", 6, 1, 4], ["FU", 6, [2, 3, 4, 5]], ["AN", 6, 2, 6], ["FU", 4, [0, 1, 2, 3]], ["SP", 4, 0, 12, [1], 1], ["AN", 4, 1, 2], ["FFSP", 4, 0, [3, 2, 1, 0], 1, 1], ["AN", 4, 1, 6], ["FU", 2, [0, 1, 2, 3]], ["SP", 2, 0, 12, [1], 1], ["AN", 2, 1, 2], ["FFSP", 2, 0, [3, 2, 1, 0], 1, 1], ["AN", 2, 1, 6], ["PR", 5, 0, "auto_unroll_max_step$1024"]]]], "r": [[1.2445e-05], 0, 6.33874, 1685671648], "v": "v0.6"}
{"i": [["[\"depthwise_conv2d_8\"]", "cuda -keys=cuda,gpu -arch=sm_80 -max_num_threads=1024 -thread_warp_size=32", [-1, 16, 64, 49152, 2147483647, 1024, 8, 32], "", 0, []], [[], [["SP", 3, 0, 1, [1, 1, 1, 1], 1], ["SP", 3, 5, 512, [1, 64, 1, 4], 1], ["SP", 3, 10, 7, [1, 1, 1, 1], 1], ["SP", 3, 15, 7, [1, 1, 1, 1], 1], ["SP", 3, 20, 3, [1, 3], 1], ["SP", 3, 23, 3, [1, 1], 1], ["RE", 3, [0, 5, 10, 15, 1, 6, 11, 16, 2, 7, 12, 17, 20, 23, 21, 24, 3, 8, 13, 18, 22, 25, 4, 9, 14, 19]], ["FSP", 4, 0, 0, 3], ["FSP", 4, 4, 1, 3], ["FSP", 4, 8, 2, 3], ["FSP", 4, 12, 3, 3], ["RE", 4, [0, 4, 8, 12, 1, 5, 9, 13, 2, 6, 10, 14, 3, 7, 11, 15]], ["CA", 3, 4, 11], ["CHR", 2, "shared", [3]], ["CA", 3, 4, 13], ["CHR", 1, "shared", [4]], ["CA", 2, 5, 13], ["CI", 1], ["FU", 6, [0, 1, 2, 3]], ["AN", 6, 0, 5], ["FU", 6, [1, 2, 3, 4]], ["AN", 6, 1, 4], ["FU", 6, [2, 3, 4, 5]], ["AN", 6, 2, 6], ["FU", 4, [0, 1, 2, 3]], ["SP", 4, 0, 12, [1], 1], ["AN", 4, 1, 2], ["FFSP", 4, 0, [3, 2, 1, 0], 1, 1], ["AN", 4, 1, 6], ["FU", 2, [0, 1, 2, 3]], ["SP", 2, 0, 12, [1], 1], ["AN", 2, 1, 2], ["FFSP", 2, 0, [3, 2, 1, 0], 1, 1], ["AN", 2, 1, 6], ["PR", 5, 0, "auto_unroll_max_step$64"]]]], "r": [[7.5805e-06], 0, 3.46771, 1685671650], "v": "v0.6"}
{"i": [["[\"depthwise_conv2d_8\"]", "cuda -keys=cuda,gpu -arch=sm_80 -max_num_threads=1024 -thread_warp_size=32", [-1, 16, 64, 49152, 2147483647, 1024, 8, 32], "", 0, []], [[], [["SP", 3, 0, 1, [1, 1, 1, 1], 1], ["SP", 3, 5, 512, [2, 64, 1, 2], 1], ["SP", 3, 10, 7, [1, 1, 1, 1], 1], ["SP", 3, 15, 7, [1, 1, 1, 1], 1], ["SP", 3, 20, 3, [1, 1], 1], ["SP", 3, 23, 3, [1, 3], 1], ["RE", 3, [0, 5, 10, 15, 1, 6, 11, 16, 2, 7, 12, 17, 20, 23, 21, 24, 3, 8, 13, 18, 22, 25, 4, 9, 14, 19]], ["FSP", 4, 0, 0, 3], ["FSP", 4, 4, 1, 3], ["FSP", 4, 8, 2, 3], ["FSP", 4, 12, 3, 3], ["RE", 4, [0, 4, 8, 12, 1, 5, 9, 13, 2, 6, 10, 14, 3, 7, 11, 15]], ["CA", 3, 4, 11], ["CHR", 2, "shared", [3]], ["CA", 3, 4, 13], ["CHR", 1, "shared", [4]], ["CA", 2, 5, 13], ["CI", 1], ["FU", 6, [0, 1, 2, 3]], ["AN", 6, 0, 5], ["FU", 6, [1, 2, 3, 4]], ["AN", 6, 1, 4], ["FU", 6, [2, 3, 4, 5]], ["AN", 6, 2, 6], ["FU", 4, [0, 1, 2, 3]], ["SP", 4, 0, 6, [1], 1], ["AN", 4, 1, 2], ["FFSP", 4, 0, [3, 2, 1, 0], 1, 1], ["AN", 4, 1, 6], ["FU", 2, [0, 1, 2, 3]], ["SP", 2, 0, 6, [1], 1], ["AN", 2, 1, 2], ["FFSP", 2, 0, [3, 2, 1, 0], 1, 1], ["AN", 2, 1, 6], ["PR", 5, 0, "auto_unroll_max_step$64"]]]], "r": [[1.02783e-05], 0, 3.56127, 1685671651], "v": "v0.6"}
{"i": [["[\"depthwise_conv2d_8\"]", "cuda -keys=cuda,gpu -arch=sm_80 -max_num_threads=1024 -thread_warp_size=32", [-1, 16, 64, 49152, 2147483647, 1024, 8, 32], "", 0, []], [[], [["SP", 3, 0, 1, [1, 1, 1, 1], 1], ["SP", 3, 5, 512, [1, 64, 2, 2], 1], ["SP", 3, 10, 7, [1, 1, 1, 1], 1], ["SP", 3, 15, 7, [1, 1, 1, 1], 1], ["SP", 3, 20, 3, [1, 3], 1], ["SP", 3, 23, 3, [3, 1], 1], ["RE", 3, [0, 5, 10, 15, 1, 6, 11, 16, 2, 7, 12, 17, 20, 23, 21, 24, 3, 8, 13, 18, 22, 25, 4, 9, 14, 19]], ["FSP", 4, 0, 0, 3], ["FSP", 4, 4, 1, 3], ["FSP", 4, 8, 2, 3], ["FSP", 4, 12, 3, 3], ["RE", 4, [0, 4, 8, 12, 1, 5, 9, 13, 2, 6, 10, 14, 3, 7, 11, 15]], ["CA", 3, 4, 11], ["CHR", 2, "shared", [3]], ["CA", 3, 4, 13], ["CHR", 1, "shared", [4]], ["CA", 2, 5, 13], ["CI", 1], ["FU", 6, [0, 1, 2, 3]], ["AN", 6, 0, 5], ["FU", 6, [1, 2, 3, 4]], ["AN", 6, 1, 4], ["FU", 6, [2, 3, 4, 5]], ["AN", 6, 2, 6], ["FU", 4, [0, 1, 2, 3]], ["SP", 4, 0, 36, [1], 1], ["AN", 4, 1, 2], ["FFSP", 4, 0, [3, 2, 1, 0], 1, 1], ["AN", 4, 1, 6], ["FU", 2, [0, 1, 2, 3]], ["SP", 2, 0, 36, [1], 1], ["AN", 2, 1, 2], ["FFSP", 2, 0, [3, 2, 1, 0], 1, 1], ["AN", 2, 1, 6], ["PR", 5, 0, "auto_unroll_max_step$16"]]]], "r": [[1.29892e-05], 0, 2.43852, 1685671652], "v": "v0.6"}
{"i": [["[\"depthwise_conv2d_8\"]", "cuda -keys=cuda,gpu -arch=sm_80 -max_num_threads=1024 -thread_warp_size=32", [-1, 16, 64, 49152, 2147483647, 1024, 8, 32], "", 0, []], [[], [["SP", 3, 0, 1, [1, 1, 1, 1], 1], ["SP", 3, 5, 512, [1, 32, 4, 2], 1], ["SP", 3, 10, 7, [1, 1, 1, 1], 1], ["SP", 3, 15, 7, [1, 1, 1, 1], 1], ["SP", 3, 20, 3, [3, 1], 1], ["SP", 3, 23, 3, [1, 3], 1], ["RE", 3, [0, 5, 10, 15, 1, 6, 11, 16, 2, 7, 12, 17, 20, 23, 21, 24, 3, 8, 13, 18, 22, 25, 4, 9, 14, 19]], ["FSP", 4, 0, 0, 3], ["FSP", 4, 4, 1, 3], ["FSP", 4, 8, 2, 3], ["FSP", 4, 12, 3, 3], ["RE", 4, [0, 4, 8, 12, 1, 5, 9, 13, 2, 6, 10, 14, 3, 7, 11, 15]], ["CA", 3, 4, 11], ["CHR", 2, "shared", [3]], ["CA", 3, 4, 13], ["CHR", 1, "shared", [4]], ["CA", 2, 5, 13], ["CI", 1], ["FU", 6, [0, 1, 2, 3]], ["AN", 6, 0, 5], ["FU", 6, [1, 2, 3, 4]], ["AN", 6, 1, 4], ["FU", 6, [2, 3, 4, 5]], ["AN", 6, 2, 6], ["FU", 4, [0, 1, 2, 3]], ["SP", 4, 0, 72, [1], 1], ["AN", 4, 1, 2], ["FFSP", 4, 0, [3, 2, 1, 0], 1, 1], ["AN", 4, 1, 6], ["FU", 2, [0, 1, 2, 3]], ["SP", 2, 0, 72, [1], 1], ["AN", 2, 1, 2], ["FFSP", 2, 0, [3, 2, 1, 0], 1, 1], ["AN", 2, 1, 6], ["PR", 5, 0, "auto_unroll_max_step$1024"]]]], "r": [[2.34898e-05], 0, 9.80531, 1685671654], "v": "v0.6"}
{"i": [["[\"depthwise_conv2d_8\"]", "cuda -keys=cuda,gpu -arch=sm_80 -max_num_threads=1024 -thread_warp_size=32", [-1, 16, 64, 49152, 2147483647, 1024, 8, 32], "", 0, []], [[], [["SP", 3, 0, 1, [1, 1, 1, 1], 1], ["SP", 3, 5, 512, [4, 32, 1, 2], 1], ["SP", 3, 10, 7, [1, 1, 1, 1], 1], ["SP", 3, 15, 7, [1, 1, 1, 1], 1], ["SP", 3, 20, 3, [1, 3], 1], ["SP", 3, 23, 3, [1, 1], 1], ["RE", 3, [0, 5, 10, 15, 1, 6, 11, 16, 2, 7, 12, 17, 20, 23, 21, 24, 3, 8, 13, 18, 22, 25, 4, 9, 14, 19]], ["FSP", 4, 0, 0, 3], ["FSP", 4, 4, 1, 3], ["FSP", 4, 8, 2, 3], ["FSP", 4, 12, 3, 3], ["RE", 4, [0, 4, 8, 12, 1, 5, 9, 13, 2, 6, 10, 14, 3, 7, 11, 15]], ["CA", 3, 4, 11], ["CHR", 2, "shared", [3]], ["CA", 3, 4, 13], ["CHR", 1, "shared", [4]], ["CA", 2, 5, 13], ["CI", 1], ["FU", 6, [0, 1, 2, 3]], ["AN", 6, 0, 5], ["FU", 6, [1, 2, 3, 4]], ["AN", 6, 1, 4], ["FU", 6, [2, 3, 4, 5]], ["AN", 6, 2, 6], ["FU", 4, [0, 1, 2, 3]], ["SP", 4, 0, 6, [1], 1], ["AN", 4, 1, 2], ["FFSP", 4, 0, [3, 2, 1, 0], 1, 1], ["AN", 4, 1, 6], ["FU", 2, [0, 1, 2, 3]], ["SP", 2, 0, 6, [1], 1], ["AN", 2, 1, 2], ["FFSP", 2, 0, [3, 2, 1, 0], 1, 1], ["AN", 2, 1, 6], ["PR", 5, 0, "auto_unroll_max_step$512"]]]], "r": [[1.183e-05], 0, 6.13516, 1685671655], "v": "v0.6"}
{"i": [["[\"depthwise_conv2d_8\"]", "cuda -keys=cuda,gpu -arch=sm_80 -max_num_threads=1024 -thread_warp_size=32", [-1, 16, 64, 49152, 2147483647, 1024, 8, 32], "", 0, []], [[], [["SP", 3, 0, 1, [1, 1, 1, 1], 1], ["SP", 3, 5, 512, [1, 64, 2, 2], 1], ["SP", 3, 10, 7, [1, 1, 1, 1], 1], ["SP", 3, 15, 7, [1, 1, 1, 1], 1], ["SP", 3, 20, 3, [1, 1], 1], ["SP", 3, 23, 3, [1, 1], 1], ["RE", 3, [0, 5, 10, 15, 1, 6, 11, 16, 2, 7, 12, 17, 20, 23, 21, 24, 3, 8, 13, 18, 22, 25, 4, 9, 14, 19]], ["FSP", 4, 0, 0, 3], ["FSP", 4, 4, 1, 3], ["FSP", 4, 8, 2, 3], ["FSP", 4, 12, 3, 3], ["RE", 4, [0, 4, 8, 12, 1, 5, 9, 13, 2, 6, 10, 14, 3, 7, 11, 15]], ["CA", 3, 4, 11], ["CHR", 2, "shared", [3]], ["CA", 3, 4, 13], ["CHR", 1, "shared", [4]], ["CA", 2, 5, 13], ["CI", 1], ["FU", 6, [0, 1, 2, 3]], ["AN", 6, 0, 5], ["FU", 6, [1, 2, 3, 4]], ["AN", 6, 1, 4], ["FU", 6, [2, 3, 4, 5]], ["AN", 6, 2, 6], ["FU", 4, [0, 1, 2, 3]], ["SP", 4, 0, 4, [1], 1], ["AN", 4, 1, 2], ["FFSP", 4, 0, [3, 2, 1, 0], 1, 1], ["AN", 4, 1, 6], ["FU", 2, [0, 1, 2, 3]], ["SP", 2, 0, 4, [1], 1], ["AN", 2, 1, 2], ["FFSP", 2, 0, [3, 2, 1, 0], 1, 1], ["AN", 2, 1, 6], ["PR", 5, 0, "auto_unroll_max_step$0"]]]], "r": [[9.51497e-06], 0, 2.61915, 1685671656], "v": "v0.6"}
{"i": [["[\"depthwise_conv2d_8\"]", "cuda -keys=cuda,gpu -arch=sm_80 -max_num_threads=1024 -thread_warp_size=32", [-1, 16, 64, 49152, 2147483647, 1024, 8, 32], "", 0, []], [[], [["SP", 3, 0, 1, [1, 1, 1, 1], 1], ["SP", 3, 5, 512, [2, 32, 1, 4], 1], ["SP", 3, 10, 7, [1, 1, 1, 1], 1], ["SP", 3, 15, 7, [1, 1, 1, 1], 1], ["SP", 3, 20, 3, [3, 1], 1], ["SP", 3, 23, 3, [1, 3], 1], ["RE", 3, [0, 5, 10, 15, 1, 6, 11, 16, 2, 7, 12, 17, 20, 23, 21, 24, 3, 8, 13, 18, 22, 25, 4, 9, 14, 19]], ["FSP", 4, 0, 0, 3], ["FSP", 4, 4, 1, 3], ["FSP", 4, 8, 2, 3], ["FSP", 4, 12, 3, 3], ["RE", 4, [0, 4, 8, 12, 1, 5, 9, 13, 2, 6, 10, 14, 3, 7, 11, 15]], ["CA", 3, 4, 11], ["CHR", 2, "shared", [3]], ["CA", 3, 4, 13], ["CHR", 1, "shared", [4]], ["CA", 2, 5, 13], ["CI", 1], ["FU", 6, [0, 1, 2, 3]], ["AN", 6, 0, 5], ["FU", 6, [1, 2, 3, 4]], ["AN", 6, 1, 4], ["FU", 6, [2, 3, 4, 5]], ["AN", 6, 2, 6], ["FU", 4, [0, 1, 2, 3]], ["SP", 4, 0, 36, [1], 1], ["AN", 4, 1, 2], ["FFSP", 4, 0, [3, 2, 1, 0], 1, 1], ["AN", 4, 1, 6], ["FU", 2, [0, 1, 2, 3]], ["SP", 2, 0, 36, [1], 1], ["AN", 2, 1, 2], ["FFSP", 2, 0, [3, 2, 1, 0], 1, 1], ["AN", 2, 1, 6], ["PR", 5, 0, "auto_unroll_max_step$1024"]]]], "r": [[2.30927e-05], 0, 9.53546, 1685671657], "v": "v0.6"}
{"i": [["[\"depthwise_conv2d_8\"]", "cuda -keys=cuda,gpu -arch=sm_80 -max_num_threads=1024 -thread_warp_size=32", [-1, 16, 64, 49152, 2147483647, 1024, 8, 32], "", 0, []], [[], [["SP", 3, 0, 1, [1, 1, 1, 1], 1], ["SP", 3, 5, 512, [1, 32, 2, 4], 1], ["SP", 3, 10, 7, [1, 1, 1, 1], 1], ["SP", 3, 15, 7, [1, 1, 1, 1], 1], ["SP", 3, 20, 3, [1, 1], 1], ["SP", 3, 23, 3, [1, 1], 1], ["RE", 3, [0, 5, 10, 15, 1, 6, 11, 16, 2, 7, 12, 17, 20, 23, 21, 24, 3, 8, 13, 18, 22, 25, 4, 9, 14, 19]], ["FSP", 4, 0, 0, 3], ["FSP", 4, 4, 1, 3], ["FSP", 4, 8, 2, 3], ["FSP", 4, 12, 3, 3], ["RE", 4, [0, 4, 8, 12, 1, 5, 9, 13, 2, 6, 10, 14, 3, 7, 11, 15]], ["CA", 3, 4, 11], ["CHR", 2, "shared", [3]], ["CA", 3, 4, 13], ["CHR", 1, "shared", [4]], ["CA", 2, 5, 13], ["CI", 1], ["FU", 6, [0, 1, 2, 3]], ["AN", 6, 0, 5], ["FU", 6, [1, 2, 3, 4]], ["AN", 6, 1, 4], ["FU", 6, [2, 3, 4, 5]], ["AN", 6, 2, 6], ["FU", 4, [0, 1, 2, 3]], ["SP", 4, 0, 8, [1], 1], ["AN", 4, 1, 2], ["FFSP", 4, 0, [3, 2, 1, 0], 1, 1], ["AN", 4, 1, 6], ["FU", 2, [0, 1, 2, 3]], ["SP", 2, 0, 8, [1], 1], ["AN", 2, 1, 2], ["FFSP", 2, 0, [3, 2, 1, 0], 1, 1], ["AN", 2, 1, 6], ["PR", 5, 0, "auto_unroll_max_step$16"]]]], "r": [[8.94714e-06], 0, 2.75974, 1685671658], "v": "v0.6"}
{"i": [["[\"depthwise_conv2d_8\"]", "cuda -keys=cuda,gpu -arch=sm_80 -max_num_threads=1024 -thread_warp_size=32", [-1, 16, 64, 49152, 2147483647, 1024, 8, 32], "", 0, []], [[], [["SP", 3, 0, 1, [1, 1, 1, 1], 1], ["SP", 3, 5, 512, [2, 64, 2, 1], 1], ["SP", 3, 10, 7, [1, 1, 1, 1], 1], ["SP", 3, 15, 7, [1, 1, 1, 1], 1], ["SP", 3, 20, 3, [1, 3], 1], ["SP", 3, 23, 3, [3, 1], 1], ["RE", 3, [0, 5, 10, 15, 1, 6, 11, 16, 2, 7, 12, 17, 20, 23, 21, 24, 3, 8, 13, 18, 22, 25, 4, 9, 14, 19]], ["FSP", 4, 0, 0, 3], ["FSP", 4, 4, 1, 3], ["FSP", 4, 8, 2, 3], ["FSP", 4, 12, 3, 3], ["RE", 4, [0, 4, 8, 12, 1, 5, 9, 13, 2, 6, 10, 14, 3, 7, 11, 15]], ["CA", 3, 4, 11], ["CHR", 2, "shared", [3]], ["CA", 3, 4, 13], ["CHR", 1, "shared", [4]], ["CA", 2, 5, 13], ["CI", 1], ["FU", 6, [0, 1, 2, 3]], ["AN", 6, 0, 5], ["FU", 6, [1, 2, 3, 4]], ["AN", 6, 1, 4], ["FU", 6, [2, 3, 4, 5]], ["AN", 6, 2, 6], ["FU", 4, [0, 1, 2, 3]], ["SP", 4, 0, 18, [1], 1], ["AN", 4, 1, 2], ["FFSP", 4, 0, [3, 2, 1, 0], 1, 1], ["AN", 4, 1, 6], ["FU", 2, [0, 1, 2, 3]], ["SP", 2, 0, 18, [1], 1], ["AN", 2, 1, 2], ["FFSP", 2, 0, [3, 2, 1, 0], 1, 1], ["AN", 2, 1, 6], ["PR", 5, 0, "auto_unroll_max_step$512"]]]], "r": [[1.35034e-05], 0, 5.66278, 1685671659], "v": "v0.6"}
{"i": [["[\"depthwise_conv2d_8\"]", "cuda -keys=cuda,gpu -arch=sm_80 -max_num_threads=1024 -thread_warp_size=32", [-1, 16, 64, 49152, 2147483647, 1024, 8, 32], "", 0, []], [[], [["SP", 3, 0, 1, [1, 1, 1, 1], 1], ["SP", 3, 5, 512, [1, 64, 2, 2], 1], ["SP", 3, 10, 7, [1, 1, 1, 1], 1], ["SP", 3, 15, 7, [1, 1, 1, 1], 1], ["SP", 3, 20, 3, [1, 1], 1], ["SP", 3, 23, 3, [3, 1], 1], ["RE", 3, [0, 5, 10, 15, 1, 6, 11, 16, 2, 7, 12, 17, 20, 23, 21, 24, 3, 8, 13, 18, 22, 25, 4, 9, 14, 19]], ["FSP", 4, 0, 0, 3], ["FSP", 4, 4, 1, 3], ["FSP", 4, 8, 2, 3], ["FSP", 4, 12, 3, 3], ["RE", 4, [0, 4, 8, 12, 1, 5, 9, 13, 2, 6, 10, 14, 3, 7, 11, 15]], ["CA", 3, 4, 11], ["CHR", 2, "shared", [3]], ["CA", 3, 4, 13], ["CHR", 1, "shared", [4]], ["CA", 2, 5, 13], ["CI", 1], ["FU", 6, [0, 1, 2, 3]], ["AN", 6, 0, 5], ["FU", 6, [1, 2, 3, 4]], ["AN", 6, 1, 4], ["FU", 6, [2, 3, 4, 5]], ["AN", 6, 2, 6], ["FU", 4, [0, 1, 2, 3]], ["SP", 4, 0, 12, [1], 1], ["AN", 4, 1, 2], ["FFSP", 4, 0, [3, 2, 1, 0], 1, 1], ["AN", 4, 1, 6], ["FU", 2, [0, 1, 2, 3]], ["SP", 2, 0, 12, [1], 1], ["AN", 2, 1, 2], ["FFSP", 2, 0, [3, 2, 1, 0], 1, 1], ["AN", 2, 1, 6], ["PR", 5, 0, "auto_unroll_max_step$512"]]]], "r": [[8.94065e-06], 0, 4.25532, 1685671660], "v": "v0.6"}
{"i": [["[\"depthwise_conv2d_8\"]", "cuda -keys=cuda,gpu -arch=sm_80 -max_num_threads=1024 -thread_warp_size=32", [-1, 16, 64, 49152, 2147483647, 1024, 8, 32], "", 0, []], [[], [["SP", 3, 0, 1, [1, 1, 1, 1], 1], ["SP", 3, 5, 512, [2, 32, 2, 2], 1], ["SP", 3, 10, 7, [1, 1, 1, 1], 1], ["SP", 3, 15, 7, [1, 1, 1, 1], 1], ["SP", 3, 20, 3, [1, 1], 1], ["SP", 3, 23, 3, [3, 1], 1], ["RE", 3, [0, 5, 10, 15, 1, 6, 11, 16, 2, 7, 12, 17, 20, 23, 21, 24, 3, 8, 13, 18, 22, 25, 4, 9, 14, 19]], ["FSP", 4, 0, 0, 3], ["FSP", 4, 4, 1, 3], ["FSP", 4, 8, 2, 3], ["FSP", 4, 12, 3, 3], ["RE", 4, [0, 4, 8, 12, 1, 5, 9, 13, 2, 6, 10, 14, 3, 7, 11, 15]], ["CA", 3, 4, 11], ["CHR", 2, "shared", [3]], ["CA", 3, 4, 13], ["CHR", 1, "shared", [4]], ["CA", 2, 5, 13], ["CI", 1], ["FU", 6, [0, 1, 2, 3]], ["AN", 6, 0, 5], ["FU", 6, [1, 2, 3, 4]], ["AN", 6, 1, 4], ["FU", 6, [2, 3, 4, 5]], ["AN", 6, 2, 6], ["FU", 4, [0, 1, 2, 3]], ["SP", 4, 0, 12, [1], 1], ["AN", 4, 1, 2], ["FFSP", 4, 0, [3, 2, 1, 0], 1, 1], ["AN", 4, 1, 6], ["FU", 2, [0, 1, 2, 3]], ["SP", 2, 0, 12, [1], 1], ["AN", 2, 1, 2], ["FFSP", 2, 0, [3, 2, 1, 0], 1, 1], ["AN", 2, 1, 6], ["PR", 5, 0, "auto_unroll_max_step$512"]]]], "r": [[1.17067e-05], 0, 6.95983, 1685671662], "v": "v0.6"}
{"i": [["[\"depthwise_conv2d_8\"]", "cuda -keys=cuda,gpu -arch=sm_80 -max_num_threads=1024 -thread_warp_size=32", [-1, 16, 64, 49152, 2147483647, 1024, 8, 32], "", 0, []], [[], [["SP", 3, 0, 1, [1, 1, 1, 1], 1], ["SP", 3, 5, 512, [2, 32, 2, 2], 1], ["SP", 3, 10, 7, [1, 1, 1, 1], 1], ["SP", 3, 15, 7, [1, 1, 1, 1], 1], ["SP", 3, 20, 3, [1, 3], 1], ["SP", 3, 23, 3, [1, 3], 1], ["RE", 3, [0, 5, 10, 15, 1, 6, 11, 16, 2, 7, 12, 17, 20, 23, 21, 24, 3, 8, 13, 18, 22, 25, 4, 9, 14, 19]], ["FSP", 4, 0, 0, 3], ["FSP", 4, 4, 1, 3], ["FSP", 4, 8, 2, 3], ["FSP", 4, 12, 3, 3], ["RE", 4, [0, 4, 8, 12, 1, 5, 9, 13, 2, 6, 10, 14, 3, 7, 11, 15]], ["CA", 3, 4, 11], ["CHR", 2, "shared", [3]], ["CA", 3, 4, 13], ["CHR", 1, "shared", [4]], ["CA", 2, 5, 13], ["CI", 1], ["FU", 6, [0, 1, 2, 3]], ["AN", 6, 0, 5], ["FU", 6, [1, 2, 3, 4]], ["AN", 6, 1, 4], ["FU", 6, [2, 3, 4, 5]], ["AN", 6, 2, 6], ["FU", 4, [0, 1, 2, 3]], ["SP", 4, 0, 36, [1], 1], ["AN", 4, 1, 2], ["FFSP", 4, 0, [3, 2, 1, 0], 1, 1], ["AN", 4, 1, 6], ["FU", 2, [0, 1, 2, 3]], ["SP", 2, 0, 36, [1], 1], ["AN", 2, 1, 2], ["FFSP", 2, 0, [3, 2, 1, 0], 1, 1], ["AN", 2, 1, 6], ["PR", 5, 0, "auto_unroll_max_step$16"]]]], "r": [[2.21791e-05], 0, 3.00891, 1685671772], "v": "v0.6"}
{"i": [["[\"depthwise_conv2d_8\"]", "cuda -keys=cuda,gpu -arch=sm_80 -max_num_threads=1024 -thread_warp_size=32", [-1, 16, 64, 49152, 2147483647, 1024, 8, 32], "", 0, []], [[], [["SP", 3, 0, 1, [1, 1, 1, 1], 1], ["SP", 3, 5, 512, [4, 64, 1, 1], 1], ["SP", 3, 10, 7, [1, 1, 1, 1], 1], ["SP", 3, 15, 7, [1, 1, 1, 1], 1], ["SP", 3, 20, 3, [1, 1], 1], ["SP", 3, 23, 3, [1, 1], 1], ["RE", 3, [0, 5, 10, 15, 1, 6, 11, 16, 2, 7, 12, 17, 20, 23, 21, 24, 3, 8, 13, 18, 22, 25, 4, 9, 14, 19]], ["FSP", 4, 0, 0, 3], ["FSP", 4, 4, 1, 3], ["FSP", 4, 8, 2, 3], ["FSP", 4, 12, 3, 3], ["RE", 4, [0, 4, 8, 12, 1, 5, 9, 13, 2, 6, 10, 14, 3, 7, 11, 15]], ["CA", 3, 4, 11], ["CHR", 2, "shared", [3]], ["CA", 3, 4, 13], ["CHR", 1, "shared", [4]], ["CA", 2, 5, 13], ["CI", 1], ["FU", 6, [0, 1, 2, 3]], ["AN", 6, 0, 5], ["FU", 6, [1, 2, 3, 4]], ["AN", 6, 1, 4], ["FU", 6, [2, 3, 4, 5]], ["AN", 6, 2, 6], ["FU", 4, [0, 1, 2, 3]], ["SP", 4, 0, 1, [1], 1], ["AN", 4, 1, 2], ["FFSP", 4, 0, [3, 2, 1, 0], 1, 1], ["AN", 4, 1, 6], ["FU", 2, [0, 1, 2, 3]], ["SP", 2, 0, 1, [1], 1], ["AN", 2, 1, 2], ["FFSP", 2, 0, [3, 2, 1, 0], 1, 1], ["AN", 2, 1, 6], ["PR", 5, 0, "auto_unroll_max_step$0"]]]], "r": [[9.66513e-06], 0, 2.46267, 1685671773], "v": "v0.6"}
