runtime/fineco/code_gen/darknet/conv2d_15-32.json
{"i": [["[\"conv2d_15\"]", "cuda -keys=cuda,gpu -arch=sm_80 -max_num_threads=1024 -thread_warp_size=32", [-1, 16, 64, 49152, 2147483647, 1024, 8, 32], "", 0, []], [[], [["CI", 5], ["SP", 3, 0, 1, [1, 1, 1, 1], 1], ["SP", 3, 5, 512, [1, 4, 2, 2], 1], ["SP", 3, 10, 7, [1, 7, 1, 1], 1], ["SP", 3, 15, 7, [1, 7, 1, 1], 1], ["SP", 3, 20, 1024, [8, 4], 1], ["SP", 3, 23, 1, [1, 1], 1], ["SP", 3, 26, 1, [1, 1], 1], ["RE", 3, [0, 5, 10, 15, 1, 6, 11, 16, 2, 7, 12, 17, 20, 23, 26, 21, 24, 27, 3, 8, 13, 18, 22, 25, 28, 4, 9, 14, 19]], ["FSP", 6, 0, 1, 3], ["FSP", 6, 4, 2, 3], ["FSP", 6, 8, 3, 3], ["FSP", 6, 12, 4, 3], ["RE", 6, [0, 4, 8, 12, 1, 5, 9, 13, 2, 6, 10, 14, 3, 7, 11, 15]], ["CA", 3, 6, 11], ["CHR", 2, "shared", [3]], ["CA", 3, 4, 14], ["CHR", 1, "shared", [4]], ["CA", 2, 5, 14], ["CI", 1], ["FU", 8, [0, 1, 2, 3]], ["AN", 8, 0, 5], ["FU", 8, [1, 2, 3, 4]], ["AN", 8, 1, 4], ["FU", 8, [2, 3, 4, 5]], ["AN", 8, 2, 6], ["FU", 4, [0, 1, 2, 3]], ["SP", 4, 0, 128, [1], 1], ["AN", 4, 1, 2], ["FFSP", 4, 0, [4, 3, 2, 1], 1, 1], ["AN", 4, 1, 6], ["FU", 2, [0, 1, 2, 3]], ["SP", 2, 0, 32, [1], 1], ["AN", 2, 1, 2], ["FFSP", 2, 0, [4, 3, 2, 1], 1, 1], ["AN", 2, 1, 6], ["PR", 5, 0, "auto_unroll_max_step$16"]]]], "r": [[4.91395e-05], 0, 4.82017, 1682364509], "v": "v0.6"}
{"i": [["[\"conv2d_15\"]", "cuda -keys=cuda,gpu -arch=sm_80 -max_num_threads=1024 -thread_warp_size=32", [-1, 16, 64, 49152, 2147483647, 1024, 8, 32], "", 0, []], [[], [["CI", 5], ["SP", 3, 0, 1, [1, 1, 1, 1], 1], ["SP", 3, 5, 512, [8, 2, 1, 1], 1], ["SP", 3, 10, 7, [1, 7, 1, 1], 1], ["SP", 3, 15, 7, [1, 7, 1, 1], 1], ["SP", 3, 20, 1024, [16, 2], 1], ["SP", 3, 23, 1, [1, 1], 1], ["SP", 3, 26, 1, [1, 1], 1], ["RE", 3, [0, 5, 10, 15, 1, 6, 11, 16, 2, 7, 12, 17, 20, 23, 26, 21, 24, 27, 3, 8, 13, 18, 22, 25, 28, 4, 9, 14, 19]], ["FSP", 6, 0, 1, 3], ["FSP", 6, 4, 2, 3], ["FSP", 6, 8, 3, 3], ["FSP", 6, 12, 4, 3], ["RE", 6, [0, 4, 8, 12, 1, 5, 9, 13, 2, 6, 10, 14, 3, 7, 11, 15]], ["CA", 3, 6, 11], ["CHR", 2, "shared", [3]], ["CA", 3, 4, 14], ["CHR", 1, "shared", [4]], ["CA", 2, 5, 14], ["CI", 1], ["FU", 8, [0, 1, 2, 3]], ["AN", 8, 0, 5], ["FU", 8, [1, 2, 3, 4]], ["AN", 8, 1, 4], ["FU", 8, [2, 3, 4, 5]], ["AN", 8, 2, 6], ["FU", 4, [0, 1, 2, 3]], ["SP", 4, 0, 32, [1], 1], ["AN", 4, 1, 2], ["FFSP", 4, 0, [4, 3, 2, 1], 1, 1], ["AN", 4, 1, 6], ["FU", 2, [0, 1, 2, 3]], ["SP", 2, 0, 32, [1], 1], ["AN", 2, 1, 2], ["FFSP", 2, 0, [4, 3, 2, 1], 1, 1], ["AN", 2, 1, 6], ["PR", 5, 0, "auto_unroll_max_step$512"]]]], "r": [[4.29005e-05], 0, 5.96156, 1682364511], "v": "v0.6"}
{"i": [["[\"conv2d_15\"]", "cuda -keys=cuda,gpu -arch=sm_80 -max_num_threads=1024 -thread_warp_size=32", [-1, 16, 64, 49152, 2147483647, 1024, 8, 32], "", 0, []], [[], [["CI", 5], ["SP", 3, 0, 1, [1, 1, 1, 1], 1], ["SP", 3, 5, 512, [1, 8, 1, 2], 1], ["SP", 3, 10, 7, [1, 1, 1, 7], 1], ["SP", 3, 15, 7, [1, 7, 1, 1], 1], ["SP", 3, 20, 1024, [16, 1], 1], ["SP", 3, 23, 1, [1, 1], 1], ["SP", 3, 26, 1, [1, 1], 1], ["RE", 3, [0, 5, 10, 15, 1, 6, 11, 16, 2, 7, 12, 17, 20, 23, 26, 21, 24, 27, 3, 8, 13, 18, 22, 25, 28, 4, 9, 14, 19]], ["FSP", 6, 0, 1, 3], ["FSP", 6, 4, 2, 3], ["FSP", 6, 8, 3, 3], ["FSP", 6, 12, 4, 3], ["RE", 6, [0, 4, 8, 12, 1, 5, 9, 13, 2, 6, 10, 14, 3, 7, 11, 15]], ["CA", 3, 6, 11], ["CHR", 2, "shared", [3]], ["CA", 3, 4, 14], ["CHR", 1, "shared", [4]], ["CA", 2, 5, 14], ["CI", 1], ["FU", 8, [0, 1, 2, 3]], ["AN", 8, 0, 5], ["FU", 8, [1, 2, 3, 4]], ["AN", 8, 1, 4], ["FU", 8, [2, 3, 4, 5]], ["AN", 8, 2, 6], ["FU", 4, [0, 1, 2, 3]], ["SP", 4, 0, 32, [1], 1], ["AN", 4, 1, 2], ["FFSP", 4, 0, [4, 3, 2, 1], 1, 1], ["AN", 4, 1, 6], ["FU", 2, [0, 1, 2, 3]], ["SP", 2, 0, 112, [1], 1], ["AN", 2, 1, 2], ["FFSP", 2, 0, [4, 3, 2, 1], 1, 1], ["AN", 2, 1, 6], ["PR", 5, 0, "auto_unroll_max_step$16"]]]], "r": [[0.000120594], 0, 4.51077, 1682364512], "v": "v0.6"}
{"i": [["[\"conv2d_15\"]", "cuda -keys=cuda,gpu -arch=sm_80 -max_num_threads=1024 -thread_warp_size=32", [-1, 16, 64, 49152, 2147483647, 1024, 8, 32], "", 0, []], [[], [["CI", 5], ["SP", 3, 0, 1, [1, 1, 1, 1], 1], ["SP", 3, 5, 512, [1, 1, 16, 1], 1], ["SP", 3, 10, 7, [1, 7, 1, 1], 1], ["SP", 3, 15, 7, [1, 7, 1, 1], 1], ["SP", 3, 20, 1024, [2, 4], 1], ["SP", 3, 23, 1, [1, 1], 1], ["SP", 3, 26, 1, [1, 1], 1], ["RE", 3, [0, 5, 10, 15, 1, 6, 11, 16, 2, 7, 12, 17, 20, 23, 26, 21, 24, 27, 3, 8, 13, 18, 22, 25, 28, 4, 9, 14, 19]], ["FSP", 6, 0, 1, 3], ["FSP", 6, 4, 2, 3], ["FSP", 6, 8, 3, 3], ["FSP", 6, 12, 4, 3], ["RE", 6, [0, 4, 8, 12, 1, 5, 9, 13, 2, 6, 10, 14, 3, 7, 11, 15]], ["CA", 3, 6, 11], ["CHR", 2, "shared", [3]], ["CA", 3, 4, 14], ["CHR", 1, "shared", [4]], ["CA", 2, 5, 14], ["CI", 1], ["FU", 8, [0, 1, 2, 3]], ["AN", 8, 0, 5], ["FU", 8, [1, 2, 3, 4]], ["AN", 8, 1, 4], ["FU", 8, [2, 3, 4, 5]], ["AN", 8, 2, 6], ["FU", 4, [0, 1, 2, 3]], ["SP", 4, 0, 128, [1], 1], ["AN", 4, 1, 2], ["FFSP", 4, 0, [4, 3, 2, 1], 1, 1], ["AN", 4, 1, 6], ["FU", 2, [0, 1, 2, 3]], ["SP", 2, 0, 8, [1], 1], ["AN", 2, 1, 2], ["FFSP", 2, 0, [4, 3, 2, 1], 1, 1], ["AN", 2, 1, 6], ["PR", 5, 0, "auto_unroll_max_step$512"]]]], "r": [[8.11274e-05], 0, 4.63566, 1682364513], "v": "v0.6"}
{"i": [["[\"conv2d_15\"]", "cuda -keys=cuda,gpu -arch=sm_80 -max_num_threads=1024 -thread_warp_size=32", [-1, 16, 64, 49152, 2147483647, 1024, 8, 32], "", 0, []], [[], [["CI", 5], ["SP", 3, 0, 1, [1, 1, 1, 1], 1], ["SP", 3, 5, 512, [1, 16, 1, 1], 1], ["SP", 3, 10, 7, [1, 1, 7, 1], 1], ["SP", 3, 15, 7, [1, 7, 1, 1], 1], ["SP", 3, 20, 1024, [1, 1], 1], ["SP", 3, 23, 1, [1, 1], 1], ["SP", 3, 26, 1, [1, 1], 1], ["RE", 3, [0, 5, 10, 15, 1, 6, 11, 16, 2, 7, 12, 17, 20, 23, 26, 21, 24, 27, 3, 8, 13, 18, 22, 25, 28, 4, 9, 14, 19]], ["FSP", 6, 0, 1, 3], ["FSP", 6, 4, 2, 3], ["FSP", 6, 8, 3, 3], ["FSP", 6, 12, 4, 3], ["RE", 6, [0, 4, 8, 12, 1, 5, 9, 13, 2, 6, 10, 14, 3, 7, 11, 15]], ["CA", 3, 6, 11], ["CHR", 2, "shared", [3]], ["CA", 3, 4, 14], ["CHR", 1, "shared", [4]], ["CA", 2, 5, 14], ["CI", 1], ["FU", 8, [0, 1, 2, 3]], ["AN", 8, 0, 5], ["FU", 8, [1, 2, 3, 4]], ["AN", 8, 1, 4], ["FU", 8, [2, 3, 4, 5]], ["AN", 8, 2, 6], ["FU", 4, [0, 1, 2, 3]], ["SP", 4, 0, 1, [1], 1], ["AN", 4, 1, 2], ["FFSP", 4, 0, [4, 3, 2, 1], 1, 1], ["AN", 4, 1, 6], ["FU", 2, [0, 1, 2, 3]], ["SP", 2, 0, 7, [1], 1], ["AN", 2, 1, 2], ["FFSP", 2, 0, [4, 3, 2, 1], 1, 1], ["AN", 2, 1, 6], ["PR", 5, 0, "auto_unroll_max_step$16"]]]], "r": [[0.000123711], 0, 4.37647, 1682364515], "v": "v0.6"}
{"i": [["[\"conv2d_15\"]", "cuda -keys=cuda,gpu -arch=sm_80 -max_num_threads=1024 -thread_warp_size=32", [-1, 16, 64, 49152, 2147483647, 1024, 8, 32], "", 0, []], [[], [["CI", 5], ["SP", 3, 0, 1, [1, 1, 1, 1], 1], ["SP", 3, 5, 512, [1, 2, 8, 1], 1], ["SP", 3, 10, 7, [1, 7, 1, 1], 1], ["SP", 3, 15, 7, [1, 7, 1, 1], 1], ["SP", 3, 20, 1024, [8, 2], 1], ["SP", 3, 23, 1, [1, 1], 1], ["SP", 3, 26, 1, [1, 1], 1], ["RE", 3, [0, 5, 10, 15, 1, 6, 11, 16, 2, 7, 12, 17, 20, 23, 26, 21, 24, 27, 3, 8, 13, 18, 22, 25, 28, 4, 9, 14, 19]], ["FSP", 6, 0, 1, 3], ["FSP", 6, 4, 2, 3], ["FSP", 6, 8, 3, 3], ["FSP", 6, 12, 4, 3], ["RE", 6, [0, 4, 8, 12, 1, 5, 9, 13, 2, 6, 10, 14, 3, 7, 11, 15]], ["CA", 3, 6, 11], ["CHR", 2, "shared", [3]], ["CA", 3, 4, 14], ["CHR", 1, "shared", [4]], ["CA", 2, 5, 14], ["CI", 1], ["FU", 8, [0, 1, 2, 3]], ["AN", 8, 0, 5], ["FU", 8, [1, 2, 3, 4]], ["AN", 8, 1, 4], ["FU", 8, [2, 3, 4, 5]], ["AN", 8, 2, 6], ["FU", 4, [0, 1, 2, 3]], ["SP", 4, 0, 128, [1], 1], ["AN", 4, 1, 2], ["FFSP", 4, 0, [4, 3, 2, 1], 1, 1], ["AN", 4, 1, 6], ["FU", 2, [0, 1, 2, 3]], ["SP", 2, 0, 16, [1], 1], ["AN", 2, 1, 2], ["FFSP", 2, 0, [4, 3, 2, 1], 1, 1], ["AN", 2, 1, 6], ["PR", 5, 0, "auto_unroll_max_step$1024"]]]], "r": [[5.22811e-05], 0, 4.92481, 1682364516], "v": "v0.6"}
{"i": [["[\"conv2d_15\"]", "cuda -keys=cuda,gpu -arch=sm_80 -max_num_threads=1024 -thread_warp_size=32", [-1, 16, 64, 49152, 2147483647, 1024, 8, 32], "", 0, []], [[], [["CI", 5], ["SP", 3, 0, 1, [1, 1, 1, 1], 1], ["SP", 3, 5, 512, [1, 8, 2, 1], 1], ["SP", 3, 10, 7, [7, 1, 1, 1], 1], ["SP", 3, 15, 7, [1, 7, 1, 1], 1], ["SP", 3, 20, 1024, [1, 2], 1], ["SP", 3, 23, 1, [1, 1], 1], ["SP", 3, 26, 1, [1, 1], 1], ["RE", 3, [0, 5, 10, 15, 1, 6, 11, 16, 2, 7, 12, 17, 20, 23, 26, 21, 24, 27, 3, 8, 13, 18, 22, 25, 28, 4, 9, 14, 19]], ["FSP", 6, 0, 1, 3], ["FSP", 6, 4, 2, 3], ["FSP", 6, 8, 3, 3], ["FSP", 6, 12, 4, 3], ["RE", 6, [0, 4, 8, 12, 1, 5, 9, 13, 2, 6, 10, 14, 3, 7, 11, 15]], ["CA", 3, 6, 11], ["CHR", 2, "shared", [3]], ["CA", 3, 4, 14], ["CHR", 1, "shared", [4]], ["CA", 2, 5, 14], ["CI", 1], ["FU", 8, [0, 1, 2, 3]], ["AN", 8, 0, 5], ["FU", 8, [1, 2, 3, 4]], ["AN", 8, 1, 4], ["FU", 8, [2, 3, 4, 5]], ["AN", 8, 2, 6], ["FU", 4, [0, 1, 2, 3]], ["SP", 4, 0, 4, [1], 1], ["AN", 4, 1, 2], ["FFSP", 4, 0, [4, 3, 2, 1], 1, 1], ["AN", 4, 1, 6], ["FU", 2, [0, 1, 2, 3]], ["SP", 2, 0, 2, [1], 1], ["AN", 2, 1, 2], ["FFSP", 2, 0, [4, 3, 2, 1], 1, 1], ["AN", 2, 1, 6], ["PR", 5, 0, "auto_unroll_max_step$64"]]]], "r": [[0.00015884], 0, 4.39779, 1682364517], "v": "v0.6"}
{"i": [["[\"conv2d_15\"]", "cuda -keys=cuda,gpu -arch=sm_80 -max_num_threads=1024 -thread_warp_size=32", [-1, 16, 64, 49152, 2147483647, 1024, 8, 32], "", 0, []], [[], [["CI", 5], ["SP", 3, 0, 1, [1, 1, 1, 1], 1], ["SP", 3, 5, 512, [8, 2, 1, 1], 1], ["SP", 3, 10, 7, [1, 7, 1, 1], 1], ["SP", 3, 15, 7, [1, 7, 1, 1], 1], ["SP", 3, 20, 1024, [4, 4], 1], ["SP", 3, 23, 1, [1, 1], 1], ["SP", 3, 26, 1, [1, 1], 1], ["RE", 3, [0, 5, 10, 15, 1, 6, 11, 16, 2, 7, 12, 17, 20, 23, 26, 21, 24, 27, 3, 8, 13, 18, 22, 25, 28, 4, 9, 14, 19]], ["FSP", 6, 0, 1, 3], ["FSP", 6, 4, 2, 3], ["FSP", 6, 8, 3, 3], ["FSP", 6, 12, 4, 3], ["RE", 6, [0, 4, 8, 12, 1, 5, 9, 13, 2, 6, 10, 14, 3, 7, 11, 15]], ["CA", 3, 6, 11], ["CHR", 2, "shared", [3]], ["CA", 3, 4, 14], ["CHR", 1, "shared", [4]], ["CA", 2, 5, 14], ["CI", 1], ["FU", 8, [0, 1, 2, 3]], ["AN", 8, 0, 5], ["FU", 8, [1, 2, 3, 4]], ["AN", 8, 1, 4], ["FU", 8, [2, 3, 4, 5]], ["AN", 8, 2, 6], ["FU", 4, [0, 1, 2, 3]], ["SP", 4, 0, 16, [1], 1], ["AN", 4, 1, 2], ["FFSP", 4, 0, [4, 3, 2, 1], 1, 1], ["AN", 4, 1, 6], ["FU", 2, [0, 1, 2, 3]], ["SP", 2, 0, 16, [1], 1], ["AN", 2, 1, 2], ["FFSP", 2, 0, [4, 3, 2, 1], 1, 1], ["AN", 2, 1, 6], ["PR", 5, 0, "auto_unroll_max_step$1024"]]]], "r": [[5.2196e-05], 0, 4.98101, 1682364519], "v": "v0.6"}
{"i": [["[\"conv2d_15\"]", "cuda -keys=cuda,gpu -arch=sm_80 -max_num_threads=1024 -thread_warp_size=32", [-1, 16, 64, 49152, 2147483647, 1024, 8, 32], "", 0, []], [[], [["CI", 5], ["SP", 3, 0, 1, [1, 1, 1, 1], 1], ["SP", 3, 5, 512, [1, 16, 1, 1], 1], ["SP", 3, 10, 7, [1, 1, 1, 7], 1], ["SP", 3, 15, 7, [1, 7, 1, 1], 1], ["SP", 3, 20, 1024, [1, 64], 1], ["SP", 3, 23, 1, [1, 1], 1], ["SP", 3, 26, 1, [1, 1], 1], ["RE", 3, [0, 5, 10, 15, 1, 6, 11, 16, 2, 7, 12, 17, 20, 23, 26, 21, 24, 27, 3, 8, 13, 18, 22, 25, 28, 4, 9, 14, 19]], ["FSP", 6, 0, 1, 3], ["FSP", 6, 4, 2, 3], ["FSP", 6, 8, 3, 3], ["FSP", 6, 12, 4, 3], ["RE", 6, [0, 4, 8, 12, 1, 5, 9, 13, 2, 6, 10, 14, 3, 7, 11, 15]], ["CA", 3, 6, 11], ["CHR", 2, "shared", [3]], ["CA", 3, 4, 14], ["CHR", 1, "shared", [4]], ["CA", 2, 5, 14], ["CI", 1], ["FU", 8, [0, 1, 2, 3]], ["AN", 8, 0, 5], ["FU", 8, [1, 2, 3, 4]], ["AN", 8, 1, 4], ["FU", 8, [2, 3, 4, 5]], ["AN", 8, 2, 6], ["FU", 4, [0, 1, 2, 3]], ["SP", 4, 0, 64, [1], 1], ["AN", 4, 1, 2], ["FFSP", 4, 0, [4, 3, 2, 1], 1, 1], ["AN", 4, 1, 6], ["FU", 2, [0, 1, 2, 3]], ["SP", 2, 0, 448, [1], 1], ["AN", 2, 1, 2], ["FFSP", 2, 0, [4, 3, 2, 1], 1, 1], ["AN", 2, 1, 6], ["PR", 5, 0, "auto_unroll_max_step$512"]]]], "r": [[4.26686e-05], 0, 7.28945, 1682364520], "v": "v0.6"}
{"i": [["[\"conv2d_15\"]", "cuda -keys=cuda,gpu -arch=sm_80 -max_num_threads=1024 -thread_warp_size=32", [-1, 16, 64, 49152, 2147483647, 1024, 8, 32], "", 0, []], [[], [["CI", 5], ["SP", 3, 0, 1, [1, 1, 1, 1], 1], ["SP", 3, 5, 512, [1, 8, 1, 2], 1], ["SP", 3, 10, 7, [1, 7, 1, 1], 1], ["SP", 3, 15, 7, [1, 1, 7, 1], 1], ["SP", 3, 20, 1024, [1, 2], 1], ["SP", 3, 23, 1, [1, 1], 1], ["SP", 3, 26, 1, [1, 1], 1], ["RE", 3, [0, 5, 10, 15, 1, 6, 11, 16, 2, 7, 12, 17, 20, 23, 26, 21, 24, 27, 3, 8, 13, 18, 22, 25, 28, 4, 9, 14, 19]], ["FSP", 6, 0, 1, 3], ["FSP", 6, 4, 2, 3], ["FSP", 6, 8, 3, 3], ["FSP", 6, 12, 4, 3], ["RE", 6, [0, 4, 8, 12, 1, 5, 9, 13, 2, 6, 10, 14, 3, 7, 11, 15]], ["CA", 3, 6, 11], ["CHR", 2, "shared", [3]], ["CA", 3, 4, 14], ["CHR", 1, "shared", [4]], ["CA", 2, 5, 14], ["CI", 1], ["FU", 8, [0, 1, 2, 3]], ["AN", 8, 0, 5], ["FU", 8, [1, 2, 3, 4]], ["AN", 8, 1, 4], ["FU", 8, [2, 3, 4, 5]], ["AN", 8, 2, 6], ["FU", 4, [0, 1, 2, 3]], ["SP", 4, 0, 4, [1], 1], ["AN", 4, 1, 2], ["FFSP", 4, 0, [4, 3, 2, 1], 1, 1], ["AN", 4, 1, 6], ["FU", 2, [0, 1, 2, 3]], ["SP", 2, 0, 14, [1], 1], ["AN", 2, 1, 2], ["FFSP", 2, 0, [4, 3, 2, 1], 1, 1], ["AN", 2, 1, 6], ["PR", 5, 0, "auto_unroll_max_step$16"]]]], "r": [[0.00016064], 0, 4.32963, 1682364522], "v": "v0.6"}
{"i": [["[\"conv2d_15\"]", "cuda -keys=cuda,gpu -arch=sm_80 -max_num_threads=1024 -thread_warp_size=32", [-1, 16, 64, 49152, 2147483647, 1024, 8, 32], "", 0, []], [[], [["CI", 5], ["SP", 3, 0, 1, [1, 1, 1, 1], 1], ["SP", 3, 5, 512, [4, 1, 4, 1], 1], ["SP", 3, 10, 7, [1, 7, 1, 1], 1], ["SP", 3, 15, 7, [1, 7, 1, 1], 1], ["SP", 3, 20, 1024, [4, 32], 1], ["SP", 3, 23, 1, [1, 1], 1], ["SP", 3, 26, 1, [1, 1], 1], ["RE", 3, [0, 5, 10, 15, 1, 6, 11, 16, 2, 7, 12, 17, 20, 23, 26, 21, 24, 27, 3, 8, 13, 18, 22, 25, 28, 4, 9, 14, 19]], ["FSP", 6, 0, 1, 3], ["FSP", 6, 4, 2, 3], ["FSP", 6, 8, 3, 3], ["FSP", 6, 12, 4, 3], ["RE", 6, [0, 4, 8, 12, 1, 5, 9, 13, 2, 6, 10, 14, 3, 7, 11, 15]], ["CA", 3, 6, 11], ["CHR", 2, "shared", [3]], ["CA", 3, 4, 14], ["CHR", 1, "shared", [4]], ["CA", 2, 5, 14], ["CI", 1], ["FU", 8, [0, 1, 2, 3]], ["AN", 8, 0, 5], ["FU", 8, [1, 2, 3, 4]], ["AN", 8, 1, 4], ["FU", 8, [2, 3, 4, 5]], ["AN", 8, 2, 6], ["FU", 4, [0, 1, 2, 3]], ["SP", 4, 0, 512, [1], 1], ["AN", 4, 1, 2], ["FFSP", 4, 0, [4, 3, 2, 1], 1, 1], ["AN", 4, 1, 6], ["FU", 2, [0, 1, 2, 3]], ["SP", 2, 0, 128, [1], 1], ["AN", 2, 1, 2], ["FFSP", 2, 0, [4, 3, 2, 1], 1, 1], ["AN", 2, 1, 6], ["PR", 5, 0, "auto_unroll_max_step$16"]]]], "r": [[8.81565e-05], 0, 4.62111, 1682364523], "v": "v0.6"}
{"i": [["[\"conv2d_15\"]", "cuda -keys=cuda,gpu -arch=sm_80 -max_num_threads=1024 -thread_warp_size=32", [-1, 16, 64, 49152, 2147483647, 1024, 8, 32], "", 0, []], [[], [["CI", 5], ["SP", 3, 0, 1, [1, 1, 1, 1], 1], ["SP", 3, 5, 512, [1, 8, 1, 2], 1], ["SP", 3, 10, 7, [1, 7, 1, 1], 1], ["SP", 3, 15, 7, [1, 1, 1, 7], 1], ["SP", 3, 20, 1024, [8, 1], 1], ["SP", 3, 23, 1, [1, 1], 1], ["SP", 3, 26, 1, [1, 1], 1], ["RE", 3, [0, 5, 10, 15, 1, 6, 11, 16, 2, 7, 12, 17, 20, 23, 26, 21, 24, 27, 3, 8, 13, 18, 22, 25, 28, 4, 9, 14, 19]], ["FSP", 6, 0, 1, 3], ["FSP", 6, 4, 2, 3], ["FSP", 6, 8, 3, 3], ["FSP", 6, 12, 4, 3], ["RE", 6, [0, 4, 8, 12, 1, 5, 9, 13, 2, 6, 10, 14, 3, 7, 11, 15]], ["CA", 3, 6, 11], ["CHR", 2, "shared", [3]], ["CA", 3, 4, 14], ["CHR", 1, "shared", [4]], ["CA", 2, 5, 14], ["CI", 1], ["FU", 8, [0, 1, 2, 3]], ["AN", 8, 0, 5], ["FU", 8, [1, 2, 3, 4]], ["AN", 8, 1, 4], ["FU", 8, [2, 3, 4, 5]], ["AN", 8, 2, 6], ["FU", 4, [0, 1, 2, 3]], ["SP", 4, 0, 16, [1], 1], ["AN", 4, 1, 2], ["FFSP", 4, 0, [4, 3, 2, 1], 1, 1], ["AN", 4, 1, 6], ["FU", 2, [0, 1, 2, 3]], ["SP", 2, 0, 56, [1], 1], ["AN", 2, 1, 2], ["FFSP", 2, 0, [4, 3, 2, 1], 1, 1], ["AN", 2, 1, 6], ["PR", 5, 0, "auto_unroll_max_step$64"]]]], "r": [[6.97663e-05], 0, 4.39258, 1682364524], "v": "v0.6"}
{"i": [["[\"conv2d_15\"]", "cuda -keys=cuda,gpu -arch=sm_80 -max_num_threads=1024 -thread_warp_size=32", [-1, 16, 64, 49152, 2147483647, 1024, 8, 32], "", 0, []], [[], [["CI", 5], ["SP", 3, 0, 1, [1, 1, 1, 1], 1], ["SP", 3, 5, 512, [4, 4, 1, 1], 1], ["SP", 3, 10, 7, [1, 7, 1, 1], 1], ["SP", 3, 15, 7, [1, 7, 1, 1], 1], ["SP", 3, 20, 1024, [8, 1], 1], ["SP", 3, 23, 1, [1, 1], 1], ["SP", 3, 26, 1, [1, 1], 1], ["RE", 3, [0, 5, 10, 15, 1, 6, 11, 16, 2, 7, 12, 17, 20, 23, 26, 21, 24, 27, 3, 8, 13, 18, 22, 25, 28, 4, 9, 14, 19]], ["FSP", 6, 0, 1, 3], ["FSP", 6, 4, 2, 3], ["FSP", 6, 8, 3, 3], ["FSP", 6, 12, 4, 3], ["RE", 6, [0, 4, 8, 12, 1, 5, 9, 13, 2, 6, 10, 14, 3, 7, 11, 15]], ["CA", 3, 6, 11], ["CHR", 2, "shared", [3]], ["CA", 3, 4, 14], ["CHR", 1, "shared", [4]], ["CA", 2, 5, 14], ["CI", 1], ["FU", 8, [0, 1, 2, 3]], ["AN", 8, 0, 5], ["FU", 8, [1, 2, 3, 4]], ["AN", 8, 1, 4], ["FU", 8, [2, 3, 4, 5]], ["AN", 8, 2, 6], ["FU", 4, [0, 1, 2, 3]], ["SP", 4, 0, 8, [1], 1], ["AN", 4, 1, 2], ["FFSP", 4, 0, [4, 3, 2, 1], 1, 1], ["AN", 4, 1, 6], ["FU", 2, [0, 1, 2, 3]], ["SP", 2, 0, 8, [1], 1], ["AN", 2, 1, 2], ["FFSP", 2, 0, [4, 3, 2, 1], 1, 1], ["AN", 2, 1, 6], ["PR", 5, 0, "auto_unroll_max_step$512"]]]], "r": [[6.51225e-05], 0, 4.38637, 1682364526], "v": "v0.6"}
{"i": [["[\"conv2d_15\"]", "cuda -keys=cuda,gpu -arch=sm_80 -max_num_threads=1024 -thread_warp_size=32", [-1, 16, 64, 49152, 2147483647, 1024, 8, 32], "", 0, []], [[], [["CI", 5], ["SP", 3, 0, 1, [1, 1, 1, 1], 1], ["SP", 3, 5, 512, [1, 4, 2, 2], 1], ["SP", 3, 10, 7, [1, 7, 1, 1], 1], ["SP", 3, 15, 7, [1, 7, 1, 1], 1], ["SP", 3, 20, 1024, [32, 4], 1], ["SP", 3, 23, 1, [1, 1], 1], ["SP", 3, 26, 1, [1, 1], 1], ["RE", 3, [0, 5, 10, 15, 1, 6, 11, 16, 2, 7, 12, 17, 20, 23, 26, 21, 24, 27, 3, 8, 13, 18, 22, 25, 28, 4, 9, 14, 19]], ["FSP", 6, 0, 1, 3], ["FSP", 6, 4, 2, 3], ["FSP", 6, 8, 3, 3], ["FSP", 6, 12, 4, 3], ["RE", 6, [0, 4, 8, 12, 1, 5, 9, 13, 2, 6, 10, 14, 3, 7, 11, 15]], ["CA", 3, 6, 11], ["CHR", 2, "shared", [3]], ["CA", 3, 4, 14], ["CHR", 1, "shared", [4]], ["CA", 2, 5, 14], ["CI", 1], ["FU", 8, [0, 1, 2, 3]], ["AN", 8, 0, 5], ["FU", 8, [1, 2, 3, 4]], ["AN", 8, 1, 4], ["FU", 8, [2, 3, 4, 5]], ["AN", 8, 2, 6], ["FU", 4, [0, 1, 2, 3]], ["SP", 4, 0, 512, [1], 1], ["AN", 4, 1, 2], ["FFSP", 4, 0, [4, 3, 2, 1], 1, 1], ["AN", 4, 1, 6], ["FU", 2, [0, 1, 2, 3]], ["SP", 2, 0, 128, [1], 1], ["AN", 2, 1, 2], ["FFSP", 2, 0, [4, 3, 2, 1], 1, 1], ["AN", 2, 1, 6], ["PR", 5, 0, "auto_unroll_max_step$1024"]]]], "r": [[3.26764e-05], 0, 8.24672, 1682364527], "v": "v0.6"}
{"i": [["[\"conv2d_15\"]", "cuda -keys=cuda,gpu -arch=sm_80 -max_num_threads=1024 -thread_warp_size=32", [-1, 16, 64, 49152, 2147483647, 1024, 8, 32], "", 0, []], [[], [["CI", 5], ["SP", 3, 0, 1, [1, 1, 1, 1], 1], ["SP", 3, 5, 512, [1, 1, 4, 4], 1], ["SP", 3, 10, 7, [1, 7, 1, 1], 1], ["SP", 3, 15, 7, [1, 7, 1, 1], 1], ["SP", 3, 20, 1024, [1, 32], 1], ["SP", 3, 23, 1, [1, 1], 1], ["SP", 3, 26, 1, [1, 1], 1], ["RE", 3, [0, 5, 10, 15, 1, 6, 11, 16, 2, 7, 12, 17, 20, 23, 26, 21, 24, 27, 3, 8, 13, 18, 22, 25, 28, 4, 9, 14, 19]], ["FSP", 6, 0, 1, 3], ["FSP", 6, 4, 2, 3], ["FSP", 6, 8, 3, 3], ["FSP", 6, 12, 4, 3], ["RE", 6, [0, 4, 8, 12, 1, 5, 9, 13, 2, 6, 10, 14, 3, 7, 11, 15]], ["CA", 3, 6, 11], ["CHR", 2, "shared", [3]], ["CA", 3, 4, 14], ["CHR", 1, "shared", [4]], ["CA", 2, 5, 14], ["CI", 1], ["FU", 8, [0, 1, 2, 3]], ["AN", 8, 0, 5], ["FU", 8, [1, 2, 3, 4]], ["AN", 8, 1, 4], ["FU", 8, [2, 3, 4, 5]], ["AN", 8, 2, 6], ["FU", 4, [0, 1, 2, 3]], ["SP", 4, 0, 512, [1], 1], ["AN", 4, 1, 2], ["FFSP", 4, 0, [4, 3, 2, 1], 1, 1], ["AN", 4, 1, 6], ["FU", 2, [0, 1, 2, 3]], ["SP", 2, 0, 32, [1], 1], ["AN", 2, 1, 2], ["FFSP", 2, 0, [4, 3, 2, 1], 1, 1], ["AN", 2, 1, 6], ["PR", 5, 0, "auto_unroll_max_step$16"]]]], "r": [[5.99819e-05], 0, 4.48487, 1682364528], "v": "v0.6"}
{"i": [["[\"conv2d_15\"]", "cuda -keys=cuda,gpu -arch=sm_80 -max_num_threads=1024 -thread_warp_size=32", [-1, 16, 64, 49152, 2147483647, 1024, 8, 32], "", 0, []], [[], [["CI", 5], ["SP", 3, 0, 1, [1, 1, 1, 1], 1], ["SP", 3, 5, 512, [2, 1, 8, 1], 1], ["SP", 3, 10, 7, [1, 7, 1, 1], 1], ["SP", 3, 15, 7, [1, 7, 1, 1], 1], ["SP", 3, 20, 1024, [32, 4], 1], ["SP", 3, 23, 1, [1, 1], 1], ["SP", 3, 26, 1, [1, 1], 1], ["RE", 3, [0, 5, 10, 15, 1, 6, 11, 16, 2, 7, 12, 17, 20, 23, 26, 21, 24, 27, 3, 8, 13, 18, 22, 25, 28, 4, 9, 14, 19]], ["FSP", 6, 0, 1, 3], ["FSP", 6, 4, 2, 3], ["FSP", 6, 8, 3, 3], ["FSP", 6, 12, 4, 3], ["RE", 6, [0, 4, 8, 12, 1, 5, 9, 13, 2, 6, 10, 14, 3, 7, 11, 15]], ["CA", 3, 6, 11], ["CHR", 2, "shared", [3]], ["CA", 3, 4, 14], ["CHR", 1, "shared", [4]], ["CA", 2, 5, 14], ["CI", 1], ["FU", 8, [0, 1, 2, 3]], ["AN", 8, 0, 5], ["FU", 8, [1, 2, 3, 4]], ["AN", 8, 1, 4], ["FU", 8, [2, 3, 4, 5]], ["AN", 8, 2, 6], ["FU", 4, [0, 1, 2, 3]], ["SP", 4, 0, 1024, [1], 1], ["AN", 4, 1, 2], ["FFSP", 4, 0, [4, 3, 2, 1], 1, 1], ["AN", 4, 1, 6], ["FU", 2, [0, 1, 2, 3]], ["SP", 2, 0, 128, [1], 1], ["AN", 2, 1, 2], ["FFSP", 2, 0, [4, 3, 2, 1], 1, 1], ["AN", 2, 1, 6], ["PR", 5, 0, "auto_unroll_max_step$0"]]]], "r": [[9.04908e-05], 0, 4.58923, 1682364530], "v": "v0.6"}
{"i": [["[\"conv2d_15\"]", "cuda -keys=cuda,gpu -arch=sm_80 -max_num_threads=1024 -thread_warp_size=32", [-1, 16, 64, 49152, 2147483647, 1024, 8, 32], "", 0, []], [[], [["CI", 5], ["SP", 3, 0, 1, [1, 1, 1, 1], 1], ["SP", 3, 5, 512, [4, 1, 2, 2], 1], ["SP", 3, 10, 7, [1, 7, 1, 1], 1], ["SP", 3, 15, 7, [1, 7, 1, 1], 1], ["SP", 3, 20, 1024, [4, 8], 1], ["SP", 3, 23, 1, [1, 1], 1], ["SP", 3, 26, 1, [1, 1], 1], ["RE", 3, [0, 5, 10, 15, 1, 6, 11, 16, 2, 7, 12, 17, 20, 23, 26, 21, 24, 27, 3, 8, 13, 18, 22, 25, 28, 4, 9, 14, 19]], ["FSP", 6, 0, 1, 3], ["FSP", 6, 4, 2, 3], ["FSP", 6, 8, 3, 3], ["FSP", 6, 12, 4, 3], ["RE", 6, [0, 4, 8, 12, 1, 5, 9, 13, 2, 6, 10, 14, 3, 7, 11, 15]], ["CA", 3, 6, 11], ["CHR", 2, "shared", [3]], ["CA", 3, 4, 14], ["CHR", 1, "shared", [4]], ["CA", 2, 5, 14], ["CI", 1], ["FU", 8, [0, 1, 2, 3]], ["AN", 8, 0, 5], ["FU", 8, [1, 2, 3, 4]], ["AN", 8, 1, 4], ["FU", 8, [2, 3, 4, 5]], ["AN", 8, 2, 6], ["FU", 4, [0, 1, 2, 3]], ["SP", 4, 0, 128, [1], 1], ["AN", 4, 1, 2], ["FFSP", 4, 0, [4, 3, 2, 1], 1, 1], ["AN", 4, 1, 6], ["FU", 2, [0, 1, 2, 3]], ["SP", 2, 0, 32, [1], 1], ["AN", 2, 1, 2], ["FFSP", 2, 0, [4, 3, 2, 1], 1, 1], ["AN", 2, 1, 6], ["PR", 5, 0, "auto_unroll_max_step$0"]]]], "r": [[9.98501e-05], 0, 8.31732, 1682364531], "v": "v0.6"}
{"i": [["[\"conv2d_15\"]", "cuda -keys=cuda,gpu -arch=sm_80 -max_num_threads=1024 -thread_warp_size=32", [-1, 16, 64, 49152, 2147483647, 1024, 8, 32], "", 0, []], [[], [["CI", 5], ["SP", 3, 0, 1, [1, 1, 1, 1], 1], ["SP", 3, 5, 512, [1, 1, 1, 16], 1], ["SP", 3, 10, 7, [1, 7, 1, 1], 1], ["SP", 3, 15, 7, [1, 7, 1, 1], 1], ["SP", 3, 20, 1024, [8, 1], 1], ["SP", 3, 23, 1, [1, 1], 1], ["SP", 3, 26, 1, [1, 1], 1], ["RE", 3, [0, 5, 10, 15, 1, 6, 11, 16, 2, 7, 12, 17, 20, 23, 26, 21, 24, 27, 3, 8, 13, 18, 22, 25, 28, 4, 9, 14, 19]], ["FSP", 6, 0, 1, 3], ["FSP", 6, 4, 2, 3], ["FSP", 6, 8, 3, 3], ["FSP", 6, 12, 4, 3], ["RE", 6, [0, 4, 8, 12, 1, 5, 9, 13, 2, 6, 10, 14, 3, 7, 11, 15]], ["CA", 3, 6, 11], ["CHR", 2, "shared", [3]], ["CA", 3, 4, 14], ["CHR", 1, "shared", [4]], ["CA", 2, 5, 14], ["CI", 1], ["FU", 8, [0, 1, 2, 3]], ["AN", 8, 0, 5], ["FU", 8, [1, 2, 3, 4]], ["AN", 8, 1, 4], ["FU", 8, [2, 3, 4, 5]], ["AN", 8, 2, 6], ["FU", 4, [0, 1, 2, 3]], ["SP", 4, 0, 128, [1], 1], ["AN", 4, 1, 2], ["FFSP", 4, 0, [4, 3, 2, 1], 1, 1], ["AN", 4, 1, 6], ["FU", 2, [0, 1, 2, 3]], ["SP", 2, 0, 8, [1], 1], ["AN", 2, 1, 2], ["FFSP", 2, 0, [4, 3, 2, 1], 1, 1], ["AN", 2, 1, 6], ["PR", 5, 0, "auto_unroll_max_step$0"]]]], "r": [[7.86937e-05], 0, 2.86429, 1682364532], "v": "v0.6"}
{"i": [["[\"conv2d_15\"]", "cuda -keys=cuda,gpu -arch=sm_80 -max_num_threads=1024 -thread_warp_size=32", [-1, 16, 64, 49152, 2147483647, 1024, 8, 32], "", 0, []], [[], [["CI", 5], ["SP", 3, 0, 1, [1, 1, 1, 1], 1], ["SP", 3, 5, 512, [1, 8, 2, 1], 1], ["SP", 3, 10, 7, [1, 7, 1, 1], 1], ["SP", 3, 15, 7, [1, 1, 1, 7], 1], ["SP", 3, 20, 1024, [32, 4], 1], ["SP", 3, 23, 1, [1, 1], 1], ["SP", 3, 26, 1, [1, 1], 1], ["RE", 3, [0, 5, 10, 15, 1, 6, 11, 16, 2, 7, 12, 17, 20, 23, 26, 21, 24, 27, 3, 8, 13, 18, 22, 25, 28, 4, 9, 14, 19]], ["FSP", 6, 0, 1, 3], ["FSP", 6, 4, 2, 3], ["FSP", 6, 8, 3, 3], ["FSP", 6, 12, 4, 3], ["RE", 6, [0, 4, 8, 12, 1, 5, 9, 13, 2, 6, 10, 14, 3, 7, 11, 15]], ["CA", 3, 6, 11], ["CHR", 2, "shared", [3]], ["CA", 3, 4, 14], ["CHR", 1, "shared", [4]], ["CA", 2, 5, 14], ["CI", 1], ["FU", 8, [0, 1, 2, 3]], ["AN", 8, 0, 5], ["FU", 8, [1, 2, 3, 4]], ["AN", 8, 1, 4], ["FU", 8, [2, 3, 4, 5]], ["AN", 8, 2, 6], ["FU", 4, [0, 1, 2, 3]], ["SP", 4, 0, 256, [1], 1], ["AN", 4, 1, 2], ["FFSP", 4, 0, [4, 3, 2, 1], 1, 1], ["AN", 4, 1, 6], ["FU", 2, [0, 1, 2, 3]], ["SP", 2, 0, 896, [1], 1], ["AN", 2, 1, 2], ["FFSP", 2, 0, [4, 3, 2, 1], 1, 1], ["AN", 2, 1, 6], ["PR", 5, 0, "auto_unroll_max_step$1024"]]]], "r": [[4.82897e-05], 0, 4.39642, 1682364534], "v": "v0.6"}
{"i": [["[\"conv2d_15\"]", "cuda -keys=cuda,gpu -arch=sm_80 -max_num_threads=1024 -thread_warp_size=32", [-1, 16, 64, 49152, 2147483647, 1024, 8, 32], "", 0, []], [[], [["CI", 5], ["SP", 3, 0, 1, [1, 1, 1, 1], 1], ["SP", 3, 5, 512, [1, 16, 1, 1], 1], ["SP", 3, 10, 7, [1, 7, 1, 1], 1], ["SP", 3, 15, 7, [1, 1, 7, 1], 1], ["SP", 3, 20, 1024, [8, 8], 1], ["SP", 3, 23, 1, [1, 1], 1], ["SP", 3, 26, 1, [1, 1], 1], ["RE", 3, [0, 5, 10, 15, 1, 6, 11, 16, 2, 7, 12, 17, 20, 23, 26, 21, 24, 27, 3, 8, 13, 18, 22, 25, 28, 4, 9, 14, 19]], ["FSP", 6, 0, 1, 3], ["FSP", 6, 4, 2, 3], ["FSP", 6, 8, 3, 3], ["FSP", 6, 12, 4, 3], ["RE", 6, [0, 4, 8, 12, 1, 5, 9, 13, 2, 6, 10, 14, 3, 7, 11, 15]], ["CA", 3, 6, 11], ["CHR", 2, "shared", [3]], ["CA", 3, 4, 14], ["CHR", 1, "shared", [4]], ["CA", 2, 5, 14], ["CI", 1], ["FU", 8, [0, 1, 2, 3]], ["AN", 8, 0, 5], ["FU", 8, [1, 2, 3, 4]], ["AN", 8, 1, 4], ["FU", 8, [2, 3, 4, 5]], ["AN", 8, 2, 6], ["FU", 4, [0, 1, 2, 3]], ["SP", 4, 0, 64, [1], 1], ["AN", 4, 1, 2], ["FFSP", 4, 0, [4, 3, 2, 1], 1, 1], ["AN", 4, 1, 6], ["FU", 2, [0, 1, 2, 3]], ["SP", 2, 0, 448, [1], 1], ["AN", 2, 1, 2], ["FFSP", 2, 0, [4, 3, 2, 1], 1, 1], ["AN", 2, 1, 6], ["PR", 5, 0, "auto_unroll_max_step$16"]]]], "r": [[4.35562e-05], 0, 2.98823, 1682364535], "v": "v0.6"}
{"i": [["[\"conv2d_15\"]", "cuda -keys=cuda,gpu -arch=sm_80 -max_num_threads=1024 -thread_warp_size=32", [-1, 16, 64, 49152, 2147483647, 1024, 8, 32], "", 0, []], [[], [["CI", 5], ["SP", 3, 0, 1, [1, 1, 1, 1], 1], ["SP", 3, 5, 512, [1, 16, 1, 1], 1], ["SP", 3, 10, 7, [1, 1, 1, 7], 1], ["SP", 3, 15, 7, [1, 7, 1, 1], 1], ["SP", 3, 20, 1024, [16, 4], 1], ["SP", 3, 23, 1, [1, 1], 1], ["SP", 3, 26, 1, [1, 1], 1], ["RE", 3, [0, 5, 10, 15, 1, 6, 11, 16, 2, 7, 12, 17, 20, 23, 26, 21, 24, 27, 3, 8, 13, 18, 22, 25, 28, 4, 9, 14, 19]], ["FSP", 6, 0, 1, 3], ["FSP", 6, 4, 2, 3], ["FSP", 6, 8, 3, 3], ["FSP", 6, 12, 4, 3], ["RE", 6, [0, 4, 8, 12, 1, 5, 9, 13, 2, 6, 10, 14, 3, 7, 11, 15]], ["CA", 3, 6, 11], ["CHR", 2, "shared", [3]], ["CA", 3, 4, 14], ["CHR", 1, "shared", [4]], ["CA", 2, 5, 14], ["CI", 1], ["FU", 8, [0, 1, 2, 3]], ["AN", 8, 0, 5], ["FU", 8, [1, 2, 3, 4]], ["AN", 8, 1, 4], ["FU", 8, [2, 3, 4, 5]], ["AN", 8, 2, 6], ["FU", 4, [0, 1, 2, 3]], ["SP", 4, 0, 64, [1], 1], ["AN", 4, 1, 2], ["FFSP", 4, 0, [4, 3, 2, 1], 1, 1], ["AN", 4, 1, 6], ["FU", 2, [0, 1, 2, 3]], ["SP", 2, 0, 448, [1], 1], ["AN", 2, 1, 2], ["FFSP", 2, 0, [4, 3, 2, 1], 1, 1], ["AN", 2, 1, 6], ["PR", 5, 0, "auto_unroll_max_step$16"]]]], "r": [[4.78858e-05], 0, 3.01702, 1682364536], "v": "v0.6"}
{"i": [["[\"conv2d_15\"]", "cuda -keys=cuda,gpu -arch=sm_80 -max_num_threads=1024 -thread_warp_size=32", [-1, 16, 64, 49152, 2147483647, 1024, 8, 32], "", 0, []], [[], [["CI", 5], ["SP", 3, 0, 1, [1, 1, 1, 1], 1], ["SP", 3, 5, 512, [4, 2, 2, 1], 1], ["SP", 3, 10, 7, [1, 7, 1, 1], 1], ["SP", 3, 15, 7, [1, 7, 1, 1], 1], ["SP", 3, 20, 1024, [4, 1], 1], ["SP", 3, 23, 1, [1, 1], 1], ["SP", 3, 26, 1, [1, 1], 1], ["RE", 3, [0, 5, 10, 15, 1, 6, 11, 16, 2, 7, 12, 17, 20, 23, 26, 21, 24, 27, 3, 8, 13, 18, 22, 25, 28, 4, 9, 14, 19]], ["FSP", 6, 0, 1, 3], ["FSP", 6, 4, 2, 3], ["FSP", 6, 8, 3, 3], ["FSP", 6, 12, 4, 3], ["RE", 6, [0, 4, 8, 12, 1, 5, 9, 13, 2, 6, 10, 14, 3, 7, 11, 15]], ["CA", 3, 6, 11], ["CHR", 2, "shared", [3]], ["CA", 3, 4, 14], ["CHR", 1, "shared", [4]], ["CA", 2, 5, 14], ["CI", 1], ["FU", 8, [0, 1, 2, 3]], ["AN", 8, 0, 5], ["FU", 8, [1, 2, 3, 4]], ["AN", 8, 1, 4], ["FU", 8, [2, 3, 4, 5]], ["AN", 8, 2, 6], ["FU", 4, [0, 1, 2, 3]], ["SP", 4, 0, 8, [1], 1], ["AN", 4, 1, 2], ["FFSP", 4, 0, [4, 3, 2, 1], 1, 1], ["AN", 4, 1, 6], ["FU", 2, [0, 1, 2, 3]], ["SP", 2, 0, 4, [1], 1], ["AN", 2, 1, 2], ["FFSP", 2, 0, [4, 3, 2, 1], 1, 1], ["AN", 2, 1, 6], ["PR", 5, 0, "auto_unroll_max_step$0"]]]], "r": [[8.66723e-05], 0, 2.924, 1682364538], "v": "v0.6"}
{"i": [["[\"conv2d_15\"]", "cuda -keys=cuda,gpu -arch=sm_80 -max_num_threads=1024 -thread_warp_size=32", [-1, 16, 64, 49152, 2147483647, 1024, 8, 32], "", 0, []], [[], [["CI", 5], ["SP", 3, 0, 1, [1, 1, 1, 1], 1], ["SP", 3, 5, 512, [1, 4, 2, 2], 1], ["SP", 3, 10, 7, [1, 7, 1, 1], 1], ["SP", 3, 15, 7, [1, 7, 1, 1], 1], ["SP", 3, 20, 1024, [16, 1], 1], ["SP", 3, 23, 1, [1, 1], 1], ["SP", 3, 26, 1, [1, 1], 1], ["RE", 3, [0, 5, 10, 15, 1, 6, 11, 16, 2, 7, 12, 17, 20, 23, 26, 21, 24, 27, 3, 8, 13, 18, 22, 25, 28, 4, 9, 14, 19]], ["FSP", 6, 0, 1, 3], ["FSP", 6, 4, 2, 3], ["FSP", 6, 8, 3, 3], ["FSP", 6, 12, 4, 3], ["RE", 6, [0, 4, 8, 12, 1, 5, 9, 13, 2, 6, 10, 14, 3, 7, 11, 15]], ["CA", 3, 6, 11], ["CHR", 2, "shared", [3]], ["CA", 3, 4, 14], ["CHR", 1, "shared", [4]], ["CA", 2, 5, 14], ["CI", 1], ["FU", 8, [0, 1, 2, 3]], ["AN", 8, 0, 5], ["FU", 8, [1, 2, 3, 4]], ["AN", 8, 1, 4], ["FU", 8, [2, 3, 4, 5]], ["AN", 8, 2, 6], ["FU", 4, [0, 1, 2, 3]], ["SP", 4, 0, 64, [1], 1], ["AN", 4, 1, 2], ["FFSP", 4, 0, [4, 3, 2, 1], 1, 1], ["AN", 4, 1, 6], ["FU", 2, [0, 1, 2, 3]], ["SP", 2, 0, 16, [1], 1], ["AN", 2, 1, 2], ["FFSP", 2, 0, [4, 3, 2, 1], 1, 1], ["AN", 2, 1, 6], ["PR", 5, 0, "auto_unroll_max_step$512"]]]], "r": [[4.18963e-05], 0, 3.04174, 1682364539], "v": "v0.6"}
{"i": [["[\"conv2d_15\"]", "cuda -keys=cuda,gpu -arch=sm_80 -max_num_threads=1024 -thread_warp_size=32", [-1, 16, 64, 49152, 2147483647, 1024, 8, 32], "", 0, []], [[], [["CI", 5], ["SP", 3, 0, 1, [1, 1, 1, 1], 1], ["SP", 3, 5, 512, [1, 4, 4, 1], 1], ["SP", 3, 10, 7, [1, 7, 1, 1], 1], ["SP", 3, 15, 7, [1, 7, 1, 1], 1], ["SP", 3, 20, 1024, [8, 2], 1], ["SP", 3, 23, 1, [1, 1], 1], ["SP", 3, 26, 1, [1, 1], 1], ["RE", 3, [0, 5, 10, 15, 1, 6, 11, 16, 2, 7, 12, 17, 20, 23, 26, 21, 24, 27, 3, 8, 13, 18, 22, 25, 28, 4, 9, 14, 19]], ["FSP", 6, 0, 1, 3], ["FSP", 6, 4, 2, 3], ["FSP", 6, 8, 3, 3], ["FSP", 6, 12, 4, 3], ["RE", 6, [0, 4, 8, 12, 1, 5, 9, 13, 2, 6, 10, 14, 3, 7, 11, 15]], ["CA", 3, 6, 11], ["CHR", 2, "shared", [3]], ["CA", 3, 4, 14], ["CHR", 1, "shared", [4]], ["CA", 2, 5, 14], ["CI", 1], ["FU", 8, [0, 1, 2, 3]], ["AN", 8, 0, 5], ["FU", 8, [1, 2, 3, 4]], ["AN", 8, 1, 4], ["FU", 8, [2, 3, 4, 5]], ["AN", 8, 2, 6], ["FU", 4, [0, 1, 2, 3]], ["SP", 4, 0, 64, [1], 1], ["AN", 4, 1, 2], ["FFSP", 4, 0, [4, 3, 2, 1], 1, 1], ["AN", 4, 1, 6], ["FU", 2, [0, 1, 2, 3]], ["SP", 2, 0, 16, [1], 1], ["AN", 2, 1, 2], ["FFSP", 2, 0, [4, 3, 2, 1], 1, 1], ["AN", 2, 1, 6], ["PR", 5, 0, "auto_unroll_max_step$16"]]]], "r": [[4.1923e-05], 0, 2.92332, 1682364541], "v": "v0.6"}
{"i": [["[\"conv2d_15\"]", "cuda -keys=cuda,gpu -arch=sm_80 -max_num_threads=1024 -thread_warp_size=32", [-1, 16, 64, 49152, 2147483647, 1024, 8, 32], "", 0, []], [[], [["CI", 5], ["SP", 3, 0, 1, [1, 1, 1, 1], 1], ["SP", 3, 5, 512, [1, 1, 8, 2], 1], ["SP", 3, 10, 7, [1, 7, 1, 1], 1], ["SP", 3, 15, 7, [1, 7, 1, 1], 1], ["SP", 3, 20, 1024, [16, 1], 1], ["SP", 3, 23, 1, [1, 1], 1], ["SP", 3, 26, 1, [1, 1], 1], ["RE", 3, [0, 5, 10, 15, 1, 6, 11, 16, 2, 7, 12, 17, 20, 23, 26, 21, 24, 27, 3, 8, 13, 18, 22, 25, 28, 4, 9, 14, 19]], ["FSP", 6, 0, 1, 3], ["FSP", 6, 4, 2, 3], ["FSP", 6, 8, 3, 3], ["FSP", 6, 12, 4, 3], ["RE", 6, [0, 4, 8, 12, 1, 5, 9, 13, 2, 6, 10, 14, 3, 7, 11, 15]], ["CA", 3, 6, 11], ["CHR", 2, "shared", [3]], ["CA", 3, 4, 14], ["CHR", 1, "shared", [4]], ["CA", 2, 5, 14], ["CI", 1], ["FU", 8, [0, 1, 2, 3]], ["AN", 8, 0, 5], ["FU", 8, [1, 2, 3, 4]], ["AN", 8, 1, 4], ["FU", 8, [2, 3, 4, 5]], ["AN", 8, 2, 6], ["FU", 4, [0, 1, 2, 3]], ["SP", 4, 0, 256, [1], 1], ["AN", 4, 1, 2], ["FFSP", 4, 0, [4, 3, 2, 1], 1, 1], ["AN", 4, 1, 6], ["FU", 2, [0, 1, 2, 3]], ["SP", 2, 0, 16, [1], 1], ["AN", 2, 1, 2], ["FFSP", 2, 0, [4, 3, 2, 1], 1, 1], ["AN", 2, 1, 6], ["PR", 5, 0, "auto_unroll_max_step$512"]]]], "r": [[7.52593e-05], 0, 3.40813, 1682364542], "v": "v0.6"}
{"i": [["[\"conv2d_15\"]", "cuda -keys=cuda,gpu -arch=sm_80 -max_num_threads=1024 -thread_warp_size=32", [-1, 16, 64, 49152, 2147483647, 1024, 8, 32], "", 0, []], [[], [["CI", 5], ["SP", 3, 0, 1, [1, 1, 1, 1], 1], ["SP", 3, 5, 512, [1, 16, 1, 1], 1], ["SP", 3, 10, 7, [1, 1, 1, 7], 1], ["SP", 3, 15, 7, [1, 7, 1, 1], 1], ["SP", 3, 20, 1024, [16, 1], 1], ["SP", 3, 23, 1, [1, 1], 1], ["SP", 3, 26, 1, [1, 1], 1], ["RE", 3, [0, 5, 10, 15, 1, 6, 11, 16, 2, 7, 12, 17, 20, 23, 26, 21, 24, 27, 3, 8, 13, 18, 22, 25, 28, 4, 9, 14, 19]], ["FSP", 6, 0, 1, 3], ["FSP", 6, 4, 2, 3], ["FSP", 6, 8, 3, 3], ["FSP", 6, 12, 4, 3], ["RE", 6, [0, 4, 8, 12, 1, 5, 9, 13, 2, 6, 10, 14, 3, 7, 11, 15]], ["CA", 3, 6, 11], ["CHR", 2, "shared", [3]], ["CA", 3, 4, 14], ["CHR", 1, "shared", [4]], ["CA", 2, 5, 14], ["CI", 1], ["FU", 8, [0, 1, 2, 3]], ["AN", 8, 0, 5], ["FU", 8, [1, 2, 3, 4]], ["AN", 8, 1, 4], ["FU", 8, [2, 3, 4, 5]], ["AN", 8, 2, 6], ["FU", 4, [0, 1, 2, 3]], ["SP", 4, 0, 16, [1], 1], ["AN", 4, 1, 2], ["FFSP", 4, 0, [4, 3, 2, 1], 1, 1], ["AN", 4, 1, 6], ["FU", 2, [0, 1, 2, 3]], ["SP", 2, 0, 112, [1], 1], ["AN", 2, 1, 2], ["FFSP", 2, 0, [4, 3, 2, 1], 1, 1], ["AN", 2, 1, 6], ["PR", 5, 0, "auto_unroll_max_step$16"]]]], "r": [[5.32493e-05], 0, 2.91351, 1682364543], "v": "v0.6"}
{"i": [["[\"conv2d_15\"]", "cuda -keys=cuda,gpu -arch=sm_80 -max_num_threads=1024 -thread_warp_size=32", [-1, 16, 64, 49152, 2147483647, 1024, 8, 32], "", 0, []], [[], [["CI", 5], ["SP", 3, 0, 1, [1, 1, 1, 1], 1], ["SP", 3, 5, 512, [1, 1, 16, 1], 1], ["SP", 3, 10, 7, [1, 7, 1, 1], 1], ["SP", 3, 15, 7, [1, 7, 1, 1], 1], ["SP", 3, 20, 1024, [1, 64], 1], ["SP", 3, 23, 1, [1, 1], 1], ["SP", 3, 26, 1, [1, 1], 1], ["RE", 3, [0, 5, 10, 15, 1, 6, 11, 16, 2, 7, 12, 17, 20, 23, 26, 21, 24, 27, 3, 8, 13, 18, 22, 25, 28, 4, 9, 14, 19]], ["FSP", 6, 0, 1, 3], ["FSP", 6, 4, 2, 3], ["FSP", 6, 8, 3, 3], ["FSP", 6, 12, 4, 3], ["RE", 6, [0, 4, 8, 12, 1, 5, 9, 13, 2, 6, 10, 14, 3, 7, 11, 15]], ["CA", 3, 6, 11], ["CHR", 2, "shared", [3]], ["CA", 3, 4, 14], ["CHR", 1, "shared", [4]], ["CA", 2, 5, 14], ["CI", 1], ["FU", 8, [0, 1, 2, 3]], ["AN", 8, 0, 5], ["FU", 8, [1, 2, 3, 4]], ["AN", 8, 1, 4], ["FU", 8, [2, 3, 4, 5]], ["AN", 8, 2, 6], ["FU", 4, [0, 1, 2, 3]], ["SP", 4, 0, 1024, [1], 1], ["AN", 4, 1, 2], ["FFSP", 4, 0, [4, 3, 2, 1], 1, 1], ["AN", 4, 1, 6], ["FU", 2, [0, 1, 2, 3]], ["SP", 2, 0, 64, [1], 1], ["AN", 2, 1, 2], ["FFSP", 2, 0, [4, 3, 2, 1], 1, 1], ["AN", 2, 1, 6], ["PR", 5, 0, "auto_unroll_max_step$512"]]]], "r": [[8.60925e-05], 0, 8.62674, 1682364545], "v": "v0.6"}
{"i": [["[\"conv2d_15\"]", "cuda -keys=cuda,gpu -arch=sm_80 -max_num_threads=1024 -thread_warp_size=32", [-1, 16, 64, 49152, 2147483647, 1024, 8, 32], "", 0, []], [[], [["CI", 5], ["SP", 3, 0, 1, [1, 1, 1, 1], 1], ["SP", 3, 5, 512, [1, 8, 2, 1], 1], ["SP", 3, 10, 7, [7, 1, 1, 1], 1], ["SP", 3, 15, 7, [1, 7, 1, 1], 1], ["SP", 3, 20, 1024, [4, 2], 1], ["SP", 3, 23, 1, [1, 1], 1], ["SP", 3, 26, 1, [1, 1], 1], ["RE", 3, [0, 5, 10, 15, 1, 6, 11, 16, 2, 7, 12, 17, 20, 23, 26, 21, 24, 27, 3, 8, 13, 18, 22, 25, 28, 4, 9, 14, 19]], ["FSP", 6, 0, 1, 3], ["FSP", 6, 4, 2, 3], ["FSP", 6, 8, 3, 3], ["FSP", 6, 12, 4, 3], ["RE", 6, [0, 4, 8, 12, 1, 5, 9, 13, 2, 6, 10, 14, 3, 7, 11, 15]], ["CA", 3, 6, 11], ["CHR", 2, "shared", [3]], ["CA", 3, 4, 14], ["CHR", 1, "shared", [4]], ["CA", 2, 5, 14], ["CI", 1], ["FU", 8, [0, 1, 2, 3]], ["AN", 8, 0, 5], ["FU", 8, [1, 2, 3, 4]], ["AN", 8, 1, 4], ["FU", 8, [2, 3, 4, 5]], ["AN", 8, 2, 6], ["FU", 4, [0, 1, 2, 3]], ["SP", 4, 0, 16, [1], 1], ["AN", 4, 1, 2], ["FFSP", 4, 0, [4, 3, 2, 1], 1, 1], ["AN", 4, 1, 6], ["FU", 2, [0, 1, 2, 3]], ["SP", 2, 0, 8, [1], 1], ["AN", 2, 1, 2], ["FFSP", 2, 0, [4, 3, 2, 1], 1, 1], ["AN", 2, 1, 6], ["PR", 5, 0, "auto_unroll_max_step$0"]]]], "r": [[8.03558e-05], 0, 3.06483, 1682364546], "v": "v0.6"}
{"i": [["[\"conv2d_15\"]", "cuda -keys=cuda,gpu -arch=sm_80 -max_num_threads=1024 -thread_warp_size=32", [-1, 16, 64, 49152, 2147483647, 1024, 8, 32], "", 0, []], [[], [["CI", 5], ["SP", 3, 0, 1, [1, 1, 1, 1], 1], ["SP", 3, 5, 512, [1, 16, 1, 1], 1], ["SP", 3, 10, 7, [1, 1, 7, 1], 1], ["SP", 3, 15, 7, [1, 7, 1, 1], 1], ["SP", 3, 20, 1024, [2, 16], 1], ["SP", 3, 23, 1, [1, 1], 1], ["SP", 3, 26, 1, [1, 1], 1], ["RE", 3, [0, 5, 10, 15, 1, 6, 11, 16, 2, 7, 12, 17, 20, 23, 26, 21, 24, 27, 3, 8, 13, 18, 22, 25, 28, 4, 9, 14, 19]], ["FSP", 6, 0, 1, 3], ["FSP", 6, 4, 2, 3], ["FSP", 6, 8, 3, 3], ["FSP", 6, 12, 4, 3], ["RE", 6, [0, 4, 8, 12, 1, 5, 9, 13, 2, 6, 10, 14, 3, 7, 11, 15]], ["CA", 3, 6, 11], ["CHR", 2, "shared", [3]], ["CA", 3, 4, 14], ["CHR", 1, "shared", [4]], ["CA", 2, 5, 14], ["CI", 1], ["FU", 8, [0, 1, 2, 3]], ["AN", 8, 0, 5], ["FU", 8, [1, 2, 3, 4]], ["AN", 8, 1, 4], ["FU", 8, [2, 3, 4, 5]], ["AN", 8, 2, 6], ["FU", 4, [0, 1, 2, 3]], ["SP", 4, 0, 32, [1], 1], ["AN", 4, 1, 2], ["FFSP", 4, 0, [4, 3, 2, 1], 1, 1], ["AN", 4, 1, 6], ["FU", 2, [0, 1, 2, 3]], ["SP", 2, 0, 224, [1], 1], ["AN", 2, 1, 2], ["FFSP", 2, 0, [4, 3, 2, 1], 1, 1], ["AN", 2, 1, 6], ["PR", 5, 0, "auto_unroll_max_step$64"]]]], "r": [[4.94492e-05], 0, 3.28943, 1682364547], "v": "v0.6"}
{"i": [["[\"conv2d_15\"]", "cuda -keys=cuda,gpu -arch=sm_80 -max_num_threads=1024 -thread_warp_size=32", [-1, 16, 64, 49152, 2147483647, 1024, 8, 32], "", 0, []], [[], [["CI", 5], ["SP", 3, 0, 1, [1, 1, 1, 1], 1], ["SP", 3, 5, 512, [2, 1, 4, 2], 1], ["SP", 3, 10, 7, [1, 7, 1, 1], 1], ["SP", 3, 15, 7, [1, 7, 1, 1], 1], ["SP", 3, 20, 1024, [1, 8], 1], ["SP", 3, 23, 1, [1, 1], 1], ["SP", 3, 26, 1, [1, 1], 1], ["RE", 3, [0, 5, 10, 15, 1, 6, 11, 16, 2, 7, 12, 17, 20, 23, 26, 21, 24, 27, 3, 8, 13, 18, 22, 25, 28, 4, 9, 14, 19]], ["FSP", 6, 0, 1, 3], ["FSP", 6, 4, 2, 3], ["FSP", 6, 8, 3, 3], ["FSP", 6, 12, 4, 3], ["RE", 6, [0, 4, 8, 12, 1, 5, 9, 13, 2, 6, 10, 14, 3, 7, 11, 15]], ["CA", 3, 6, 11], ["CHR", 2, "shared", [3]], ["CA", 3, 4, 14], ["CHR", 1, "shared", [4]], ["CA", 2, 5, 14], ["CI", 1], ["FU", 8, [0, 1, 2, 3]], ["AN", 8, 0, 5], ["FU", 8, [1, 2, 3, 4]], ["AN", 8, 1, 4], ["FU", 8, [2, 3, 4, 5]], ["AN", 8, 2, 6], ["FU", 4, [0, 1, 2, 3]], ["SP", 4, 0, 64, [1], 1], ["AN", 4, 1, 2], ["FFSP", 4, 0, [4, 3, 2, 1], 1, 1], ["AN", 4, 1, 6], ["FU", 2, [0, 1, 2, 3]], ["SP", 2, 0, 8, [1], 1], ["AN", 2, 1, 2], ["FFSP", 2, 0, [4, 3, 2, 1], 1, 1], ["AN", 2, 1, 6], ["PR", 5, 0, "auto_unroll_max_step$512"]]]], "r": [[8.1062e-05], 0, 3.27727, 1682364549], "v": "v0.6"}
{"i": [["[\"conv2d_15\"]", "cuda -keys=cuda,gpu -arch=sm_80 -max_num_threads=1024 -thread_warp_size=32", [-1, 16, 64, 49152, 2147483647, 1024, 8, 32], "", 0, []], [[], [["CI", 5], ["SP", 3, 0, 1, [1, 1, 1, 1], 1], ["SP", 3, 5, 512, [1, 8, 1, 2], 1], ["SP", 3, 10, 7, [7, 1, 1, 1], 1], ["SP", 3, 15, 7, [1, 7, 1, 1], 1], ["SP", 3, 20, 1024, [8, 8], 1], ["SP", 3, 23, 1, [1, 1], 1], ["SP", 3, 26, 1, [1, 1], 1], ["RE", 3, [0, 5, 10, 15, 1, 6, 11, 16, 2, 7, 12, 17, 20, 23, 26, 21, 24, 27, 3, 8, 13, 18, 22, 25, 28, 4, 9, 14, 19]], ["FSP", 6, 0, 1, 3], ["FSP", 6, 4, 2, 3], ["FSP", 6, 8, 3, 3], ["FSP", 6, 12, 4, 3], ["RE", 6, [0, 4, 8, 12, 1, 5, 9, 13, 2, 6, 10, 14, 3, 7, 11, 15]], ["CA", 3, 6, 11], ["CHR", 2, "shared", [3]], ["CA", 3, 4, 14], ["CHR", 1, "shared", [4]], ["CA", 2, 5, 14], ["CI", 1], ["FU", 8, [0, 1, 2, 3]], ["AN", 8, 0, 5], ["FU", 8, [1, 2, 3, 4]], ["AN", 8, 1, 4], ["FU", 8, [2, 3, 4, 5]], ["AN", 8, 2, 6], ["FU", 4, [0, 1, 2, 3]], ["SP", 4, 0, 128, [1], 1], ["AN", 4, 1, 2], ["FFSP", 4, 0, [4, 3, 2, 1], 1, 1], ["AN", 4, 1, 6], ["FU", 2, [0, 1, 2, 3]], ["SP", 2, 0, 64, [1], 1], ["AN", 2, 1, 2], ["FFSP", 2, 0, [4, 3, 2, 1], 1, 1], ["AN", 2, 1, 6], ["PR", 5, 0, "auto_unroll_max_step$0"]]]], "r": [[5.23774e-05], 0, 3.30383, 1682364550], "v": "v0.6"}
{"i": [["[\"conv2d_15\"]", "cuda -keys=cuda,gpu -arch=sm_80 -max_num_threads=1024 -thread_warp_size=32", [-1, 16, 64, 49152, 2147483647, 1024, 8, 32], "", 0, []], [[], [["CI", 5], ["SP", 3, 0, 1, [1, 1, 1, 1], 1], ["SP", 3, 5, 512, [1, 1, 4, 4], 1], ["SP", 3, 10, 7, [1, 7, 1, 1], 1], ["SP", 3, 15, 7, [1, 7, 1, 1], 1], ["SP", 3, 20, 1024, [16, 2], 1], ["SP", 3, 23, 1, [1, 1], 1], ["SP", 3, 26, 1, [1, 1], 1], ["RE", 3, [0, 5, 10, 15, 1, 6, 11, 16, 2, 7, 12, 17, 20, 23, 26, 21, 24, 27, 3, 8, 13, 18, 22, 25, 28, 4, 9, 14, 19]], ["FSP", 6, 0, 1, 3], ["FSP", 6, 4, 2, 3], ["FSP", 6, 8, 3, 3], ["FSP", 6, 12, 4, 3], ["RE", 6, [0, 4, 8, 12, 1, 5, 9, 13, 2, 6, 10, 14, 3, 7, 11, 15]], ["CA", 3, 6, 11], ["CHR", 2, "shared", [3]], ["CA", 3, 4, 14], ["CHR", 1, "shared", [4]], ["CA", 2, 5, 14], ["CI", 1], ["FU", 8, [0, 1, 2, 3]], ["AN", 8, 0, 5], ["FU", 8, [1, 2, 3, 4]], ["AN", 8, 1, 4], ["FU", 8, [2, 3, 4, 5]], ["AN", 8, 2, 6], ["FU", 4, [0, 1, 2, 3]], ["SP", 4, 0, 512, [1], 1], ["AN", 4, 1, 2], ["FFSP", 4, 0, [4, 3, 2, 1], 1, 1], ["AN", 4, 1, 6], ["FU", 2, [0, 1, 2, 3]], ["SP", 2, 0, 32, [1], 1], ["AN", 2, 1, 2], ["FFSP", 2, 0, [4, 3, 2, 1], 1, 1], ["AN", 2, 1, 6], ["PR", 5, 0, "auto_unroll_max_step$64"]]]], "r": [[7.43757e-05], 0, 3.43291, 1682364551], "v": "v0.6"}
{"i": [["[\"conv2d_15\"]", "cuda -keys=cuda,gpu -arch=sm_80 -max_num_threads=1024 -thread_warp_size=32", [-1, 16, 64, 49152, 2147483647, 1024, 8, 32], "", 0, []], [[], [["CI", 5], ["SP", 3, 0, 1, [1, 1, 1, 1], 1], ["SP", 3, 5, 512, [1, 2, 1, 8], 1], ["SP", 3, 10, 7, [1, 7, 1, 1], 1], ["SP", 3, 15, 7, [1, 7, 1, 1], 1], ["SP", 3, 20, 1024, [1, 8], 1], ["SP", 3, 23, 1, [1, 1], 1], ["SP", 3, 26, 1, [1, 1], 1], ["RE", 3, [0, 5, 10, 15, 1, 6, 11, 16, 2, 7, 12, 17, 20, 23, 26, 21, 24, 27, 3, 8, 13, 18, 22, 25, 28, 4, 9, 14, 19]], ["FSP", 6, 0, 1, 3], ["FSP", 6, 4, 2, 3], ["FSP", 6, 8, 3, 3], ["FSP", 6, 12, 4, 3], ["RE", 6, [0, 4, 8, 12, 1, 5, 9, 13, 2, 6, 10, 14, 3, 7, 11, 15]], ["CA", 3, 6, 11], ["CHR", 2, "shared", [3]], ["CA", 3, 4, 14], ["CHR", 1, "shared", [4]], ["CA", 2, 5, 14], ["CI", 1], ["FU", 8, [0, 1, 2, 3]], ["AN", 8, 0, 5], ["FU", 8, [1, 2, 3, 4]], ["AN", 8, 1, 4], ["FU", 8, [2, 3, 4, 5]], ["AN", 8, 2, 6], ["FU", 4, [0, 1, 2, 3]], ["SP", 4, 0, 64, [1], 1], ["AN", 4, 1, 2], ["FFSP", 4, 0, [4, 3, 2, 1], 1, 1], ["AN", 4, 1, 6], ["FU", 2, [0, 1, 2, 3]], ["SP", 2, 0, 8, [1], 1], ["AN", 2, 1, 2], ["FFSP", 2, 0, [4, 3, 2, 1], 1, 1], ["AN", 2, 1, 6], ["PR", 5, 0, "auto_unroll_max_step$512"]]]], "r": [[6.71394e-05], 0, 4.85801, 1682364574], "v": "v0.6"}
{"i": [["[\"conv2d_15\"]", "cuda -keys=cuda,gpu -arch=sm_80 -max_num_threads=1024 -thread_warp_size=32", [-1, 16, 64, 49152, 2147483647, 1024, 8, 32], "", 0, []], [[], [["CI", 5], ["SP", 3, 0, 1, [1, 1, 1, 1], 1], ["SP", 3, 5, 512, [1, 2, 1, 8], 1], ["SP", 3, 10, 7, [1, 7, 1, 1], 1], ["SP", 3, 15, 7, [1, 7, 1, 1], 1], ["SP", 3, 20, 1024, [2, 4], 1], ["SP", 3, 23, 1, [1, 1], 1], ["SP", 3, 26, 1, [1, 1], 1], ["RE", 3, [0, 5, 10, 15, 1, 6, 11, 16, 2, 7, 12, 17, 20, 23, 26, 21, 24, 27, 3, 8, 13, 18, 22, 25, 28, 4, 9, 14, 19]], ["FSP", 6, 0, 1, 3], ["FSP", 6, 4, 2, 3], ["FSP", 6, 8, 3, 3], ["FSP", 6, 12, 4, 3], ["RE", 6, [0, 4, 8, 12, 1, 5, 9, 13, 2, 6, 10, 14, 3, 7, 11, 15]], ["CA", 3, 6, 11], ["CHR", 2, "shared", [3]], ["CA", 3, 4, 14], ["CHR", 1, "shared", [4]], ["CA", 2, 5, 14], ["CI", 1], ["FU", 8, [0, 1, 2, 3]], ["AN", 8, 0, 5], ["FU", 8, [1, 2, 3, 4]], ["AN", 8, 1, 4], ["FU", 8, [2, 3, 4, 5]], ["AN", 8, 2, 6], ["FU", 4, [0, 1, 2, 3]], ["SP", 4, 0, 64, [1], 1], ["AN", 4, 1, 2], ["FFSP", 4, 0, [4, 3, 2, 1], 1, 1], ["AN", 4, 1, 6], ["FU", 2, [0, 1, 2, 3]], ["SP", 2, 0, 8, [1], 1], ["AN", 2, 1, 2], ["FFSP", 2, 0, [4, 3, 2, 1], 1, 1], ["AN", 2, 1, 6], ["PR", 5, 0, "auto_unroll_max_step$16"]]]], "r": [[6.71301e-05], 0, 4.38747, 1682364575], "v": "v0.6"}
{"i": [["[\"conv2d_15\"]", "cuda -keys=cuda,gpu -arch=sm_80 -max_num_threads=1024 -thread_warp_size=32", [-1, 16, 64, 49152, 2147483647, 1024, 8, 32], "", 0, []], [[], [["CI", 5], ["SP", 3, 0, 1, [1, 1, 1, 1], 1], ["SP", 3, 5, 512, [2, 8, 1, 1], 1], ["SP", 3, 10, 7, [1, 1, 7, 1], 1], ["SP", 3, 15, 7, [1, 7, 1, 1], 1], ["SP", 3, 20, 1024, [16, 4], 1], ["SP", 3, 23, 1, [1, 1], 1], ["SP", 3, 26, 1, [1, 1], 1], ["RE", 3, [0, 5, 10, 15, 1, 6, 11, 16, 2, 7, 12, 17, 20, 23, 26, 21, 24, 27, 3, 8, 13, 18, 22, 25, 28, 4, 9, 14, 19]], ["FSP", 6, 0, 1, 3], ["FSP", 6, 4, 2, 3], ["FSP", 6, 8, 3, 3], ["FSP", 6, 12, 4, 3], ["RE", 6, [0, 4, 8, 12, 1, 5, 9, 13, 2, 6, 10, 14, 3, 7, 11, 15]], ["CA", 3, 6, 11], ["CHR", 2, "shared", [3]], ["CA", 3, 4, 14], ["CHR", 1, "shared", [4]], ["CA", 2, 5, 14], ["CI", 1], ["FU", 8, [0, 1, 2, 3]], ["AN", 8, 0, 5], ["FU", 8, [1, 2, 3, 4]], ["AN", 8, 1, 4], ["FU", 8, [2, 3, 4, 5]], ["AN", 8, 2, 6], ["FU", 4, [0, 1, 2, 3]], ["SP", 4, 0, 64, [1], 1], ["AN", 4, 1, 2], ["FFSP", 4, 0, [4, 3, 2, 1], 1, 1], ["AN", 4, 1, 6], ["FU", 2, [0, 1, 2, 3]], ["SP", 2, 0, 448, [1], 1], ["AN", 2, 1, 2], ["FFSP", 2, 0, [4, 3, 2, 1], 1, 1], ["AN", 2, 1, 6], ["PR", 5, 0, "auto_unroll_max_step$64"]]]], "r": [[4.83663e-05], 0, 5.24571, 1682364576], "v": "v0.6"}
{"i": [["[\"conv2d_15\"]", "cuda -keys=cuda,gpu -arch=sm_80 -max_num_threads=1024 -thread_warp_size=32", [-1, 16, 64, 49152, 2147483647, 1024, 8, 32], "", 0, []], [[], [["CI", 5], ["SP", 3, 0, 1, [1, 1, 1, 1], 1], ["SP", 3, 5, 512, [1, 8, 1, 2], 1], ["SP", 3, 10, 7, [1, 1, 1, 7], 1], ["SP", 3, 15, 7, [1, 7, 1, 1], 1], ["SP", 3, 20, 1024, [2, 64], 1], ["SP", 3, 23, 1, [1, 1], 1], ["SP", 3, 26, 1, [1, 1], 1], ["RE", 3, [0, 5, 10, 15, 1, 6, 11, 16, 2, 7, 12, 17, 20, 23, 26, 21, 24, 27, 3, 8, 13, 18, 22, 25, 28, 4, 9, 14, 19]], ["FSP", 6, 0, 1, 3], ["FSP", 6, 4, 2, 3], ["FSP", 6, 8, 3, 3], ["FSP", 6, 12, 4, 3], ["RE", 6, [0, 4, 8, 12, 1, 5, 9, 13, 2, 6, 10, 14, 3, 7, 11, 15]], ["CA", 3, 6, 11], ["CHR", 2, "shared", [3]], ["CA", 3, 4, 14], ["CHR", 1, "shared", [4]], ["CA", 2, 5, 14], ["CI", 1], ["FU", 8, [0, 1, 2, 3]], ["AN", 8, 0, 5], ["FU", 8, [1, 2, 3, 4]], ["AN", 8, 1, 4], ["FU", 8, [2, 3, 4, 5]], ["AN", 8, 2, 6], ["FU", 4, [0, 1, 2, 3]], ["SP", 4, 0, 256, [1], 1], ["AN", 4, 1, 2], ["FFSP", 4, 0, [4, 3, 2, 1], 1, 1], ["AN", 4, 1, 6], ["FU", 2, [0, 1, 2, 3]], ["SP", 2, 0, 896, [1], 1], ["AN", 2, 1, 2], ["FFSP", 2, 0, [4, 3, 2, 1], 1, 1], ["AN", 2, 1, 6], ["PR", 5, 0, "auto_unroll_max_step$0"]]]], "r": [[8.06631e-05], 0, 4.54332, 1682364578], "v": "v0.6"}
{"i": [["[\"conv2d_15\"]", "cuda -keys=cuda,gpu -arch=sm_80 -max_num_threads=1024 -thread_warp_size=32", [-1, 16, 64, 49152, 2147483647, 1024, 8, 32], "", 0, []], [[], [["CI", 5], ["SP", 3, 0, 1, [1, 1, 1, 1], 1], ["SP", 3, 5, 512, [1, 8, 1, 2], 1], ["SP", 3, 10, 7, [1, 1, 7, 1], 1], ["SP", 3, 15, 7, [1, 7, 1, 1], 1], ["SP", 3, 20, 1024, [1, 2], 1], ["SP", 3, 23, 1, [1, 1], 1], ["SP", 3, 26, 1, [1, 1], 1], ["RE", 3, [0, 5, 10, 15, 1, 6, 11, 16, 2, 7, 12, 17, 20, 23, 26, 21, 24, 27, 3, 8, 13, 18, 22, 25, 28, 4, 9, 14, 19]], ["FSP", 6, 0, 1, 3], ["FSP", 6, 4, 2, 3], ["FSP", 6, 8, 3, 3], ["FSP", 6, 12, 4, 3], ["RE", 6, [0, 4, 8, 12, 1, 5, 9, 13, 2, 6, 10, 14, 3, 7, 11, 15]], ["CA", 3, 6, 11], ["CHR", 2, "shared", [3]], ["CA", 3, 4, 14], ["CHR", 1, "shared", [4]], ["CA", 2, 5, 14], ["CI", 1], ["FU", 8, [0, 1, 2, 3]], ["AN", 8, 0, 5], ["FU", 8, [1, 2, 3, 4]], ["AN", 8, 1, 4], ["FU", 8, [2, 3, 4, 5]], ["AN", 8, 2, 6], ["FU", 4, [0, 1, 2, 3]], ["SP", 4, 0, 4, [1], 1], ["AN", 4, 1, 2], ["FFSP", 4, 0, [4, 3, 2, 1], 1, 1], ["AN", 4, 1, 6], ["FU", 2, [0, 1, 2, 3]], ["SP", 2, 0, 14, [1], 1], ["AN", 2, 1, 2], ["FFSP", 2, 0, [4, 3, 2, 1], 1, 1], ["AN", 2, 1, 6], ["PR", 5, 0, "auto_unroll_max_step$16"]]]], "r": [[0.000158463], 0, 4.40345, 1682364579], "v": "v0.6"}
{"i": [["[\"conv2d_15\"]", "cuda -keys=cuda,gpu -arch=sm_80 -max_num_threads=1024 -thread_warp_size=32", [-1, 16, 64, 49152, 2147483647, 1024, 8, 32], "", 0, []], [[], [["CI", 5], ["SP", 3, 0, 1, [1, 1, 1, 1], 1], ["SP", 3, 5, 512, [1, 1, 1, 16], 1], ["SP", 3, 10, 7, [1, 7, 1, 1], 1], ["SP", 3, 15, 7, [1, 7, 1, 1], 1], ["SP", 3, 20, 1024, [4, 4], 1], ["SP", 3, 23, 1, [1, 1], 1], ["SP", 3, 26, 1, [1, 1], 1], ["RE", 3, [0, 5, 10, 15, 1, 6, 11, 16, 2, 7, 12, 17, 20, 23, 26, 21, 24, 27, 3, 8, 13, 18, 22, 25, 28, 4, 9, 14, 19]], ["FSP", 6, 0, 1, 3], ["FSP", 6, 4, 2, 3], ["FSP", 6, 8, 3, 3], ["FSP", 6, 12, 4, 3], ["RE", 6, [0, 4, 8, 12, 1, 5, 9, 13, 2, 6, 10, 14, 3, 7, 11, 15]], ["CA", 3, 6, 11], ["CHR", 2, "shared", [3]], ["CA", 3, 4, 14], ["CHR", 1, "shared", [4]], ["CA", 2, 5, 14], ["CI", 1], ["FU", 8, [0, 1, 2, 3]], ["AN", 8, 0, 5], ["FU", 8, [1, 2, 3, 4]], ["AN", 8, 1, 4], ["FU", 8, [2, 3, 4, 5]], ["AN", 8, 2, 6], ["FU", 4, [0, 1, 2, 3]], ["SP", 4, 0, 256, [1], 1], ["AN", 4, 1, 2], ["FFSP", 4, 0, [4, 3, 2, 1], 1, 1], ["AN", 4, 1, 6], ["FU", 2, [0, 1, 2, 3]], ["SP", 2, 0, 16, [1], 1], ["AN", 2, 1, 2], ["FFSP", 2, 0, [4, 3, 2, 1], 1, 1], ["AN", 2, 1, 6], ["PR", 5, 0, "auto_unroll_max_step$512"]]]], "r": [[7.55099e-05], 0, 4.94632, 1682364581], "v": "v0.6"}
{"i": [["[\"conv2d_15\"]", "cuda -keys=cuda,gpu -arch=sm_80 -max_num_threads=1024 -thread_warp_size=32", [-1, 16, 64, 49152, 2147483647, 1024, 8, 32], "", 0, []], [[], [["CI", 5], ["SP", 3, 0, 1, [1, 1, 1, 1], 1], ["SP", 3, 5, 512, [1, 8, 1, 2], 1], ["SP", 3, 10, 7, [1, 1, 7, 1], 1], ["SP", 3, 15, 7, [1, 7, 1, 1], 1], ["SP", 3, 20, 1024, [4, 2], 1], ["SP", 3, 23, 1, [1, 1], 1], ["SP", 3, 26, 1, [1, 1], 1], ["RE", 3, [0, 5, 10, 15, 1, 6, 11, 16, 2, 7, 12, 17, 20, 23, 26, 21, 24, 27, 3, 8, 13, 18, 22, 25, 28, 4, 9, 14, 19]], ["FSP", 6, 0, 1, 3], ["FSP", 6, 4, 2, 3], ["FSP", 6, 8, 3, 3], ["FSP", 6, 12, 4, 3], ["RE", 6, [0, 4, 8, 12, 1, 5, 9, 13, 2, 6, 10, 14, 3, 7, 11, 15]], ["CA", 3, 6, 11], ["CHR", 2, "shared", [3]], ["CA", 3, 4, 14], ["CHR", 1, "shared", [4]], ["CA", 2, 5, 14], ["CI", 1], ["FU", 8, [0, 1, 2, 3]], ["AN", 8, 0, 5], ["FU", 8, [1, 2, 3, 4]], ["AN", 8, 1, 4], ["FU", 8, [2, 3, 4, 5]], ["AN", 8, 2, 6], ["FU", 4, [0, 1, 2, 3]], ["SP", 4, 0, 16, [1], 1], ["AN", 4, 1, 2], ["FFSP", 4, 0, [4, 3, 2, 1], 1, 1], ["AN", 4, 1, 6], ["FU", 2, [0, 1, 2, 3]], ["SP", 2, 0, 56, [1], 1], ["AN", 2, 1, 2], ["FFSP", 2, 0, [4, 3, 2, 1], 1, 1], ["AN", 2, 1, 6], ["PR", 5, 0, "auto_unroll_max_step$512"]]]], "r": [[7.71548e-05], 0, 4.80362, 1682364582], "v": "v0.6"}
{"i": [["[\"conv2d_15\"]", "cuda -keys=cuda,gpu -arch=sm_80 -max_num_threads=1024 -thread_warp_size=32", [-1, 16, 64, 49152, 2147483647, 1024, 8, 32], "", 0, []], [[], [["CI", 5], ["SP", 3, 0, 1, [1, 1, 1, 1], 1], ["SP", 3, 5, 512, [1, 8, 1, 2], 1], ["SP", 3, 10, 7, [1, 1, 1, 7], 1], ["SP", 3, 15, 7, [1, 7, 1, 1], 1], ["SP", 3, 20, 1024, [2, 2], 1], ["SP", 3, 23, 1, [1, 1], 1], ["SP", 3, 26, 1, [1, 1], 1], ["RE", 3, [0, 5, 10, 15, 1, 6, 11, 16, 2, 7, 12, 17, 20, 23, 26, 21, 24, 27, 3, 8, 13, 18, 22, 25, 28, 4, 9, 14, 19]], ["FSP", 6, 0, 1, 3], ["FSP", 6, 4, 2, 3], ["FSP", 6, 8, 3, 3], ["FSP", 6, 12, 4, 3], ["RE", 6, [0, 4, 8, 12, 1, 5, 9, 13, 2, 6, 10, 14, 3, 7, 11, 15]], ["CA", 3, 6, 11], ["CHR", 2, "shared", [3]], ["CA", 3, 4, 14], ["CHR", 1, "shared", [4]], ["CA", 2, 5, 14], ["CI", 1], ["FU", 8, [0, 1, 2, 3]], ["AN", 8, 0, 5], ["FU", 8, [1, 2, 3, 4]], ["AN", 8, 1, 4], ["FU", 8, [2, 3, 4, 5]], ["AN", 8, 2, 6], ["FU", 4, [0, 1, 2, 3]], ["SP", 4, 0, 8, [1], 1], ["AN", 4, 1, 2], ["FFSP", 4, 0, [4, 3, 2, 1], 1, 1], ["AN", 4, 1, 6], ["FU", 2, [0, 1, 2, 3]], ["SP", 2, 0, 28, [1], 1], ["AN", 2, 1, 2], ["FFSP", 2, 0, [4, 3, 2, 1], 1, 1], ["AN", 2, 1, 6], ["PR", 5, 0, "auto_unroll_max_step$64"]]]], "r": [[0.000114408], 0, 4.88333, 1682364583], "v": "v0.6"}
{"i": [["[\"conv2d_15\"]", "cuda -keys=cuda,gpu -arch=sm_80 -max_num_threads=1024 -thread_warp_size=32", [-1, 16, 64, 49152, 2147483647, 1024, 8, 32], "", 0, []], [[], [["CI", 5], ["SP", 3, 0, 1, [1, 1, 1, 1], 1], ["SP", 3, 5, 512, [1, 1, 1, 16], 1], ["SP", 3, 10, 7, [1, 7, 1, 1], 1], ["SP", 3, 15, 7, [1, 7, 1, 1], 1], ["SP", 3, 20, 1024, [1, 8], 1], ["SP", 3, 23, 1, [1, 1], 1], ["SP", 3, 26, 1, [1, 1], 1], ["RE", 3, [0, 5, 10, 15, 1, 6, 11, 16, 2, 7, 12, 17, 20, 23, 26, 21, 24, 27, 3, 8, 13, 18, 22, 25, 28, 4, 9, 14, 19]], ["FSP", 6, 0, 1, 3], ["FSP", 6, 4, 2, 3], ["FSP", 6, 8, 3, 3], ["FSP", 6, 12, 4, 3], ["RE", 6, [0, 4, 8, 12, 1, 5, 9, 13, 2, 6, 10, 14, 3, 7, 11, 15]], ["CA", 3, 6, 11], ["CHR", 2, "shared", [3]], ["CA", 3, 4, 14], ["CHR", 1, "shared", [4]], ["CA", 2, 5, 14], ["CI", 1], ["FU", 8, [0, 1, 2, 3]], ["AN", 8, 0, 5], ["FU", 8, [1, 2, 3, 4]], ["AN", 8, 1, 4], ["FU", 8, [2, 3, 4, 5]], ["AN", 8, 2, 6], ["FU", 4, [0, 1, 2, 3]], ["SP", 4, 0, 128, [1], 1], ["AN", 4, 1, 2], ["FFSP", 4, 0, [4, 3, 2, 1], 1, 1], ["AN", 4, 1, 6], ["FU", 2, [0, 1, 2, 3]], ["SP", 2, 0, 8, [1], 1], ["AN", 2, 1, 2], ["FFSP", 2, 0, [4, 3, 2, 1], 1, 1], ["AN", 2, 1, 6], ["PR", 5, 0, "auto_unroll_max_step$16"]]]], "r": [[9.12427e-05], 0, 4.37091, 1682364585], "v": "v0.6"}
{"i": [["[\"conv2d_15\"]", "cuda -keys=cuda,gpu -arch=sm_80 -max_num_threads=1024 -thread_warp_size=32", [-1, 16, 64, 49152, 2147483647, 1024, 8, 32], "", 0, []], [[], [["CI", 5], ["SP", 3, 0, 1, [1, 1, 1, 1], 1], ["SP", 3, 5, 512, [2, 2, 2, 2], 1], ["SP", 3, 10, 7, [1, 7, 1, 1], 1], ["SP", 3, 15, 7, [1, 7, 1, 1], 1], ["SP", 3, 20, 1024, [8, 4], 1], ["SP", 3, 23, 1, [1, 1], 1], ["SP", 3, 26, 1, [1, 1], 1], ["RE", 3, [0, 5, 10, 15, 1, 6, 11, 16, 2, 7, 12, 17, 20, 23, 26, 21, 24, 27, 3, 8, 13, 18, 22, 25, 28, 4, 9, 14, 19]], ["FSP", 6, 0, 1, 3], ["FSP", 6, 4, 2, 3], ["FSP", 6, 8, 3, 3], ["FSP", 6, 12, 4, 3], ["RE", 6, [0, 4, 8, 12, 1, 5, 9, 13, 2, 6, 10, 14, 3, 7, 11, 15]], ["CA", 3, 6, 11], ["CHR", 2, "shared", [3]], ["CA", 3, 4, 14], ["CHR", 1, "shared", [4]], ["CA", 2, 5, 14], ["CI", 1], ["FU", 8, [0, 1, 2, 3]], ["AN", 8, 0, 5], ["FU", 8, [1, 2, 3, 4]], ["AN", 8, 1, 4], ["FU", 8, [2, 3, 4, 5]], ["AN", 8, 2, 6], ["FU", 4, [0, 1, 2, 3]], ["SP", 4, 0, 128, [1], 1], ["AN", 4, 1, 2], ["FFSP", 4, 0, [4, 3, 2, 1], 1, 1], ["AN", 4, 1, 6], ["FU", 2, [0, 1, 2, 3]], ["SP", 2, 0, 32, [1], 1], ["AN", 2, 1, 2], ["FFSP", 2, 0, [4, 3, 2, 1], 1, 1], ["AN", 2, 1, 6], ["PR", 5, 0, "auto_unroll_max_step$1024"]]]], "r": [[5.68222e-05], 0, 5.84978, 1682364586], "v": "v0.6"}
{"i": [["[\"conv2d_15\"]", "cuda -keys=cuda,gpu -arch=sm_80 -max_num_threads=1024 -thread_warp_size=32", [-1, 16, 64, 49152, 2147483647, 1024, 8, 32], "", 0, []], [[], [["CI", 5], ["SP", 3, 0, 1, [1, 1, 1, 1], 1], ["SP", 3, 5, 512, [2, 8, 1, 1], 1], ["SP", 3, 10, 7, [1, 7, 1, 1], 1], ["SP", 3, 15, 7, [1, 7, 1, 1], 1], ["SP", 3, 20, 1024, [64, 2], 1], ["SP", 3, 23, 1, [1, 1], 1], ["SP", 3, 26, 1, [1, 1], 1], ["RE", 3, [0, 5, 10, 15, 1, 6, 11, 16, 2, 7, 12, 17, 20, 23, 26, 21, 24, 27, 3, 8, 13, 18, 22, 25, 28, 4, 9, 14, 19]], ["FSP", 6, 0, 1, 3], ["FSP", 6, 4, 2, 3], ["FSP", 6, 8, 3, 3], ["FSP", 6, 12, 4, 3], ["RE", 6, [0, 4, 8, 12, 1, 5, 9, 13, 2, 6, 10, 14, 3, 7, 11, 15]], ["CA", 3, 6, 11], ["CHR", 2, "shared", [3]], ["CA", 3, 4, 14], ["CHR", 1, "shared", [4]], ["CA", 2, 5, 14], ["CI", 1], ["FU", 8, [0, 1, 2, 3]], ["AN", 8, 0, 5], ["FU", 8, [1, 2, 3, 4]], ["AN", 8, 1, 4], ["FU", 8, [2, 3, 4, 5]], ["AN", 8, 2, 6], ["FU", 4, [0, 1, 2, 3]], ["SP", 4, 0, 128, [1], 1], ["AN", 4, 1, 2], ["FFSP", 4, 0, [4, 3, 2, 1], 1, 1], ["AN", 4, 1, 6], ["FU", 2, [0, 1, 2, 3]], ["SP", 2, 0, 128, [1], 1], ["AN", 2, 1, 2], ["FFSP", 2, 0, [4, 3, 2, 1], 1, 1], ["AN", 2, 1, 6], ["PR", 5, 0, "auto_unroll_max_step$64"]]]], "r": [[4.22731e-05], 0, 4.32828, 1682364587], "v": "v0.6"}
{"i": [["[\"conv2d_15\"]", "cuda -keys=cuda,gpu -arch=sm_80 -max_num_threads=1024 -thread_warp_size=32", [-1, 16, 64, 49152, 2147483647, 1024, 8, 32], "", 0, []], [[], [["CI", 5], ["SP", 3, 0, 1, [1, 1, 1, 1], 1], ["SP", 3, 5, 512, [1, 8, 1, 2], 1], ["SP", 3, 10, 7, [1, 7, 1, 1], 1], ["SP", 3, 15, 7, [7, 1, 1, 1], 1], ["SP", 3, 20, 1024, [64, 1], 1], ["SP", 3, 23, 1, [1, 1], 1], ["SP", 3, 26, 1, [1, 1], 1], ["RE", 3, [0, 5, 10, 15, 1, 6, 11, 16, 2, 7, 12, 17, 20, 23, 26, 21, 24, 27, 3, 8, 13, 18, 22, 25, 28, 4, 9, 14, 19]], ["FSP", 6, 0, 1, 3], ["FSP", 6, 4, 2, 3], ["FSP", 6, 8, 3, 3], ["FSP", 6, 12, 4, 3], ["RE", 6, [0, 4, 8, 12, 1, 5, 9, 13, 2, 6, 10, 14, 3, 7, 11, 15]], ["CA", 3, 6, 11], ["CHR", 2, "shared", [3]], ["CA", 3, 4, 14], ["CHR", 1, "shared", [4]], ["CA", 2, 5, 14], ["CI", 1], ["FU", 8, [0, 1, 2, 3]], ["AN", 8, 0, 5], ["FU", 8, [1, 2, 3, 4]], ["AN", 8, 1, 4], ["FU", 8, [2, 3, 4, 5]], ["AN", 8, 2, 6], ["FU", 4, [0, 1, 2, 3]], ["SP", 4, 0, 128, [1], 1], ["AN", 4, 1, 2], ["FFSP", 4, 0, [4, 3, 2, 1], 1, 1], ["AN", 4, 1, 6], ["FU", 2, [0, 1, 2, 3]], ["SP", 2, 0, 64, [1], 1], ["AN", 2, 1, 2], ["FFSP", 2, 0, [4, 3, 2, 1], 1, 1], ["AN", 2, 1, 6], ["PR", 5, 0, "auto_unroll_max_step$1024"]]]], "r": [[4.35514e-05], 0, 11.6768, 1682364589], "v": "v0.6"}
{"i": [["[\"conv2d_15\"]", "cuda -keys=cuda,gpu -arch=sm_80 -max_num_threads=1024 -thread_warp_size=32", [-1, 16, 64, 49152, 2147483647, 1024, 8, 32], "", 0, []], [[], [["CI", 5], ["SP", 3, 0, 1, [1, 1, 1, 1], 1], ["SP", 3, 5, 512, [4, 2, 1, 2], 1], ["SP", 3, 10, 7, [1, 7, 1, 1], 1], ["SP", 3, 15, 7, [1, 7, 1, 1], 1], ["SP", 3, 20, 1024, [2, 64], 1], ["SP", 3, 23, 1, [1, 1], 1], ["SP", 3, 26, 1, [1, 1], 1], ["RE", 3, [0, 5, 10, 15, 1, 6, 11, 16, 2, 7, 12, 17, 20, 23, 26, 21, 24, 27, 3, 8, 13, 18, 22, 25, 28, 4, 9, 14, 19]], ["FSP", 6, 0, 1, 3], ["FSP", 6, 4, 2, 3], ["FSP", 6, 8, 3, 3], ["FSP", 6, 12, 4, 3], ["RE", 6, [0, 4, 8, 12, 1, 5, 9, 13, 2, 6, 10, 14, 3, 7, 11, 15]], ["CA", 3, 6, 11], ["CHR", 2, "shared", [3]], ["CA", 3, 4, 14], ["CHR", 1, "shared", [4]], ["CA", 2, 5, 14], ["CI", 1], ["FU", 8, [0, 1, 2, 3]], ["AN", 8, 0, 5], ["FU", 8, [1, 2, 3, 4]], ["AN", 8, 1, 4], ["FU", 8, [2, 3, 4, 5]], ["AN", 8, 2, 6], ["FU", 4, [0, 1, 2, 3]], ["SP", 4, 0, 256, [1], 1], ["AN", 4, 1, 2], ["FFSP", 4, 0, [4, 3, 2, 1], 1, 1], ["AN", 4, 1, 6], ["FU", 2, [0, 1, 2, 3]], ["SP", 2, 0, 128, [1], 1], ["AN", 2, 1, 2], ["FFSP", 2, 0, [4, 3, 2, 1], 1, 1], ["AN", 2, 1, 6], ["PR", 5, 0, "auto_unroll_max_step$0"]]]], "r": [[4.81492e-05], 0, 4.47701, 1682364590], "v": "v0.6"}
{"i": [["[\"conv2d_15\"]", "cuda -keys=cuda,gpu -arch=sm_80 -max_num_threads=1024 -thread_warp_size=32", [-1, 16, 64, 49152, 2147483647, 1024, 8, 32], "", 0, []], [[], [["CI", 5], ["SP", 3, 0, 1, [1, 1, 1, 1], 1], ["SP", 3, 5, 512, [8, 2, 1, 1], 1], ["SP", 3, 10, 7, [1, 7, 1, 1], 1], ["SP", 3, 15, 7, [1, 7, 1, 1], 1], ["SP", 3, 20, 1024, [8, 4], 1], ["SP", 3, 23, 1, [1, 1], 1], ["SP", 3, 26, 1, [1, 1], 1], ["RE", 3, [0, 5, 10, 15, 1, 6, 11, 16, 2, 7, 12, 17, 20, 23, 26, 21, 24, 27, 3, 8, 13, 18, 22, 25, 28, 4, 9, 14, 19]], ["FSP", 6, 0, 1, 3], ["FSP", 6, 4, 2, 3], ["FSP", 6, 8, 3, 3], ["FSP", 6, 12, 4, 3], ["RE", 6, [0, 4, 8, 12, 1, 5, 9, 13, 2, 6, 10, 14, 3, 7, 11, 15]], ["CA", 3, 6, 11], ["CHR", 2, "shared", [3]], ["CA", 3, 4, 14], ["CHR", 1, "shared", [4]], ["CA", 2, 5, 14], ["CI", 1], ["FU", 8, [0, 1, 2, 3]], ["AN", 8, 0, 5], ["FU", 8, [1, 2, 3, 4]], ["AN", 8, 1, 4], ["FU", 8, [2, 3, 4, 5]], ["AN", 8, 2, 6], ["FU", 4, [0, 1, 2, 3]], ["SP", 4, 0, 32, [1], 1], ["AN", 4, 1, 2], ["FFSP", 4, 0, [4, 3, 2, 1], 1, 1], ["AN", 4, 1, 6], ["FU", 2, [0, 1, 2, 3]], ["SP", 2, 0, 32, [1], 1], ["AN", 2, 1, 2], ["FFSP", 2, 0, [4, 3, 2, 1], 1, 1], ["AN", 2, 1, 6], ["PR", 5, 0, "auto_unroll_max_step$512"]]]], "r": [[4.29471e-05], 0, 5.92465, 1682364591], "v": "v0.6"}
{"i": [["[\"conv2d_15\"]", "cuda -keys=cuda,gpu -arch=sm_80 -max_num_threads=1024 -thread_warp_size=32", [-1, 16, 64, 49152, 2147483647, 1024, 8, 32], "", 0, []], [[], [["CI", 5], ["SP", 3, 0, 1, [1, 1, 1, 1], 1], ["SP", 3, 5, 512, [2, 2, 1, 4], 1], ["SP", 3, 10, 7, [1, 7, 1, 1], 1], ["SP", 3, 15, 7, [1, 7, 1, 1], 1], ["SP", 3, 20, 1024, [64, 1], 1], ["SP", 3, 23, 1, [1, 1], 1], ["SP", 3, 26, 1, [1, 1], 1], ["RE", 3, [0, 5, 10, 15, 1, 6, 11, 16, 2, 7, 12, 17, 20, 23, 26, 21, 24, 27, 3, 8, 13, 18, 22, 25, 28, 4, 9, 14, 19]], ["FSP", 6, 0, 1, 3], ["FSP", 6, 4, 2, 3], ["FSP", 6, 8, 3, 3], ["FSP", 6, 12, 4, 3], ["RE", 6, [0, 4, 8, 12, 1, 5, 9, 13, 2, 6, 10, 14, 3, 7, 11, 15]], ["CA", 3, 6, 11], ["CHR", 2, "shared", [3]], ["CA", 3, 4, 14], ["CHR", 1, "shared", [4]], ["CA", 2, 5, 14], ["CI", 1], ["FU", 8, [0, 1, 2, 3]], ["AN", 8, 0, 5], ["FU", 8, [1, 2, 3, 4]], ["AN", 8, 1, 4], ["FU", 8, [2, 3, 4, 5]], ["AN", 8, 2, 6], ["FU", 4, [0, 1, 2, 3]], ["SP", 4, 0, 256, [1], 1], ["AN", 4, 1, 2], ["FFSP", 4, 0, [4, 3, 2, 1], 1, 1], ["AN", 4, 1, 6], ["FU", 2, [0, 1, 2, 3]], ["SP", 2, 0, 64, [1], 1], ["AN", 2, 1, 2], ["FFSP", 2, 0, [4, 3, 2, 1], 1, 1], ["AN", 2, 1, 6], ["PR", 5, 0, "auto_unroll_max_step$64"]]]], "r": [[4.55551e-05], 0, 4.50961, 1682364593], "v": "v0.6"}
{"i": [["[\"conv2d_15\"]", "cuda -keys=cuda,gpu -arch=sm_80 -max_num_threads=1024 -thread_warp_size=32", [-1, 16, 64, 49152, 2147483647, 1024, 8, 32], "", 0, []], [[], [["CI", 5], ["SP", 3, 0, 1, [1, 1, 1, 1], 1], ["SP", 3, 5, 512, [2, 2, 2, 2], 1], ["SP", 3, 10, 7, [1, 7, 1, 1], 1], ["SP", 3, 15, 7, [1, 7, 1, 1], 1], ["SP", 3, 20, 1024, [2, 1], 1], ["SP", 3, 23, 1, [1, 1], 1], ["SP", 3, 26, 1, [1, 1], 1], ["RE", 3, [0, 5, 10, 15, 1, 6, 11, 16, 2, 7, 12, 17, 20, 23, 26, 21, 24, 27, 3, 8, 13, 18, 22, 25, 28, 4, 9, 14, 19]], ["FSP", 6, 0, 1, 3], ["FSP", 6, 4, 2, 3], ["FSP", 6, 8, 3, 3], ["FSP", 6, 12, 4, 3], ["RE", 6, [0, 4, 8, 12, 1, 5, 9, 13, 2, 6, 10, 14, 3, 7, 11, 15]], ["CA", 3, 6, 11], ["CHR", 2, "shared", [3]], ["CA", 3, 4, 14], ["CHR", 1, "shared", [4]], ["CA", 2, 5, 14], ["CI", 1], ["FU", 8, [0, 1, 2, 3]], ["AN", 8, 0, 5], ["FU", 8, [1, 2, 3, 4]], ["AN", 8, 1, 4], ["FU", 8, [2, 3, 4, 5]], ["AN", 8, 2, 6], ["FU", 4, [0, 1, 2, 3]], ["SP", 4, 0, 8, [1], 1], ["AN", 4, 1, 2], ["FFSP", 4, 0, [4, 3, 2, 1], 1, 1], ["AN", 4, 1, 6], ["FU", 2, [0, 1, 2, 3]], ["SP", 2, 0, 2, [1], 1], ["AN", 2, 1, 2], ["FFSP", 2, 0, [4, 3, 2, 1], 1, 1], ["AN", 2, 1, 6], ["PR", 5, 0, "auto_unroll_max_step$16"]]]], "r": [[9.83847e-05], 0, 4.39392, 1682364594], "v": "v0.6"}
{"i": [["[\"conv2d_15\"]", "cuda -keys=cuda,gpu -arch=sm_80 -max_num_threads=1024 -thread_warp_size=32", [-1, 16, 64, 49152, 2147483647, 1024, 8, 32], "", 0, []], [[], [["CI", 5], ["SP", 3, 0, 1, [1, 1, 1, 1], 1], ["SP", 3, 5, 512, [1, 2, 8, 1], 1], ["SP", 3, 10, 7, [1, 7, 1, 1], 1], ["SP", 3, 15, 7, [1, 7, 1, 1], 1], ["SP", 3, 20, 1024, [1, 32], 1], ["SP", 3, 23, 1, [1, 1], 1], ["SP", 3, 26, 1, [1, 1], 1], ["RE", 3, [0, 5, 10, 15, 1, 6, 11, 16, 2, 7, 12, 17, 20, 23, 26, 21, 24, 27, 3, 8, 13, 18, 22, 25, 28, 4, 9, 14, 19]], ["FSP", 6, 0, 1, 3], ["FSP", 6, 4, 2, 3], ["FSP", 6, 8, 3, 3], ["FSP", 6, 12, 4, 3], ["RE", 6, [0, 4, 8, 12, 1, 5, 9, 13, 2, 6, 10, 14, 3, 7, 11, 15]], ["CA", 3, 6, 11], ["CHR", 2, "shared", [3]], ["CA", 3, 4, 14], ["CHR", 1, "shared", [4]], ["CA", 2, 5, 14], ["CI", 1], ["FU", 8, [0, 1, 2, 3]], ["AN", 8, 0, 5], ["FU", 8, [1, 2, 3, 4]], ["AN", 8, 1, 4], ["FU", 8, [2, 3, 4, 5]], ["AN", 8, 2, 6], ["FU", 4, [0, 1, 2, 3]], ["SP", 4, 0, 256, [1], 1], ["AN", 4, 1, 2], ["FFSP", 4, 0, [4, 3, 2, 1], 1, 1], ["AN", 4, 1, 6], ["FU", 2, [0, 1, 2, 3]], ["SP", 2, 0, 32, [1], 1], ["AN", 2, 1, 2], ["FFSP", 2, 0, [4, 3, 2, 1], 1, 1], ["AN", 2, 1, 6], ["PR", 5, 0, "auto_unroll_max_step$16"]]]], "r": [[5.15414e-05], 0, 3.14765, 1682364595], "v": "v0.6"}
{"i": [["[\"conv2d_15\"]", "cuda -keys=cuda,gpu -arch=sm_80 -max_num_threads=1024 -thread_warp_size=32", [-1, 16, 64, 49152, 2147483647, 1024, 8, 32], "", 0, []], [[], [["CI", 5], ["SP", 3, 0, 1, [1, 1, 1, 1], 1], ["SP", 3, 5, 512, [1, 8, 2, 1], 1], ["SP", 3, 10, 7, [1, 7, 1, 1], 1], ["SP", 3, 15, 7, [7, 1, 1, 1], 1], ["SP", 3, 20, 1024, [2, 4], 1], ["SP", 3, 23, 1, [1, 1], 1], ["SP", 3, 26, 1, [1, 1], 1], ["RE", 3, [0, 5, 10, 15, 1, 6, 11, 16, 2, 7, 12, 17, 20, 23, 26, 21, 24, 27, 3, 8, 13, 18, 22, 25, 28, 4, 9, 14, 19]], ["FSP", 6, 0, 1, 3], ["FSP", 6, 4, 2, 3], ["FSP", 6, 8, 3, 3], ["FSP", 6, 12, 4, 3], ["RE", 6, [0, 4, 8, 12, 1, 5, 9, 13, 2, 6, 10, 14, 3, 7, 11, 15]], ["CA", 3, 6, 11], ["CHR", 2, "shared", [3]], ["CA", 3, 4, 14], ["CHR", 1, "shared", [4]], ["CA", 2, 5, 14], ["CI", 1], ["FU", 8, [0, 1, 2, 3]], ["AN", 8, 0, 5], ["FU", 8, [1, 2, 3, 4]], ["AN", 8, 1, 4], ["FU", 8, [2, 3, 4, 5]], ["AN", 8, 2, 6], ["FU", 4, [0, 1, 2, 3]], ["SP", 4, 0, 16, [1], 1], ["AN", 4, 1, 2], ["FFSP", 4, 0, [4, 3, 2, 1], 1, 1], ["AN", 4, 1, 6], ["FU", 2, [0, 1, 2, 3]], ["SP", 2, 0, 8, [1], 1], ["AN", 2, 1, 2], ["FFSP", 2, 0, [4, 3, 2, 1], 1, 1], ["AN", 2, 1, 6], ["PR", 5, 0, "auto_unroll_max_step$16"]]]], "r": [[6.99634e-05], 0, 3.16495, 1682364597], "v": "v0.6"}
