runtime/fineco/code_gen/darknet/conv2d_1-49.json
{"i": [["[\"conv2d_1\"]", "cuda -keys=cuda,gpu -arch=sm_80 -max_num_threads=1024 -thread_warp_size=32", [-1, 16, 64, 49152, 2147483647, 1024, 8, 32], "", 0, []], [[], [["CI", 5], ["SP", 3, 0, 1, [1, 1, 1, 1], 1], ["SP", 3, 5, 32, [1, 16, 1, 2], 1], ["SP", 3, 10, 224, [1, 4, 2, 4], 1], ["SP", 3, 15, 224, [4, 2, 4, 1], 1], ["SP", 3, 20, 3, [3, 1], 1], ["SP", 3, 23, 3, [1, 1], 1], ["SP", 3, 26, 3, [1, 1], 1], ["RE", 3, [0, 5, 10, 15, 1, 6, 11, 16, 2, 7, 12, 17, 20, 23, 26, 21, 24, 27, 3, 8, 13, 18, 22, 25, 28, 4, 9, 14, 19]], ["FSP", 6, 0, 1, 3], ["FSP", 6, 4, 2, 3], ["FSP", 6, 8, 3, 3], ["FSP", 6, 12, 4, 3], ["RE", 6, [0, 4, 8, 12, 1, 5, 9, 13, 2, 6, 10, 14, 3, 7, 11, 15]], ["CA", 3, 6, 11], ["CHR", 2, "shared", [3]], ["CA", 3, 4, 14], ["CHR", 1, "shared", [4]], ["CA", 2, 5, 14], ["CI", 1], ["FU", 8, [0, 1, 2, 3]], ["AN", 8, 0, 5], ["FU", 8, [1, 2, 3, 4]], ["AN", 8, 1, 4], ["FU", 8, [2, 3, 4, 5]], ["AN", 8, 2, 6], ["FU", 4, [0, 1, 2, 3]], ["SP", 4, 0, 6, [1], 1], ["AN", 4, 1, 2], ["FFSP", 4, 0, [4, 3, 2, 1], 1, 1], ["AN", 4, 1, 6], ["FU", 2, [0, 1, 2, 3]], ["SP", 2, 0, 96, [1], 1], ["AN", 2, 1, 2], ["FFSP", 2, 0, [4, 3, 2, 1], 1, 1], ["AN", 2, 1, 6], ["PR", 5, 0, "auto_unroll_max_step$512"]]]], "r": [[8.93485e-05], 0, 9.59113, 1682137843], "v": "v0.6"}
{"i": [["[\"conv2d_1\"]", "cuda -keys=cuda,gpu -arch=sm_80 -max_num_threads=1024 -thread_warp_size=32", [-1, 16, 64, 49152, 2147483647, 1024, 8, 32], "", 0, []], [[], [["CI", 5], ["SP", 3, 0, 1, [1, 1, 1, 1], 1], ["SP", 3, 5, 32, [1, 2, 2, 8], 1], ["SP", 3, 10, 224, [1, 4, 4, 2], 1], ["SP", 3, 15, 224, [1, 16, 1, 2], 1], ["SP", 3, 20, 3, [1, 1], 1], ["SP", 3, 23, 3, [3, 1], 1], ["SP", 3, 26, 3, [3, 1], 1], ["RE", 3, [0, 5, 10, 15, 1, 6, 11, 16, 2, 7, 12, 17, 20, 23, 26, 21, 24, 27, 3, 8, 13, 18, 22, 25, 28, 4, 9, 14, 19]], ["FSP", 6, 0, 1, 3], ["FSP", 6, 4, 2, 3], ["FSP", 6, 8, 3, 3], ["FSP", 6, 12, 4, 3], ["RE", 6, [0, 4, 8, 12, 1, 5, 9, 13, 2, 6, 10, 14, 3, 7, 11, 15]], ["CA", 3, 6, 11], ["CHR", 2, "shared", [3]], ["CA", 3, 4, 14], ["CHR", 1, "shared", [4]], ["CA", 2, 5, 14], ["CI", 1], ["FU", 8, [0, 1, 2, 3]], ["AN", 8, 0, 5], ["FU", 8, [1, 2, 3, 4]], ["AN", 8, 1, 4], ["FU", 8, [2, 3, 4, 5]], ["AN", 8, 2, 6], ["FU", 4, [0, 1, 2, 3]], ["SP", 4, 0, 144, [1], 1], ["AN", 4, 1, 2], ["FFSP", 4, 0, [4, 3, 2, 1], 1, 1], ["AN", 4, 1, 6], ["FU", 2, [0, 1, 2, 3]], ["SP", 2, 0, 40, [1], 1], ["AN", 2, 1, 2], ["FFSP", 2, 0, [4, 3, 2, 1], 1, 1], ["AN", 2, 1, 6], ["PR", 5, 0, "auto_unroll_max_step$0"]]]], "r": [[0.000136004], 0, 5.21349, 1682137845], "v": "v0.6"}
{"i": [["[\"conv2d_1\"]", "cuda -keys=cuda,gpu -arch=sm_80 -max_num_threads=1024 -thread_warp_size=32", [-1, 16, 64, 49152, 2147483647, 1024, 8, 32], "", 0, []], [[], [["CI", 5], ["SP", 3, 0, 1, [1, 1, 1, 1], 1], ["SP", 3, 5, 32, [1, 4, 4, 2], 1], ["SP", 3, 10, 224, [4, 4, 1, 2], 1], ["SP", 3, 15, 224, [2, 4, 1, 4], 1], ["SP", 3, 20, 3, [3, 1], 1], ["SP", 3, 23, 3, [1, 1], 1], ["SP", 3, 26, 3, [1, 1], 1], ["RE", 3, [0, 5, 10, 15, 1, 6, 11, 16, 2, 7, 12, 17, 20, 23, 26, 21, 24, 27, 3, 8, 13, 18, 22, 25, 28, 4, 9, 14, 19]], ["FSP", 6, 0, 1, 3], ["FSP", 6, 4, 2, 3], ["FSP", 6, 8, 3, 3], ["FSP", 6, 12, 4, 3], ["RE", 6, [0, 4, 8, 12, 1, 5, 9, 13, 2, 6, 10, 14, 3, 7, 11, 15]], ["CA", 3, 6, 11], ["CHR", 2, "shared", [3]], ["CA", 3, 4, 14], ["CHR", 1, "shared", [4]], ["CA", 2, 5, 14], ["CI", 1], ["FU", 8, [0, 1, 2, 3]], ["AN", 8, 0, 5], ["FU", 8, [1, 2, 3, 4]], ["AN", 8, 1, 4], ["FU", 8, [2, 3, 4, 5]], ["AN", 8, 2, 6], ["FU", 4, [0, 1, 2, 3]], ["SP", 4, 0, 24, [1], 1], ["AN", 4, 1, 2], ["FFSP", 4, 0, [4, 3, 2, 1], 1, 1], ["AN", 4, 1, 6], ["FU", 2, [0, 1, 2, 3]], ["SP", 2, 0, 24, [1], 1], ["AN", 2, 1, 2], ["FFSP", 2, 0, [4, 3, 2, 1], 1, 1], ["AN", 2, 1, 6], ["PR", 5, 0, "auto_unroll_max_step$1024"]]]], "r": [[0.000219286], 0, 14.2561, 1682137846], "v": "v0.6"}
{"i": [["[\"conv2d_1\"]", "cuda -keys=cuda,gpu -arch=sm_80 -max_num_threads=1024 -thread_warp_size=32", [-1, 16, 64, 49152, 2147483647, 1024, 8, 32], "", 0, []], [[], [["CI", 5], ["SP", 3, 0, 1, [1, 1, 1, 1], 1], ["SP", 3, 5, 32, [1, 16, 1, 2], 1], ["SP", 3, 10, 224, [2, 4, 4, 1], 1], ["SP", 3, 15, 224, [2, 16, 1, 1], 1], ["SP", 3, 20, 3, [1, 1], 1], ["SP", 3, 23, 3, [1, 1], 1], ["SP", 3, 26, 3, [1, 1], 1], ["RE", 3, [0, 5, 10, 15, 1, 6, 11, 16, 2, 7, 12, 17, 20, 23, 26, 21, 24, 27, 3, 8, 13, 18, 22, 25, 28, 4, 9, 14, 19]], ["FSP", 6, 0, 1, 3], ["FSP", 6, 4, 2, 3], ["FSP", 6, 8, 3, 3], ["FSP", 6, 12, 4, 3], ["RE", 6, [0, 4, 8, 12, 1, 5, 9, 13, 2, 6, 10, 14, 3, 7, 11, 15]], ["CA", 3, 6, 11], ["CHR", 2, "shared", [3]], ["CA", 3, 4, 14], ["CHR", 1, "shared", [4]], ["CA", 2, 5, 14], ["CI", 1], ["FU", 8, [0, 1, 2, 3]], ["AN", 8, 0, 5], ["FU", 8, [1, 2, 3, 4]], ["AN", 8, 1, 4], ["FU", 8, [2, 3, 4, 5]], ["AN", 8, 2, 6], ["FU", 4, [0, 1, 2, 3]], ["SP", 4, 0, 2, [1], 1], ["AN", 4, 1, 2], ["FFSP", 4, 0, [4, 3, 2, 1], 1, 1], ["AN", 4, 1, 6], ["FU", 2, [0, 1, 2, 3]], ["SP", 2, 0, 4, [1], 1], ["AN", 2, 1, 2], ["FFSP", 2, 0, [4, 3, 2, 1], 1, 1], ["AN", 2, 1, 6], ["PR", 5, 0, "auto_unroll_max_step$512"]]]], "r": [[3.14077e-05], 0, 6.63189, 1682137848], "v": "v0.6"}
{"i": [["[\"conv2d_1\"]", "cuda -keys=cuda,gpu -arch=sm_80 -max_num_threads=1024 -thread_warp_size=32", [-1, 16, 64, 49152, 2147483647, 1024, 8, 32], "", 0, []], [[], [["CI", 5], ["SP", 3, 0, 1, [1, 1, 1, 1], 1], ["SP", 3, 5, 32, [1, 32, 1, 1], 1], ["SP", 3, 10, 224, [1, 4, 8, 1], 1], ["SP", 3, 15, 224, [4, 4, 1, 2], 1], ["SP", 3, 20, 3, [1, 3], 1], ["SP", 3, 23, 3, [3, 1], 1], ["SP", 3, 26, 3, [1, 1], 1], ["RE", 3, [0, 5, 10, 15, 1, 6, 11, 16, 2, 7, 12, 17, 20, 23, 26, 21, 24, 27, 3, 8, 13, 18, 22, 25, 28, 4, 9, 14, 19]], ["FSP", 6, 0, 1, 3], ["FSP", 6, 4, 2, 3], ["FSP", 6, 8, 3, 3], ["FSP", 6, 12, 4, 3], ["RE", 6, [0, 4, 8, 12, 1, 5, 9, 13, 2, 6, 10, 14, 3, 7, 11, 15]], ["CA", 3, 6, 11], ["CHR", 2, "shared", [3]], ["CA", 3, 4, 14], ["CHR", 1, "shared", [4]], ["CA", 2, 5, 14], ["CI", 1], ["FU", 8, [0, 1, 2, 3]], ["AN", 8, 0, 5], ["FU", 8, [1, 2, 3, 4]], ["AN", 8, 1, 4], ["FU", 8, [2, 3, 4, 5]], ["AN", 8, 2, 6], ["FU", 4, [0, 1, 2, 3]], ["SP", 4, 0, 9, [1], 1], ["AN", 4, 1, 2], ["FFSP", 4, 0, [4, 3, 2, 1], 1, 1], ["AN", 4, 1, 6], ["FU", 2, [0, 1, 2, 3]], ["SP", 2, 0, 60, [1], 1], ["AN", 2, 1, 2], ["FFSP", 2, 0, [4, 3, 2, 1], 1, 1], ["AN", 2, 1, 6], ["PR", 5, 0, "auto_unroll_max_step$0"]]]], "r": [[9.918e-05], 0, 5.19116, 1682137849], "v": "v0.6"}
{"i": [["[\"conv2d_1\"]", "cuda -keys=cuda,gpu -arch=sm_80 -max_num_threads=1024 -thread_warp_size=32", [-1, 16, 64, 49152, 2147483647, 1024, 8, 32], "", 0, []], [[], [["CI", 5], ["SP", 3, 0, 1, [1, 1, 1, 1], 1], ["SP", 3, 5, 32, [1, 32, 1, 1], 1], ["SP", 3, 10, 224, [2, 1, 2, 8], 1], ["SP", 3, 15, 224, [2, 8, 2, 1], 1], ["SP", 3, 20, 3, [1, 1], 1], ["SP", 3, 23, 3, [1, 1], 1], ["SP", 3, 26, 3, [3, 1], 1], ["RE", 3, [0, 5, 10, 15, 1, 6, 11, 16, 2, 7, 12, 17, 20, 23, 26, 21, 24, 27, 3, 8, 13, 18, 22, 25, 28, 4, 9, 14, 19]], ["FSP", 6, 0, 1, 3], ["FSP", 6, 4, 2, 3], ["FSP", 6, 8, 3, 3], ["FSP", 6, 12, 4, 3], ["RE", 6, [0, 4, 8, 12, 1, 5, 9, 13, 2, 6, 10, 14, 3, 7, 11, 15]], ["CA", 3, 6, 11], ["CHR", 2, "shared", [3]], ["CA", 3, 4, 14], ["CHR", 1, "shared", [4]], ["CA", 2, 5, 14], ["CI", 1], ["FU", 8, [0, 1, 2, 3]], ["AN", 8, 0, 5], ["FU", 8, [1, 2, 3, 4]], ["AN", 8, 1, 4], ["FU", 8, [2, 3, 4, 5]], ["AN", 8, 2, 6], ["FU", 4, [0, 1, 2, 3]], ["SP", 4, 0, 3, [1], 1], ["AN", 4, 1, 2], ["FFSP", 4, 0, [4, 3, 2, 1], 1, 1], ["AN", 4, 1, 6], ["FU", 2, [0, 1, 2, 3]], ["SP", 2, 0, 64, [1], 1], ["AN", 2, 1, 2], ["FFSP", 2, 0, [4, 3, 2, 1], 1, 1], ["AN", 2, 1, 6], ["PR", 5, 0, "auto_unroll_max_step$16"]]]], "r": [[3.79382e-05], 0, 5.25538, 1682137851], "v": "v0.6"}
{"i": [["[\"conv2d_1\"]", "cuda -keys=cuda,gpu -arch=sm_80 -max_num_threads=1024 -thread_warp_size=32", [-1, 16, 64, 49152, 2147483647, 1024, 8, 32], "", 0, []], [[], [["CI", 5], ["SP", 3, 0, 1, [1, 1, 1, 1], 1], ["SP", 3, 5, 32, [2, 4, 2, 2], 1], ["SP", 3, 10, 224, [1, 4, 1, 8], 1], ["SP", 3, 15, 224, [1, 2, 1, 16], 1], ["SP", 3, 20, 3, [1, 3], 1], ["SP", 3, 23, 3, [3, 1], 1], ["SP", 3, 26, 3, [1, 1], 1], ["RE", 3, [0, 5, 10, 15, 1, 6, 11, 16, 2, 7, 12, 17, 20, 23, 26, 21, 24, 27, 3, 8, 13, 18, 22, 25, 28, 4, 9, 14, 19]], ["FSP", 6, 0, 1, 3], ["FSP", 6, 4, 2, 3], ["FSP", 6, 8, 3, 3], ["FSP", 6, 12, 4, 3], ["RE", 6, [0, 4, 8, 12, 1, 5, 9, 13, 2, 6, 10, 14, 3, 7, 11, 15]], ["CA", 3, 6, 11], ["CHR", 2, "shared", [3]], ["CA", 3, 4, 14], ["CHR", 1, "shared", [4]], ["CA", 2, 5, 14], ["CI", 1], ["FU", 8, [0, 1, 2, 3]], ["AN", 8, 0, 5], ["FU", 8, [1, 2, 3, 4]], ["AN", 8, 1, 4], ["FU", 8, [2, 3, 4, 5]], ["AN", 8, 2, 6], ["FU", 4, [0, 1, 2, 3]], ["SP", 4, 0, 36, [1], 1], ["AN", 4, 1, 2], ["FFSP", 4, 0, [4, 3, 2, 1], 1, 1], ["AN", 4, 1, 6], ["FU", 2, [0, 1, 2, 3]], ["SP", 2, 0, 480, [1], 1], ["AN", 2, 1, 2], ["FFSP", 2, 0, [4, 3, 2, 1], 1, 1], ["AN", 2, 1, 6], ["PR", 5, 0, "auto_unroll_max_step$16"]]]], "r": [[0.000450527], 0, 7.87306, 1682137852], "v": "v0.6"}
{"i": [["[\"conv2d_1\"]", "cuda -keys=cuda,gpu -arch=sm_80 -max_num_threads=1024 -thread_warp_size=32", [-1, 16, 64, 49152, 2147483647, 1024, 8, 32], "", 0, []], [[], [["CI", 5], ["SP", 3, 0, 1, [1, 1, 1, 1], 1], ["SP", 3, 5, 32, [1, 4, 8, 1], 1], ["SP", 3, 10, 224, [2, 8, 2, 1], 1], ["SP", 3, 15, 224, [2, 8, 2, 1], 1], ["SP", 3, 20, 3, [3, 1], 1], ["SP", 3, 23, 3, [3, 1], 1], ["SP", 3, 26, 3, [1, 1], 1], ["RE", 3, [0, 5, 10, 15, 1, 6, 11, 16, 2, 7, 12, 17, 20, 23, 26, 21, 24, 27, 3, 8, 13, 18, 22, 25, 28, 4, 9, 14, 19]], ["FSP", 6, 0, 1, 3], ["FSP", 6, 4, 2, 3], ["FSP", 6, 8, 3, 3], ["FSP", 6, 12, 4, 3], ["RE", 6, [0, 4, 8, 12, 1, 5, 9, 13, 2, 6, 10, 14, 3, 7, 11, 15]], ["CA", 3, 6, 11], ["CHR", 2, "shared", [3]], ["CA", 3, 4, 14], ["CHR", 1, "shared", [4]], ["CA", 2, 5, 14], ["CI", 1], ["FU", 8, [0, 1, 2, 3]], ["AN", 8, 0, 5], ["FU", 8, [1, 2, 3, 4]], ["AN", 8, 1, 4], ["FU", 8, [2, 3, 4, 5]], ["AN", 8, 2, 6], ["FU", 4, [0, 1, 2, 3]], ["SP", 4, 0, 72, [1], 1], ["AN", 4, 1, 2], ["FFSP", 4, 0, [4, 3, 2, 1], 1, 1], ["AN", 4, 1, 6], ["FU", 2, [0, 1, 2, 3]], ["SP", 2, 0, 24, [1], 1], ["AN", 2, 1, 2], ["FFSP", 2, 0, [4, 3, 2, 1], 1, 1], ["AN", 2, 1, 6], ["PR", 5, 0, "auto_unroll_max_step$512"]]]], "r": [[2.33527e-05], 0, 9.32261, 1682137854], "v": "v0.6"}
{"i": [["[\"conv2d_1\"]", "cuda -keys=cuda,gpu -arch=sm_80 -max_num_threads=1024 -thread_warp_size=32", [-1, 16, 64, 49152, 2147483647, 1024, 8, 32], "", 0, []], [[], [["CI", 5], ["SP", 3, 0, 1, [1, 1, 1, 1], 1], ["SP", 3, 5, 32, [1, 1, 16, 2], 1], ["SP", 3, 10, 224, [1, 4, 2, 4], 1], ["SP", 3, 15, 224, [2, 8, 2, 1], 1], ["SP", 3, 20, 3, [1, 3], 1], ["SP", 3, 23, 3, [1, 1], 1], ["SP", 3, 26, 3, [1, 1], 1], ["RE", 3, [0, 5, 10, 15, 1, 6, 11, 16, 2, 7, 12, 17, 20, 23, 26, 21, 24, 27, 3, 8, 13, 18, 22, 25, 28, 4, 9, 14, 19]], ["FSP", 6, 0, 1, 3], ["FSP", 6, 4, 2, 3], ["FSP", 6, 8, 3, 3], ["FSP", 6, 12, 4, 3], ["RE", 6, [0, 4, 8, 12, 1, 5, 9, 13, 2, 6, 10, 14, 3, 7, 11, 15]], ["CA", 3, 6, 11], ["CHR", 2, "shared", [3]], ["CA", 3, 4, 14], ["CHR", 1, "shared", [4]], ["CA", 2, 5, 14], ["CI", 1], ["FU", 8, [0, 1, 2, 3]], ["AN", 8, 0, 5], ["FU", 8, [1, 2, 3, 4]], ["AN", 8, 1, 4], ["FU", 8, [2, 3, 4, 5]], ["AN", 8, 2, 6], ["FU", 4, [0, 1, 2, 3]], ["SP", 4, 0, 96, [1], 1], ["AN", 4, 1, 2], ["FFSP", 4, 0, [4, 3, 2, 1], 1, 1], ["AN", 4, 1, 6], ["FU", 2, [0, 1, 2, 3]], ["SP", 2, 0, 48, [1], 1], ["AN", 2, 1, 2], ["FFSP", 2, 0, [4, 3, 2, 1], 1, 1], ["AN", 2, 1, 6], ["PR", 5, 0, "auto_unroll_max_step$512"]]]], "r": [[0.000182398], 0, 14.9124, 1682137855], "v": "v0.6"}
{"i": [["[\"conv2d_1\"]", "cuda -keys=cuda,gpu -arch=sm_80 -max_num_threads=1024 -thread_warp_size=32", [-1, 16, 64, 49152, 2147483647, 1024, 8, 32], "", 0, []], [[], [["CI", 5], ["SP", 3, 0, 1, [1, 1, 1, 1], 1], ["SP", 3, 5, 32, [1, 2, 16, 1], 1], ["SP", 3, 10, 224, [8, 2, 2, 1], 1], ["SP", 3, 15, 224, [1, 16, 2, 1], 1], ["SP", 3, 20, 3, [3, 1], 1], ["SP", 3, 23, 3, [3, 1], 1], ["SP", 3, 26, 3, [1, 3], 1], ["RE", 3, [0, 5, 10, 15, 1, 6, 11, 16, 2, 7, 12, 17, 20, 23, 26, 21, 24, 27, 3, 8, 13, 18, 22, 25, 28, 4, 9, 14, 19]], ["FSP", 6, 0, 1, 3], ["FSP", 6, 4, 2, 3], ["FSP", 6, 8, 3, 3], ["FSP", 6, 12, 4, 3], ["RE", 6, [0, 4, 8, 12, 1, 5, 9, 13, 2, 6, 10, 14, 3, 7, 11, 15]], ["CA", 3, 6, 11], ["CHR", 2, "shared", [3]], ["CA", 3, 4, 14], ["CHR", 1, "shared", [4]], ["CA", 2, 5, 14], ["CI", 1], ["FU", 8, [0, 1, 2, 3]], ["AN", 8, 0, 5], ["FU", 8, [1, 2, 3, 4]], ["AN", 8, 1, 4], ["FU", 8, [2, 3, 4, 5]], ["AN", 8, 2, 6], ["FU", 4, [0, 1, 2, 3]], ["SP", 4, 0, 432, [1], 1], ["AN", 4, 1, 2], ["FFSP", 4, 0, [4, 3, 2, 1], 1, 1], ["AN", 4, 1, 6], ["FU", 2, [0, 1, 2, 3]], ["SP", 2, 0, 48, [1], 1], ["AN", 2, 1, 2], ["FFSP", 2, 0, [4, 3, 2, 1], 1, 1], ["AN", 2, 1, 6], ["PR", 5, 0, "auto_unroll_max_step$64"]]]], "r": [[0.00010598], 0, 11.5412, 1682137857], "v": "v0.6"}
{"i": [["[\"conv2d_1\"]", "cuda -keys=cuda,gpu -arch=sm_80 -max_num_threads=1024 -thread_warp_size=32", [-1, 16, 64, 49152, 2147483647, 1024, 8, 32], "", 0, []], [[], [["CI", 5], ["SP", 3, 0, 1, [1, 1, 1, 1], 1], ["SP", 3, 5, 32, [2, 8, 2, 1], 1], ["SP", 3, 10, 224, [4, 4, 1, 2], 1], ["SP", 3, 15, 224, [1, 4, 8, 1], 1], ["SP", 3, 20, 3, [1, 1], 1], ["SP", 3, 23, 3, [1, 1], 1], ["SP", 3, 26, 3, [3, 1], 1], ["RE", 3, [0, 5, 10, 15, 1, 6, 11, 16, 2, 7, 12, 17, 20, 23, 26, 21, 24, 27, 3, 8, 13, 18, 22, 25, 28, 4, 9, 14, 19]], ["FSP", 6, 0, 1, 3], ["FSP", 6, 4, 2, 3], ["FSP", 6, 8, 3, 3], ["FSP", 6, 12, 4, 3], ["RE", 6, [0, 4, 8, 12, 1, 5, 9, 13, 2, 6, 10, 14, 3, 7, 11, 15]], ["CA", 3, 6, 11], ["CHR", 2, "shared", [3]], ["CA", 3, 4, 14], ["CHR", 1, "shared", [4]], ["CA", 2, 5, 14], ["CI", 1], ["FU", 8, [0, 1, 2, 3]], ["AN", 8, 0, 5], ["FU", 8, [1, 2, 3, 4]], ["AN", 8, 1, 4], ["FU", 8, [2, 3, 4, 5]], ["AN", 8, 2, 6], ["FU", 4, [0, 1, 2, 3]], ["SP", 4, 0, 6, [1], 1], ["AN", 4, 1, 2], ["FFSP", 4, 0, [4, 3, 2, 1], 1, 1], ["AN", 4, 1, 6], ["FU", 2, [0, 1, 2, 3]], ["SP", 2, 0, 20, [1], 1], ["AN", 2, 1, 2], ["FFSP", 2, 0, [4, 3, 2, 1], 1, 1], ["AN", 2, 1, 6], ["PR", 5, 0, "auto_unroll_max_step$16"]]]], "r": [[8.56563e-05], 0, 6.09156, 1682137858], "v": "v0.6"}
{"i": [["[\"conv2d_1\"]", "cuda -keys=cuda,gpu -arch=sm_80 -max_num_threads=1024 -thread_warp_size=32", [-1, 16, 64, 49152, 2147483647, 1024, 8, 32], "", 0, []], [[], [["CI", 5], ["SP", 3, 0, 1, [1, 1, 1, 1], 1], ["SP", 3, 5, 32, [2, 8, 2, 1], 1], ["SP", 3, 10, 224, [1, 8, 2, 2], 1], ["SP", 3, 15, 224, [1, 8, 2, 2], 1], ["SP", 3, 20, 3, [3, 1], 1], ["SP", 3, 23, 3, [3, 1], 1], ["SP", 3, 26, 3, [3, 1], 1], ["RE", 3, [0, 5, 10, 15, 1, 6, 11, 16, 2, 7, 12, 17, 20, 23, 26, 21, 24, 27, 3, 8, 13, 18, 22, 25, 28, 4, 9, 14, 19]], ["FSP", 6, 0, 1, 3], ["FSP", 6, 4, 2, 3], ["FSP", 6, 8, 3, 3], ["FSP", 6, 12, 4, 3], ["RE", 6, [0, 4, 8, 12, 1, 5, 9, 13, 2, 6, 10, 14, 3, 7, 11, 15]], ["CA", 3, 6, 11], ["CHR", 2, "shared", [3]], ["CA", 3, 4, 14], ["CHR", 1, "shared", [4]], ["CA", 2, 5, 14], ["CI", 1], ["FU", 8, [0, 1, 2, 3]], ["AN", 8, 0, 5], ["FU", 8, [1, 2, 3, 4]], ["AN", 8, 1, 4], ["FU", 8, [2, 3, 4, 5]], ["AN", 8, 2, 6], ["FU", 4, [0, 1, 2, 3]], ["SP", 4, 0, 54, [1], 1], ["AN", 4, 1, 2], ["FFSP", 4, 0, [4, 3, 2, 1], 1, 1], ["AN", 4, 1, 6], ["FU", 2, [0, 1, 2, 3]], ["SP", 2, 0, 108, [1], 1], ["AN", 2, 1, 2], ["FFSP", 2, 0, [4, 3, 2, 1], 1, 1], ["AN", 2, 1, 6], ["PR", 5, 0, "auto_unroll_max_step$64"]]]], "r": [[2.77668e-05], 0, 6.1256, 1682137860], "v": "v0.6"}
{"i": [["[\"conv2d_1\"]", "cuda -keys=cuda,gpu -arch=sm_80 -max_num_threads=1024 -thread_warp_size=32", [-1, 16, 64, 49152, 2147483647, 1024, 8, 32], "", 0, []], [[], [["CI", 5], ["SP", 3, 0, 1, [1, 1, 1, 1], 1], ["SP", 3, 5, 32, [1, 4, 4, 2], 1], ["SP", 3, 10, 224, [1, 32, 1, 1], 1], ["SP", 3, 15, 224, [1, 2, 4, 4], 1], ["SP", 3, 20, 3, [1, 1], 1], ["SP", 3, 23, 3, [1, 1], 1], ["SP", 3, 26, 3, [1, 1], 1], ["RE", 3, [0, 5, 10, 15, 1, 6, 11, 16, 2, 7, 12, 17, 20, 23, 26, 21, 24, 27, 3, 8, 13, 18, 22, 25, 28, 4, 9, 14, 19]], ["FSP", 6, 0, 1, 3], ["FSP", 6, 4, 2, 3], ["FSP", 6, 8, 3, 3], ["FSP", 6, 12, 4, 3], ["RE", 6, [0, 4, 8, 12, 1, 5, 9, 13, 2, 6, 10, 14, 3, 7, 11, 15]], ["CA", 3, 6, 11], ["CHR", 2, "shared", [3]], ["CA", 3, 4, 14], ["CHR", 1, "shared", [4]], ["CA", 2, 5, 14], ["CI", 1], ["FU", 8, [0, 1, 2, 3]], ["AN", 8, 0, 5], ["FU", 8, [1, 2, 3, 4]], ["AN", 8, 1, 4], ["FU", 8, [2, 3, 4, 5]], ["AN", 8, 2, 6], ["FU", 4, [0, 1, 2, 3]], ["SP", 4, 0, 8, [1], 1], ["AN", 4, 1, 2], ["FFSP", 4, 0, [4, 3, 2, 1], 1, 1], ["AN", 4, 1, 6], ["FU", 2, [0, 1, 2, 3]], ["SP", 2, 0, 16, [1], 1], ["AN", 2, 1, 2], ["FFSP", 2, 0, [4, 3, 2, 1], 1, 1], ["AN", 2, 1, 6], ["PR", 5, 0, "auto_unroll_max_step$1024"]]]], "r": [[5.40593e-05], 0, 7.72874, 1682137861], "v": "v0.6"}
{"i": [["[\"conv2d_1\"]", "cuda -keys=cuda,gpu -arch=sm_80 -max_num_threads=1024 -thread_warp_size=32", [-1, 16, 64, 49152, 2147483647, 1024, 8, 32], "", 0, []], [[], [["CI", 5], ["SP", 3, 0, 1, [1, 1, 1, 1], 1], ["SP", 3, 5, 32, [2, 4, 4, 1], 1], ["SP", 3, 10, 224, [1, 4, 1, 8], 1], ["SP", 3, 15, 224, [2, 4, 2, 2], 1], ["SP", 3, 20, 3, [3, 1], 1], ["SP", 3, 23, 3, [1, 1], 1], ["SP", 3, 26, 3, [1, 3], 1], ["RE", 3, [0, 5, 10, 15, 1, 6, 11, 16, 2, 7, 12, 17, 20, 23, 26, 21, 24, 27, 3, 8, 13, 18, 22, 25, 28, 4, 9, 14, 19]], ["FSP", 6, 0, 1, 3], ["FSP", 6, 4, 2, 3], ["FSP", 6, 8, 3, 3], ["FSP", 6, 12, 4, 3], ["RE", 6, [0, 4, 8, 12, 1, 5, 9, 13, 2, 6, 10, 14, 3, 7, 11, 15]], ["CA", 3, 6, 11], ["CHR", 2, "shared", [3]], ["CA", 3, 4, 14], ["CHR", 1, "shared", [4]], ["CA", 2, 5, 14], ["CI", 1], ["FU", 8, [0, 1, 2, 3]], ["AN", 8, 0, 5], ["FU", 8, [1, 2, 3, 4]], ["AN", 8, 1, 4], ["FU", 8, [2, 3, 4, 5]], ["AN", 8, 2, 6], ["FU", 4, [0, 1, 2, 3]], ["SP", 4, 0, 36, [1], 1], ["AN", 4, 1, 2], ["FFSP", 4, 0, [4, 3, 2, 1], 1, 1], ["AN", 4, 1, 6], ["FU", 2, [0, 1, 2, 3]], ["SP", 2, 0, 144, [1], 1], ["AN", 2, 1, 2], ["FFSP", 2, 0, [4, 3, 2, 1], 1, 1], ["AN", 2, 1, 6], ["PR", 5, 0, "auto_unroll_max_step$64"]]]], "r": [[9.79125e-05], 0, 13.4174, 1682137863], "v": "v0.6"}
{"i": [["[\"conv2d_1\"]", "cuda -keys=cuda,gpu -arch=sm_80 -max_num_threads=1024 -thread_warp_size=32", [-1, 16, 64, 49152, 2147483647, 1024, 8, 32], "", 0, []], [[], [["CI", 5], ["SP", 3, 0, 1, [1, 1, 1, 1], 1], ["SP", 3, 5, 32, [1, 32, 1, 1], 1], ["SP", 3, 10, 224, [2, 2, 1, 8], 1], ["SP", 3, 15, 224, [1, 1, 32, 1], 1], ["SP", 3, 20, 3, [1, 1], 1], ["SP", 3, 23, 3, [3, 1], 1], ["SP", 3, 26, 3, [3, 1], 1], ["RE", 3, [0, 5, 10, 15, 1, 6, 11, 16, 2, 7, 12, 17, 20, 23, 26, 21, 24, 27, 3, 8, 13, 18, 22, 25, 28, 4, 9, 14, 19]], ["FSP", 6, 0, 1, 3], ["FSP", 6, 4, 2, 3], ["FSP", 6, 8, 3, 3], ["FSP", 6, 12, 4, 3], ["RE", 6, [0, 4, 8, 12, 1, 5, 9, 13, 2, 6, 10, 14, 3, 7, 11, 15]], ["CA", 3, 6, 11], ["CHR", 2, "shared", [3]], ["CA", 3, 4, 14], ["CHR", 1, "shared", [4]], ["CA", 2, 5, 14], ["CI", 1], ["FU", 8, [0, 1, 2, 3]], ["AN", 8, 0, 5], ["FU", 8, [1, 2, 3, 4]], ["AN", 8, 1, 4], ["FU", 8, [2, 3, 4, 5]], ["AN", 8, 2, 6], ["FU", 4, [0, 1, 2, 3]], ["SP", 4, 0, 9, [1], 1], ["AN", 4, 1, 2], ["FFSP", 4, 0, [4, 3, 2, 1], 1, 1], ["AN", 4, 1, 6], ["FU", 2, [0, 1, 2, 3]], ["SP", 2, 0, 340, [1], 1], ["AN", 2, 1, 2], ["FFSP", 2, 0, [4, 3, 2, 1], 1, 1], ["AN", 2, 1, 6], ["PR", 5, 0, "auto_unroll_max_step$0"]]]], "r": [[0.000583078], 0, 5.22176, 1682137864], "v": "v0.6"}
{"i": [["[\"conv2d_1\"]", "cuda -keys=cuda,gpu -arch=sm_80 -max_num_threads=1024 -thread_warp_size=32", [-1, 16, 64, 49152, 2147483647, 1024, 8, 32], "", 0, []], [[], [["CI", 5], ["SP", 3, 0, 1, [1, 1, 1, 1], 1], ["SP", 3, 5, 32, [2, 16, 1, 1], 1], ["SP", 3, 10, 224, [1, 2, 8, 2], 1], ["SP", 3, 15, 224, [1, 32, 1, 1], 1], ["SP", 3, 20, 3, [1, 1], 1], ["SP", 3, 23, 3, [1, 3], 1], ["SP", 3, 26, 3, [1, 3], 1], ["RE", 3, [0, 5, 10, 15, 1, 6, 11, 16, 2, 7, 12, 17, 20, 23, 26, 21, 24, 27, 3, 8, 13, 18, 22, 25, 28, 4, 9, 14, 19]], ["FSP", 6, 0, 1, 3], ["FSP", 6, 4, 2, 3], ["FSP", 6, 8, 3, 3], ["FSP", 6, 12, 4, 3], ["RE", 6, [0, 4, 8, 12, 1, 5, 9, 13, 2, 6, 10, 14, 3, 7, 11, 15]], ["CA", 3, 6, 11], ["CHR", 2, "shared", [3]], ["CA", 3, 4, 14], ["CHR", 1, "shared", [4]], ["CA", 2, 5, 14], ["CI", 1], ["FU", 8, [0, 1, 2, 3]], ["AN", 8, 0, 5], ["FU", 8, [1, 2, 3, 4]], ["AN", 8, 1, 4], ["FU", 8, [2, 3, 4, 5]], ["AN", 8, 2, 6], ["FU", 4, [0, 1, 2, 3]], ["SP", 4, 0, 9, [1], 1], ["AN", 4, 1, 2], ["FFSP", 4, 0, [4, 3, 2, 1], 1, 1], ["AN", 4, 1, 6], ["FU", 2, [0, 1, 2, 3]], ["SP", 2, 0, 54, [1], 1], ["AN", 2, 1, 2], ["FFSP", 2, 0, [4, 3, 2, 1], 1, 1], ["AN", 2, 1, 6], ["PR", 5, 0, "auto_unroll_max_step$64"]]]], "r": [[1.97766e-05], 0, 3.64602, 1682137866], "v": "v0.6"}
{"i": [["[\"conv2d_1\"]", "cuda -keys=cuda,gpu -arch=sm_80 -max_num_threads=1024 -thread_warp_size=32", [-1, 16, 64, 49152, 2147483647, 1024, 8, 32], "", 0, []], [[], [["CI", 5], ["SP", 3, 0, 1, [1, 1, 1, 1], 1], ["SP", 3, 5, 32, [1, 8, 4, 1], 1], ["SP", 3, 10, 224, [1, 4, 2, 4], 1], ["SP", 3, 15, 224, [2, 4, 4, 1], 1], ["SP", 3, 20, 3, [3, 1], 1], ["SP", 3, 23, 3, [1, 3], 1], ["SP", 3, 26, 3, [1, 3], 1], ["RE", 3, [0, 5, 10, 15, 1, 6, 11, 16, 2, 7, 12, 17, 20, 23, 26, 21, 24, 27, 3, 8, 13, 18, 22, 25, 28, 4, 9, 14, 19]], ["FSP", 6, 0, 1, 3], ["FSP", 6, 4, 2, 3], ["FSP", 6, 8, 3, 3], ["FSP", 6, 12, 4, 3], ["RE", 6, [0, 4, 8, 12, 1, 5, 9, 13, 2, 6, 10, 14, 3, 7, 11, 15]], ["CA", 3, 6, 11], ["CHR", 2, "shared", [3]], ["CA", 3, 4, 14], ["CHR", 1, "shared", [4]], ["CA", 2, 5, 14], ["CI", 1], ["FU", 8, [0, 1, 2, 3]], ["AN", 8, 0, 5], ["FU", 8, [1, 2, 3, 4]], ["AN", 8, 1, 4], ["FU", 8, [2, 3, 4, 5]], ["AN", 8, 2, 6], ["FU", 4, [0, 1, 2, 3]], ["SP", 4, 0, 108, [1], 1], ["AN", 4, 1, 2], ["FFSP", 4, 0, [4, 3, 2, 1], 1, 1], ["AN", 4, 1, 6], ["FU", 2, [0, 1, 2, 3]], ["SP", 2, 0, 180, [1], 1], ["AN", 2, 1, 2], ["FFSP", 2, 0, [4, 3, 2, 1], 1, 1], ["AN", 2, 1, 6], ["PR", 5, 0, "auto_unroll_max_step$0"]]]], "r": [[5.06658e-05], 0, 4.26537, 1682137867], "v": "v0.6"}
{"i": [["[\"conv2d_1\"]", "cuda -keys=cuda,gpu -arch=sm_80 -max_num_threads=1024 -thread_warp_size=32", [-1, 16, 64, 49152, 2147483647, 1024, 8, 32], "", 0, []], [[], [["CI", 5], ["SP", 3, 0, 1, [1, 1, 1, 1], 1], ["SP", 3, 5, 32, [2, 2, 2, 4], 1], ["SP", 3, 10, 224, [1, 16, 2, 1], 1], ["SP", 3, 15, 224, [2, 1, 4, 4], 1], ["SP", 3, 20, 3, [1, 3], 1], ["SP", 3, 23, 3, [1, 3], 1], ["SP", 3, 26, 3, [1, 3], 1], ["RE", 3, [0, 5, 10, 15, 1, 6, 11, 16, 2, 7, 12, 17, 20, 23, 26, 21, 24, 27, 3, 8, 13, 18, 22, 25, 28, 4, 9, 14, 19]], ["FSP", 6, 0, 1, 3], ["FSP", 6, 4, 2, 3], ["FSP", 6, 8, 3, 3], ["FSP", 6, 12, 4, 3], ["RE", 6, [0, 4, 8, 12, 1, 5, 9, 13, 2, 6, 10, 14, 3, 7, 11, 15]], ["CA", 3, 6, 11], ["CHR", 2, "shared", [3]], ["CA", 3, 4, 14], ["CHR", 1, "shared", [4]], ["CA", 2, 5, 14], ["CI", 1], ["FU", 8, [0, 1, 2, 3]], ["AN", 8, 0, 5], ["FU", 8, [1, 2, 3, 4]], ["AN", 8, 1, 4], ["FU", 8, [2, 3, 4, 5]], ["AN", 8, 2, 6], ["FU", 4, [0, 1, 2, 3]], ["SP", 4, 0, 216, [1], 1], ["AN", 4, 1, 2], ["FFSP", 4, 0, [4, 3, 2, 1], 1, 1], ["AN", 4, 1, 6], ["FU", 2, [0, 1, 2, 3]], ["SP", 2, 0, 216, [1], 1], ["AN", 2, 1, 2], ["FFSP", 2, 0, [4, 3, 2, 1], 1, 1], ["AN", 2, 1, 6], ["PR", 5, 0, "auto_unroll_max_step$64"]]]], "r": [[0.000154162], 0, 9.13778, 1682137869], "v": "v0.6"}
{"i": [["[\"conv2d_1\"]", "cuda -keys=cuda,gpu -arch=sm_80 -max_num_threads=1024 -thread_warp_size=32", [-1, 16, 64, 49152, 2147483647, 1024, 8, 32], "", 0, []], [[], [["CI", 5], ["SP", 3, 0, 1, [1, 1, 1, 1], 1], ["SP", 3, 5, 32, [4, 1, 2, 4], 1], ["SP", 3, 10, 224, [1, 32, 1, 1], 1], ["SP", 3, 15, 224, [1, 2, 2, 8], 1], ["SP", 3, 20, 3, [1, 3], 1], ["SP", 3, 23, 3, [3, 1], 1], ["SP", 3, 26, 3, [1, 1], 1], ["RE", 3, [0, 5, 10, 15, 1, 6, 11, 16, 2, 7, 12, 17, 20, 23, 26, 21, 24, 27, 3, 8, 13, 18, 22, 25, 28, 4, 9, 14, 19]], ["FSP", 6, 0, 1, 3], ["FSP", 6, 4, 2, 3], ["FSP", 6, 8, 3, 3], ["FSP", 6, 12, 4, 3], ["RE", 6, [0, 4, 8, 12, 1, 5, 9, 13, 2, 6, 10, 14, 3, 7, 11, 15]], ["CA", 3, 6, 11], ["CHR", 2, "shared", [3]], ["CA", 3, 4, 14], ["CHR", 1, "shared", [4]], ["CA", 2, 5, 14], ["CI", 1], ["FU", 8, [0, 1, 2, 3]], ["AN", 8, 0, 5], ["FU", 8, [1, 2, 3, 4]], ["AN", 8, 1, 4], ["FU", 8, [2, 3, 4, 5]], ["AN", 8, 2, 6], ["FU", 4, [0, 1, 2, 3]], ["SP", 4, 0, 72, [1], 1], ["AN", 4, 1, 2], ["FFSP", 4, 0, [4, 3, 2, 1], 1, 1], ["AN", 4, 1, 6], ["FU", 2, [0, 1, 2, 3]], ["SP", 2, 0, 144, [1], 1], ["AN", 2, 1, 2], ["FFSP", 2, 0, [4, 3, 2, 1], 1, 1], ["AN", 2, 1, 6], ["PR", 5, 0, "auto_unroll_max_step$16"]]]], "r": [[0.000119995], 0, 4.25118, 1682137870], "v": "v0.6"}
{"i": [["[\"conv2d_1\"]", "cuda -keys=cuda,gpu -arch=sm_80 -max_num_threads=1024 -thread_warp_size=32", [-1, 16, 64, 49152, 2147483647, 1024, 8, 32], "", 0, []], [[], [["CI", 5], ["SP", 3, 0, 1, [1, 1, 1, 1], 1], ["SP", 3, 5, 32, [1, 16, 2, 1], 1], ["SP", 3, 10, 224, [2, 8, 2, 1], 1], ["SP", 3, 15, 224, [1, 2, 8, 2], 1], ["SP", 3, 20, 3, [3, 1], 1], ["SP", 3, 23, 3, [1, 3], 1], ["SP", 3, 26, 3, [1, 3], 1], ["RE", 3, [0, 5, 10, 15, 1, 6, 11, 16, 2, 7, 12, 17, 20, 23, 26, 21, 24, 27, 3, 8, 13, 18, 22, 25, 28, 4, 9, 14, 19]], ["FSP", 6, 0, 1, 3], ["FSP", 6, 4, 2, 3], ["FSP", 6, 8, 3, 3], ["FSP", 6, 12, 4, 3], ["RE", 6, [0, 4, 8, 12, 1, 5, 9, 13, 2, 6, 10, 14, 3, 7, 11, 15]], ["CA", 3, 6, 11], ["CHR", 2, "shared", [3]], ["CA", 3, 4, 14], ["CHR", 1, "shared", [4]], ["CA", 2, 5, 14], ["CI", 1], ["FU", 8, [0, 1, 2, 3]], ["AN", 8, 0, 5], ["FU", 8, [1, 2, 3, 4]], ["AN", 8, 1, 4], ["FU", 8, [2, 3, 4, 5]], ["AN", 8, 2, 6], ["FU", 4, [0, 1, 2, 3]], ["SP", 4, 0, 54, [1], 1], ["AN", 4, 1, 2], ["FFSP", 4, 0, [4, 3, 2, 1], 1, 1], ["AN", 4, 1, 6], ["FU", 2, [0, 1, 2, 3]], ["SP", 2, 0, 216, [1], 1], ["AN", 2, 1, 2], ["FFSP", 2, 0, [4, 3, 2, 1], 1, 1], ["AN", 2, 1, 6], ["PR", 5, 0, "auto_unroll_max_step$0"]]]], "r": [[8.31624e-05], 0, 3.66034, 1682137872], "v": "v0.6"}
{"i": [["[\"conv2d_1\"]", "cuda -keys=cuda,gpu -arch=sm_80 -max_num_threads=1024 -thread_warp_size=32", [-1, 16, 64, 49152, 2147483647, 1024, 8, 32], "", 0, []], [[], [["CI", 5], ["SP", 3, 0, 1, [1, 1, 1, 1], 1], ["SP", 3, 5, 32, [1, 16, 1, 2], 1], ["SP", 3, 10, 224, [4, 1, 2, 4], 1], ["SP", 3, 15, 224, [1, 2, 16, 1], 1], ["SP", 3, 20, 3, [1, 3], 1], ["SP", 3, 23, 3, [1, 3], 1], ["SP", 3, 26, 3, [1, 1], 1], ["RE", 3, [0, 5, 10, 15, 1, 6, 11, 16, 2, 7, 12, 17, 20, 23, 26, 21, 24, 27, 3, 8, 13, 18, 22, 25, 28, 4, 9, 14, 19]], ["FSP", 6, 0, 1, 3], ["FSP", 6, 4, 2, 3], ["FSP", 6, 8, 3, 3], ["FSP", 6, 12, 4, 3], ["RE", 6, [0, 4, 8, 12, 1, 5, 9, 13, 2, 6, 10, 14, 3, 7, 11, 15]], ["CA", 3, 6, 11], ["CHR", 2, "shared", [3]], ["CA", 3, 4, 14], ["CHR", 1, "shared", [4]], ["CA", 2, 5, 14], ["CI", 1], ["FU", 8, [0, 1, 2, 3]], ["AN", 8, 0, 5], ["FU", 8, [1, 2, 3, 4]], ["AN", 8, 1, 4], ["FU", 8, [2, 3, 4, 5]], ["AN", 8, 2, 6], ["FU", 4, [0, 1, 2, 3]], ["SP", 4, 0, 18, [1], 1], ["AN", 4, 1, 2], ["FFSP", 4, 0, [4, 3, 2, 1], 1, 1], ["AN", 4, 1, 6], ["FU", 2, [0, 1, 2, 3]], ["SP", 2, 0, 480, [1], 1], ["AN", 2, 1, 2], ["FFSP", 2, 0, [4, 3, 2, 1], 1, 1], ["AN", 2, 1, 6], ["PR", 5, 0, "auto_unroll_max_step$1024"]]]], "r": [[0.000118196], 0, 14.2457, 1682137873], "v": "v0.6"}
{"i": [["[\"conv2d_1\"]", "cuda -keys=cuda,gpu -arch=sm_80 -max_num_threads=1024 -thread_warp_size=32", [-1, 16, 64, 49152, 2147483647, 1024, 8, 32], "", 0, []], [[], [["CI", 5], ["SP", 3, 0, 1, [1, 1, 1, 1], 1], ["SP", 3, 5, 32, [1, 4, 2, 4], 1], ["SP", 3, 10, 224, [8, 2, 2, 1], 1], ["SP", 3, 15, 224, [1, 8, 1, 4], 1], ["SP", 3, 20, 3, [1, 1], 1], ["SP", 3, 23, 3, [1, 1], 1], ["SP", 3, 26, 3, [1, 3], 1], ["RE", 3, [0, 5, 10, 15, 1, 6, 11, 16, 2, 7, 12, 17, 20, 23, 26, 21, 24, 27, 3, 8, 13, 18, 22, 25, 28, 4, 9, 14, 19]], ["FSP", 6, 0, 1, 3], ["FSP", 6, 4, 2, 3], ["FSP", 6, 8, 3, 3], ["FSP", 6, 12, 4, 3], ["RE", 6, [0, 4, 8, 12, 1, 5, 9, 13, 2, 6, 10, 14, 3, 7, 11, 15]], ["CA", 3, 6, 11], ["CHR", 2, "shared", [3]], ["CA", 3, 4, 14], ["CHR", 1, "shared", [4]], ["CA", 2, 5, 14], ["CI", 1], ["FU", 8, [0, 1, 2, 3]], ["AN", 8, 0, 5], ["FU", 8, [1, 2, 3, 4]], ["AN", 8, 1, 4], ["FU", 8, [2, 3, 4, 5]], ["AN", 8, 2, 6], ["FU", 4, [0, 1, 2, 3]], ["SP", 4, 0, 24, [1], 1], ["AN", 4, 1, 2], ["FFSP", 4, 0, [4, 3, 2, 1], 1, 1], ["AN", 4, 1, 6], ["FU", 2, [0, 1, 2, 3]], ["SP", 2, 0, 12, [1], 1], ["AN", 2, 1, 2], ["FFSP", 2, 0, [4, 3, 2, 1], 1, 1], ["AN", 2, 1, 6], ["PR", 5, 0, "auto_unroll_max_step$64"]]]], "r": [[8.63281e-05], 0, 6.51083, 1682137875], "v": "v0.6"}
{"i": [["[\"conv2d_1\"]", "cuda -keys=cuda,gpu -arch=sm_80 -max_num_threads=1024 -thread_warp_size=32", [-1, 16, 64, 49152, 2147483647, 1024, 8, 32], "", 0, []], [[], [["CI", 5], ["SP", 3, 0, 1, [1, 1, 1, 1], 1], ["SP", 3, 5, 32, [2, 8, 2, 1], 1], ["SP", 3, 10, 224, [1, 4, 1, 8], 1], ["SP", 3, 15, 224, [1, 16, 1, 2], 1], ["SP", 3, 20, 3, [1, 1], 1], ["SP", 3, 23, 3, [1, 3], 1], ["SP", 3, 26, 3, [1, 3], 1], ["RE", 3, [0, 5, 10, 15, 1, 6, 11, 16, 2, 7, 12, 17, 20, 23, 26, 21, 24, 27, 3, 8, 13, 18, 22, 25, 28, 4, 9, 14, 19]], ["FSP", 6, 0, 1, 3], ["FSP", 6, 4, 2, 3], ["FSP", 6, 8, 3, 3], ["FSP", 6, 12, 4, 3], ["RE", 6, [0, 4, 8, 12, 1, 5, 9, 13, 2, 6, 10, 14, 3, 7, 11, 15]], ["CA", 3, 6, 11], ["CHR", 2, "shared", [3]], ["CA", 3, 4, 14], ["CHR", 1, "shared", [4]], ["CA", 2, 5, 14], ["CI", 1], ["FU", 8, [0, 1, 2, 3]], ["AN", 8, 0, 5], ["FU", 8, [1, 2, 3, 4]], ["AN", 8, 1, 4], ["FU", 8, [2, 3, 4, 5]], ["AN", 8, 2, 6], ["FU", 4, [0, 1, 2, 3]], ["SP", 4, 0, 18, [1], 1], ["AN", 4, 1, 2], ["FFSP", 4, 0, [4, 3, 2, 1], 1, 1], ["AN", 4, 1, 6], ["FU", 2, [0, 1, 2, 3]], ["SP", 2, 0, 40, [1], 1], ["AN", 2, 1, 2], ["FFSP", 2, 0, [4, 3, 2, 1], 1, 1], ["AN", 2, 1, 6], ["PR", 5, 0, "auto_unroll_max_step$1024"]]]], "r": [[2.19966e-05], 0, 7.51202, 1682137876], "v": "v0.6"}
{"i": [["[\"conv2d_1\"]", "cuda -keys=cuda,gpu -arch=sm_80 -max_num_threads=1024 -thread_warp_size=32", [-1, 16, 64, 49152, 2147483647, 1024, 8, 32], "", 0, []], [[], [["CI", 5], ["SP", 3, 0, 1, [1, 1, 1, 1], 1], ["SP", 3, 5, 32, [4, 4, 1, 2], 1], ["SP", 3, 10, 224, [1, 16, 2, 1], 1], ["SP", 3, 15, 224, [1, 8, 1, 4], 1], ["SP", 3, 20, 3, [3, 1], 1], ["SP", 3, 23, 3, [3, 1], 1], ["SP", 3, 26, 3, [1, 3], 1], ["RE", 3, [0, 5, 10, 15, 1, 6, 11, 16, 2, 7, 12, 17, 20, 23, 26, 21, 24, 27, 3, 8, 13, 18, 22, 25, 28, 4, 9, 14, 19]], ["FSP", 6, 0, 1, 3], ["FSP", 6, 4, 2, 3], ["FSP", 6, 8, 3, 3], ["FSP", 6, 12, 4, 3], ["RE", 6, [0, 4, 8, 12, 1, 5, 9, 13, 2, 6, 10, 14, 3, 7, 11, 15]], ["CA", 3, 6, 11], ["CHR", 2, "shared", [3]], ["CA", 3, 4, 14], ["CHR", 1, "shared", [4]], ["CA", 2, 5, 14], ["CI", 1], ["FU", 8, [0, 1, 2, 3]], ["AN", 8, 0, 5], ["FU", 8, [1, 2, 3, 4]], ["AN", 8, 1, 4], ["FU", 8, [2, 3, 4, 5]], ["AN", 8, 2, 6], ["FU", 4, [0, 1, 2, 3]], ["SP", 4, 0, 54, [1], 1], ["AN", 4, 1, 2], ["FFSP", 4, 0, [4, 3, 2, 1], 1, 1], ["AN", 4, 1, 6], ["FU", 2, [0, 1, 2, 3]], ["SP", 2, 0, 72, [1], 1], ["AN", 2, 1, 2], ["FFSP", 2, 0, [4, 3, 2, 1], 1, 1], ["AN", 2, 1, 6], ["PR", 5, 0, "auto_unroll_max_step$1024"]]]], "r": [[2.78366e-05], 0, 9.64584, 1682137878], "v": "v0.6"}
{"i": [["[\"conv2d_1\"]", "cuda -keys=cuda,gpu -arch=sm_80 -max_num_threads=1024 -thread_warp_size=32", [-1, 16, 64, 49152, 2147483647, 1024, 8, 32], "", 0, []], [[], [["CI", 5], ["SP", 3, 0, 1, [1, 1, 1, 1], 1], ["SP", 3, 5, 32, [4, 2, 2, 2], 1], ["SP", 3, 10, 224, [1, 16, 2, 1], 1], ["SP", 3, 15, 224, [1, 1, 2, 16], 1], ["SP", 3, 20, 3, [1, 3], 1], ["SP", 3, 23, 3, [1, 1], 1], ["SP", 3, 26, 3, [1, 3], 1], ["RE", 3, [0, 5, 10, 15, 1, 6, 11, 16, 2, 7, 12, 17, 20, 23, 26, 21, 24, 27, 3, 8, 13, 18, 22, 25, 28, 4, 9, 14, 19]], ["FSP", 6, 0, 1, 3], ["FSP", 6, 4, 2, 3], ["FSP", 6, 8, 3, 3], ["FSP", 6, 12, 4, 3], ["RE", 6, [0, 4, 8, 12, 1, 5, 9, 13, 2, 6, 10, 14, 3, 7, 11, 15]], ["CA", 3, 6, 11], ["CHR", 2, "shared", [3]], ["CA", 3, 4, 14], ["CHR", 1, "shared", [4]], ["CA", 2, 5, 14], ["CI", 1], ["FU", 8, [0, 1, 2, 3]], ["AN", 8, 0, 5], ["FU", 8, [1, 2, 3, 4]], ["AN", 8, 1, 4], ["FU", 8, [2, 3, 4, 5]], ["AN", 8, 2, 6], ["FU", 4, [0, 1, 2, 3]], ["SP", 4, 0, 36, [1], 1], ["AN", 4, 1, 2], ["FFSP", 4, 0, [4, 3, 2, 1], 1, 1], ["AN", 4, 1, 6], ["FU", 2, [0, 1, 2, 3]], ["SP", 2, 0, 204, [1], 1], ["AN", 2, 1, 2], ["FFSP", 2, 0, [4, 3, 2, 1], 1, 1], ["AN", 2, 1, 6], ["PR", 5, 0, "auto_unroll_max_step$64"]]]], "r": [[0.000207521], 0, 10.991, 1682137879], "v": "v0.6"}
{"i": [["[\"conv2d_1\"]", "cuda -keys=cuda,gpu -arch=sm_80 -max_num_threads=1024 -thread_warp_size=32", [-1, 16, 64, 49152, 2147483647, 1024, 8, 32], "", 0, []], [[], [["CI", 5], ["SP", 3, 0, 1, [1, 1, 1, 1], 1], ["SP", 3, 5, 32, [4, 4, 1, 2], 1], ["SP", 3, 10, 224, [1, 8, 4, 1], 1], ["SP", 3, 15, 224, [2, 1, 2, 8], 1], ["SP", 3, 20, 3, [1, 3], 1], ["SP", 3, 23, 3, [1, 3], 1], ["SP", 3, 26, 3, [1, 3], 1], ["RE", 3, [0, 5, 10, 15, 1, 6, 11, 16, 2, 7, 12, 17, 20, 23, 26, 21, 24, 27, 3, 8, 13, 18, 22, 25, 28, 4, 9, 14, 19]], ["FSP", 6, 0, 1, 3], ["FSP", 6, 4, 2, 3], ["FSP", 6, 8, 3, 3], ["FSP", 6, 12, 4, 3], ["RE", 6, [0, 4, 8, 12, 1, 5, 9, 13, 2, 6, 10, 14, 3, 7, 11, 15]], ["CA", 3, 6, 11], ["CHR", 2, "shared", [3]], ["CA", 3, 4, 14], ["CHR", 1, "shared", [4]], ["CA", 2, 5, 14], ["CI", 1], ["FU", 8, [0, 1, 2, 3]], ["AN", 8, 0, 5], ["FU", 8, [1, 2, 3, 4]], ["AN", 8, 1, 4], ["FU", 8, [2, 3, 4, 5]], ["AN", 8, 2, 6], ["FU", 4, [0, 1, 2, 3]], ["SP", 4, 0, 54, [1], 1], ["AN", 4, 1, 2], ["FFSP", 4, 0, [4, 3, 2, 1], 1, 1], ["AN", 4, 1, 6], ["FU", 2, [0, 1, 2, 3]], ["SP", 2, 0, 324, [1], 1], ["AN", 2, 1, 2], ["FFSP", 2, 0, [4, 3, 2, 1], 1, 1], ["AN", 2, 1, 6], ["PR", 5, 0, "auto_unroll_max_step$64"]]]], "r": [[0.000151802], 0, 10.2386, 1682137881], "v": "v0.6"}
{"i": [["[\"conv2d_1\"]", "cuda -keys=cuda,gpu -arch=sm_80 -max_num_threads=1024 -thread_warp_size=32", [-1, 16, 64, 49152, 2147483647, 1024, 8, 32], "", 0, []], [[], [["CI", 5], ["SP", 3, 0, 1, [1, 1, 1, 1], 1], ["SP", 3, 5, 32, [1, 16, 1, 2], 1], ["SP", 3, 10, 224, [2, 1, 2, 8], 1], ["SP", 3, 15, 224, [2, 4, 4, 1], 1], ["SP", 3, 20, 3, [1, 3], 1], ["SP", 3, 23, 3, [3, 1], 1], ["SP", 3, 26, 3, [1, 3], 1], ["RE", 3, [0, 5, 10, 15, 1, 6, 11, 16, 2, 7, 12, 17, 20, 23, 26, 21, 24, 27, 3, 8, 13, 18, 22, 25, 28, 4, 9, 14, 19]], ["FSP", 6, 0, 1, 3], ["FSP", 6, 4, 2, 3], ["FSP", 6, 8, 3, 3], ["FSP", 6, 12, 4, 3], ["RE", 6, [0, 4, 8, 12, 1, 5, 9, 13, 2, 6, 10, 14, 3, 7, 11, 15]], ["CA", 3, 6, 11], ["CHR", 2, "shared", [3]], ["CA", 3, 4, 14], ["CHR", 1, "shared", [4]], ["CA", 2, 5, 14], ["CI", 1], ["FU", 8, [0, 1, 2, 3]], ["AN", 8, 0, 5], ["FU", 8, [1, 2, 3, 4]], ["AN", 8, 1, 4], ["FU", 8, [2, 3, 4, 5]], ["AN", 8, 2, 6], ["FU", 4, [0, 1, 2, 3]], ["SP", 4, 0, 54, [1], 1], ["AN", 4, 1, 2], ["FFSP", 4, 0, [4, 3, 2, 1], 1, 1], ["AN", 4, 1, 6], ["FU", 2, [0, 1, 2, 3]], ["SP", 2, 0, 324, [1], 1], ["AN", 2, 1, 2], ["FFSP", 2, 0, [4, 3, 2, 1], 1, 1], ["AN", 2, 1, 6], ["PR", 5, 0, "auto_unroll_max_step$64"]]]], "r": [[6.4617e-05], 0, 15.2973, 1682137882], "v": "v0.6"}
{"i": [["[\"conv2d_1\"]", "cuda -keys=cuda,gpu -arch=sm_80 -max_num_threads=1024 -thread_warp_size=32", [-1, 16, 64, 49152, 2147483647, 1024, 8, 32], "", 0, []], [[], [["CI", 5], ["SP", 3, 0, 1, [1, 1, 1, 1], 1], ["SP", 3, 5, 32, [1, 8, 1, 4], 1], ["SP", 3, 10, 224, [1, 32, 1, 1], 1], ["SP", 3, 15, 224, [2, 2, 4, 2], 1], ["SP", 3, 20, 3, [3, 1], 1], ["SP", 3, 23, 3, [1, 1], 1], ["SP", 3, 26, 3, [3, 1], 1], ["RE", 3, [0, 5, 10, 15, 1, 6, 11, 16, 2, 7, 12, 17, 20, 23, 26, 21, 24, 27, 3, 8, 13, 18, 22, 25, 28, 4, 9, 14, 19]], ["FSP", 6, 0, 1, 3], ["FSP", 6, 4, 2, 3], ["FSP", 6, 8, 3, 3], ["FSP", 6, 12, 4, 3], ["RE", 6, [0, 4, 8, 12, 1, 5, 9, 13, 2, 6, 10, 14, 3, 7, 11, 15]], ["CA", 3, 6, 11], ["CHR", 2, "shared", [3]], ["CA", 3, 4, 14], ["CHR", 1, "shared", [4]], ["CA", 2, 5, 14], ["CI", 1], ["FU", 8, [0, 1, 2, 3]], ["AN", 8, 0, 5], ["FU", 8, [1, 2, 3, 4]], ["AN", 8, 1, 4], ["FU", 8, [2, 3, 4, 5]], ["AN", 8, 2, 6], ["FU", 4, [0, 1, 2, 3]], ["SP", 4, 0, 36, [1], 1], ["AN", 4, 1, 2], ["FFSP", 4, 0, [4, 3, 2, 1], 1, 1], ["AN", 4, 1, 6], ["FU", 2, [0, 1, 2, 3]], ["SP", 2, 0, 30, [1], 1], ["AN", 2, 1, 2], ["FFSP", 2, 0, [4, 3, 2, 1], 1, 1], ["AN", 2, 1, 6], ["PR", 5, 0, "auto_unroll_max_step$1024"]]]], "r": [[5.24697e-05], 0, 8.41081, 1682137884], "v": "v0.6"}
{"i": [["[\"conv2d_1\"]", "cuda -keys=cuda,gpu -arch=sm_80 -max_num_threads=1024 -thread_warp_size=32", [-1, 16, 64, 49152, 2147483647, 1024, 8, 32], "", 0, []], [[], [["CI", 5], ["SP", 3, 0, 1, [1, 1, 1, 1], 1], ["SP", 3, 5, 32, [1, 2, 8, 2], 1], ["SP", 3, 10, 224, [2, 4, 2, 2], 1], ["SP", 3, 15, 224, [1, 8, 2, 2], 1], ["SP", 3, 20, 3, [1, 3], 1], ["SP", 3, 23, 3, [1, 3], 1], ["SP", 3, 26, 3, [1, 1], 1], ["RE", 3, [0, 5, 10, 15, 1, 6, 11, 16, 2, 7, 12, 17, 20, 23, 26, 21, 24, 27, 3, 8, 13, 18, 22, 25, 28, 4, 9, 14, 19]], ["FSP", 6, 0, 1, 3], ["FSP", 6, 4, 2, 3], ["FSP", 6, 8, 3, 3], ["FSP", 6, 12, 4, 3], ["RE", 6, [0, 4, 8, 12, 1, 5, 9, 13, 2, 6, 10, 14, 3, 7, 11, 15]], ["CA", 3, 6, 11], ["CHR", 2, "shared", [3]], ["CA", 3, 4, 14], ["CHR", 1, "shared", [4]], ["CA", 2, 5, 14], ["CI", 1], ["FU", 8, [0, 1, 2, 3]], ["AN", 8, 0, 5], ["FU", 8, [1, 2, 3, 4]], ["AN", 8, 1, 4], ["FU", 8, [2, 3, 4, 5]], ["AN", 8, 2, 6], ["FU", 4, [0, 1, 2, 3]], ["SP", 4, 0, 144, [1], 1], ["AN", 4, 1, 2], ["FFSP", 4, 0, [4, 3, 2, 1], 1, 1], ["AN", 4, 1, 6], ["FU", 2, [0, 1, 2, 3]], ["SP", 2, 0, 72, [1], 1], ["AN", 2, 1, 2], ["FFSP", 2, 0, [4, 3, 2, 1], 1, 1], ["AN", 2, 1, 6], ["PR", 5, 0, "auto_unroll_max_step$0"]]]], "r": [[8.03991e-05], 0, 5.56567, 1682137910], "v": "v0.6"}
{"i": [["[\"conv2d_1\"]", "cuda -keys=cuda,gpu -arch=sm_80 -max_num_threads=1024 -thread_warp_size=32", [-1, 16, 64, 49152, 2147483647, 1024, 8, 32], "", 0, []], [[], [["CI", 5], ["SP", 3, 0, 1, [1, 1, 1, 1], 1], ["SP", 3, 5, 32, [2, 8, 2, 1], 1], ["SP", 3, 10, 224, [1, 1, 8, 4], 1], ["SP", 3, 15, 224, [1, 16, 2, 1], 1], ["SP", 3, 20, 3, [3, 1], 1], ["SP", 3, 23, 3, [1, 1], 1], ["SP", 3, 26, 3, [1, 1], 1], ["RE", 3, [0, 5, 10, 15, 1, 6, 11, 16, 2, 7, 12, 17, 20, 23, 26, 21, 24, 27, 3, 8, 13, 18, 22, 25, 28, 4, 9, 14, 19]], ["FSP", 6, 0, 1, 3], ["FSP", 6, 4, 2, 3], ["FSP", 6, 8, 3, 3], ["FSP", 6, 12, 4, 3], ["RE", 6, [0, 4, 8, 12, 1, 5, 9, 13, 2, 6, 10, 14, 3, 7, 11, 15]], ["CA", 3, 6, 11], ["CHR", 2, "shared", [3]], ["CA", 3, 4, 14], ["CHR", 1, "shared", [4]], ["CA", 2, 5, 14], ["CI", 1], ["FU", 8, [0, 1, 2, 3]], ["AN", 8, 0, 5], ["FU", 8, [1, 2, 3, 4]], ["AN", 8, 1, 4], ["FU", 8, [2, 3, 4, 5]], ["AN", 8, 2, 6], ["FU", 4, [0, 1, 2, 3]], ["SP", 4, 0, 6, [1], 1], ["AN", 4, 1, 2], ["FFSP", 4, 0, [4, 3, 2, 1], 1, 1], ["AN", 4, 1, 6], ["FU", 2, [0, 1, 2, 3]], ["SP", 2, 0, 192, [1], 1], ["AN", 2, 1, 2], ["FFSP", 2, 0, [4, 3, 2, 1], 1, 1], ["AN", 2, 1, 6], ["PR", 5, 0, "auto_unroll_max_step$0"]]]], "r": [[4.69822e-05], 0, 5.06041, 1682137911], "v": "v0.6"}
{"i": [["[\"conv2d_1\"]", "cuda -keys=cuda,gpu -arch=sm_80 -max_num_threads=1024 -thread_warp_size=32", [-1, 16, 64, 49152, 2147483647, 1024, 8, 32], "", 0, []], [[], [["CI", 5], ["SP", 3, 0, 1, [1, 1, 1, 1], 1], ["SP", 3, 5, 32, [2, 16, 1, 1], 1], ["SP", 3, 10, 224, [1, 4, 2, 4], 1], ["SP", 3, 15, 224, [1, 2, 1, 16], 1], ["SP", 3, 20, 3, [1, 1], 1], ["SP", 3, 23, 3, [1, 3], 1], ["SP", 3, 26, 3, [3, 1], 1], ["RE", 3, [0, 5, 10, 15, 1, 6, 11, 16, 2, 7, 12, 17, 20, 23, 26, 21, 24, 27, 3, 8, 13, 18, 22, 25, 28, 4, 9, 14, 19]], ["FSP", 6, 0, 1, 3], ["FSP", 6, 4, 2, 3], ["FSP", 6, 8, 3, 3], ["FSP", 6, 12, 4, 3], ["RE", 6, [0, 4, 8, 12, 1, 5, 9, 13, 2, 6, 10, 14, 3, 7, 11, 15]], ["CA", 3, 6, 11], ["CHR", 2, "shared", [3]], ["CA", 3, 4, 14], ["CHR", 1, "shared", [4]], ["CA", 2, 5, 14], ["CI", 1], ["FU", 8, [0, 1, 2, 3]], ["AN", 8, 0, 5], ["FU", 8, [1, 2, 3, 4]], ["AN", 8, 1, 4], ["FU", 8, [2, 3, 4, 5]], ["AN", 8, 2, 6], ["FU", 4, [0, 1, 2, 3]], ["SP", 4, 0, 9, [1], 1], ["AN", 4, 1, 2], ["FFSP", 4, 0, [4, 3, 2, 1], 1, 1], ["AN", 4, 1, 6], ["FU", 2, [0, 1, 2, 3]], ["SP", 2, 0, 180, [1], 1], ["AN", 2, 1, 2], ["FFSP", 2, 0, [4, 3, 2, 1], 1, 1], ["AN", 2, 1, 6], ["PR", 5, 0, "auto_unroll_max_step$16"]]]], "r": [[0.00012939], 0, 5.73214, 1682137913], "v": "v0.6"}
{"i": [["[\"conv2d_1\"]", "cuda -keys=cuda,gpu -arch=sm_80 -max_num_threads=1024 -thread_warp_size=32", [-1, 16, 64, 49152, 2147483647, 1024, 8, 32], "", 0, []], [[], [["CI", 5], ["SP", 3, 0, 1, [1, 1, 1, 1], 1], ["SP", 3, 5, 32, [1, 16, 2, 1], 1], ["SP", 3, 10, 224, [4, 2, 4, 1], 1], ["SP", 3, 15, 224, [2, 2, 4, 2], 1], ["SP", 3, 20, 3, [1, 3], 1], ["SP", 3, 23, 3, [3, 1], 1], ["SP", 3, 26, 3, [3, 1], 1], ["RE", 3, [0, 5, 10, 15, 1, 6, 11, 16, 2, 7, 12, 17, 20, 23, 26, 21, 24, 27, 3, 8, 13, 18, 22, 25, 28, 4, 9, 14, 19]], ["FSP", 6, 0, 1, 3], ["FSP", 6, 4, 2, 3], ["FSP", 6, 8, 3, 3], ["FSP", 6, 12, 4, 3], ["RE", 6, [0, 4, 8, 12, 1, 5, 9, 13, 2, 6, 10, 14, 3, 7, 11, 15]], ["CA", 3, 6, 11], ["CHR", 2, "shared", [3]], ["CA", 3, 4, 14], ["CHR", 1, "shared", [4]], ["CA", 2, 5, 14], ["CI", 1], ["FU", 8, [0, 1, 2, 3]], ["AN", 8, 0, 5], ["FU", 8, [1, 2, 3, 4]], ["AN", 8, 1, 4], ["FU", 8, [2, 3, 4, 5]], ["AN", 8, 2, 6], ["FU", 4, [0, 1, 2, 3]], ["SP", 4, 0, 54, [1], 1], ["AN", 4, 1, 2], ["FFSP", 4, 0, [4, 3, 2, 1], 1, 1], ["AN", 4, 1, 6], ["FU", 2, [0, 1, 2, 3]], ["SP", 2, 0, 180, [1], 1], ["AN", 2, 1, 2], ["FFSP", 2, 0, [4, 3, 2, 1], 1, 1], ["AN", 2, 1, 6], ["PR", 5, 0, "auto_unroll_max_step$0"]]]], "r": [[0.000124079], 0, 8.90458, 1682137914], "v": "v0.6"}
{"i": [["[\"conv2d_1\"]", "cuda -keys=cuda,gpu -arch=sm_80 -max_num_threads=1024 -thread_warp_size=32", [-1, 16, 64, 49152, 2147483647, 1024, 8, 32], "", 0, []], [[], [["CI", 5], ["SP", 3, 0, 1, [1, 1, 1, 1], 1], ["SP", 3, 5, 32, [1, 16, 1, 2], 1], ["SP", 3, 10, 224, [1, 8, 4, 1], 1], ["SP", 3, 15, 224, [1, 4, 8, 1], 1], ["SP", 3, 20, 3, [3, 1], 1], ["SP", 3, 23, 3, [3, 1], 1], ["SP", 3, 26, 3, [1, 1], 1], ["RE", 3, [0, 5, 10, 15, 1, 6, 11, 16, 2, 7, 12, 17, 20, 23, 26, 21, 24, 27, 3, 8, 13, 18, 22, 25, 28, 4, 9, 14, 19]], ["FSP", 6, 0, 1, 3], ["FSP", 6, 4, 2, 3], ["FSP", 6, 8, 3, 3], ["FSP", 6, 12, 4, 3], ["RE", 6, [0, 4, 8, 12, 1, 5, 9, 13, 2, 6, 10, 14, 3, 7, 11, 15]], ["CA", 3, 6, 11], ["CHR", 2, "shared", [3]], ["CA", 3, 4, 14], ["CHR", 1, "shared", [4]], ["CA", 2, 5, 14], ["CI", 1], ["FU", 8, [0, 1, 2, 3]], ["AN", 8, 0, 5], ["FU", 8, [1, 2, 3, 4]], ["AN", 8, 1, 4], ["FU", 8, [2, 3, 4, 5]], ["AN", 8, 2, 6], ["FU", 4, [0, 1, 2, 3]], ["SP", 4, 0, 18, [1], 1], ["AN", 4, 1, 2], ["FFSP", 4, 0, [4, 3, 2, 1], 1, 1], ["AN", 4, 1, 6], ["FU", 2, [0, 1, 2, 3]], ["SP", 2, 0, 144, [1], 1], ["AN", 2, 1, 2], ["FFSP", 2, 0, [4, 3, 2, 1], 1, 1], ["AN", 2, 1, 6], ["PR", 5, 0, "auto_unroll_max_step$0"]]]], "r": [[4.82235e-05], 0, 4.82208, 1682137916], "v": "v0.6"}
{"i": [["[\"conv2d_1\"]", "cuda -keys=cuda,gpu -arch=sm_80 -max_num_threads=1024 -thread_warp_size=32", [-1, 16, 64, 49152, 2147483647, 1024, 8, 32], "", 0, []], [[], [["CI", 5], ["SP", 3, 0, 1, [1, 1, 1, 1], 1], ["SP", 3, 5, 32, [1, 8, 1, 4], 1], ["SP", 3, 10, 224, [4, 2, 1, 4], 1], ["SP", 3, 15, 224, [1, 16, 1, 2], 1], ["SP", 3, 20, 3, [1, 3], 1], ["SP", 3, 23, 3, [3, 1], 1], ["SP", 3, 26, 3, [3, 1], 1], ["RE", 3, [0, 5, 10, 15, 1, 6, 11, 16, 2, 7, 12, 17, 20, 23, 26, 21, 24, 27, 3, 8, 13, 18, 22, 25, 28, 4, 9, 14, 19]], ["FSP", 6, 0, 1, 3], ["FSP", 6, 4, 2, 3], ["FSP", 6, 8, 3, 3], ["FSP", 6, 12, 4, 3], ["RE", 6, [0, 4, 8, 12, 1, 5, 9, 13, 2, 6, 10, 14, 3, 7, 11, 15]], ["CA", 3, 6, 11], ["CHR", 2, "shared", [3]], ["CA", 3, 4, 14], ["CHR", 1, "shared", [4]], ["CA", 2, 5, 14], ["CI", 1], ["FU", 8, [0, 1, 2, 3]], ["AN", 8, 0, 5], ["FU", 8, [1, 2, 3, 4]], ["AN", 8, 1, 4], ["FU", 8, [2, 3, 4, 5]], ["AN", 8, 2, 6], ["FU", 4, [0, 1, 2, 3]], ["SP", 4, 0, 108, [1], 1], ["AN", 4, 1, 2], ["FFSP", 4, 0, [4, 3, 2, 1], 1, 1], ["AN", 4, 1, 6], ["FU", 2, [0, 1, 2, 3]], ["SP", 2, 0, 72, [1], 1], ["AN", 2, 1, 2], ["FFSP", 2, 0, [4, 3, 2, 1], 1, 1], ["AN", 2, 1, 6], ["PR", 5, 0, "auto_unroll_max_step$1024"]]]], "r": [[2.18463e-05], 0, 10.9306, 1682137917], "v": "v0.6"}
{"i": [["[\"conv2d_1\"]", "cuda -keys=cuda,gpu -arch=sm_80 -max_num_threads=1024 -thread_warp_size=32", [-1, 16, 64, 49152, 2147483647, 1024, 8, 32], "", 0, []], [[], [["CI", 5], ["SP", 3, 0, 1, [1, 1, 1, 1], 1], ["SP", 3, 5, 32, [1, 32, 1, 1], 1], ["SP", 3, 10, 224, [1, 4, 1, 8], 1], ["SP", 3, 15, 224, [1, 1, 8, 4], 1], ["SP", 3, 20, 3, [3, 1], 1], ["SP", 3, 23, 3, [3, 1], 1], ["SP", 3, 26, 3, [3, 1], 1], ["RE", 3, [0, 5, 10, 15, 1, 6, 11, 16, 2, 7, 12, 17, 20, 23, 26, 21, 24, 27, 3, 8, 13, 18, 22, 25, 28, 4, 9, 14, 19]], ["FSP", 6, 0, 1, 3], ["FSP", 6, 4, 2, 3], ["FSP", 6, 8, 3, 3], ["FSP", 6, 12, 4, 3], ["RE", 6, [0, 4, 8, 12, 1, 5, 9, 13, 2, 6, 10, 14, 3, 7, 11, 15]], ["CA", 3, 6, 11], ["CHR", 2, "shared", [3]], ["CA", 3, 4, 14], ["CHR", 1, "shared", [4]], ["CA", 2, 5, 14], ["CI", 1], ["FU", 8, [0, 1, 2, 3]], ["AN", 8, 0, 5], ["FU", 8, [1, 2, 3, 4]], ["AN", 8, 1, 4], ["FU", 8, [2, 3, 4, 5]], ["AN", 8, 2, 6], ["FU", 4, [0, 1, 2, 3]], ["SP", 4, 0, 27, [1], 1], ["AN", 4, 1, 2], ["FFSP", 4, 0, [4, 3, 2, 1], 1, 1], ["AN", 4, 1, 6], ["FU", 2, [0, 1, 2, 3]], ["SP", 2, 0, 1020, [1], 1], ["AN", 2, 1, 2], ["FFSP", 2, 0, [4, 3, 2, 1], 1, 1], ["AN", 2, 1, 6], ["PR", 5, 0, "auto_unroll_max_step$512"]]]], "r": [[7.37323e-05], 0, 11.5998, 1682137918], "v": "v0.6"}
{"i": [["[\"conv2d_1\"]", "cuda -keys=cuda,gpu -arch=sm_80 -max_num_threads=1024 -thread_warp_size=32", [-1, 16, 64, 49152, 2147483647, 1024, 8, 32], "", 0, []], [[], [["CI", 5], ["SP", 3, 0, 1, [1, 1, 1, 1], 1], ["SP", 3, 5, 32, [2, 4, 1, 4], 1], ["SP", 3, 10, 224, [1, 4, 8, 1], 1], ["SP", 3, 15, 224, [1, 2, 1, 16], 1], ["SP", 3, 20, 3, [1, 1], 1], ["SP", 3, 23, 3, [1, 3], 1], ["SP", 3, 26, 3, [1, 1], 1], ["RE", 3, [0, 5, 10, 15, 1, 6, 11, 16, 2, 7, 12, 17, 20, 23, 26, 21, 24, 27, 3, 8, 13, 18, 22, 25, 28, 4, 9, 14, 19]], ["FSP", 6, 0, 1, 3], ["FSP", 6, 4, 2, 3], ["FSP", 6, 8, 3, 3], ["FSP", 6, 12, 4, 3], ["RE", 6, [0, 4, 8, 12, 1, 5, 9, 13, 2, 6, 10, 14, 3, 7, 11, 15]], ["CA", 3, 6, 11], ["CHR", 2, "shared", [3]], ["CA", 3, 4, 14], ["CHR", 1, "shared", [4]], ["CA", 2, 5, 14], ["CI", 1], ["FU", 8, [0, 1, 2, 3]], ["AN", 8, 0, 5], ["FU", 8, [1, 2, 3, 4]], ["AN", 8, 1, 4], ["FU", 8, [2, 3, 4, 5]], ["AN", 8, 2, 6], ["FU", 4, [0, 1, 2, 3]], ["SP", 4, 0, 12, [1], 1], ["AN", 4, 1, 2], ["FFSP", 4, 0, [4, 3, 2, 1], 1, 1], ["AN", 4, 1, 6], ["FU", 2, [0, 1, 2, 3]], ["SP", 2, 0, 160, [1], 1], ["AN", 2, 1, 2], ["FFSP", 2, 0, [4, 3, 2, 1], 1, 1], ["AN", 2, 1, 6], ["PR", 5, 0, "auto_unroll_max_step$0"]]]], "r": [[0.000127669], 0, 6.3672, 1682137920], "v": "v0.6"}
{"i": [["[\"conv2d_1\"]", "cuda -keys=cuda,gpu -arch=sm_80 -max_num_threads=1024 -thread_warp_size=32", [-1, 16, 64, 49152, 2147483647, 1024, 8, 32], "", 0, []], [[], [["CI", 5], ["SP", 3, 0, 1, [1, 1, 1, 1], 1], ["SP", 3, 5, 32, [1, 32, 1, 1], 1], ["SP", 3, 10, 224, [4, 2, 2, 2], 1], ["SP", 3, 15, 224, [1, 16, 2, 1], 1], ["SP", 3, 20, 3, [3, 1], 1], ["SP", 3, 23, 3, [3, 1], 1], ["SP", 3, 26, 3, [1, 1], 1], ["RE", 3, [0, 5, 10, 15, 1, 6, 11, 16, 2, 7, 12, 17, 20, 23, 26, 21, 24, 27, 3, 8, 13, 18, 22, 25, 28, 4, 9, 14, 19]], ["FSP", 6, 0, 1, 3], ["FSP", 6, 4, 2, 3], ["FSP", 6, 8, 3, 3], ["FSP", 6, 12, 4, 3], ["RE", 6, [0, 4, 8, 12, 1, 5, 9, 13, 2, 6, 10, 14, 3, 7, 11, 15]], ["CA", 3, 6, 11], ["CHR", 2, "shared", [3]], ["CA", 3, 4, 14], ["CHR", 1, "shared", [4]], ["CA", 2, 5, 14], ["CI", 1], ["FU", 8, [0, 1, 2, 3]], ["AN", 8, 0, 5], ["FU", 8, [1, 2, 3, 4]], ["AN", 8, 1, 4], ["FU", 8, [2, 3, 4, 5]], ["AN", 8, 2, 6], ["FU", 4, [0, 1, 2, 3]], ["SP", 4, 0, 9, [1], 1], ["AN", 4, 1, 2], ["FFSP", 4, 0, [4, 3, 2, 1], 1, 1], ["AN", 4, 1, 6], ["FU", 2, [0, 1, 2, 3]], ["SP", 2, 0, 36, [1], 1], ["AN", 2, 1, 2], ["FFSP", 2, 0, [4, 3, 2, 1], 1, 1], ["AN", 2, 1, 6], ["PR", 5, 0, "auto_unroll_max_step$512"]]]], "r": [[2.47322e-05], 0, 8.36277, 1682137921], "v": "v0.6"}
{"i": [["[\"conv2d_1\"]", "cuda -keys=cuda,gpu -arch=sm_80 -max_num_threads=1024 -thread_warp_size=32", [-1, 16, 64, 49152, 2147483647, 1024, 8, 32], "", 0, []], [[], [["CI", 5], ["SP", 3, 0, 1, [1, 1, 1, 1], 1], ["SP", 3, 5, 32, [1, 8, 4, 1], 1], ["SP", 3, 10, 224, [4, 2, 2, 2], 1], ["SP", 3, 15, 224, [1, 2, 4, 4], 1], ["SP", 3, 20, 3, [1, 3], 1], ["SP", 3, 23, 3, [3, 1], 1], ["SP", 3, 26, 3, [1, 1], 1], ["RE", 3, [0, 5, 10, 15, 1, 6, 11, 16, 2, 7, 12, 17, 20, 23, 26, 21, 24, 27, 3, 8, 13, 18, 22, 25, 28, 4, 9, 14, 19]], ["FSP", 6, 0, 1, 3], ["FSP", 6, 4, 2, 3], ["FSP", 6, 8, 3, 3], ["FSP", 6, 12, 4, 3], ["RE", 6, [0, 4, 8, 12, 1, 5, 9, 13, 2, 6, 10, 14, 3, 7, 11, 15]], ["CA", 3, 6, 11], ["CHR", 2, "shared", [3]], ["CA", 3, 4, 14], ["CHR", 1, "shared", [4]], ["CA", 2, 5, 14], ["CI", 1], ["FU", 8, [0, 1, 2, 3]], ["AN", 8, 0, 5], ["FU", 8, [1, 2, 3, 4]], ["AN", 8, 1, 4], ["FU", 8, [2, 3, 4, 5]], ["AN", 8, 2, 6], ["FU", 4, [0, 1, 2, 3]], ["SP", 4, 0, 36, [1], 1], ["AN", 4, 1, 2], ["FFSP", 4, 0, [4, 3, 2, 1], 1, 1], ["AN", 4, 1, 6], ["FU", 2, [0, 1, 2, 3]], ["SP", 2, 0, 288, [1], 1], ["AN", 2, 1, 2], ["FFSP", 2, 0, [4, 3, 2, 1], 1, 1], ["AN", 2, 1, 6], ["PR", 5, 0, "auto_unroll_max_step$16"]]]], "r": [[0.000182136], 0, 7.66239, 1682137923], "v": "v0.6"}
{"i": [["[\"conv2d_1\"]", "cuda -keys=cuda,gpu -arch=sm_80 -max_num_threads=1024 -thread_warp_size=32", [-1, 16, 64, 49152, 2147483647, 1024, 8, 32], "", 0, []], [[], [["CI", 5], ["SP", 3, 0, 1, [1, 1, 1, 1], 1], ["SP", 3, 5, 32, [2, 2, 2, 4], 1], ["SP", 3, 10, 224, [1, 8, 1, 4], 1], ["SP", 3, 15, 224, [4, 8, 1, 1], 1], ["SP", 3, 20, 3, [3, 1], 1], ["SP", 3, 23, 3, [1, 3], 1], ["SP", 3, 26, 3, [1, 3], 1], ["RE", 3, [0, 5, 10, 15, 1, 6, 11, 16, 2, 7, 12, 17, 20, 23, 26, 21, 24, 27, 3, 8, 13, 18, 22, 25, 28, 4, 9, 14, 19]], ["FSP", 6, 0, 1, 3], ["FSP", 6, 4, 2, 3], ["FSP", 6, 8, 3, 3], ["FSP", 6, 12, 4, 3], ["RE", 6, [0, 4, 8, 12, 1, 5, 9, 13, 2, 6, 10, 14, 3, 7, 11, 15]], ["CA", 3, 6, 11], ["CHR", 2, "shared", [3]], ["CA", 3, 4, 14], ["CHR", 1, "shared", [4]], ["CA", 2, 5, 14], ["CI", 1], ["FU", 8, [0, 1, 2, 3]], ["AN", 8, 0, 5], ["FU", 8, [1, 2, 3, 4]], ["AN", 8, 1, 4], ["FU", 8, [2, 3, 4, 5]], ["AN", 8, 2, 6], ["FU", 4, [0, 1, 2, 3]], ["SP", 4, 0, 216, [1], 1], ["AN", 4, 1, 2], ["FFSP", 4, 0, [4, 3, 2, 1], 1, 1], ["AN", 4, 1, 6], ["FU", 2, [0, 1, 2, 3]], ["SP", 2, 0, 54, [1], 1], ["AN", 2, 1, 2], ["FFSP", 2, 0, [4, 3, 2, 1], 1, 1], ["AN", 2, 1, 6], ["PR", 5, 0, "auto_unroll_max_step$64"]]]], "r": [[3.10891e-05], 0, 9.34632, 1682138151], "v": "v0.6"}
{"i": [["[\"conv2d_1\"]", "cuda -keys=cuda,gpu -arch=sm_80 -max_num_threads=1024 -thread_warp_size=32", [-1, 16, 64, 49152, 2147483647, 1024, 8, 32], "", 0, []], [[], [["CI", 5], ["SP", 3, 0, 1, [1, 1, 1, 1], 1], ["SP", 3, 5, 32, [4, 2, 1, 4], 1], ["SP", 3, 10, 224, [2, 4, 4, 1], 1], ["SP", 3, 15, 224, [1, 8, 1, 4], 1], ["SP", 3, 20, 3, [1, 3], 1], ["SP", 3, 23, 3, [1, 3], 1], ["SP", 3, 26, 3, [1, 1], 1], ["RE", 3, [0, 5, 10, 15, 1, 6, 11, 16, 2, 7, 12, 17, 20, 23, 26, 21, 24, 27, 3, 8, 13, 18, 22, 25, 28, 4, 9, 14, 19]], ["FSP", 6, 0, 1, 3], ["FSP", 6, 4, 2, 3], ["FSP", 6, 8, 3, 3], ["FSP", 6, 12, 4, 3], ["RE", 6, [0, 4, 8, 12, 1, 5, 9, 13, 2, 6, 10, 14, 3, 7, 11, 15]], ["CA", 3, 6, 11], ["CHR", 2, "shared", [3]], ["CA", 3, 4, 14], ["CHR", 1, "shared", [4]], ["CA", 2, 5, 14], ["CI", 1], ["FU", 8, [0, 1, 2, 3]], ["AN", 8, 0, 5], ["FU", 8, [1, 2, 3, 4]], ["AN", 8, 1, 4], ["FU", 8, [2, 3, 4, 5]], ["AN", 8, 2, 6], ["FU", 4, [0, 1, 2, 3]], ["SP", 4, 0, 36, [1], 1], ["AN", 4, 1, 2], ["FFSP", 4, 0, [4, 3, 2, 1], 1, 1], ["AN", 4, 1, 6], ["FU", 2, [0, 1, 2, 3]], ["SP", 2, 0, 72, [1], 1], ["AN", 2, 1, 2], ["FFSP", 2, 0, [4, 3, 2, 1], 1, 1], ["AN", 2, 1, 6], ["PR", 5, 0, "auto_unroll_max_step$64"]]]], "r": [[5.1936e-05], 0, 9.88179, 1682138152], "v": "v0.6"}
{"i": [["[\"conv2d_1\"]", "cuda -keys=cuda,gpu -arch=sm_80 -max_num_threads=1024 -thread_warp_size=32", [-1, 16, 64, 49152, 2147483647, 1024, 8, 32], "", 0, []], [[], [["CI", 5], ["SP", 3, 0, 1, [1, 1, 1, 1], 1], ["SP", 3, 5, 32, [2, 8, 2, 1], 1], ["SP", 3, 10, 224, [1, 4, 2, 4], 1], ["SP", 3, 15, 224, [1, 32, 1, 1], 1], ["SP", 3, 20, 3, [1, 1], 1], ["SP", 3, 23, 3, [1, 3], 1], ["SP", 3, 26, 3, [1, 3], 1], ["RE", 3, [0, 5, 10, 15, 1, 6, 11, 16, 2, 7, 12, 17, 20, 23, 26, 21, 24, 27, 3, 8, 13, 18, 22, 25, 28, 4, 9, 14, 19]], ["FSP", 6, 0, 1, 3], ["FSP", 6, 4, 2, 3], ["FSP", 6, 8, 3, 3], ["FSP", 6, 12, 4, 3], ["RE", 6, [0, 4, 8, 12, 1, 5, 9, 13, 2, 6, 10, 14, 3, 7, 11, 15]], ["CA", 3, 6, 11], ["CHR", 2, "shared", [3]], ["CA", 3, 4, 14], ["CHR", 1, "shared", [4]], ["CA", 2, 5, 14], ["CI", 1], ["FU", 8, [0, 1, 2, 3]], ["AN", 8, 0, 5], ["FU", 8, [1, 2, 3, 4]], ["AN", 8, 1, 4], ["FU", 8, [2, 3, 4, 5]], ["AN", 8, 2, 6], ["FU", 4, [0, 1, 2, 3]], ["SP", 4, 0, 18, [1], 1], ["AN", 4, 1, 2], ["FFSP", 4, 0, [4, 3, 2, 1], 1, 1], ["AN", 4, 1, 6], ["FU", 2, [0, 1, 2, 3]], ["SP", 2, 0, 30, [1], 1], ["AN", 2, 1, 2], ["FFSP", 2, 0, [4, 3, 2, 1], 1, 1], ["AN", 2, 1, 6], ["PR", 5, 0, "auto_unroll_max_step$16"]]]], "r": [[2.38909e-05], 0, 4.79038, 1682138154], "v": "v0.6"}
{"i": [["[\"conv2d_1\"]", "cuda -keys=cuda,gpu -arch=sm_80 -max_num_threads=1024 -thread_warp_size=32", [-1, 16, 64, 49152, 2147483647, 1024, 8, 32], "", 0, []], [[], [["CI", 5], ["SP", 3, 0, 1, [1, 1, 1, 1], 1], ["SP", 3, 5, 32, [1, 8, 2, 2], 1], ["SP", 3, 10, 224, [2, 4, 2, 2], 1], ["SP", 3, 15, 224, [1, 1, 8, 4], 1], ["SP", 3, 20, 3, [3, 1], 1], ["SP", 3, 23, 3, [3, 1], 1], ["SP", 3, 26, 3, [1, 3], 1], ["RE", 3, [0, 5, 10, 15, 1, 6, 11, 16, 2, 7, 12, 17, 20, 23, 26, 21, 24, 27, 3, 8, 13, 18, 22, 25, 28, 4, 9, 14, 19]], ["FSP", 6, 0, 1, 3], ["FSP", 6, 4, 2, 3], ["FSP", 6, 8, 3, 3], ["FSP", 6, 12, 4, 3], ["RE", 6, [0, 4, 8, 12, 1, 5, 9, 13, 2, 6, 10, 14, 3, 7, 11, 15]], ["CA", 3, 6, 11], ["CHR", 2, "shared", [3]], ["CA", 3, 4, 14], ["CHR", 1, "shared", [4]], ["CA", 2, 5, 14], ["CI", 1], ["FU", 8, [0, 1, 2, 3]], ["AN", 8, 0, 5], ["FU", 8, [1, 2, 3, 4]], ["AN", 8, 1, 4], ["FU", 8, [2, 3, 4, 5]], ["AN", 8, 2, 6], ["FU", 4, [0, 1, 2, 3]], ["SP", 4, 0, 108, [1], 1], ["AN", 4, 1, 2], ["FFSP", 4, 0, [4, 3, 2, 1], 1, 1], ["AN", 4, 1, 6], ["FU", 2, [0, 1, 2, 3]], ["SP", 2, 0, 612, [1], 1], ["AN", 2, 1, 2], ["FFSP", 2, 0, [4, 3, 2, 1], 1, 1], ["AN", 2, 1, 6], ["PR", 5, 0, "auto_unroll_max_step$64"]]]], "r": [[0.00017369], 0, 10.1962, 1682138155], "v": "v0.6"}
{"i": [["[\"conv2d_1\"]", "cuda -keys=cuda,gpu -arch=sm_80 -max_num_threads=1024 -thread_warp_size=32", [-1, 16, 64, 49152, 2147483647, 1024, 8, 32], "", 0, []], [[], [["CI", 5], ["SP", 3, 0, 1, [1, 1, 1, 1], 1], ["SP", 3, 5, 32, [2, 4, 2, 2], 1], ["SP", 3, 10, 224, [1, 4, 4, 2], 1], ["SP", 3, 15, 224, [4, 8, 1, 1], 1], ["SP", 3, 20, 3, [1, 3], 1], ["SP", 3, 23, 3, [3, 1], 1], ["SP", 3, 26, 3, [1, 3], 1], ["RE", 3, [0, 5, 10, 15, 1, 6, 11, 16, 2, 7, 12, 17, 20, 23, 26, 21, 24, 27, 3, 8, 13, 18, 22, 25, 28, 4, 9, 14, 19]], ["FSP", 6, 0, 1, 3], ["FSP", 6, 4, 2, 3], ["FSP", 6, 8, 3, 3], ["FSP", 6, 12, 4, 3], ["RE", 6, [0, 4, 8, 12, 1, 5, 9, 13, 2, 6, 10, 14, 3, 7, 11, 15]], ["CA", 3, 6, 11], ["CHR", 2, "shared", [3]], ["CA", 3, 4, 14], ["CHR", 1, "shared", [4]], ["CA", 2, 5, 14], ["CI", 1], ["FU", 8, [0, 1, 2, 3]], ["AN", 8, 0, 5], ["FU", 8, [1, 2, 3, 4]], ["AN", 8, 1, 4], ["FU", 8, [2, 3, 4, 5]], ["AN", 8, 2, 6], ["FU", 4, [0, 1, 2, 3]], ["SP", 4, 0, 108, [1], 1], ["AN", 4, 1, 2], ["FFSP", 4, 0, [4, 3, 2, 1], 1, 1], ["AN", 4, 1, 6], ["FU", 2, [0, 1, 2, 3]], ["SP", 2, 0, 90, [1], 1], ["AN", 2, 1, 2], ["FFSP", 2, 0, [4, 3, 2, 1], 1, 1], ["AN", 2, 1, 6], ["PR", 5, 0, "auto_unroll_max_step$16"]]]], "r": [[4.74073e-05], 0, 6.6296, 1682138157], "v": "v0.6"}
{"i": [["[\"conv2d_1\"]", "cuda -keys=cuda,gpu -arch=sm_80 -max_num_threads=1024 -thread_warp_size=32", [-1, 16, 64, 49152, 2147483647, 1024, 8, 32], "", 0, []], [[], [["CI", 5], ["SP", 3, 0, 1, [1, 1, 1, 1], 1], ["SP", 3, 5, 32, [8, 1, 1, 4], 1], ["SP", 3, 10, 224, [1, 8, 1, 4], 1], ["SP", 3, 15, 224, [1, 8, 4, 1], 1], ["SP", 3, 20, 3, [3, 1], 1], ["SP", 3, 23, 3, [1, 1], 1], ["SP", 3, 26, 3, [1, 3], 1], ["RE", 3, [0, 5, 10, 15, 1, 6, 11, 16, 2, 7, 12, 17, 20, 23, 26, 21, 24, 27, 3, 8, 13, 18, 22, 25, 28, 4, 9, 14, 19]], ["FSP", 6, 0, 1, 3], ["FSP", 6, 4, 2, 3], ["FSP", 6, 8, 3, 3], ["FSP", 6, 12, 4, 3], ["RE", 6, [0, 4, 8, 12, 1, 5, 9, 13, 2, 6, 10, 14, 3, 7, 11, 15]], ["CA", 3, 6, 11], ["CHR", 2, "shared", [3]], ["CA", 3, 4, 14], ["CHR", 1, "shared", [4]], ["CA", 2, 5, 14], ["CI", 1], ["FU", 8, [0, 1, 2, 3]], ["AN", 8, 0, 5], ["FU", 8, [1, 2, 3, 4]], ["AN", 8, 1, 4], ["FU", 8, [2, 3, 4, 5]], ["AN", 8, 2, 6], ["FU", 4, [0, 1, 2, 3]], ["SP", 4, 0, 36, [1], 1], ["AN", 4, 1, 2], ["FFSP", 4, 0, [4, 3, 2, 1], 1, 1], ["AN", 4, 1, 6], ["FU", 2, [0, 1, 2, 3]], ["SP", 2, 0, 72, [1], 1], ["AN", 2, 1, 2], ["FFSP", 2, 0, [4, 3, 2, 1], 1, 1], ["AN", 2, 1, 6], ["PR", 5, 0, "auto_unroll_max_step$16"]]]], "r": [[0.000126022], 0, 6.09573, 1682138158], "v": "v0.6"}
{"i": [["[\"conv2d_1\"]", "cuda -keys=cuda,gpu -arch=sm_80 -max_num_threads=1024 -thread_warp_size=32", [-1, 16, 64, 49152, 2147483647, 1024, 8, 32], "", 0, []], [[], [["CI", 5], ["SP", 3, 0, 1, [1, 1, 1, 1], 1], ["SP", 3, 5, 32, [1, 1, 2, 16], 1], ["SP", 3, 10, 224, [1, 4, 2, 4], 1], ["SP", 3, 15, 224, [1, 16, 2, 1], 1], ["SP", 3, 20, 3, [1, 3], 1], ["SP", 3, 23, 3, [3, 1], 1], ["SP", 3, 26, 3, [1, 3], 1], ["RE", 3, [0, 5, 10, 15, 1, 6, 11, 16, 2, 7, 12, 17, 20, 23, 26, 21, 24, 27, 3, 8, 13, 18, 22, 25, 28, 4, 9, 14, 19]], ["FSP", 6, 0, 1, 3], ["FSP", 6, 4, 2, 3], ["FSP", 6, 8, 3, 3], ["FSP", 6, 12, 4, 3], ["RE", 6, [0, 4, 8, 12, 1, 5, 9, 13, 2, 6, 10, 14, 3, 7, 11, 15]], ["CA", 3, 6, 11], ["CHR", 2, "shared", [3]], ["CA", 3, 4, 14], ["CHR", 1, "shared", [4]], ["CA", 2, 5, 14], ["CI", 1], ["FU", 8, [0, 1, 2, 3]], ["AN", 8, 0, 5], ["FU", 8, [1, 2, 3, 4]], ["AN", 8, 1, 4], ["FU", 8, [2, 3, 4, 5]], ["AN", 8, 2, 6], ["FU", 4, [0, 1, 2, 3]], ["SP", 4, 0, 864, [1], 1], ["AN", 4, 1, 2], ["FFSP", 4, 0, [4, 3, 2, 1], 1, 1], ["AN", 4, 1, 6], ["FU", 2, [0, 1, 2, 3]], ["SP", 2, 0, 120, [1], 1], ["AN", 2, 1, 2], ["FFSP", 2, 0, [4, 3, 2, 1], 1, 1], ["AN", 2, 1, 6], ["PR", 5, 0, "auto_unroll_max_step$0"]]]], "r": [[8.4249e-05], 0, 5.55487, 1682138160], "v": "v0.6"}
{"i": [["[\"conv2d_1\"]", "cuda -keys=cuda,gpu -arch=sm_80 -max_num_threads=1024 -thread_warp_size=32", [-1, 16, 64, 49152, 2147483647, 1024, 8, 32], "", 0, []], [[], [["CI", 5], ["SP", 3, 0, 1, [1, 1, 1, 1], 1], ["SP", 3, 5, 32, [1, 4, 1, 8], 1], ["SP", 3, 10, 224, [1, 1, 1, 32], 1], ["SP", 3, 15, 224, [2, 8, 2, 1], 1], ["SP", 3, 20, 3, [1, 1], 1], ["SP", 3, 23, 3, [1, 3], 1], ["SP", 3, 26, 3, [3, 1], 1], ["RE", 3, [0, 5, 10, 15, 1, 6, 11, 16, 2, 7, 12, 17, 20, 23, 26, 21, 24, 27, 3, 8, 13, 18, 22, 25, 28, 4, 9, 14, 19]], ["FSP", 6, 0, 1, 3], ["FSP", 6, 4, 2, 3], ["FSP", 6, 8, 3, 3], ["FSP", 6, 12, 4, 3], ["RE", 6, [0, 4, 8, 12, 1, 5, 9, 13, 2, 6, 10, 14, 3, 7, 11, 15]], ["CA", 3, 6, 11], ["CHR", 2, "shared", [3]], ["CA", 3, 4, 14], ["CHR", 1, "shared", [4]], ["CA", 2, 5, 14], ["CI", 1], ["FU", 8, [0, 1, 2, 3]], ["AN", 8, 0, 5], ["FU", 8, [1, 2, 3, 4]], ["AN", 8, 1, 4], ["FU", 8, [2, 3, 4, 5]], ["AN", 8, 2, 6], ["FU", 4, [0, 1, 2, 3]], ["SP", 4, 0, 72, [1], 1], ["AN", 4, 1, 2], ["FFSP", 4, 0, [4, 3, 2, 1], 1, 1], ["AN", 4, 1, 6], ["FU", 2, [0, 1, 2, 3]], ["SP", 2, 0, 136, [1], 1], ["AN", 2, 1, 2], ["FFSP", 2, 0, [4, 3, 2, 1], 1, 1], ["AN", 2, 1, 6], ["PR", 5, 0, "auto_unroll_max_step$16"]]]], "r": [[0.000676023], 0, 6.3384, 1682138161], "v": "v0.6"}
{"i": [["[\"conv2d_1\"]", "cuda -keys=cuda,gpu -arch=sm_80 -max_num_threads=1024 -thread_warp_size=32", [-1, 16, 64, 49152, 2147483647, 1024, 8, 32], "", 0, []], [[], [["CI", 5], ["SP", 3, 0, 1, [1, 1, 1, 1], 1], ["SP", 3, 5, 32, [2, 4, 2, 2], 1], ["SP", 3, 10, 224, [1, 1, 8, 4], 1], ["SP", 3, 15, 224, [1, 16, 2, 1], 1], ["SP", 3, 20, 3, [3, 1], 1], ["SP", 3, 23, 3, [1, 1], 1], ["SP", 3, 26, 3, [3, 1], 1], ["RE", 3, [0, 5, 10, 15, 1, 6, 11, 16, 2, 7, 12, 17, 20, 23, 26, 21, 24, 27, 3, 8, 13, 18, 22, 25, 28, 4, 9, 14, 19]], ["FSP", 6, 0, 1, 3], ["FSP", 6, 4, 2, 3], ["FSP", 6, 8, 3, 3], ["FSP", 6, 12, 4, 3], ["RE", 6, [0, 4, 8, 12, 1, 5, 9, 13, 2, 6, 10, 14, 3, 7, 11, 15]], ["CA", 3, 6, 11], ["CHR", 2, "shared", [3]], ["CA", 3, 4, 14], ["CHR", 1, "shared", [4]], ["CA", 2, 5, 14], ["CI", 1], ["FU", 8, [0, 1, 2, 3]], ["AN", 8, 0, 5], ["FU", 8, [1, 2, 3, 4]], ["AN", 8, 1, 4], ["FU", 8, [2, 3, 4, 5]], ["AN", 8, 2, 6], ["FU", 4, [0, 1, 2, 3]], ["SP", 4, 0, 36, [1], 1], ["AN", 4, 1, 2], ["FFSP", 4, 0, [4, 3, 2, 1], 1, 1], ["AN", 4, 1, 6], ["FU", 2, [0, 1, 2, 3]], ["SP", 2, 0, 384, [1], 1], ["AN", 2, 1, 2], ["FFSP", 2, 0, [4, 3, 2, 1], 1, 1], ["AN", 2, 1, 6], ["PR", 5, 0, "auto_unroll_max_step$512"]]]], "r": [[0.000168838], 0, 15.4449, 1682138163], "v": "v0.6"}
{"i": [["[\"conv2d_1\"]", "cuda -keys=cuda,gpu -arch=sm_80 -max_num_threads=1024 -thread_warp_size=32", [-1, 16, 64, 49152, 2147483647, 1024, 8, 32], "", 0, []], [[], [["CI", 5], ["SP", 3, 0, 1, [1, 1, 1, 1], 1], ["SP", 3, 5, 32, [1, 16, 2, 1], 1], ["SP", 3, 10, 224, [4, 4, 1, 2], 1], ["SP", 3, 15, 224, [1, 1, 16, 2], 1], ["SP", 3, 20, 3, [1, 3], 1], ["SP", 3, 23, 3, [3, 1], 1], ["SP", 3, 26, 3, [1, 3], 1], ["RE", 3, [0, 5, 10, 15, 1, 6, 11, 16, 2, 7, 12, 17, 20, 23, 26, 21, 24, 27, 3, 8, 13, 18, 22, 25, 28, 4, 9, 14, 19]], ["FSP", 6, 0, 1, 3], ["FSP", 6, 4, 2, 3], ["FSP", 6, 8, 3, 3], ["FSP", 6, 12, 4, 3], ["RE", 6, [0, 4, 8, 12, 1, 5, 9, 13, 2, 6, 10, 14, 3, 7, 11, 15]], ["CA", 3, 6, 11], ["CHR", 2, "shared", [3]], ["CA", 3, 4, 14], ["CHR", 1, "shared", [4]], ["CA", 2, 5, 14], ["CI", 1], ["FU", 8, [0, 1, 2, 3]], ["AN", 8, 0, 5], ["FU", 8, [1, 2, 3, 4]], ["AN", 8, 1, 4], ["FU", 8, [2, 3, 4, 5]], ["AN", 8, 2, 6], ["FU", 4, [0, 1, 2, 3]], ["SP", 4, 0, 54, [1], 1], ["AN", 4, 1, 2], ["FFSP", 4, 0, [4, 3, 2, 1], 1, 1], ["AN", 4, 1, 6], ["FU", 2, [0, 1, 2, 3]], ["SP", 2, 0, 408, [1], 1], ["AN", 2, 1, 2], ["FFSP", 2, 0, [4, 3, 2, 1], 1, 1], ["AN", 2, 1, 6], ["PR", 5, 0, "auto_unroll_max_step$1024"]]]], "r": [[0.000101485], 0, 15.2566, 1682138165], "v": "v0.6"}
{"i": [["[\"conv2d_1\"]", "cuda -keys=cuda,gpu -arch=sm_80 -max_num_threads=1024 -thread_warp_size=32", [-1, 16, 64, 49152, 2147483647, 1024, 8, 32], "", 0, []], [[], [["CI", 5], ["SP", 3, 0, 1, [1, 1, 1, 1], 1], ["SP", 3, 5, 32, [1, 2, 8, 2], 1], ["SP", 3, 10, 224, [1, 32, 1, 1], 1], ["SP", 3, 15, 224, [1, 2, 16, 1], 1], ["SP", 3, 20, 3, [1, 1], 1], ["SP", 3, 23, 3, [1, 1], 1], ["SP", 3, 26, 3, [3, 1], 1], ["RE", 3, [0, 5, 10, 15, 1, 6, 11, 16, 2, 7, 12, 17, 20, 23, 26, 21, 24, 27, 3, 8, 13, 18, 22, 25, 28, 4, 9, 14, 19]], ["FSP", 6, 0, 1, 3], ["FSP", 6, 4, 2, 3], ["FSP", 6, 8, 3, 3], ["FSP", 6, 12, 4, 3], ["RE", 6, [0, 4, 8, 12, 1, 5, 9, 13, 2, 6, 10, 14, 3, 7, 11, 15]], ["CA", 3, 6, 11], ["CHR", 2, "shared", [3]], ["CA", 3, 4, 14], ["CHR", 1, "shared", [4]], ["CA", 2, 5, 14], ["CI", 1], ["FU", 8, [0, 1, 2, 3]], ["AN", 8, 0, 5], ["FU", 8, [1, 2, 3, 4]], ["AN", 8, 1, 4], ["FU", 8, [2, 3, 4, 5]], ["AN", 8, 2, 6], ["FU", 4, [0, 1, 2, 3]], ["SP", 4, 0, 48, [1], 1], ["AN", 4, 1, 2], ["FFSP", 4, 0, [4, 3, 2, 1], 1, 1], ["AN", 4, 1, 6], ["FU", 2, [0, 1, 2, 3]], ["SP", 2, 0, 18, [1], 1], ["AN", 2, 1, 2], ["FFSP", 2, 0, [4, 3, 2, 1], 1, 1], ["AN", 2, 1, 6], ["PR", 5, 0, "auto_unroll_max_step$512"]]]], "r": [[8.13417e-05], 0, 7.75973, 1682138166], "v": "v0.6"}
{"i": [["[\"conv2d_1\"]", "cuda -keys=cuda,gpu -arch=sm_80 -max_num_threads=1024 -thread_warp_size=32", [-1, 16, 64, 49152, 2147483647, 1024, 8, 32], "", 0, []], [[], [["CI", 5], ["SP", 3, 0, 1, [1, 1, 1, 1], 1], ["SP", 3, 5, 32, [2, 8, 2, 1], 1], ["SP", 3, 10, 224, [1, 8, 4, 1], 1], ["SP", 3, 15, 224, [1, 4, 8, 1], 1], ["SP", 3, 20, 3, [1, 3], 1], ["SP", 3, 23, 3, [1, 1], 1], ["SP", 3, 26, 3, [3, 1], 1], ["RE", 3, [0, 5, 10, 15, 1, 6, 11, 16, 2, 7, 12, 17, 20, 23, 26, 21, 24, 27, 3, 8, 13, 18, 22, 25, 28, 4, 9, 14, 19]], ["FSP", 6, 0, 1, 3], ["FSP", 6, 4, 2, 3], ["FSP", 6, 8, 3, 3], ["FSP", 6, 12, 4, 3], ["RE", 6, [0, 4, 8, 12, 1, 5, 9, 13, 2, 6, 10, 14, 3, 7, 11, 15]], ["CA", 3, 6, 11], ["CHR", 2, "shared", [3]], ["CA", 3, 4, 14], ["CHR", 1, "shared", [4]], ["CA", 2, 5, 14], ["CI", 1], ["FU", 8, [0, 1, 2, 3]], ["AN", 8, 0, 5], ["FU", 8, [1, 2, 3, 4]], ["AN", 8, 1, 4], ["FU", 8, [2, 3, 4, 5]], ["AN", 8, 2, 6], ["FU", 4, [0, 1, 2, 3]], ["SP", 4, 0, 18, [1], 1], ["AN", 4, 1, 2], ["FFSP", 4, 0, [4, 3, 2, 1], 1, 1], ["AN", 4, 1, 6], ["FU", 2, [0, 1, 2, 3]], ["SP", 2, 0, 120, [1], 1], ["AN", 2, 1, 2], ["FFSP", 2, 0, [4, 3, 2, 1], 1, 1], ["AN", 2, 1, 6], ["PR", 5, 0, "auto_unroll_max_step$0"]]]], "r": [[8.21167e-05], 0, 5.52455, 1682138168], "v": "v0.6"}
