runtime/fineco-hip/code_gen/alexnet/conv2-81.json
{"i": [["[\"conv2d_relu_layer_2\"]", "cuda -keys=cuda,gpu -arch=sm_80 -max_num_threads=1024 -thread_warp_size=32", [-1, 16, 64, 49152, 2147483647, 1024, 8, 32], "", 0, []], [[], [["CI", 5], ["SP", 3, 0, 1, [1, 1, 1, 1], 1], ["SP", 3, 5, 128, [4, 16, 2, 1], 1], ["SP", 3, 10, 27, [1, 3, 3, 1], 1], ["SP", 3, 15, 27, [1, 1, 1, 1], 1], ["SP", 3, 20, 48, [6, 1], 1], ["SP", 3, 23, 5, [1, 1], 1], ["SP", 3, 26, 5, [1, 5], 1], ["RE", 3, [0, 5, 10, 15, 1, 6, 11, 16, 2, 7, 12, 17, 20, 23, 26, 21, 24, 27, 3, 8, 13, 18, 22, 25, 28, 4, 9, 14, 19]], ["FSP", 6, 0, 1, 3], ["FSP", 6, 4, 2, 3], ["FSP", 6, 8, 3, 3], ["FSP", 6, 12, 4, 3], ["RE", 6, [0, 4, 8, 12, 1, 5, 9, 13, 2, 6, 10, 14, 3, 7, 11, 15]], ["CA", 3, 6, 11], ["CHR", 2, "shared", [3]], ["CA", 3, 4, 14], ["CHR", 1, "shared", [4]], ["CA", 2, 5, 14], ["CI", 1], ["FU", 8, [0, 1, 2, 3]], ["AN", 8, 0, 5], ["FU", 8, [1, 2, 3, 4]], ["AN", 8, 1, 4], ["FU", 8, [2, 3, 4, 5]], ["AN", 8, 2, 6], ["FU", 4, [0, 1, 2, 3]], ["SP", 4, 0, 60, [1], 1], ["AN", 4, 1, 2], ["FFSP", 4, 0, [4, 3, 2, 1], 1, 1], ["AN", 4, 1, 6], ["FU", 2, [0, 1, 2, 3]], ["SP", 2, 0, 90, [1], 1], ["AN", 2, 1, 2], ["FFSP", 2, 0, [4, 3, 2, 1], 1, 1], ["AN", 2, 1, 6], ["PR", 5, 0, "auto_unroll_max_step$0"]]]], "r": [[0.000370681], 0, 7.16846, 1678084402], "v": "v0.6"}
{"i": [["[\"conv2d_relu_layer_2\"]", "cuda -keys=cuda,gpu -arch=sm_80 -max_num_threads=1024 -thread_warp_size=32", [-1, 16, 64, 49152, 2147483647, 1024, 8, 32], "", 0, []], [[], [["CI", 5], ["SP", 3, 0, 1, [1, 1, 1, 1], 1], ["SP", 3, 5, 128, [1, 64, 2, 1], 1], ["SP", 3, 10, 27, [1, 3, 1, 1], 1], ["SP", 3, 15, 27, [3, 1, 1, 1], 1], ["SP", 3, 20, 48, [1, 4], 1], ["SP", 3, 23, 5, [1, 1], 1], ["SP", 3, 26, 5, [1, 5], 1], ["RE", 3, [0, 5, 10, 15, 1, 6, 11, 16, 2, 7, 12, 17, 20, 23, 26, 21, 24, 27, 3, 8, 13, 18, 22, 25, 28, 4, 9, 14, 19]], ["FSP", 6, 0, 1, 3], ["FSP", 6, 4, 2, 3], ["FSP", 6, 8, 3, 3], ["FSP", 6, 12, 4, 3], ["RE", 6, [0, 4, 8, 12, 1, 5, 9, 13, 2, 6, 10, 14, 3, 7, 11, 15]], ["CA", 3, 6, 11], ["CHR", 2, "shared", [3]], ["CA", 3, 4, 14], ["CHR", 1, "shared", [4]], ["CA", 2, 5, 14], ["CI", 1], ["FU", 8, [0, 1, 2, 3]], ["AN", 8, 0, 5], ["FU", 8, [1, 2, 3, 4]], ["AN", 8, 1, 4], ["FU", 8, [2, 3, 4, 5]], ["AN", 8, 2, 6], ["FU", 4, [0, 1, 2, 3]], ["SP", 4, 0, 40, [1], 1], ["AN", 4, 1, 2], ["FFSP", 4, 0, [4, 3, 2, 1], 1, 1], ["AN", 4, 1, 6], ["FU", 2, [0, 1, 2, 3]], ["SP", 2, 0, 20, [1], 1], ["AN", 2, 1, 2], ["FFSP", 2, 0, [4, 3, 2, 1], 1, 1], ["AN", 2, 1, 6], ["PR", 5, 0, "auto_unroll_max_step$64"]]]], "r": [[7.91986e-05], 0, 7.62588, 1678084403], "v": "v0.6"}
{"i": [["[\"conv2d_relu_layer_2\"]", "cuda -keys=cuda,gpu -arch=sm_80 -max_num_threads=1024 -thread_warp_size=32", [-1, 16, 64, 49152, 2147483647, 1024, 8, 32], "", 0, []], [[], [["CI", 5], ["SP", 3, 0, 1, [1, 1, 1, 1], 1], ["SP", 3, 5, 128, [4, 16, 2, 1], 1], ["SP", 3, 10, 27, [1, 9, 1, 1], 1], ["SP", 3, 15, 27, [1, 1, 1, 1], 1], ["SP", 3, 20, 48, [8, 2], 1], ["SP", 3, 23, 5, [1, 1], 1], ["SP", 3, 26, 5, [1, 5], 1], ["RE", 3, [0, 5, 10, 15, 1, 6, 11, 16, 2, 7, 12, 17, 20, 23, 26, 21, 24, 27, 3, 8, 13, 18, 22, 25, 28, 4, 9, 14, 19]], ["FSP", 6, 0, 1, 3], ["FSP", 6, 4, 2, 3], ["FSP", 6, 8, 3, 3], ["FSP", 6, 12, 4, 3], ["RE", 6, [0, 4, 8, 12, 1, 5, 9, 13, 2, 6, 10, 14, 3, 7, 11, 15]], ["CA", 3, 6, 11], ["CHR", 2, "shared", [3]], ["CA", 3, 4, 14], ["CHR", 1, "shared", [4]], ["CA", 2, 5, 14], ["CI", 1], ["FU", 8, [0, 1, 2, 3]], ["AN", 8, 0, 5], ["FU", 8, [1, 2, 3, 4]], ["AN", 8, 1, 4], ["FU", 8, [2, 3, 4, 5]], ["AN", 8, 2, 6], ["FU", 4, [0, 1, 2, 3]], ["SP", 4, 0, 160, [1], 1], ["AN", 4, 1, 2], ["FFSP", 4, 0, [4, 3, 2, 1], 1, 1], ["AN", 4, 1, 6], ["FU", 2, [0, 1, 2, 3]], ["SP", 2, 0, 80, [1], 1], ["AN", 2, 1, 2], ["FFSP", 2, 0, [4, 3, 2, 1], 1, 1], ["AN", 2, 1, 6], ["PR", 5, 0, "auto_unroll_max_step$0"]]]], "r": [[0.000253091], 0, 6.83821, 1678084405], "v": "v0.6"}
{"i": [["[\"conv2d_relu_layer_2\"]", "cuda -keys=cuda,gpu -arch=sm_80 -max_num_threads=1024 -thread_warp_size=32", [-1, 16, 64, 49152, 2147483647, 1024, 8, 32], "", 0, []], [[], [["CI", 5], ["SP", 3, 0, 1, [1, 1, 1, 1], 1], ["SP", 3, 5, 128, [8, 8, 2, 1], 1], ["SP", 3, 10, 27, [1, 1, 1, 1], 1], ["SP", 3, 15, 27, [1, 9, 1, 1], 1], ["SP", 3, 20, 48, [1, 2], 1], ["SP", 3, 23, 5, [1, 1], 1], ["SP", 3, 26, 5, [1, 1], 1], ["RE", 3, [0, 5, 10, 15, 1, 6, 11, 16, 2, 7, 12, 17, 20, 23, 26, 21, 24, 27, 3, 8, 13, 18, 22, 25, 28, 4, 9, 14, 19]], ["FSP", 6, 0, 1, 3], ["FSP", 6, 4, 2, 3], ["FSP", 6, 8, 3, 3], ["FSP", 6, 12, 4, 3], ["RE", 6, [0, 4, 8, 12, 1, 5, 9, 13, 2, 6, 10, 14, 3, 7, 11, 15]], ["CA", 3, 6, 11], ["CHR", 2, "shared", [3]], ["CA", 3, 4, 14], ["CHR", 1, "shared", [4]], ["CA", 2, 5, 14], ["CI", 1], ["FU", 8, [0, 1, 2, 3]], ["AN", 8, 0, 5], ["FU", 8, [1, 2, 3, 4]], ["AN", 8, 1, 4], ["FU", 8, [2, 3, 4, 5]], ["AN", 8, 2, 6], ["FU", 4, [0, 1, 2, 3]], ["SP", 4, 0, 4, [1], 1], ["AN", 4, 1, 2], ["FFSP", 4, 0, [4, 3, 2, 1], 1, 1], ["AN", 4, 1, 6], ["FU", 2, [0, 1, 2, 3]], ["SP", 2, 0, 2, [1], 1], ["AN", 2, 1, 2], ["FFSP", 2, 0, [4, 3, 2, 1], 1, 1], ["AN", 2, 1, 6], ["PR", 5, 0, "auto_unroll_max_step$512"]]]], "r": [[0.000254579], 0, 8.14135, 1678084406], "v": "v0.6"}
{"i": [["[\"conv2d_relu_layer_2\"]", "cuda -keys=cuda,gpu -arch=sm_80 -max_num_threads=1024 -thread_warp_size=32", [-1, 16, 64, 49152, 2147483647, 1024, 8, 32], "", 0, []], [[], [["CI", 5], ["SP", 3, 0, 1, [1, 1, 1, 1], 1], ["SP", 3, 5, 128, [1, 32, 2, 2], 1], ["SP", 3, 10, 27, [1, 3, 1, 1], 1], ["SP", 3, 15, 27, [1, 3, 1, 1], 1], ["SP", 3, 20, 48, [2, 1], 1], ["SP", 3, 23, 5, [1, 1], 1], ["SP", 3, 26, 5, [1, 5], 1], ["RE", 3, [0, 5, 10, 15, 1, 6, 11, 16, 2, 7, 12, 17, 20, 23, 26, 21, 24, 27, 3, 8, 13, 18, 22, 25, 28, 4, 9, 14, 19]], ["FSP", 6, 0, 1, 3], ["FSP", 6, 4, 2, 3], ["FSP", 6, 8, 3, 3], ["FSP", 6, 12, 4, 3], ["RE", 6, [0, 4, 8, 12, 1, 5, 9, 13, 2, 6, 10, 14, 3, 7, 11, 15]], ["CA", 3, 6, 11], ["CHR", 2, "shared", [3]], ["CA", 3, 4, 14], ["CHR", 1, "shared", [4]], ["CA", 2, 5, 14], ["CI", 1], ["FU", 8, [0, 1, 2, 3]], ["AN", 8, 0, 5], ["FU", 8, [1, 2, 3, 4]], ["AN", 8, 1, 4], ["FU", 8, [2, 3, 4, 5]], ["AN", 8, 2, 6], ["FU", 4, [0, 1, 2, 3]], ["SP", 4, 0, 40, [1], 1], ["AN", 4, 1, 2], ["FFSP", 4, 0, [4, 3, 2, 1], 1, 1], ["AN", 4, 1, 6], ["FU", 2, [0, 1, 2, 3]], ["SP", 2, 0, 10, [1], 1], ["AN", 2, 1, 2], ["FFSP", 2, 0, [4, 3, 2, 1], 1, 1], ["AN", 2, 1, 6], ["PR", 5, 0, "auto_unroll_max_step$1024"]]]], "r": [[0.000107469], 0, 9.50177, 1678084407], "v": "v0.6"}
{"i": [["[\"conv2d_relu_layer_2\"]", "cuda -keys=cuda,gpu -arch=sm_80 -max_num_threads=1024 -thread_warp_size=32", [-1, 16, 64, 49152, 2147483647, 1024, 8, 32], "", 0, []], [[], [["CI", 5], ["SP", 3, 0, 1, [1, 1, 1, 1], 1], ["SP", 3, 5, 128, [4, 32, 1, 1], 1], ["SP", 3, 10, 27, [1, 3, 1, 1], 1], ["SP", 3, 15, 27, [1, 1, 1, 3], 1], ["SP", 3, 20, 48, [1, 6], 1], ["SP", 3, 23, 5, [1, 1], 1], ["SP", 3, 26, 5, [5, 1], 1], ["RE", 3, [0, 5, 10, 15, 1, 6, 11, 16, 2, 7, 12, 17, 20, 23, 26, 21, 24, 27, 3, 8, 13, 18, 22, 25, 28, 4, 9, 14, 19]], ["FSP", 6, 0, 1, 3], ["FSP", 6, 4, 2, 3], ["FSP", 6, 8, 3, 3], ["FSP", 6, 12, 4, 3], ["RE", 6, [0, 4, 8, 12, 1, 5, 9, 13, 2, 6, 10, 14, 3, 7, 11, 15]], ["CA", 3, 6, 11], ["CHR", 2, "shared", [3]], ["CA", 3, 4, 14], ["CHR", 1, "shared", [4]], ["CA", 2, 5, 14], ["CI", 1], ["FU", 8, [0, 1, 2, 3]], ["AN", 8, 0, 5], ["FU", 8, [1, 2, 3, 4]], ["AN", 8, 1, 4], ["FU", 8, [2, 3, 4, 5]], ["AN", 8, 2, 6], ["FU", 4, [0, 1, 2, 3]], ["SP", 4, 0, 30, [1], 1], ["AN", 4, 1, 2], ["FFSP", 4, 0, [4, 3, 2, 1], 1, 1], ["AN", 4, 1, 6], ["FU", 2, [0, 1, 2, 3]], ["SP", 2, 0, 42, [1], 1], ["AN", 2, 1, 2], ["FFSP", 2, 0, [4, 3, 2, 1], 1, 1], ["AN", 2, 1, 6], ["PR", 5, 0, "auto_unroll_max_step$0"]]]], "r": [[0.000183305], 0, 6.8585, 1678084409], "v": "v0.6"}
{"i": [["[\"conv2d_relu_layer_2\"]", "cuda -keys=cuda,gpu -arch=sm_80 -max_num_threads=1024 -thread_warp_size=32", [-1, 16, 64, 49152, 2147483647, 1024, 8, 32], "", 0, []], [[], [["CI", 5], ["SP", 3, 0, 1, [1, 1, 1, 1], 1], ["SP", 3, 5, 128, [1, 64, 1, 2], 1], ["SP", 3, 10, 27, [1, 1, 9, 1], 1], ["SP", 3, 15, 27, [1, 1, 1, 1], 1], ["SP", 3, 20, 48, [12, 1], 1], ["SP", 3, 23, 5, [1, 5], 1], ["SP", 3, 26, 5, [1, 1], 1], ["RE", 3, [0, 5, 10, 15, 1, 6, 11, 16, 2, 7, 12, 17, 20, 23, 26, 21, 24, 27, 3, 8, 13, 18, 22, 25, 28, 4, 9, 14, 19]], ["FSP", 6, 0, 1, 3], ["FSP", 6, 4, 2, 3], ["FSP", 6, 8, 3, 3], ["FSP", 6, 12, 4, 3], ["RE", 6, [0, 4, 8, 12, 1, 5, 9, 13, 2, 6, 10, 14, 3, 7, 11, 15]], ["CA", 3, 6, 11], ["CHR", 2, "shared", [3]], ["CA", 3, 4, 14], ["CHR", 1, "shared", [4]], ["CA", 2, 5, 14], ["CI", 1], ["FU", 8, [0, 1, 2, 3]], ["AN", 8, 0, 5], ["FU", 8, [1, 2, 3, 4]], ["AN", 8, 1, 4], ["FU", 8, [2, 3, 4, 5]], ["AN", 8, 2, 6], ["FU", 4, [0, 1, 2, 3]], ["SP", 4, 0, 120, [1], 1], ["AN", 4, 1, 2], ["FFSP", 4, 0, [4, 3, 2, 1], 1, 1], ["AN", 4, 1, 6], ["FU", 2, [0, 1, 2, 3]], ["SP", 2, 0, 156, [1], 1], ["AN", 2, 1, 2], ["FFSP", 2, 0, [4, 3, 2, 1], 1, 1], ["AN", 2, 1, 6], ["PR", 5, 0, "auto_unroll_max_step$1024"]]]], "r": [[0.000133178], 0, 11.2441, 1678084410], "v": "v0.6"}
{"i": [["[\"conv2d_relu_layer_2\"]", "cuda -keys=cuda,gpu -arch=sm_80 -max_num_threads=1024 -thread_warp_size=32", [-1, 16, 64, 49152, 2147483647, 1024, 8, 32], "", 0, []], [[], [["CI", 5], ["SP", 3, 0, 1, [1, 1, 1, 1], 1], ["SP", 3, 5, 128, [4, 16, 1, 2], 1], ["SP", 3, 10, 27, [1, 1, 1, 1], 1], ["SP", 3, 15, 27, [1, 9, 1, 1], 1], ["SP", 3, 20, 48, [12, 1], 1], ["SP", 3, 23, 5, [1, 1], 1], ["SP", 3, 26, 5, [5, 1], 1], ["RE", 3, [0, 5, 10, 15, 1, 6, 11, 16, 2, 7, 12, 17, 20, 23, 26, 21, 24, 27, 3, 8, 13, 18, 22, 25, 28, 4, 9, 14, 19]], ["FSP", 6, 0, 1, 3], ["FSP", 6, 4, 2, 3], ["FSP", 6, 8, 3, 3], ["FSP", 6, 12, 4, 3], ["RE", 6, [0, 4, 8, 12, 1, 5, 9, 13, 2, 6, 10, 14, 3, 7, 11, 15]], ["CA", 3, 6, 11], ["CHR", 2, "shared", [3]], ["CA", 3, 4, 14], ["CHR", 1, "shared", [4]], ["CA", 2, 5, 14], ["CI", 1], ["FU", 8, [0, 1, 2, 3]], ["AN", 8, 0, 5], ["FU", 8, [1, 2, 3, 4]], ["AN", 8, 1, 4], ["FU", 8, [2, 3, 4, 5]], ["AN", 8, 2, 6], ["FU", 4, [0, 1, 2, 3]], ["SP", 4, 0, 120, [1], 1], ["AN", 4, 1, 2], ["FFSP", 4, 0, [4, 3, 2, 1], 1, 1], ["AN", 4, 1, 6], ["FU", 2, [0, 1, 2, 3]], ["SP", 2, 0, 60, [1], 1], ["AN", 2, 1, 2], ["FFSP", 2, 0, [4, 3, 2, 1], 1, 1], ["AN", 2, 1, 6], ["PR", 5, 0, "auto_unroll_max_step$1024"]]]], "r": [[9.0183e-05], 0, 14.3956, 1678084411], "v": "v0.6"}
{"i": [["[\"conv2d_relu_layer_2\"]", "cuda -keys=cuda,gpu -arch=sm_80 -max_num_threads=1024 -thread_warp_size=32", [-1, 16, 64, 49152, 2147483647, 1024, 8, 32], "", 0, []], [[], [["CI", 5], ["SP", 3, 0, 1, [1, 1, 1, 1], 1], ["SP", 3, 5, 128, [1, 64, 1, 2], 1], ["SP", 3, 10, 27, [1, 1, 1, 3], 1], ["SP", 3, 15, 27, [1, 3, 1, 1], 1], ["SP", 3, 20, 48, [48, 1], 1], ["SP", 3, 23, 5, [1, 1], 1], ["SP", 3, 26, 5, [1, 1], 1], ["RE", 3, [0, 5, 10, 15, 1, 6, 11, 16, 2, 7, 12, 17, 20, 23, 26, 21, 24, 27, 3, 8, 13, 18, 22, 25, 28, 4, 9, 14, 19]], ["FSP", 6, 0, 1, 3], ["FSP", 6, 4, 2, 3], ["FSP", 6, 8, 3, 3], ["FSP", 6, 12, 4, 3], ["RE", 6, [0, 4, 8, 12, 1, 5, 9, 13, 2, 6, 10, 14, 3, 7, 11, 15]], ["CA", 3, 6, 11], ["CHR", 2, "shared", [3]], ["CA", 3, 4, 14], ["CHR", 1, "shared", [4]], ["CA", 2, 5, 14], ["CI", 1], ["FU", 8, [0, 1, 2, 3]], ["AN", 8, 0, 5], ["FU", 8, [1, 2, 3, 4]], ["AN", 8, 1, 4], ["FU", 8, [2, 3, 4, 5]], ["AN", 8, 2, 6], ["FU", 4, [0, 1, 2, 3]], ["SP", 4, 0, 96, [1], 1], ["AN", 4, 1, 2], ["FFSP", 4, 0, [4, 3, 2, 1], 1, 1], ["AN", 4, 1, 6], ["FU", 2, [0, 1, 2, 3]], ["SP", 2, 0, 144, [1], 1], ["AN", 2, 1, 2], ["FFSP", 2, 0, [4, 3, 2, 1], 1, 1], ["AN", 2, 1, 6], ["PR", 5, 0, "auto_unroll_max_step$0"]]]], "r": [[0.000269493], 0, 6.42599, 1678084412], "v": "v0.6"}
{"i": [["[\"conv2d_relu_layer_2\"]", "cuda -keys=cuda,gpu -arch=sm_80 -max_num_threads=1024 -thread_warp_size=32", [-1, 16, 64, 49152, 2147483647, 1024, 8, 32], "", 0, []], [[], [["CI", 5], ["SP", 3, 0, 1, [1, 1, 1, 1], 1], ["SP", 3, 5, 128, [1, 32, 1, 4], 1], ["SP", 3, 10, 27, [1, 1, 1, 1], 1], ["SP", 3, 15, 27, [1, 1, 1, 9], 1], ["SP", 3, 20, 48, [8, 2], 1], ["SP", 3, 23, 5, [1, 1], 1], ["SP", 3, 26, 5, [5, 1], 1], ["RE", 3, [0, 5, 10, 15, 1, 6, 11, 16, 2, 7, 12, 17, 20, 23, 26, 21, 24, 27, 3, 8, 13, 18, 22, 25, 28, 4, 9, 14, 19]], ["FSP", 6, 0, 1, 3], ["FSP", 6, 4, 2, 3], ["FSP", 6, 8, 3, 3], ["FSP", 6, 12, 4, 3], ["RE", 6, [0, 4, 8, 12, 1, 5, 9, 13, 2, 6, 10, 14, 3, 7, 11, 15]], ["CA", 3, 6, 11], ["CHR", 2, "shared", [3]], ["CA", 3, 4, 14], ["CHR", 1, "shared", [4]], ["CA", 2, 5, 14], ["CI", 1], ["FU", 8, [0, 1, 2, 3]], ["AN", 8, 0, 5], ["FU", 8, [1, 2, 3, 4]], ["AN", 8, 1, 4], ["FU", 8, [2, 3, 4, 5]], ["AN", 8, 2, 6], ["FU", 4, [0, 1, 2, 3]], ["SP", 4, 0, 320, [1], 1], ["AN", 4, 1, 2], ["FFSP", 4, 0, [4, 3, 2, 1], 1, 1], ["AN", 4, 1, 6], ["FU", 2, [0, 1, 2, 3]], ["SP", 2, 0, 208, [1], 1], ["AN", 2, 1, 2], ["FFSP", 2, 0, [4, 3, 2, 1], 1, 1], ["AN", 2, 1, 6], ["PR", 5, 0, "auto_unroll_max_step$16"]]]], "r": [[0.000484293], 0, 7.517, 1678084414], "v": "v0.6"}
{"i": [["[\"conv2d_relu_layer_2\"]", "cuda -keys=cuda,gpu -arch=sm_80 -max_num_threads=1024 -thread_warp_size=32", [-1, 16, 64, 49152, 2147483647, 1024, 8, 32], "", 0, []], [[], [["CI", 5], ["SP", 3, 0, 1, [1, 1, 1, 1], 1], ["SP", 3, 5, 128, [2, 16, 1, 4], 1], ["SP", 3, 10, 27, [1, 1, 1, 1], 1], ["SP", 3, 15, 27, [1, 3, 3, 1], 1], ["SP", 3, 20, 48, [6, 4], 1], ["SP", 3, 23, 5, [1, 1], 1], ["SP", 3, 26, 5, [1, 1], 1], ["RE", 3, [0, 5, 10, 15, 1, 6, 11, 16, 2, 7, 12, 17, 20, 23, 26, 21, 24, 27, 3, 8, 13, 18, 22, 25, 28, 4, 9, 14, 19]], ["FSP", 6, 0, 1, 3], ["FSP", 6, 4, 2, 3], ["FSP", 6, 8, 3, 3], ["FSP", 6, 12, 4, 3], ["RE", 6, [0, 4, 8, 12, 1, 5, 9, 13, 2, 6, 10, 14, 3, 7, 11, 15]], ["CA", 3, 6, 11], ["CHR", 2, "shared", [3]], ["CA", 3, 4, 14], ["CHR", 1, "shared", [4]], ["CA", 2, 5, 14], ["CI", 1], ["FU", 8, [0, 1, 2, 3]], ["AN", 8, 0, 5], ["FU", 8, [1, 2, 3, 4]], ["AN", 8, 1, 4], ["FU", 8, [2, 3, 4, 5]], ["AN", 8, 2, 6], ["FU", 4, [0, 1, 2, 3]], ["SP", 4, 0, 96, [1], 1], ["AN", 4, 1, 2], ["FFSP", 4, 0, [4, 3, 2, 1], 1, 1], ["AN", 4, 1, 6], ["FU", 2, [0, 1, 2, 3]], ["SP", 2, 0, 72, [1], 1], ["AN", 2, 1, 2], ["FFSP", 2, 0, [4, 3, 2, 1], 1, 1], ["AN", 2, 1, 6], ["PR", 5, 0, "auto_unroll_max_step$0"]]]], "r": [[0.000348273], 0, 6.80778, 1678084415], "v": "v0.6"}
{"i": [["[\"conv2d_relu_layer_2\"]", "cuda -keys=cuda,gpu -arch=sm_80 -max_num_threads=1024 -thread_warp_size=32", [-1, 16, 64, 49152, 2147483647, 1024, 8, 32], "", 0, []], [[], [["CI", 5], ["SP", 3, 0, 1, [1, 1, 1, 1], 1], ["SP", 3, 5, 128, [2, 64, 1, 1], 1], ["SP", 3, 10, 27, [1, 1, 1, 1], 1], ["SP", 3, 15, 27, [3, 3, 1, 1], 1], ["SP", 3, 20, 48, [2, 6], 1], ["SP", 3, 23, 5, [1, 1], 1], ["SP", 3, 26, 5, [5, 1], 1], ["RE", 3, [0, 5, 10, 15, 1, 6, 11, 16, 2, 7, 12, 17, 20, 23, 26, 21, 24, 27, 3, 8, 13, 18, 22, 25, 28, 4, 9, 14, 19]], ["FSP", 6, 0, 1, 3], ["FSP", 6, 4, 2, 3], ["FSP", 6, 8, 3, 3], ["FSP", 6, 12, 4, 3], ["RE", 6, [0, 4, 8, 12, 1, 5, 9, 13, 2, 6, 10, 14, 3, 7, 11, 15]], ["CA", 3, 6, 11], ["CHR", 2, "shared", [3]], ["CA", 3, 4, 14], ["CHR", 1, "shared", [4]], ["CA", 2, 5, 14], ["CI", 1], ["FU", 8, [0, 1, 2, 3]], ["AN", 8, 0, 5], ["FU", 8, [1, 2, 3, 4]], ["AN", 8, 1, 4], ["FU", 8, [2, 3, 4, 5]], ["AN", 8, 2, 6], ["FU", 4, [0, 1, 2, 3]], ["SP", 4, 0, 60, [1], 1], ["AN", 4, 1, 2], ["FFSP", 4, 0, [4, 3, 2, 1], 1, 1], ["AN", 4, 1, 6], ["FU", 2, [0, 1, 2, 3]], ["SP", 2, 0, 60, [1], 1], ["AN", 2, 1, 2], ["FFSP", 2, 0, [4, 3, 2, 1], 1, 1], ["AN", 2, 1, 6], ["PR", 5, 0, "auto_unroll_max_step$1024"]]]], "r": [[6.87144e-05], 0, 10.7477, 1678084417], "v": "v0.6"}
{"i": [["[\"conv2d_relu_layer_2\"]", "cuda -keys=cuda,gpu -arch=sm_80 -max_num_threads=1024 -thread_warp_size=32", [-1, 16, 64, 49152, 2147483647, 1024, 8, 32], "", 0, []], [[], [["CI", 5], ["SP", 3, 0, 1, [1, 1, 1, 1], 1], ["SP", 3, 5, 128, [1, 8, 8, 2], 1], ["SP", 3, 10, 27, [1, 3, 1, 1], 1], ["SP", 3, 15, 27, [1, 3, 1, 1], 1], ["SP", 3, 20, 48, [1, 4], 1], ["SP", 3, 23, 5, [1, 1], 1], ["SP", 3, 26, 5, [1, 5], 1], ["RE", 3, [0, 5, 10, 15, 1, 6, 11, 16, 2, 7, 12, 17, 20, 23, 26, 21, 24, 27, 3, 8, 13, 18, 22, 25, 28, 4, 9, 14, 19]], ["FSP", 6, 0, 1, 3], ["FSP", 6, 4, 2, 3], ["FSP", 6, 8, 3, 3], ["FSP", 6, 12, 4, 3], ["RE", 6, [0, 4, 8, 12, 1, 5, 9, 13, 2, 6, 10, 14, 3, 7, 11, 15]], ["CA", 3, 6, 11], ["CHR", 2, "shared", [3]], ["CA", 3, 4, 14], ["CHR", 1, "shared", [4]], ["CA", 2, 5, 14], ["CI", 1], ["FU", 8, [0, 1, 2, 3]], ["AN", 8, 0, 5], ["FU", 8, [1, 2, 3, 4]], ["AN", 8, 1, 4], ["FU", 8, [2, 3, 4, 5]], ["AN", 8, 2, 6], ["FU", 4, [0, 1, 2, 3]], ["SP", 4, 0, 320, [1], 1], ["AN", 4, 1, 2], ["FFSP", 4, 0, [4, 3, 2, 1], 1, 1], ["AN", 4, 1, 6], ["FU", 2, [0, 1, 2, 3]], ["SP", 2, 0, 20, [1], 1], ["AN", 2, 1, 2], ["FFSP", 2, 0, [4, 3, 2, 1], 1, 1], ["AN", 2, 1, 6], ["PR", 5, 0, "auto_unroll_max_step$512"]]]], "r": [[0.000187999], 0, 12.8621, 1678084418], "v": "v0.6"}
{"i": [["[\"conv2d_relu_layer_2\"]", "cuda -keys=cuda,gpu -arch=sm_80 -max_num_threads=1024 -thread_warp_size=32", [-1, 16, 64, 49152, 2147483647, 1024, 8, 32], "", 0, []], [[], [["CI", 5], ["SP", 3, 0, 1, [1, 1, 1, 1], 1], ["SP", 3, 5, 128, [1, 128, 1, 1], 1], ["SP", 3, 10, 27, [1, 1, 1, 1], 1], ["SP", 3, 15, 27, [3, 3, 1, 1], 1], ["SP", 3, 20, 48, [1, 12], 1], ["SP", 3, 23, 5, [5, 1], 1], ["SP", 3, 26, 5, [1, 1], 1], ["RE", 3, [0, 5, 10, 15, 1, 6, 11, 16, 2, 7, 12, 17, 20, 23, 26, 21, 24, 27, 3, 8, 13, 18, 22, 25, 28, 4, 9, 14, 19]], ["FSP", 6, 0, 1, 3], ["FSP", 6, 4, 2, 3], ["FSP", 6, 8, 3, 3], ["FSP", 6, 12, 4, 3], ["RE", 6, [0, 4, 8, 12, 1, 5, 9, 13, 2, 6, 10, 14, 3, 7, 11, 15]], ["CA", 3, 6, 11], ["CHR", 2, "shared", [3]], ["CA", 3, 4, 14], ["CHR", 1, "shared", [4]], ["CA", 2, 5, 14], ["CI", 1], ["FU", 8, [0, 1, 2, 3]], ["AN", 8, 0, 5], ["FU", 8, [1, 2, 3, 4]], ["AN", 8, 1, 4], ["FU", 8, [2, 3, 4, 5]], ["AN", 8, 2, 6], ["FU", 4, [0, 1, 2, 3]], ["SP", 4, 0, 60, [1], 1], ["AN", 4, 1, 2], ["FFSP", 4, 0, [4, 3, 2, 1], 1, 1], ["AN", 4, 1, 6], ["FU", 2, [0, 1, 2, 3]], ["SP", 2, 0, 60, [1], 1], ["AN", 2, 1, 2], ["FFSP", 2, 0, [4, 3, 2, 1], 1, 1], ["AN", 2, 1, 6], ["PR", 5, 0, "auto_unroll_max_step$1024"]]]], "r": [[0.000103659], 0, 14.4218, 1678084419], "v": "v0.6"}
{"i": [["[\"conv2d_relu_layer_2\"]", "cuda -keys=cuda,gpu -arch=sm_80 -max_num_threads=1024 -thread_warp_size=32", [-1, 16, 64, 49152, 2147483647, 1024, 8, 32], "", 0, []], [[], [["CI", 5], ["SP", 3, 0, 1, [1, 1, 1, 1], 1], ["SP", 3, 5, 128, [1, 16, 2, 4], 1], ["SP", 3, 10, 27, [1, 3, 1, 1], 1], ["SP", 3, 15, 27, [1, 3, 1, 1], 1], ["SP", 3, 20, 48, [1, 6], 1], ["SP", 3, 23, 5, [5, 1], 1], ["SP", 3, 26, 5, [1, 1], 1], ["RE", 3, [0, 5, 10, 15, 1, 6, 11, 16, 2, 7, 12, 17, 20, 23, 26, 21, 24, 27, 3, 8, 13, 18, 22, 25, 28, 4, 9, 14, 19]], ["FSP", 6, 0, 1, 3], ["FSP", 6, 4, 2, 3], ["FSP", 6, 8, 3, 3], ["FSP", 6, 12, 4, 3], ["RE", 6, [0, 4, 8, 12, 1, 5, 9, 13, 2, 6, 10, 14, 3, 7, 11, 15]], ["CA", 3, 6, 11], ["CHR", 2, "shared", [3]], ["CA", 3, 4, 14], ["CHR", 1, "shared", [4]], ["CA", 2, 5, 14], ["CI", 1], ["FU", 8, [0, 1, 2, 3]], ["AN", 8, 0, 5], ["FU", 8, [1, 2, 3, 4]], ["AN", 8, 1, 4], ["FU", 8, [2, 3, 4, 5]], ["AN", 8, 2, 6], ["FU", 4, [0, 1, 2, 3]], ["SP", 4, 0, 240, [1], 1], ["AN", 4, 1, 2], ["FFSP", 4, 0, [4, 3, 2, 1], 1, 1], ["AN", 4, 1, 6], ["FU", 2, [0, 1, 2, 3]], ["SP", 2, 0, 30, [1], 1], ["AN", 2, 1, 2], ["FFSP", 2, 0, [4, 3, 2, 1], 1, 1], ["AN", 2, 1, 6], ["PR", 5, 0, "auto_unroll_max_step$64"]]]], "r": [[0.000173502], 0, 7.20343, 1678084420], "v": "v0.6"}
{"i": [["[\"conv2d_relu_layer_2\"]", "cuda -keys=cuda,gpu -arch=sm_80 -max_num_threads=1024 -thread_warp_size=32", [-1, 16, 64, 49152, 2147483647, 1024, 8, 32], "", 0, []], [[], [["CI", 5], ["SP", 3, 0, 1, [1, 1, 1, 1], 1], ["SP", 3, 5, 128, [1, 16, 2, 4], 1], ["SP", 3, 10, 27, [3, 1, 1, 1], 1], ["SP", 3, 15, 27, [1, 3, 1, 1], 1], ["SP", 3, 20, 48, [4, 2], 1], ["SP", 3, 23, 5, [1, 5], 1], ["SP", 3, 26, 5, [1, 1], 1], ["RE", 3, [0, 5, 10, 15, 1, 6, 11, 16, 2, 7, 12, 17, 20, 23, 26, 21, 24, 27, 3, 8, 13, 18, 22, 25, 28, 4, 9, 14, 19]], ["FSP", 6, 0, 1, 3], ["FSP", 6, 4, 2, 3], ["FSP", 6, 8, 3, 3], ["FSP", 6, 12, 4, 3], ["RE", 6, [0, 4, 8, 12, 1, 5, 9, 13, 2, 6, 10, 14, 3, 7, 11, 15]], ["CA", 3, 6, 11], ["CHR", 2, "shared", [3]], ["CA", 3, 4, 14], ["CHR", 1, "shared", [4]], ["CA", 2, 5, 14], ["CI", 1], ["FU", 8, [0, 1, 2, 3]], ["AN", 8, 0, 5], ["FU", 8, [1, 2, 3, 4]], ["AN", 8, 1, 4], ["FU", 8, [2, 3, 4, 5]], ["AN", 8, 2, 6], ["FU", 4, [0, 1, 2, 3]], ["SP", 4, 0, 320, [1], 1], ["AN", 4, 1, 2], ["FFSP", 4, 0, [4, 3, 2, 1], 1, 1], ["AN", 4, 1, 6], ["FU", 2, [0, 1, 2, 3]], ["SP", 2, 0, 40, [1], 1], ["AN", 2, 1, 2], ["FFSP", 2, 0, [4, 3, 2, 1], 1, 1], ["AN", 2, 1, 6], ["PR", 5, 0, "auto_unroll_max_step$16"]]]], "r": [[0.000524618], 0, 7.33955, 1678084422], "v": "v0.6"}
{"i": [["[\"conv2d_relu_layer_2\"]", "cuda -keys=cuda,gpu -arch=sm_80 -max_num_threads=1024 -thread_warp_size=32", [-1, 16, 64, 49152, 2147483647, 1024, 8, 32], "", 0, []], [[], [["CI", 5], ["SP", 3, 0, 1, [1, 1, 1, 1], 1], ["SP", 3, 5, 128, [1, 128, 1, 1], 1], ["SP", 3, 10, 27, [1, 1, 3, 1], 1], ["SP", 3, 15, 27, [1, 1, 1, 3], 1], ["SP", 3, 20, 48, [3, 16], 1], ["SP", 3, 23, 5, [1, 1], 1], ["SP", 3, 26, 5, [1, 1], 1], ["RE", 3, [0, 5, 10, 15, 1, 6, 11, 16, 2, 7, 12, 17, 20, 23, 26, 21, 24, 27, 3, 8, 13, 18, 22, 25, 28, 4, 9, 14, 19]], ["FSP", 6, 0, 1, 3], ["FSP", 6, 4, 2, 3], ["FSP", 6, 8, 3, 3], ["FSP", 6, 12, 4, 3], ["RE", 6, [0, 4, 8, 12, 1, 5, 9, 13, 2, 6, 10, 14, 3, 7, 11, 15]], ["CA", 3, 6, 11], ["CHR", 2, "shared", [3]], ["CA", 3, 4, 14], ["CHR", 1, "shared", [4]], ["CA", 2, 5, 14], ["CI", 1], ["FU", 8, [0, 1, 2, 3]], ["AN", 8, 0, 5], ["FU", 8, [1, 2, 3, 4]], ["AN", 8, 1, 4], ["FU", 8, [2, 3, 4, 5]], ["AN", 8, 2, 6], ["FU", 4, [0, 1, 2, 3]], ["SP", 4, 0, 48, [1], 1], ["AN", 4, 1, 2], ["FFSP", 4, 0, [4, 3, 2, 1], 1, 1], ["AN", 4, 1, 6], ["FU", 2, [0, 1, 2, 3]], ["SP", 2, 0, 432, [1], 1], ["AN", 2, 1, 2], ["FFSP", 2, 0, [4, 3, 2, 1], 1, 1], ["AN", 2, 1, 6], ["PR", 5, 0, "auto_unroll_max_step$64"]]]], "r": [[0.000163333], 0, 8.4706, 1678084423], "v": "v0.6"}
{"i": [["[\"conv2d_relu_layer_2\"]", "cuda -keys=cuda,gpu -arch=sm_80 -max_num_threads=1024 -thread_warp_size=32", [-1, 16, 64, 49152, 2147483647, 1024, 8, 32], "", 0, []], [[], [["CI", 5], ["SP", 3, 0, 1, [1, 1, 1, 1], 1], ["SP", 3, 5, 128, [1, 16, 8, 1], 1], ["SP", 3, 10, 27, [1, 9, 1, 1], 1], ["SP", 3, 15, 27, [1, 1, 1, 1], 1], ["SP", 3, 20, 48, [8, 2], 1], ["SP", 3, 23, 5, [5, 1], 1], ["SP", 3, 26, 5, [1, 1], 1], ["RE", 3, [0, 5, 10, 15, 1, 6, 11, 16, 2, 7, 12, 17, 20, 23, 26, 21, 24, 27, 3, 8, 13, 18, 22, 25, 28, 4, 9, 14, 19]], ["FSP", 6, 0, 1, 3], ["FSP", 6, 4, 2, 3], ["FSP", 6, 8, 3, 3], ["FSP", 6, 12, 4, 3], ["RE", 6, [0, 4, 8, 12, 1, 5, 9, 13, 2, 6, 10, 14, 3, 7, 11, 15]], ["CA", 3, 6, 11], ["CHR", 2, "shared", [3]], ["CA", 3, 4, 14], ["CHR", 1, "shared", [4]], ["CA", 2, 5, 14], ["CI", 1], ["FU", 8, [0, 1, 2, 3]], ["AN", 8, 0, 5], ["FU", 8, [1, 2, 3, 4]], ["AN", 8, 1, 4], ["FU", 8, [2, 3, 4, 5]], ["AN", 8, 2, 6], ["FU", 4, [0, 1, 2, 3]], ["SP", 4, 0, 640, [1], 1], ["AN", 4, 1, 2], ["FFSP", 4, 0, [4, 3, 2, 1], 1, 1], ["AN", 4, 1, 6], ["FU", 2, [0, 1, 2, 3]], ["SP", 2, 0, 80, [1], 1], ["AN", 2, 1, 2], ["FFSP", 2, 0, [4, 3, 2, 1], 1, 1], ["AN", 2, 1, 6], ["PR", 5, 0, "auto_unroll_max_step$512"]]]], "r": [[0.000168477], 0, 10.3125, 1678084424], "v": "v0.6"}
{"i": [["[\"conv2d_relu_layer_2\"]", "cuda -keys=cuda,gpu -arch=sm_80 -max_num_threads=1024 -thread_warp_size=32", [-1, 16, 64, 49152, 2147483647, 1024, 8, 32], "", 0, []], [[], [["CI", 5], ["SP", 3, 0, 1, [1, 1, 1, 1], 1], ["SP", 3, 5, 128, [2, 16, 2, 2], 1], ["SP", 3, 10, 27, [1, 3, 1, 1], 1], ["SP", 3, 15, 27, [1, 1, 3, 1], 1], ["SP", 3, 20, 48, [4, 2], 1], ["SP", 3, 23, 5, [1, 1], 1], ["SP", 3, 26, 5, [1, 1], 1], ["RE", 3, [0, 5, 10, 15, 1, 6, 11, 16, 2, 7, 12, 17, 20, 23, 26, 21, 24, 27, 3, 8, 13, 18, 22, 25, 28, 4, 9, 14, 19]], ["FSP", 6, 0, 1, 3], ["FSP", 6, 4, 2, 3], ["FSP", 6, 8, 3, 3], ["FSP", 6, 12, 4, 3], ["RE", 6, [0, 4, 8, 12, 1, 5, 9, 13, 2, 6, 10, 14, 3, 7, 11, 15]], ["CA", 3, 6, 11], ["CHR", 2, "shared", [3]], ["CA", 3, 4, 14], ["CHR", 1, "shared", [4]], ["CA", 2, 5, 14], ["CI", 1], ["FU", 8, [0, 1, 2, 3]], ["AN", 8, 0, 5], ["FU", 8, [1, 2, 3, 4]], ["AN", 8, 1, 4], ["FU", 8, [2, 3, 4, 5]], ["AN", 8, 2, 6], ["FU", 4, [0, 1, 2, 3]], ["SP", 4, 0, 32, [1], 1], ["AN", 4, 1, 2], ["FFSP", 4, 0, [4, 3, 2, 1], 1, 1], ["AN", 4, 1, 6], ["FU", 2, [0, 1, 2, 3]], ["SP", 2, 0, 24, [1], 1], ["AN", 2, 1, 2], ["FFSP", 2, 0, [4, 3, 2, 1], 1, 1], ["AN", 2, 1, 6], ["PR", 5, 0, "auto_unroll_max_step$1024"]]]], "r": [[0.000223129], 0, 8.47494, 1678084426], "v": "v0.6"}
{"i": [["[\"conv2d_relu_layer_2\"]", "cuda -keys=cuda,gpu -arch=sm_80 -max_num_threads=1024 -thread_warp_size=32", [-1, 16, 64, 49152, 2147483647, 1024, 8, 32], "", 0, []], [[], [["CI", 5], ["SP", 3, 0, 1, [1, 1, 1, 1], 1], ["SP", 3, 5, 128, [1, 8, 1, 16], 1], ["SP", 3, 10, 27, [1, 3, 1, 1], 1], ["SP", 3, 15, 27, [1, 3, 1, 1], 1], ["SP", 3, 20, 48, [2, 8], 1], ["SP", 3, 23, 5, [1, 1], 1], ["SP", 3, 26, 5, [5, 1], 1], ["RE", 3, [0, 5, 10, 15, 1, 6, 11, 16, 2, 7, 12, 17, 20, 23, 26, 21, 24, 27, 3, 8, 13, 18, 22, 25, 28, 4, 9, 14, 19]], ["FSP", 6, 0, 1, 3], ["FSP", 6, 4, 2, 3], ["FSP", 6, 8, 3, 3], ["FSP", 6, 12, 4, 3], ["RE", 6, [0, 4, 8, 12, 1, 5, 9, 13, 2, 6, 10, 14, 3, 7, 11, 15]], ["CA", 3, 6, 11], ["CHR", 2, "shared", [3]], ["CA", 3, 4, 14], ["CHR", 1, "shared", [4]], ["CA", 2, 5, 14], ["CI", 1], ["FU", 8, [0, 1, 2, 3]], ["AN", 8, 0, 5], ["FU", 8, [1, 2, 3, 4]], ["AN", 8, 1, 4], ["FU", 8, [2, 3, 4, 5]], ["AN", 8, 2, 6], ["FU", 4, [0, 1, 2, 3]], ["SP", 4, 0, 1280, [1], 1], ["AN", 4, 1, 2], ["FFSP", 4, 0, [4, 3, 2, 1], 1, 1], ["AN", 4, 1, 6], ["FU", 2, [0, 1, 2, 3]], ["SP", 2, 0, 80, [1], 1], ["AN", 2, 1, 2], ["FFSP", 2, 0, [4, 3, 2, 1], 1, 1], ["AN", 2, 1, 6], ["PR", 5, 0, "auto_unroll_max_step$16"]]]], "r": [[0.000574364], 0, 7.93531, 1678084427], "v": "v0.6"}
{"i": [["[\"conv2d_relu_layer_2\"]", "cuda -keys=cuda,gpu -arch=sm_80 -max_num_threads=1024 -thread_warp_size=32", [-1, 16, 64, 49152, 2147483647, 1024, 8, 32], "", 0, []], [[], [["CI", 5], ["SP", 3, 0, 1, [1, 1, 1, 1], 1], ["SP", 3, 5, 128, [1, 64, 2, 1], 1], ["SP", 3, 10, 27, [1, 3, 1, 1], 1], ["SP", 3, 15, 27, [1, 3, 1, 1], 1], ["SP", 3, 20, 48, [2, 1], 1], ["SP", 3, 23, 5, [1, 1], 1], ["SP", 3, 26, 5, [5, 1], 1], ["RE", 3, [0, 5, 10, 15, 1, 6, 11, 16, 2, 7, 12, 17, 20, 23, 26, 21, 24, 27, 3, 8, 13, 18, 22, 25, 28, 4, 9, 14, 19]], ["FSP", 6, 0, 1, 3], ["FSP", 6, 4, 2, 3], ["FSP", 6, 8, 3, 3], ["FSP", 6, 12, 4, 3], ["RE", 6, [0, 4, 8, 12, 1, 5, 9, 13, 2, 6, 10, 14, 3, 7, 11, 15]], ["CA", 3, 6, 11], ["CHR", 2, "shared", [3]], ["CA", 3, 4, 14], ["CHR", 1, "shared", [4]], ["CA", 2, 5, 14], ["CI", 1], ["FU", 8, [0, 1, 2, 3]], ["AN", 8, 0, 5], ["FU", 8, [1, 2, 3, 4]], ["AN", 8, 1, 4], ["FU", 8, [2, 3, 4, 5]], ["AN", 8, 2, 6], ["FU", 4, [0, 1, 2, 3]], ["SP", 4, 0, 20, [1], 1], ["AN", 4, 1, 2], ["FFSP", 4, 0, [4, 3, 2, 1], 1, 1], ["AN", 4, 1, 6], ["FU", 2, [0, 1, 2, 3]], ["SP", 2, 0, 10, [1], 1], ["AN", 2, 1, 2], ["FFSP", 2, 0, [4, 3, 2, 1], 1, 1], ["AN", 2, 1, 6], ["PR", 5, 0, "auto_unroll_max_step$0"]]]], "r": [[0.000122675], 0, 6.53753, 1678084429], "v": "v0.6"}
{"i": [["[\"conv2d_relu_layer_2\"]", "cuda -keys=cuda,gpu -arch=sm_80 -max_num_threads=1024 -thread_warp_size=32", [-1, 16, 64, 49152, 2147483647, 1024, 8, 32], "", 0, []], [[], [["CI", 5], ["SP", 3, 0, 1, [1, 1, 1, 1], 1], ["SP", 3, 5, 128, [2, 64, 1, 1], 1], ["SP", 3, 10, 27, [1, 1, 1, 3], 1], ["SP", 3, 15, 27, [3, 1, 1, 1], 1], ["SP", 3, 20, 48, [1, 3], 1], ["SP", 3, 23, 5, [5, 1], 1], ["SP", 3, 26, 5, [5, 1], 1], ["RE", 3, [0, 5, 10, 15, 1, 6, 11, 16, 2, 7, 12, 17, 20, 23, 26, 21, 24, 27, 3, 8, 13, 18, 22, 25, 28, 4, 9, 14, 19]], ["FSP", 6, 0, 1, 3], ["FSP", 6, 4, 2, 3], ["FSP", 6, 8, 3, 3], ["FSP", 6, 12, 4, 3], ["RE", 6, [0, 4, 8, 12, 1, 5, 9, 13, 2, 6, 10, 14, 3, 7, 11, 15]], ["CA", 3, 6, 11], ["CHR", 2, "shared", [3]], ["CA", 3, 4, 14], ["CHR", 1, "shared", [4]], ["CA", 2, 5, 14], ["CI", 1], ["FU", 8, [0, 1, 2, 3]], ["AN", 8, 0, 5], ["FU", 8, [1, 2, 3, 4]], ["AN", 8, 1, 4], ["FU", 8, [2, 3, 4, 5]], ["AN", 8, 2, 6], ["FU", 4, [0, 1, 2, 3]], ["SP", 4, 0, 75, [1], 1], ["AN", 4, 1, 2], ["FFSP", 4, 0, [4, 3, 2, 1], 1, 1], ["AN", 4, 1, 6], ["FU", 2, [0, 1, 2, 3]], ["SP", 2, 0, 105, [1], 1], ["AN", 2, 1, 2], ["FFSP", 2, 0, [4, 3, 2, 1], 1, 1], ["AN", 2, 1, 6], ["PR", 5, 0, "auto_unroll_max_step$1024"]]]], "r": [[7.36178e-05], 0, 14.6216, 1678084430], "v": "v0.6"}
{"i": [["[\"conv2d_relu_layer_2\"]", "cuda -keys=cuda,gpu -arch=sm_80 -max_num_threads=1024 -thread_warp_size=32", [-1, 16, 64, 49152, 2147483647, 1024, 8, 32], "", 0, []], [[], [["CI", 5], ["SP", 3, 0, 1, [1, 1, 1, 1], 1], ["SP", 3, 5, 128, [4, 32, 1, 1], 1], ["SP", 3, 10, 27, [1, 1, 9, 1], 1], ["SP", 3, 15, 27, [1, 1, 1, 1], 1], ["SP", 3, 20, 48, [1, 48], 1], ["SP", 3, 23, 5, [1, 1], 1], ["SP", 3, 26, 5, [1, 1], 1], ["RE", 3, [0, 5, 10, 15, 1, 6, 11, 16, 2, 7, 12, 17, 20, 23, 26, 21, 24, 27, 3, 8, 13, 18, 22, 25, 28, 4, 9, 14, 19]], ["FSP", 6, 0, 1, 3], ["FSP", 6, 4, 2, 3], ["FSP", 6, 8, 3, 3], ["FSP", 6, 12, 4, 3], ["RE", 6, [0, 4, 8, 12, 1, 5, 9, 13, 2, 6, 10, 14, 3, 7, 11, 15]], ["CA", 3, 6, 11], ["CHR", 2, "shared", [3]], ["CA", 3, 4, 14], ["CHR", 1, "shared", [4]], ["CA", 2, 5, 14], ["CI", 1], ["FU", 8, [0, 1, 2, 3]], ["AN", 8, 0, 5], ["FU", 8, [1, 2, 3, 4]], ["AN", 8, 1, 4], ["FU", 8, [2, 3, 4, 5]], ["AN", 8, 2, 6], ["FU", 4, [0, 1, 2, 3]], ["SP", 4, 0, 48, [1], 1], ["AN", 4, 1, 2], ["FFSP", 4, 0, [4, 3, 2, 1], 1, 1], ["AN", 4, 1, 6], ["FU", 2, [0, 1, 2, 3]], ["SP", 2, 0, 432, [1], 1], ["AN", 2, 1, 2], ["FFSP", 2, 0, [4, 3, 2, 1], 1, 1], ["AN", 2, 1, 6], ["PR", 5, 0, "auto_unroll_max_step$0"]]]], "r": [[0.000315036], 0, 6.80583, 1678084431], "v": "v0.6"}
{"i": [["[\"conv2d_relu_layer_2\"]", "cuda -keys=cuda,gpu -arch=sm_80 -max_num_threads=1024 -thread_warp_size=32", [-1, 16, 64, 49152, 2147483647, 1024, 8, 32], "", 0, []], [[], [["CI", 5], ["SP", 3, 0, 1, [1, 1, 1, 1], 1], ["SP", 3, 5, 128, [2, 16, 2, 2], 1], ["SP", 3, 10, 27, [3, 3, 1, 1], 1], ["SP", 3, 15, 27, [1, 1, 1, 1], 1], ["SP", 3, 20, 48, [8, 2], 1], ["SP", 3, 23, 5, [1, 1], 1], ["SP", 3, 26, 5, [5, 1], 1], ["RE", 3, [0, 5, 10, 15, 1, 6, 11, 16, 2, 7, 12, 17, 20, 23, 26, 21, 24, 27, 3, 8, 13, 18, 22, 25, 28, 4, 9, 14, 19]], ["FSP", 6, 0, 1, 3], ["FSP", 6, 4, 2, 3], ["FSP", 6, 8, 3, 3], ["FSP", 6, 12, 4, 3], ["RE", 6, [0, 4, 8, 12, 1, 5, 9, 13, 2, 6, 10, 14, 3, 7, 11, 15]], ["CA", 3, 6, 11], ["CHR", 2, "shared", [3]], ["CA", 3, 4, 14], ["CHR", 1, "shared", [4]], ["CA", 2, 5, 14], ["CI", 1], ["FU", 8, [0, 1, 2, 3]], ["AN", 8, 0, 5], ["FU", 8, [1, 2, 3, 4]], ["AN", 8, 1, 4], ["FU", 8, [2, 3, 4, 5]], ["AN", 8, 2, 6], ["FU", 4, [0, 1, 2, 3]], ["SP", 4, 0, 320, [1], 1], ["AN", 4, 1, 2], ["FFSP", 4, 0, [4, 3, 2, 1], 1, 1], ["AN", 4, 1, 6], ["FU", 2, [0, 1, 2, 3]], ["SP", 2, 0, 80, [1], 1], ["AN", 2, 1, 2], ["FFSP", 2, 0, [4, 3, 2, 1], 1, 1], ["AN", 2, 1, 6], ["PR", 5, 0, "auto_unroll_max_step$16"]]]], "r": [[0.000528987], 0, 9.71467, 1678084433], "v": "v0.6"}
{"i": [["[\"conv2d_relu_layer_2\"]", "cuda -keys=cuda,gpu -arch=sm_80 -max_num_threads=1024 -thread_warp_size=32", [-1, 16, 64, 49152, 2147483647, 1024, 8, 32], "", 0, []], [[], [["CI", 5], ["SP", 3, 0, 1, [1, 1, 1, 1], 1], ["SP", 3, 5, 128, [2, 32, 2, 1], 1], ["SP", 3, 10, 27, [1, 9, 1, 1], 1], ["SP", 3, 15, 27, [1, 1, 1, 1], 1], ["SP", 3, 20, 48, [4, 2], 1], ["SP", 3, 23, 5, [1, 1], 1], ["SP", 3, 26, 5, [1, 1], 1], ["RE", 3, [0, 5, 10, 15, 1, 6, 11, 16, 2, 7, 12, 17, 20, 23, 26, 21, 24, 27, 3, 8, 13, 18, 22, 25, 28, 4, 9, 14, 19]], ["FSP", 6, 0, 1, 3], ["FSP", 6, 4, 2, 3], ["FSP", 6, 8, 3, 3], ["FSP", 6, 12, 4, 3], ["RE", 6, [0, 4, 8, 12, 1, 5, 9, 13, 2, 6, 10, 14, 3, 7, 11, 15]], ["CA", 3, 6, 11], ["CHR", 2, "shared", [3]], ["CA", 3, 4, 14], ["CHR", 1, "shared", [4]], ["CA", 2, 5, 14], ["CI", 1], ["FU", 8, [0, 1, 2, 3]], ["AN", 8, 0, 5], ["FU", 8, [1, 2, 3, 4]], ["AN", 8, 1, 4], ["FU", 8, [2, 3, 4, 5]], ["AN", 8, 2, 6], ["FU", 4, [0, 1, 2, 3]], ["SP", 4, 0, 16, [1], 1], ["AN", 4, 1, 2], ["FFSP", 4, 0, [4, 3, 2, 1], 1, 1], ["AN", 4, 1, 6], ["FU", 2, [0, 1, 2, 3]], ["SP", 2, 0, 8, [1], 1], ["AN", 2, 1, 2], ["FFSP", 2, 0, [4, 3, 2, 1], 1, 1], ["AN", 2, 1, 6], ["PR", 5, 0, "auto_unroll_max_step$1024"]]]], "r": [[0.000136174], 0, 12.9666, 1678084434], "v": "v0.6"}
{"i": [["[\"conv2d_relu_layer_2\"]", "cuda -keys=cuda,gpu -arch=sm_80 -max_num_threads=1024 -thread_warp_size=32", [-1, 16, 64, 49152, 2147483647, 1024, 8, 32], "", 0, []], [[], [["CI", 5], ["SP", 3, 0, 1, [1, 1, 1, 1], 1], ["SP", 3, 5, 128, [1, 8, 2, 8], 1], ["SP", 3, 10, 27, [1, 3, 1, 1], 1], ["SP", 3, 15, 27, [1, 3, 1, 1], 1], ["SP", 3, 20, 48, [3, 2], 1], ["SP", 3, 23, 5, [5, 1], 1], ["SP", 3, 26, 5, [1, 1], 1], ["RE", 3, [0, 5, 10, 15, 1, 6, 11, 16, 2, 7, 12, 17, 20, 23, 26, 21, 24, 27, 3, 8, 13, 18, 22, 25, 28, 4, 9, 14, 19]], ["FSP", 6, 0, 1, 3], ["FSP", 6, 4, 2, 3], ["FSP", 6, 8, 3, 3], ["FSP", 6, 12, 4, 3], ["RE", 6, [0, 4, 8, 12, 1, 5, 9, 13, 2, 6, 10, 14, 3, 7, 11, 15]], ["CA", 3, 6, 11], ["CHR", 2, "shared", [3]], ["CA", 3, 4, 14], ["CHR", 1, "shared", [4]], ["CA", 2, 5, 14], ["CI", 1], ["FU", 8, [0, 1, 2, 3]], ["AN", 8, 0, 5], ["FU", 8, [1, 2, 3, 4]], ["AN", 8, 1, 4], ["FU", 8, [2, 3, 4, 5]], ["AN", 8, 2, 6], ["FU", 4, [0, 1, 2, 3]], ["SP", 4, 0, 480, [1], 1], ["AN", 4, 1, 2], ["FFSP", 4, 0, [4, 3, 2, 1], 1, 1], ["AN", 4, 1, 6], ["FU", 2, [0, 1, 2, 3]], ["SP", 2, 0, 30, [1], 1], ["AN", 2, 1, 2], ["FFSP", 2, 0, [4, 3, 2, 1], 1, 1], ["AN", 2, 1, 6], ["PR", 5, 0, "auto_unroll_max_step$512"]]]], "r": [[0.000136811], 0, 13.1056, 1678084435], "v": "v0.6"}
{"i": [["[\"conv2d_relu_layer_2\"]", "cuda -keys=cuda,gpu -arch=sm_80 -max_num_threads=1024 -thread_warp_size=32", [-1, 16, 64, 49152, 2147483647, 1024, 8, 32], "", 0, []], [[], [["CI", 5], ["SP", 3, 0, 1, [1, 1, 1, 1], 1], ["SP", 3, 5, 128, [1, 8, 16, 1], 1], ["SP", 3, 10, 27, [1, 9, 1, 1], 1], ["SP", 3, 15, 27, [1, 1, 1, 1], 1], ["SP", 3, 20, 48, [4, 1], 1], ["SP", 3, 23, 5, [1, 1], 1], ["SP", 3, 26, 5, [5, 1], 1], ["RE", 3, [0, 5, 10, 15, 1, 6, 11, 16, 2, 7, 12, 17, 20, 23, 26, 21, 24, 27, 3, 8, 13, 18, 22, 25, 28, 4, 9, 14, 19]], ["FSP", 6, 0, 1, 3], ["FSP", 6, 4, 2, 3], ["FSP", 6, 8, 3, 3], ["FSP", 6, 12, 4, 3], ["RE", 6, [0, 4, 8, 12, 1, 5, 9, 13, 2, 6, 10, 14, 3, 7, 11, 15]], ["CA", 3, 6, 11], ["CHR", 2, "shared", [3]], ["CA", 3, 4, 14], ["CHR", 1, "shared", [4]], ["CA", 2, 5, 14], ["CI", 1], ["FU", 8, [0, 1, 2, 3]], ["AN", 8, 0, 5], ["FU", 8, [1, 2, 3, 4]], ["AN", 8, 1, 4], ["FU", 8, [2, 3, 4, 5]], ["AN", 8, 2, 6], ["FU", 4, [0, 1, 2, 3]], ["SP", 4, 0, 320, [1], 1], ["AN", 4, 1, 2], ["FFSP", 4, 0, [4, 3, 2, 1], 1, 1], ["AN", 4, 1, 6], ["FU", 2, [0, 1, 2, 3]], ["SP", 2, 0, 20, [1], 1], ["AN", 2, 1, 2], ["FFSP", 2, 0, [4, 3, 2, 1], 1, 1], ["AN", 2, 1, 6], ["PR", 5, 0, "auto_unroll_max_step$0"]]]], "r": [[0.00071242], 0, 6.29156, 1678084437], "v": "v0.6"}
{"i": [["[\"conv2d_relu_layer_2\"]", "cuda -keys=cuda,gpu -arch=sm_80 -max_num_threads=1024 -thread_warp_size=32", [-1, 16, 64, 49152, 2147483647, 1024, 8, 32], "", 0, []], [[], [["CI", 5], ["SP", 3, 0, 1, [1, 1, 1, 1], 1], ["SP", 3, 5, 128, [4, 16, 2, 1], 1], ["SP", 3, 10, 27, [1, 1, 3, 1], 1], ["SP", 3, 15, 27, [1, 3, 1, 1], 1], ["SP", 3, 20, 48, [1, 24], 1], ["SP", 3, 23, 5, [1, 1], 1], ["SP", 3, 26, 5, [1, 1], 1], ["RE", 3, [0, 5, 10, 15, 1, 6, 11, 16, 2, 7, 12, 17, 20, 23, 26, 21, 24, 27, 3, 8, 13, 18, 22, 25, 28, 4, 9, 14, 19]], ["FSP", 6, 0, 1, 3], ["FSP", 6, 4, 2, 3], ["FSP", 6, 8, 3, 3], ["FSP", 6, 12, 4, 3], ["RE", 6, [0, 4, 8, 12, 1, 5, 9, 13, 2, 6, 10, 14, 3, 7, 11, 15]], ["CA", 3, 6, 11], ["CHR", 2, "shared", [3]], ["CA", 3, 4, 14], ["CHR", 1, "shared", [4]], ["CA", 2, 5, 14], ["CI", 1], ["FU", 8, [0, 1, 2, 3]], ["AN", 8, 0, 5], ["FU", 8, [1, 2, 3, 4]], ["AN", 8, 1, 4], ["FU", 8, [2, 3, 4, 5]], ["AN", 8, 2, 6], ["FU", 4, [0, 1, 2, 3]], ["SP", 4, 0, 48, [1], 1], ["AN", 4, 1, 2], ["FFSP", 4, 0, [4, 3, 2, 1], 1, 1], ["AN", 4, 1, 6], ["FU", 2, [0, 1, 2, 3]], ["SP", 2, 0, 72, [1], 1], ["AN", 2, 1, 2], ["FFSP", 2, 0, [4, 3, 2, 1], 1, 1], ["AN", 2, 1, 6], ["PR", 5, 0, "auto_unroll_max_step$1024"]]]], "r": [[0.000204822], 0, 13.1147, 1678084438], "v": "v0.6"}
{"i": [["[\"conv2d_relu_layer_2\"]", "cuda -keys=cuda,gpu -arch=sm_80 -max_num_threads=1024 -thread_warp_size=32", [-1, 16, 64, 49152, 2147483647, 1024, 8, 32], "", 0, []], [[], [["CI", 5], ["SP", 3, 0, 1, [1, 1, 1, 1], 1], ["SP", 3, 5, 128, [2, 64, 1, 1], 1], ["SP", 3, 10, 27, [1, 9, 1, 1], 1], ["SP", 3, 15, 27, [1, 1, 1, 1], 1], ["SP", 3, 20, 48, [1, 8], 1], ["SP", 3, 23, 5, [1, 1], 1], ["SP", 3, 26, 5, [1, 5], 1], ["RE", 3, [0, 5, 10, 15, 1, 6, 11, 16, 2, 7, 12, 17, 20, 23, 26, 21, 24, 27, 3, 8, 13, 18, 22, 25, 28, 4, 9, 14, 19]], ["FSP", 6, 0, 1, 3], ["FSP", 6, 4, 2, 3], ["FSP", 6, 8, 3, 3], ["FSP", 6, 12, 4, 3], ["RE", 6, [0, 4, 8, 12, 1, 5, 9, 13, 2, 6, 10, 14, 3, 7, 11, 15]], ["CA", 3, 6, 11], ["CHR", 2, "shared", [3]], ["CA", 3, 4, 14], ["CHR", 1, "shared", [4]], ["CA", 2, 5, 14], ["CI", 1], ["FU", 8, [0, 1, 2, 3]], ["AN", 8, 0, 5], ["FU", 8, [1, 2, 3, 4]], ["AN", 8, 1, 4], ["FU", 8, [2, 3, 4, 5]], ["AN", 8, 2, 6], ["FU", 4, [0, 1, 2, 3]], ["SP", 4, 0, 40, [1], 1], ["AN", 4, 1, 2], ["FFSP", 4, 0, [4, 3, 2, 1], 1, 1], ["AN", 4, 1, 6], ["FU", 2, [0, 1, 2, 3]], ["SP", 2, 0, 40, [1], 1], ["AN", 2, 1, 2], ["FFSP", 2, 0, [4, 3, 2, 1], 1, 1], ["AN", 2, 1, 6], ["PR", 5, 0, "auto_unroll_max_step$512"]]]], "r": [[8.69688e-05], 0, 10.4427, 1678084439], "v": "v0.6"}
{"i": [["[\"conv2d_relu_layer_2\"]", "cuda -keys=cuda,gpu -arch=sm_80 -max_num_threads=1024 -thread_warp_size=32", [-1, 16, 64, 49152, 2147483647, 1024, 8, 32], "", 0, []], [[], [["CI", 5], ["SP", 3, 0, 1, [1, 1, 1, 1], 1], ["SP", 3, 5, 128, [2, 32, 1, 2], 1], ["SP", 3, 10, 27, [1, 1, 1, 1], 1], ["SP", 3, 15, 27, [1, 1, 1, 9], 1], ["SP", 3, 20, 48, [8, 3], 1], ["SP", 3, 23, 5, [1, 1], 1], ["SP", 3, 26, 5, [1, 1], 1], ["RE", 3, [0, 5, 10, 15, 1, 6, 11, 16, 2, 7, 12, 17, 20, 23, 26, 21, 24, 27, 3, 8, 13, 18, 22, 25, 28, 4, 9, 14, 19]], ["FSP", 6, 0, 1, 3], ["FSP", 6, 4, 2, 3], ["FSP", 6, 8, 3, 3], ["FSP", 6, 12, 4, 3], ["RE", 6, [0, 4, 8, 12, 1, 5, 9, 13, 2, 6, 10, 14, 3, 7, 11, 15]], ["CA", 3, 6, 11], ["CHR", 2, "shared", [3]], ["CA", 3, 4, 14], ["CHR", 1, "shared", [4]], ["CA", 2, 5, 14], ["CI", 1], ["FU", 8, [0, 1, 2, 3]], ["AN", 8, 0, 5], ["FU", 8, [1, 2, 3, 4]], ["AN", 8, 1, 4], ["FU", 8, [2, 3, 4, 5]], ["AN", 8, 2, 6], ["FU", 4, [0, 1, 2, 3]], ["SP", 4, 0, 48, [1], 1], ["AN", 4, 1, 2], ["FFSP", 4, 0, [4, 3, 2, 1], 1, 1], ["AN", 4, 1, 6], ["FU", 2, [0, 1, 2, 3]], ["SP", 2, 0, 216, [1], 1], ["AN", 2, 1, 2], ["FFSP", 2, 0, [4, 3, 2, 1], 1, 1], ["AN", 2, 1, 6], ["PR", 5, 0, "auto_unroll_max_step$0"]]]], "r": [[0.000439778], 0, 6.40812, 1678084441], "v": "v0.6"}
{"i": [["[\"conv2d_relu_layer_2\"]", "cuda -keys=cuda,gpu -arch=sm_80 -max_num_threads=1024 -thread_warp_size=32", [-1, 16, 64, 49152, 2147483647, 1024, 8, 32], "", 0, []], [[], [["CI", 5], ["SP", 3, 0, 1, [1, 1, 1, 1], 1], ["SP", 3, 5, 128, [1, 16, 8, 1], 1], ["SP", 3, 10, 27, [1, 1, 1, 1], 1], ["SP", 3, 15, 27, [1, 3, 1, 3], 1], ["SP", 3, 20, 48, [4, 1], 1], ["SP", 3, 23, 5, [1, 5], 1], ["SP", 3, 26, 5, [1, 1], 1], ["RE", 3, [0, 5, 10, 15, 1, 6, 11, 16, 2, 7, 12, 17, 20, 23, 26, 21, 24, 27, 3, 8, 13, 18, 22, 25, 28, 4, 9, 14, 19]], ["FSP", 6, 0, 1, 3], ["FSP", 6, 4, 2, 3], ["FSP", 6, 8, 3, 3], ["FSP", 6, 12, 4, 3], ["RE", 6, [0, 4, 8, 12, 1, 5, 9, 13, 2, 6, 10, 14, 3, 7, 11, 15]], ["CA", 3, 6, 11], ["CHR", 2, "shared", [3]], ["CA", 3, 4, 14], ["CHR", 1, "shared", [4]], ["CA", 2, 5, 14], ["CI", 1], ["FU", 8, [0, 1, 2, 3]], ["AN", 8, 0, 5], ["FU", 8, [1, 2, 3, 4]], ["AN", 8, 1, 4], ["FU", 8, [2, 3, 4, 5]], ["AN", 8, 2, 6], ["FU", 4, [0, 1, 2, 3]], ["SP", 4, 0, 160, [1], 1], ["AN", 4, 1, 2], ["FFSP", 4, 0, [4, 3, 2, 1], 1, 1], ["AN", 4, 1, 6], ["FU", 2, [0, 1, 2, 3]], ["SP", 2, 0, 60, [1], 1], ["AN", 2, 1, 2], ["FFSP", 2, 0, [4, 3, 2, 1], 1, 1], ["AN", 2, 1, 6], ["PR", 5, 0, "auto_unroll_max_step$512"]]]], "r": [[0.000138839], 0, 12.5256, 1678084442], "v": "v0.6"}
{"i": [["[\"conv2d_relu_layer_2\"]", "cuda -keys=cuda,gpu -arch=sm_80 -max_num_threads=1024 -thread_warp_size=32", [-1, 16, 64, 49152, 2147483647, 1024, 8, 32], "", 0, []], [[], [["CI", 5], ["SP", 3, 0, 1, [1, 1, 1, 1], 1], ["SP", 3, 5, 128, [1, 32, 1, 4], 1], ["SP", 3, 10, 27, [1, 1, 1, 1], 1], ["SP", 3, 15, 27, [3, 3, 1, 1], 1], ["SP", 3, 20, 48, [3, 4], 1], ["SP", 3, 23, 5, [5, 1], 1], ["SP", 3, 26, 5, [1, 1], 1], ["RE", 3, [0, 5, 10, 15, 1, 6, 11, 16, 2, 7, 12, 17, 20, 23, 26, 21, 24, 27, 3, 8, 13, 18, 22, 25, 28, 4, 9, 14, 19]], ["FSP", 6, 0, 1, 3], ["FSP", 6, 4, 2, 3], ["FSP", 6, 8, 3, 3], ["FSP", 6, 12, 4, 3], ["RE", 6, [0, 4, 8, 12, 1, 5, 9, 13, 2, 6, 10, 14, 3, 7, 11, 15]], ["CA", 3, 6, 11], ["CHR", 2, "shared", [3]], ["CA", 3, 4, 14], ["CHR", 1, "shared", [4]], ["CA", 2, 5, 14], ["CI", 1], ["FU", 8, [0, 1, 2, 3]], ["AN", 8, 0, 5], ["FU", 8, [1, 2, 3, 4]], ["AN", 8, 1, 4], ["FU", 8, [2, 3, 4, 5]], ["AN", 8, 2, 6], ["FU", 4, [0, 1, 2, 3]], ["SP", 4, 0, 240, [1], 1], ["AN", 4, 1, 2], ["FFSP", 4, 0, [4, 3, 2, 1], 1, 1], ["AN", 4, 1, 6], ["FU", 2, [0, 1, 2, 3]], ["SP", 2, 0, 60, [1], 1], ["AN", 2, 1, 2], ["FFSP", 2, 0, [4, 3, 2, 1], 1, 1], ["AN", 2, 1, 6], ["PR", 5, 0, "auto_unroll_max_step$1024"]]]], "r": [[0.000117354], 0, 12.0364, 1678084443], "v": "v0.6"}
{"i": [["[\"conv2d_relu_layer_2\"]", "cuda -keys=cuda,gpu -arch=sm_80 -max_num_threads=1024 -thread_warp_size=32", [-1, 16, 64, 49152, 2147483647, 1024, 8, 32], "", 0, []], [[], [["CI", 5], ["SP", 3, 0, 1, [1, 1, 1, 1], 1], ["SP", 3, 5, 128, [4, 16, 2, 1], 1], ["SP", 3, 10, 27, [1, 1, 1, 1], 1], ["SP", 3, 15, 27, [1, 9, 1, 1], 1], ["SP", 3, 20, 48, [1, 24], 1], ["SP", 3, 23, 5, [1, 1], 1], ["SP", 3, 26, 5, [1, 1], 1], ["RE", 3, [0, 5, 10, 15, 1, 6, 11, 16, 2, 7, 12, 17, 20, 23, 26, 21, 24, 27, 3, 8, 13, 18, 22, 25, 28, 4, 9, 14, 19]], ["FSP", 6, 0, 1, 3], ["FSP", 6, 4, 2, 3], ["FSP", 6, 8, 3, 3], ["FSP", 6, 12, 4, 3], ["RE", 6, [0, 4, 8, 12, 1, 5, 9, 13, 2, 6, 10, 14, 3, 7, 11, 15]], ["CA", 3, 6, 11], ["CHR", 2, "shared", [3]], ["CA", 3, 4, 14], ["CHR", 1, "shared", [4]], ["CA", 2, 5, 14], ["CI", 1], ["FU", 8, [0, 1, 2, 3]], ["AN", 8, 0, 5], ["FU", 8, [1, 2, 3, 4]], ["AN", 8, 1, 4], ["FU", 8, [2, 3, 4, 5]], ["AN", 8, 2, 6], ["FU", 4, [0, 1, 2, 3]], ["SP", 4, 0, 48, [1], 1], ["AN", 4, 1, 2], ["FFSP", 4, 0, [4, 3, 2, 1], 1, 1], ["AN", 4, 1, 6], ["FU", 2, [0, 1, 2, 3]], ["SP", 2, 0, 24, [1], 1], ["AN", 2, 1, 2], ["FFSP", 2, 0, [4, 3, 2, 1], 1, 1], ["AN", 2, 1, 6], ["PR", 5, 0, "auto_unroll_max_step$64"]]]], "r": [[0.000167362], 0, 4.36973, 1678084445], "v": "v0.6"}
{"i": [["[\"conv2d_relu_layer_2\"]", "cuda -keys=cuda,gpu -arch=sm_80 -max_num_threads=1024 -thread_warp_size=32", [-1, 16, 64, 49152, 2147483647, 1024, 8, 32], "", 0, []], [[], [["CI", 5], ["SP", 3, 0, 1, [1, 1, 1, 1], 1], ["SP", 3, 5, 128, [1, 128, 1, 1], 1], ["SP", 3, 10, 27, [1, 1, 1, 1], 1], ["SP", 3, 15, 27, [1, 1, 1, 9], 1], ["SP", 3, 20, 48, [3, 4], 1], ["SP", 3, 23, 5, [1, 1], 1], ["SP", 3, 26, 5, [1, 1], 1], ["RE", 3, [0, 5, 10, 15, 1, 6, 11, 16, 2, 7, 12, 17, 20, 23, 26, 21, 24, 27, 3, 8, 13, 18, 22, 25, 28, 4, 9, 14, 19]], ["FSP", 6, 0, 1, 3], ["FSP", 6, 4, 2, 3], ["FSP", 6, 8, 3, 3], ["FSP", 6, 12, 4, 3], ["RE", 6, [0, 4, 8, 12, 1, 5, 9, 13, 2, 6, 10, 14, 3, 7, 11, 15]], ["CA", 3, 6, 11], ["CHR", 2, "shared", [3]], ["CA", 3, 4, 14], ["CHR", 1, "shared", [4]], ["CA", 2, 5, 14], ["CI", 1], ["FU", 8, [0, 1, 2, 3]], ["AN", 8, 0, 5], ["FU", 8, [1, 2, 3, 4]], ["AN", 8, 1, 4], ["FU", 8, [2, 3, 4, 5]], ["AN", 8, 2, 6], ["FU", 4, [0, 1, 2, 3]], ["SP", 4, 0, 12, [1], 1], ["AN", 4, 1, 2], ["FFSP", 4, 0, [4, 3, 2, 1], 1, 1], ["AN", 4, 1, 6], ["FU", 2, [0, 1, 2, 3]], ["SP", 2, 0, 108, [1], 1], ["AN", 2, 1, 2], ["FFSP", 2, 0, [4, 3, 2, 1], 1, 1], ["AN", 2, 1, 6], ["PR", 5, 0, "auto_unroll_max_step$16"]]]], "r": [[0.000167412], 0, 3.98456, 1678084446], "v": "v0.6"}
{"i": [["[\"conv2d_relu_layer_2\"]", "cuda -keys=cuda,gpu -arch=sm_80 -max_num_threads=1024 -thread_warp_size=32", [-1, 16, 64, 49152, 2147483647, 1024, 8, 32], "", 0, []], [[], [["CI", 5], ["SP", 3, 0, 1, [1, 1, 1, 1], 1], ["SP", 3, 5, 128, [1, 16, 2, 4], 1], ["SP", 3, 10, 27, [1, 3, 1, 3], 1], ["SP", 3, 15, 27, [1, 1, 1, 1], 1], ["SP", 3, 20, 48, [2, 8], 1], ["SP", 3, 23, 5, [1, 1], 1], ["SP", 3, 26, 5, [5, 1], 1], ["RE", 3, [0, 5, 10, 15, 1, 6, 11, 16, 2, 7, 12, 17, 20, 23, 26, 21, 24, 27, 3, 8, 13, 18, 22, 25, 28, 4, 9, 14, 19]], ["FSP", 6, 0, 1, 3], ["FSP", 6, 4, 2, 3], ["FSP", 6, 8, 3, 3], ["FSP", 6, 12, 4, 3], ["RE", 6, [0, 4, 8, 12, 1, 5, 9, 13, 2, 6, 10, 14, 3, 7, 11, 15]], ["CA", 3, 6, 11], ["CHR", 2, "shared", [3]], ["CA", 3, 4, 14], ["CHR", 1, "shared", [4]], ["CA", 2, 5, 14], ["CI", 1], ["FU", 8, [0, 1, 2, 3]], ["AN", 8, 0, 5], ["FU", 8, [1, 2, 3, 4]], ["AN", 8, 1, 4], ["FU", 8, [2, 3, 4, 5]], ["AN", 8, 2, 6], ["FU", 4, [0, 1, 2, 3]], ["SP", 4, 0, 640, [1], 1], ["AN", 4, 1, 2], ["FFSP", 4, 0, [4, 3, 2, 1], 1, 1], ["AN", 4, 1, 6], ["FU", 2, [0, 1, 2, 3]], ["SP", 2, 0, 240, [1], 1], ["AN", 2, 1, 2], ["FFSP", 2, 0, [4, 3, 2, 1], 1, 1], ["AN", 2, 1, 6], ["PR", 5, 0, "auto_unroll_max_step$16"]]]], "r": [[0.00051087], 0, 7.06082, 1678084447], "v": "v0.6"}
{"i": [["[\"conv2d_relu_layer_2\"]", "cuda -keys=cuda,gpu -arch=sm_80 -max_num_threads=1024 -thread_warp_size=32", [-1, 16, 64, 49152, 2147483647, 1024, 8, 32], "", 0, []], [[], [["CI", 5], ["SP", 3, 0, 1, [1, 1, 1, 1], 1], ["SP", 3, 5, 128, [2, 16, 4, 1], 1], ["SP", 3, 10, 27, [1, 3, 3, 1], 1], ["SP", 3, 15, 27, [1, 1, 1, 1], 1], ["SP", 3, 20, 48, [1, 3], 1], ["SP", 3, 23, 5, [1, 5], 1], ["SP", 3, 26, 5, [1, 1], 1], ["RE", 3, [0, 5, 10, 15, 1, 6, 11, 16, 2, 7, 12, 17, 20, 23, 26, 21, 24, 27, 3, 8, 13, 18, 22, 25, 28, 4, 9, 14, 19]], ["FSP", 6, 0, 1, 3], ["FSP", 6, 4, 2, 3], ["FSP", 6, 8, 3, 3], ["FSP", 6, 12, 4, 3], ["RE", 6, [0, 4, 8, 12, 1, 5, 9, 13, 2, 6, 10, 14, 3, 7, 11, 15]], ["CA", 3, 6, 11], ["CHR", 2, "shared", [3]], ["CA", 3, 4, 14], ["CHR", 1, "shared", [4]], ["CA", 2, 5, 14], ["CI", 1], ["FU", 8, [0, 1, 2, 3]], ["AN", 8, 0, 5], ["FU", 8, [1, 2, 3, 4]], ["AN", 8, 1, 4], ["FU", 8, [2, 3, 4, 5]], ["AN", 8, 2, 6], ["FU", 4, [0, 1, 2, 3]], ["SP", 4, 0, 60, [1], 1], ["AN", 4, 1, 2], ["FFSP", 4, 0, [4, 3, 2, 1], 1, 1], ["AN", 4, 1, 6], ["FU", 2, [0, 1, 2, 3]], ["SP", 2, 0, 21, [1], 1], ["AN", 2, 1, 2], ["FFSP", 2, 0, [4, 3, 2, 1], 1, 1], ["AN", 2, 1, 6], ["PR", 5, 0, "auto_unroll_max_step$1024"]]]], "r": [[0.000137333], 0, 7.51081, 1678084449], "v": "v0.6"}
{"i": [["[\"conv2d_relu_layer_2\"]", "cuda -keys=cuda,gpu -arch=sm_80 -max_num_threads=1024 -thread_warp_size=32", [-1, 16, 64, 49152, 2147483647, 1024, 8, 32], "", 0, []], [[], [["CI", 5], ["SP", 3, 0, 1, [1, 1, 1, 1], 1], ["SP", 3, 5, 128, [1, 16, 8, 1], 1], ["SP", 3, 10, 27, [1, 3, 1, 1], 1], ["SP", 3, 15, 27, [1, 1, 1, 3], 1], ["SP", 3, 20, 48, [4, 1], 1], ["SP", 3, 23, 5, [1, 1], 1], ["SP", 3, 26, 5, [1, 5], 1], ["RE", 3, [0, 5, 10, 15, 1, 6, 11, 16, 2, 7, 12, 17, 20, 23, 26, 21, 24, 27, 3, 8, 13, 18, 22, 25, 28, 4, 9, 14, 19]], ["FSP", 6, 0, 1, 3], ["FSP", 6, 4, 2, 3], ["FSP", 6, 8, 3, 3], ["FSP", 6, 12, 4, 3], ["RE", 6, [0, 4, 8, 12, 1, 5, 9, 13, 2, 6, 10, 14, 3, 7, 11, 15]], ["CA", 3, 6, 11], ["CHR", 2, "shared", [3]], ["CA", 3, 4, 14], ["CHR", 1, "shared", [4]], ["CA", 2, 5, 14], ["CI", 1], ["FU", 8, [0, 1, 2, 3]], ["AN", 8, 0, 5], ["FU", 8, [1, 2, 3, 4]], ["AN", 8, 1, 4], ["FU", 8, [2, 3, 4, 5]], ["AN", 8, 2, 6], ["FU", 4, [0, 1, 2, 3]], ["SP", 4, 0, 160, [1], 1], ["AN", 4, 1, 2], ["FFSP", 4, 0, [4, 3, 2, 1], 1, 1], ["AN", 4, 1, 6], ["FU", 2, [0, 1, 2, 3]], ["SP", 2, 0, 28, [1], 1], ["AN", 2, 1, 2], ["FFSP", 2, 0, [4, 3, 2, 1], 1, 1], ["AN", 2, 1, 6], ["PR", 5, 0, "auto_unroll_max_step$1024"]]]], "r": [[0.000128768], 0, 9.663, 1678084450], "v": "v0.6"}
{"i": [["[\"conv2d_relu_layer_2\"]", "cuda -keys=cuda,gpu -arch=sm_80 -max_num_threads=1024 -thread_warp_size=32", [-1, 16, 64, 49152, 2147483647, 1024, 8, 32], "", 0, []], [[], [["CI", 5], ["SP", 3, 0, 1, [1, 1, 1, 1], 1], ["SP", 3, 5, 128, [8, 8, 1, 2], 1], ["SP", 3, 10, 27, [1, 3, 1, 1], 1], ["SP", 3, 15, 27, [1, 3, 1, 1], 1], ["SP", 3, 20, 48, [1, 4], 1], ["SP", 3, 23, 5, [1, 1], 1], ["SP", 3, 26, 5, [1, 5], 1], ["RE", 3, [0, 5, 10, 15, 1, 6, 11, 16, 2, 7, 12, 17, 20, 23, 26, 21, 24, 27, 3, 8, 13, 18, 22, 25, 28, 4, 9, 14, 19]], ["FSP", 6, 0, 1, 3], ["FSP", 6, 4, 2, 3], ["FSP", 6, 8, 3, 3], ["FSP", 6, 12, 4, 3], ["RE", 6, [0, 4, 8, 12, 1, 5, 9, 13, 2, 6, 10, 14, 3, 7, 11, 15]], ["CA", 3, 6, 11], ["CHR", 2, "shared", [3]], ["CA", 3, 4, 14], ["CHR", 1, "shared", [4]], ["CA", 2, 5, 14], ["CI", 1], ["FU", 8, [0, 1, 2, 3]], ["AN", 8, 0, 5], ["FU", 8, [1, 2, 3, 4]], ["AN", 8, 1, 4], ["FU", 8, [2, 3, 4, 5]], ["AN", 8, 2, 6], ["FU", 4, [0, 1, 2, 3]], ["SP", 4, 0, 40, [1], 1], ["AN", 4, 1, 2], ["FFSP", 4, 0, [4, 3, 2, 1], 1, 1], ["AN", 4, 1, 6], ["FU", 2, [0, 1, 2, 3]], ["SP", 2, 0, 20, [1], 1], ["AN", 2, 1, 2], ["FFSP", 2, 0, [4, 3, 2, 1], 1, 1], ["AN", 2, 1, 6], ["PR", 5, 0, "auto_unroll_max_step$64"]]]], "r": [[0.000197652], 0, 5.47491, 1678084451], "v": "v0.6"}
{"i": [["[\"conv2d_relu_layer_2\"]", "cuda -keys=cuda,gpu -arch=sm_80 -max_num_threads=1024 -thread_warp_size=32", [-1, 16, 64, 49152, 2147483647, 1024, 8, 32], "", 0, []], [[], [["CI", 5], ["SP", 3, 0, 1, [1, 1, 1, 1], 1], ["SP", 3, 5, 128, [1, 32, 1, 4], 1], ["SP", 3, 10, 27, [1, 1, 3, 1], 1], ["SP", 3, 15, 27, [1, 1, 3, 1], 1], ["SP", 3, 20, 48, [8, 1], 1], ["SP", 3, 23, 5, [1, 1], 1], ["SP", 3, 26, 5, [1, 1], 1], ["RE", 3, [0, 5, 10, 15, 1, 6, 11, 16, 2, 7, 12, 17, 20, 23, 26, 21, 24, 27, 3, 8, 13, 18, 22, 25, 28, 4, 9, 14, 19]], ["FSP", 6, 0, 1, 3], ["FSP", 6, 4, 2, 3], ["FSP", 6, 8, 3, 3], ["FSP", 6, 12, 4, 3], ["RE", 6, [0, 4, 8, 12, 1, 5, 9, 13, 2, 6, 10, 14, 3, 7, 11, 15]], ["CA", 3, 6, 11], ["CHR", 2, "shared", [3]], ["CA", 3, 4, 14], ["CHR", 1, "shared", [4]], ["CA", 2, 5, 14], ["CI", 1], ["FU", 8, [0, 1, 2, 3]], ["AN", 8, 0, 5], ["FU", 8, [1, 2, 3, 4]], ["AN", 8, 1, 4], ["FU", 8, [2, 3, 4, 5]], ["AN", 8, 2, 6], ["FU", 4, [0, 1, 2, 3]], ["SP", 4, 0, 32, [1], 1], ["AN", 4, 1, 2], ["FFSP", 4, 0, [4, 3, 2, 1], 1, 1], ["AN", 4, 1, 6], ["FU", 2, [0, 1, 2, 3]], ["SP", 2, 0, 72, [1], 1], ["AN", 2, 1, 2], ["FFSP", 2, 0, [4, 3, 2, 1], 1, 1], ["AN", 2, 1, 6], ["PR", 5, 0, "auto_unroll_max_step$1024"]]]], "r": [[0.000267014], 0, 6.66947, 1678084453], "v": "v0.6"}
{"i": [["[\"conv2d_relu_layer_2\"]", "cuda -keys=cuda,gpu -arch=sm_80 -max_num_threads=1024 -thread_warp_size=32", [-1, 16, 64, 49152, 2147483647, 1024, 8, 32], "", 0, []], [[], [["CI", 5], ["SP", 3, 0, 1, [1, 1, 1, 1], 1], ["SP", 3, 5, 128, [1, 32, 4, 1], 1], ["SP", 3, 10, 27, [1, 3, 3, 1], 1], ["SP", 3, 15, 27, [1, 1, 1, 1], 1], ["SP", 3, 20, 48, [16, 1], 1], ["SP", 3, 23, 5, [1, 1], 1], ["SP", 3, 26, 5, [1, 1], 1], ["RE", 3, [0, 5, 10, 15, 1, 6, 11, 16, 2, 7, 12, 17, 20, 23, 26, 21, 24, 27, 3, 8, 13, 18, 22, 25, 28, 4, 9, 14, 19]], ["FSP", 6, 0, 1, 3], ["FSP", 6, 4, 2, 3], ["FSP", 6, 8, 3, 3], ["FSP", 6, 12, 4, 3], ["RE", 6, [0, 4, 8, 12, 1, 5, 9, 13, 2, 6, 10, 14, 3, 7, 11, 15]], ["CA", 3, 6, 11], ["CHR", 2, "shared", [3]], ["CA", 3, 4, 14], ["CHR", 1, "shared", [4]], ["CA", 2, 5, 14], ["CI", 1], ["FU", 8, [0, 1, 2, 3]], ["AN", 8, 0, 5], ["FU", 8, [1, 2, 3, 4]], ["AN", 8, 1, 4], ["FU", 8, [2, 3, 4, 5]], ["AN", 8, 2, 6], ["FU", 4, [0, 1, 2, 3]], ["SP", 4, 0, 64, [1], 1], ["AN", 4, 1, 2], ["FFSP", 4, 0, [4, 3, 2, 1], 1, 1], ["AN", 4, 1, 6], ["FU", 2, [0, 1, 2, 3]], ["SP", 2, 0, 48, [1], 1], ["AN", 2, 1, 2], ["FFSP", 2, 0, [4, 3, 2, 1], 1, 1], ["AN", 2, 1, 6], ["PR", 5, 0, "auto_unroll_max_step$16"]]]], "r": [[0.000201063], 0, 4.19705, 1678084454], "v": "v0.6"}
{"i": [["[\"conv2d_relu_layer_2\"]", "cuda -keys=cuda,gpu -arch=sm_80 -max_num_threads=1024 -thread_warp_size=32", [-1, 16, 64, 49152, 2147483647, 1024, 8, 32], "", 0, []], [[], [["CI", 5], ["SP", 3, 0, 1, [1, 1, 1, 1], 1], ["SP", 3, 5, 128, [1, 16, 8, 1], 1], ["SP", 3, 10, 27, [1, 1, 3, 1], 1], ["SP", 3, 15, 27, [1, 3, 1, 1], 1], ["SP", 3, 20, 48, [4, 3], 1], ["SP", 3, 23, 5, [1, 1], 1], ["SP", 3, 26, 5, [5, 1], 1], ["RE", 3, [0, 5, 10, 15, 1, 6, 11, 16, 2, 7, 12, 17, 20, 23, 26, 21, 24, 27, 3, 8, 13, 18, 22, 25, 28, 4, 9, 14, 19]], ["FSP", 6, 0, 1, 3], ["FSP", 6, 4, 2, 3], ["FSP", 6, 8, 3, 3], ["FSP", 6, 12, 4, 3], ["RE", 6, [0, 4, 8, 12, 1, 5, 9, 13, 2, 6, 10, 14, 3, 7, 11, 15]], ["CA", 3, 6, 11], ["CHR", 2, "shared", [3]], ["CA", 3, 4, 14], ["CHR", 1, "shared", [4]], ["CA", 2, 5, 14], ["CI", 1], ["FU", 8, [0, 1, 2, 3]], ["AN", 8, 0, 5], ["FU", 8, [1, 2, 3, 4]], ["AN", 8, 1, 4], ["FU", 8, [2, 3, 4, 5]], ["AN", 8, 2, 6], ["FU", 4, [0, 1, 2, 3]], ["SP", 4, 0, 480, [1], 1], ["AN", 4, 1, 2], ["FFSP", 4, 0, [4, 3, 2, 1], 1, 1], ["AN", 4, 1, 6], ["FU", 2, [0, 1, 2, 3]], ["SP", 2, 0, 180, [1], 1], ["AN", 2, 1, 2], ["FFSP", 2, 0, [4, 3, 2, 1], 1, 1], ["AN", 2, 1, 6], ["PR", 5, 0, "auto_unroll_max_step$1024"]]]], "r": [[0.000214254], 0, 14.1533, 1678084455], "v": "v0.6"}
{"i": [["[\"conv2d_relu_layer_2\"]", "cuda -keys=cuda,gpu -arch=sm_80 -max_num_threads=1024 -thread_warp_size=32", [-1, 16, 64, 49152, 2147483647, 1024, 8, 32], "", 0, []], [[], [["CI", 5], ["SP", 3, 0, 1, [1, 1, 1, 1], 1], ["SP", 3, 5, 128, [2, 64, 1, 1], 1], ["SP", 3, 10, 27, [1, 1, 1, 1], 1], ["SP", 3, 15, 27, [1, 1, 3, 3], 1], ["SP", 3, 20, 48, [16, 1], 1], ["SP", 3, 23, 5, [1, 5], 1], ["SP", 3, 26, 5, [1, 1], 1], ["RE", 3, [0, 5, 10, 15, 1, 6, 11, 16, 2, 7, 12, 17, 20, 23, 26, 21, 24, 27, 3, 8, 13, 18, 22, 25, 28, 4, 9, 14, 19]], ["FSP", 6, 0, 1, 3], ["FSP", 6, 4, 2, 3], ["FSP", 6, 8, 3, 3], ["FSP", 6, 12, 4, 3], ["RE", 6, [0, 4, 8, 12, 1, 5, 9, 13, 2, 6, 10, 14, 3, 7, 11, 15]], ["CA", 3, 6, 11], ["CHR", 2, "shared", [3]], ["CA", 3, 4, 14], ["CHR", 1, "shared", [4]], ["CA", 2, 5, 14], ["CI", 1], ["FU", 8, [0, 1, 2, 3]], ["AN", 8, 0, 5], ["FU", 8, [1, 2, 3, 4]], ["AN", 8, 1, 4], ["FU", 8, [2, 3, 4, 5]], ["AN", 8, 2, 6], ["FU", 4, [0, 1, 2, 3]], ["SP", 4, 0, 80, [1], 1], ["AN", 4, 1, 2], ["FFSP", 4, 0, [4, 3, 2, 1], 1, 1], ["AN", 4, 1, 6], ["FU", 2, [0, 1, 2, 3]], ["SP", 2, 0, 720, [1], 1], ["AN", 2, 1, 2], ["FFSP", 2, 0, [4, 3, 2, 1], 1, 1], ["AN", 2, 1, 6], ["PR", 5, 0, "auto_unroll_max_step$1024"]]]], "r": [[0.000121837], 0, 10.2116, 1678084457], "v": "v0.6"}
{"i": [["[\"conv2d_relu_layer_2\"]", "cuda -keys=cuda,gpu -arch=sm_80 -max_num_threads=1024 -thread_warp_size=32", [-1, 16, 64, 49152, 2147483647, 1024, 8, 32], "", 0, []], [[], [["CI", 5], ["SP", 3, 0, 1, [1, 1, 1, 1], 1], ["SP", 3, 5, 128, [1, 64, 1, 2], 1], ["SP", 3, 10, 27, [3, 1, 1, 1], 1], ["SP", 3, 15, 27, [1, 1, 3, 1], 1], ["SP", 3, 20, 48, [2, 24], 1], ["SP", 3, 23, 5, [1, 1], 1], ["SP", 3, 26, 5, [1, 1], 1], ["RE", 3, [0, 5, 10, 15, 1, 6, 11, 16, 2, 7, 12, 17, 20, 23, 26, 21, 24, 27, 3, 8, 13, 18, 22, 25, 28, 4, 9, 14, 19]], ["FSP", 6, 0, 1, 3], ["FSP", 6, 4, 2, 3], ["FSP", 6, 8, 3, 3], ["FSP", 6, 12, 4, 3], ["RE", 6, [0, 4, 8, 12, 1, 5, 9, 13, 2, 6, 10, 14, 3, 7, 11, 15]], ["CA", 3, 6, 11], ["CHR", 2, "shared", [3]], ["CA", 3, 4, 14], ["CHR", 1, "shared", [4]], ["CA", 2, 5, 14], ["CI", 1], ["FU", 8, [0, 1, 2, 3]], ["AN", 8, 0, 5], ["FU", 8, [1, 2, 3, 4]], ["AN", 8, 1, 4], ["FU", 8, [2, 3, 4, 5]], ["AN", 8, 2, 6], ["FU", 4, [0, 1, 2, 3]], ["SP", 4, 0, 96, [1], 1], ["AN", 4, 1, 2], ["FFSP", 4, 0, [4, 3, 2, 1], 1, 1], ["AN", 4, 1, 6], ["FU", 2, [0, 1, 2, 3]], ["SP", 2, 0, 144, [1], 1], ["AN", 2, 1, 2], ["FFSP", 2, 0, [4, 3, 2, 1], 1, 1], ["AN", 2, 1, 6], ["PR", 5, 0, "auto_unroll_max_step$0"]]]], "r": [[0.000221463], 0, 4.46229, 1678084458], "v": "v0.6"}
{"i": [["[\"conv2d_relu_layer_2\"]", "cuda -keys=cuda,gpu -arch=sm_80 -max_num_threads=1024 -thread_warp_size=32", [-1, 16, 64, 49152, 2147483647, 1024, 8, 32], "", 0, []], [[], [["CI", 5], ["SP", 3, 0, 1, [1, 1, 1, 1], 1], ["SP", 3, 5, 128, [2, 16, 1, 4], 1], ["SP", 3, 10, 27, [1, 3, 1, 1], 1], ["SP", 3, 15, 27, [1, 1, 1, 3], 1], ["SP", 3, 20, 48, [2, 4], 1], ["SP", 3, 23, 5, [1, 1], 1], ["SP", 3, 26, 5, [1, 5], 1], ["RE", 3, [0, 5, 10, 15, 1, 6, 11, 16, 2, 7, 12, 17, 20, 23, 26, 21, 24, 27, 3, 8, 13, 18, 22, 25, 28, 4, 9, 14, 19]], ["FSP", 6, 0, 1, 3], ["FSP", 6, 4, 2, 3], ["FSP", 6, 8, 3, 3], ["FSP", 6, 12, 4, 3], ["RE", 6, [0, 4, 8, 12, 1, 5, 9, 13, 2, 6, 10, 14, 3, 7, 11, 15]], ["CA", 3, 6, 11], ["CHR", 2, "shared", [3]], ["CA", 3, 4, 14], ["CHR", 1, "shared", [4]], ["CA", 2, 5, 14], ["CI", 1], ["FU", 8, [0, 1, 2, 3]], ["AN", 8, 0, 5], ["FU", 8, [1, 2, 3, 4]], ["AN", 8, 1, 4], ["FU", 8, [2, 3, 4, 5]], ["AN", 8, 2, 6], ["FU", 4, [0, 1, 2, 3]], ["SP", 4, 0, 160, [1], 1], ["AN", 4, 1, 2], ["FFSP", 4, 0, [4, 3, 2, 1], 1, 1], ["AN", 4, 1, 6], ["FU", 2, [0, 1, 2, 3]], ["SP", 2, 0, 56, [1], 1], ["AN", 2, 1, 2], ["FFSP", 2, 0, [4, 3, 2, 1], 1, 1], ["AN", 2, 1, 6], ["PR", 5, 0, "auto_unroll_max_step$0"]]]], "r": [[0.000957175], 0, 4.0337, 1678084459], "v": "v0.6"}
{"i": [["[\"conv2d_relu_layer_2\"]", "cuda -keys=cuda,gpu -arch=sm_80 -max_num_threads=1024 -thread_warp_size=32", [-1, 16, 64, 49152, 2147483647, 1024, 8, 32], "", 0, []], [[], [["CI", 5], ["SP", 3, 0, 1, [1, 1, 1, 1], 1], ["SP", 3, 5, 128, [8, 16, 1, 1], 1], ["SP", 3, 10, 27, [1, 3, 1, 1], 1], ["SP", 3, 15, 27, [1, 1, 3, 1], 1], ["SP", 3, 20, 48, [4, 1], 1], ["SP", 3, 23, 5, [1, 1], 1], ["SP", 3, 26, 5, [1, 5], 1], ["RE", 3, [0, 5, 10, 15, 1, 6, 11, 16, 2, 7, 12, 17, 20, 23, 26, 21, 24, 27, 3, 8, 13, 18, 22, 25, 28, 4, 9, 14, 19]], ["FSP", 6, 0, 1, 3], ["FSP", 6, 4, 2, 3], ["FSP", 6, 8, 3, 3], ["FSP", 6, 12, 4, 3], ["RE", 6, [0, 4, 8, 12, 1, 5, 9, 13, 2, 6, 10, 14, 3, 7, 11, 15]], ["CA", 3, 6, 11], ["CHR", 2, "shared", [3]], ["CA", 3, 4, 14], ["CHR", 1, "shared", [4]], ["CA", 2, 5, 14], ["CI", 1], ["FU", 8, [0, 1, 2, 3]], ["AN", 8, 0, 5], ["FU", 8, [1, 2, 3, 4]], ["AN", 8, 1, 4], ["FU", 8, [2, 3, 4, 5]], ["AN", 8, 2, 6], ["FU", 4, [0, 1, 2, 3]], ["SP", 4, 0, 20, [1], 1], ["AN", 4, 1, 2], ["FFSP", 4, 0, [4, 3, 2, 1], 1, 1], ["AN", 4, 1, 6], ["FU", 2, [0, 1, 2, 3]], ["SP", 2, 0, 28, [1], 1], ["AN", 2, 1, 2], ["FFSP", 2, 0, [4, 3, 2, 1], 1, 1], ["AN", 2, 1, 6], ["PR", 5, 0, "auto_unroll_max_step$1024"]]]], "r": [[0.00011976], 0, 9.12486, 1678084461], "v": "v0.6"}
{"i": [["[\"conv2d_relu_layer_2\"]", "cuda -keys=cuda,gpu -arch=sm_80 -max_num_threads=1024 -thread_warp_size=32", [-1, 16, 64, 49152, 2147483647, 1024, 8, 32], "", 0, []], [[], [["CI", 5], ["SP", 3, 0, 1, [1, 1, 1, 1], 1], ["SP", 3, 5, 128, [1, 64, 2, 1], 1], ["SP", 3, 10, 27, [1, 1, 1, 1], 1], ["SP", 3, 15, 27, [1, 1, 9, 1], 1], ["SP", 3, 20, 48, [8, 1], 1], ["SP", 3, 23, 5, [1, 5], 1], ["SP", 3, 26, 5, [1, 1], 1], ["RE", 3, [0, 5, 10, 15, 1, 6, 11, 16, 2, 7, 12, 17, 20, 23, 26, 21, 24, 27, 3, 8, 13, 18, 22, 25, 28, 4, 9, 14, 19]], ["FSP", 6, 0, 1, 3], ["FSP", 6, 4, 2, 3], ["FSP", 6, 8, 3, 3], ["FSP", 6, 12, 4, 3], ["RE", 6, [0, 4, 8, 12, 1, 5, 9, 13, 2, 6, 10, 14, 3, 7, 11, 15]], ["CA", 3, 6, 11], ["CHR", 2, "shared", [3]], ["CA", 3, 4, 14], ["CHR", 1, "shared", [4]], ["CA", 2, 5, 14], ["CI", 1], ["FU", 8, [0, 1, 2, 3]], ["AN", 8, 0, 5], ["FU", 8, [1, 2, 3, 4]], ["AN", 8, 1, 4], ["FU", 8, [2, 3, 4, 5]], ["AN", 8, 2, 6], ["FU", 4, [0, 1, 2, 3]], ["SP", 4, 0, 80, [1], 1], ["AN", 4, 1, 2], ["FFSP", 4, 0, [4, 3, 2, 1], 1, 1], ["AN", 4, 1, 6], ["FU", 2, [0, 1, 2, 3]], ["SP", 2, 0, 360, [1], 1], ["AN", 2, 1, 2], ["FFSP", 2, 0, [4, 3, 2, 1], 1, 1], ["AN", 2, 1, 6], ["PR", 5, 0, "auto_unroll_max_step$512"]]]], "r": [[0.000131869], 0, 7.08723, 1678084462], "v": "v0.6"}
{"i": [["[\"conv2d_relu_layer_2\"]", "cuda -keys=cuda,gpu -arch=sm_80 -max_num_threads=1024 -thread_warp_size=32", [-1, 16, 64, 49152, 2147483647, 1024, 8, 32], "", 0, []], [[], [["CI", 5], ["SP", 3, 0, 1, [1, 1, 1, 1], 1], ["SP", 3, 5, 128, [2, 64, 1, 1], 1], ["SP", 3, 10, 27, [1, 1, 1, 1], 1], ["SP", 3, 15, 27, [3, 3, 1, 1], 1], ["SP", 3, 20, 48, [3, 1], 1], ["SP", 3, 23, 5, [5, 1], 1], ["SP", 3, 26, 5, [1, 1], 1], ["RE", 3, [0, 5, 10, 15, 1, 6, 11, 16, 2, 7, 12, 17, 20, 23, 26, 21, 24, 27, 3, 8, 13, 18, 22, 25, 28, 4, 9, 14, 19]], ["FSP", 6, 0, 1, 3], ["FSP", 6, 4, 2, 3], ["FSP", 6, 8, 3, 3], ["FSP", 6, 12, 4, 3], ["RE", 6, [0, 4, 8, 12, 1, 5, 9, 13, 2, 6, 10, 14, 3, 7, 11, 15]], ["CA", 3, 6, 11], ["CHR", 2, "shared", [3]], ["CA", 3, 4, 14], ["CHR", 1, "shared", [4]], ["CA", 2, 5, 14], ["CI", 1], ["FU", 8, [0, 1, 2, 3]], ["AN", 8, 0, 5], ["FU", 8, [1, 2, 3, 4]], ["AN", 8, 1, 4], ["FU", 8, [2, 3, 4, 5]], ["AN", 8, 2, 6], ["FU", 4, [0, 1, 2, 3]], ["SP", 4, 0, 15, [1], 1], ["AN", 4, 1, 2], ["FFSP", 4, 0, [4, 3, 2, 1], 1, 1], ["AN", 4, 1, 6], ["FU", 2, [0, 1, 2, 3]], ["SP", 2, 0, 15, [1], 1], ["AN", 2, 1, 2], ["FFSP", 2, 0, [4, 3, 2, 1], 1, 1], ["AN", 2, 1, 6], ["PR", 5, 0, "auto_unroll_max_step$64"]]]], "r": [[7.92429e-05], 0, 3.75734, 1678084463], "v": "v0.6"}
{"i": [["[\"conv2d_relu_layer_2\"]", "cuda -keys=cuda,gpu -arch=sm_80 -max_num_threads=1024 -thread_warp_size=32", [-1, 16, 64, 49152, 2147483647, 1024, 8, 32], "", 0, []], [[], [["CI", 5], ["SP", 3, 0, 1, [1, 1, 1, 1], 1], ["SP", 3, 5, 128, [1, 64, 1, 2], 1], ["SP", 3, 10, 27, [1, 3, 1, 1], 1], ["SP", 3, 15, 27, [3, 1, 1, 1], 1], ["SP", 3, 20, 48, [4, 1], 1], ["SP", 3, 23, 5, [1, 1], 1], ["SP", 3, 26, 5, [1, 1], 1], ["RE", 3, [0, 5, 10, 15, 1, 6, 11, 16, 2, 7, 12, 17, 20, 23, 26, 21, 24, 27, 3, 8, 13, 18, 22, 25, 28, 4, 9, 14, 19]], ["FSP", 6, 0, 1, 3], ["FSP", 6, 4, 2, 3], ["FSP", 6, 8, 3, 3], ["FSP", 6, 12, 4, 3], ["RE", 6, [0, 4, 8, 12, 1, 5, 9, 13, 2, 6, 10, 14, 3, 7, 11, 15]], ["CA", 3, 6, 11], ["CHR", 2, "shared", [3]], ["CA", 3, 4, 14], ["CHR", 1, "shared", [4]], ["CA", 2, 5, 14], ["CI", 1], ["FU", 8, [0, 1, 2, 3]], ["AN", 8, 0, 5], ["FU", 8, [1, 2, 3, 4]], ["AN", 8, 1, 4], ["FU", 8, [2, 3, 4, 5]], ["AN", 8, 2, 6], ["FU", 4, [0, 1, 2, 3]], ["SP", 4, 0, 8, [1], 1], ["AN", 4, 1, 2], ["FFSP", 4, 0, [4, 3, 2, 1], 1, 1], ["AN", 4, 1, 6], ["FU", 2, [0, 1, 2, 3]], ["SP", 2, 0, 4, [1], 1], ["AN", 2, 1, 2], ["FFSP", 2, 0, [4, 3, 2, 1], 1, 1], ["AN", 2, 1, 6], ["PR", 5, 0, "auto_unroll_max_step$64"]]]], "r": [[0.000167664], 0, 3.84931, 1678084464], "v": "v0.6"}
{"i": [["[\"conv2d_relu_layer_2\"]", "cuda -keys=cuda,gpu -arch=sm_80 -max_num_threads=1024 -thread_warp_size=32", [-1, 16, 64, 49152, 2147483647, 1024, 8, 32], "", 0, []], [[], [["CI", 5], ["SP", 3, 0, 1, [1, 1, 1, 1], 1], ["SP", 3, 5, 128, [1, 64, 2, 1], 1], ["SP", 3, 10, 27, [1, 1, 1, 1], 1], ["SP", 3, 15, 27, [1, 1, 3, 3], 1], ["SP", 3, 20, 48, [8, 2], 1], ["SP", 3, 23, 5, [1, 5], 1], ["SP", 3, 26, 5, [1, 1], 1], ["RE", 3, [0, 5, 10, 15, 1, 6, 11, 16, 2, 7, 12, 17, 20, 23, 26, 21, 24, 27, 3, 8, 13, 18, 22, 25, 28, 4, 9, 14, 19]], ["FSP", 6, 0, 1, 3], ["FSP", 6, 4, 2, 3], ["FSP", 6, 8, 3, 3], ["FSP", 6, 12, 4, 3], ["RE", 6, [0, 4, 8, 12, 1, 5, 9, 13, 2, 6, 10, 14, 3, 7, 11, 15]], ["CA", 3, 6, 11], ["CHR", 2, "shared", [3]], ["CA", 3, 4, 14], ["CHR", 1, "shared", [4]], ["CA", 2, 5, 14], ["CI", 1], ["FU", 8, [0, 1, 2, 3]], ["AN", 8, 0, 5], ["FU", 8, [1, 2, 3, 4]], ["AN", 8, 1, 4], ["FU", 8, [2, 3, 4, 5]], ["AN", 8, 2, 6], ["FU", 4, [0, 1, 2, 3]], ["SP", 4, 0, 160, [1], 1], ["AN", 4, 1, 2], ["FFSP", 4, 0, [4, 3, 2, 1], 1, 1], ["AN", 4, 1, 6], ["FU", 2, [0, 1, 2, 3]], ["SP", 2, 0, 720, [1], 1], ["AN", 2, 1, 2], ["FFSP", 2, 0, [4, 3, 2, 1], 1, 1], ["AN", 2, 1, 6], ["PR", 5, 0, "auto_unroll_max_step$64"]]]], "r": [[0.000182965], 0, 5.56691, 1678084466], "v": "v0.6"}
